{"oms_id": 432563854, "name": "Antonio", "Współrzędne": "51.776505, 19.427209", "key_words": {"types": ["Pizzeria", "Restauracja obiadowa", "Jedzenie z dostawą do domu", "Pizza na telefon"], "address": "26, Marcina Kasprzaka, 91-078 Łódź, Polska", "phone": "+48 42 651 39 75", "opening_hours": {"sobota": "11:00–23:00", "niedziela": "12:00–22:00", "poniedziałek": "11:00–22:00", "wtorek": "11:00–22:00", "środa": "11:00–22:00", "czwartek": "11:00–22:00", "piątek": "11:00–23:00"}, "service_options": ["Dostawa", "Usługi na miejscu", "Na wynos", "Na miejscu"], "specials": ["Sport"], "popular_for": ["Obiad", "Kolacja", "Posiłki w pojedynkę"], "accessibility": [], "offerings": ["Jedzenie późnym wieczorem", "Małe porcje", "Piwo", "Szybka przekąska", "W ofercie dania wegetariańskie"], "amenities": ["Toaleta"], "atmosphere": ["Kameralne", "Modne", "Niezobowiązująca atmosfera", "Spokojne"], "crowd": ["Dla całej rodziny", "Grupy", "Studenci", "Turyści"], "children": ["Menu dla dzieci", "Odpowiednie dla dzieci"], "parking": ["Bezpłatny parking", "Bezpłatny parking przy ulicy", "Raczej trudno znaleźć miejsce"], "context": "Miejsce o nazwie Antonio to miejsce typu: Pizzeria, Restauracja obiadowa, Jedzenie z dostawą do domu, Pizza na telefon. W ofercie znajduje się: Jedzenie późnym wieczorem, Małe porcje, Piwo, Szybka przekąska, W ofercie dania wegetariańskie. Specjalne cechy miejsca: Sport. Atmosfera jest opisywana jako: Kameralne, Modne, Niezobowiązująca atmosfera, Spokojne. Dostępne udogodnienia to: Toaleta. Typowa grupa odwiedzających: Dla całej rodziny, Grupy, Studenci, Turyści. Jest popularne szczególnie na: Obiad, Kolacja, Posiłki w pojedynkę.", "google_rating": 4.1, "google_reviews_total": 1061, "google_price_range": "40–60"}}
{"oms_id": 432598024, "name": "Bawełna", "Współrzędne": "51.779467, 19.449784", "key_words": {"types": ["Restauracja", "Kuchnia europejska", "Kuchnia włoska", "Bar", "Makarony", "Pizzeria", "Owoce morza", "Steki", "Kuchnia wegetariańska"], "address": "Ogrodowa 19A, 91-065 Łódź, Polska", "phone": "+48 42 633 34 44", "opening_hours": {"sobota": "12:00–23:00", "niedziela": "12:00–21:00", "poniedziałek": "12:00–22:00", "wtorek": "12:00–22:00", "środa": "12:00–22:00", "czwartek": "12:00–22:00", "piątek": "12:00–23:00"}, "service_options": ["Ogródek", "Dostawa bez kontaktu", "Dostawa", "Na wynos", "Na miejscu"], "specials": ["Dobra kawa", "Dobre desery", "Dobre drinki", "Duży wybór herbat", "Duży wybór piw", "Muzyka na żywo", "Obszerna karta win", "Sport"], "popular_for": ["Obiad", "Kolacja", "Posiłki w pojedynkę"], "accessibility": ["Parking dostępny dla osób na wózkach"], "offerings": ["Alkohol", "Alkohol wysokoprocentowy", "Jedzenie późnym wieczorem", "Kawa", "Koktajle", "Małe porcje", "Piwo", "Prywatna sala", "Szybka przekąska", "To miejsce oferuje dania wegańskie", "W ofercie dania wegetariańskie", "Wino"], "amenities": ["Bar na miejscu", "Toaleta", "Toaleta unisex", "Wi-Fi", "Bezpłatne Wi-Fi"], "atmosphere": ["Kameralne", "Modne", "Niezobowiązująca atmosfera", "Romantyczna atmosfera", "Spokojne"], "crowd": ["Dla całej rodziny", "Grupy", "Miejsce przyjazne dla osób transpłciowych", "Przyjazne dla osób LGBTQ+", "Turyści"], "children": ["Krzesełka do karmienia", "Ma przewijak(i)", "Menu dla dzieci", "Odpowiednie dla dzieci"], "parking": ["Bezpłatny parking", "Bezpłatny parking przy ulicy", "Dużo miejsc parkingowych"], "context": "Miejsce o nazwie Bawełna to miejsce typu: Restauracja, Kuchnia europejska, Kuchnia włoska, Bar, Makarony, Pizzeria, Owoce morza, Steki. W ofercie znajduje się: Alkohol, Alkohol wysokoprocentowy, Jedzenie późnym wieczorem, Kawa, Koktajle, Małe porcje, Piwo, Prywatna sala. Specjalne cechy miejsca: Dobra kawa, Dobre desery, Dobre drinki, Duży wybór herbat, Duży wybór piw, Muzyka na żywo, Obszerna karta win, Sport. Atmosfera jest opisywana jako: Kameralne, Modne, Niezobowiązująca atmosfera, Romantyczna atmosfera, Spokojne. Miejsce oferuje udogodnienia dostępności: Parking dostępny dla osób na wózkach. Dostępne udogodnienia to: Bar na miejscu, Toaleta, Toaleta unisex, Wi-Fi, Bezpłatne Wi-Fi. Typowa grupa odwiedzających: Dla całej rodziny, Grupy, Miejsce przyjazne dla osób transpłciowych, Prz...", "google_rating": 4.5, "google_reviews_total": 2952, "google_price_range": "$$"}}
{"oms_id": 475373797, "name": "Sphinx", "Współrzędne": "51.765841, 19.456871", "key_words": {"types": ["Restauracja", "Restauracja dla rodzin"], "address": "Piotrkowska 93, 90-423 Łódź, Polska", "phone": "+48 725 100 253", "opening_hours": {"sobota": "10:00–23:30", "niedziela": "12:00–22:00", "poniedziałek": "12:00–22:00", "wtorek": "12:00–22:00", "środa": "12:00–22:00", "czwartek": "12:00–22:00", "piątek": "12:00–23:30"}, "service_options": ["Ogródek", "Dostawa", "Na wynos", "Na miejscu"], "specials": ["Dobra kawa", "Dobre desery", "Dobre drinki", "Duży wybór herbat", "Duży wybór piw"], "popular_for": ["Obiad", "Kolacja", "Posiłki w pojedynkę"], "accessibility": [], "offerings": ["Alkohol", "Alkohol wysokoprocentowy", "Drinki w promocji happy hours", "Jedzenie późnym wieczorem", "Kawa", "Koktajle", "Małe porcje", "Piwo", "Szybka przekąska", "W ofercie dania wegetariańskie", "Wino"], "amenities": ["Bar na miejscu", "Toaleta", "Wi-Fi", "Bezpłatne Wi-Fi"], "atmosphere": ["Kameralne", "Modne", "Niezobowiązująca atmosfera", "Spokojne"], "crowd": ["Dla całej rodziny", "Grupy", "Miejsce przyjazne dla osób transpłciowych", "Przyjazne dla osób LGBTQ+", "Studenci", "Turyści"], "children": ["Krzesełka do karmienia", "Menu dla dzieci", "Odpowiednie dla dzieci"], "parking": ["Bezpłatny parking"], "context": "Miejsce o nazwie Sphinx to miejsce typu: Restauracja, Restauracja dla rodzin. W ofercie znajduje się: Alkohol, Alkohol wysokoprocentowy, Drinki w promocji happy hours, Jedzenie późnym wieczorem, Kawa, Koktajle, Małe porcje, Piwo. Specjalne cechy miejsca: Dobra kawa, Dobre desery, Dobre drinki, Duży wybór herbat, Duży wybór piw. Atmosfera jest opisywana jako: Kameralne, Modne, Niezobowiązująca atmosfera, Spokojne. Dostępne udogodnienia to: Bar na miejscu, Toaleta, Wi-Fi, Bezpłatne Wi-Fi. Typowa grupa odwiedzających: Dla całej rodziny, Grupy, Miejsce przyjazne dla osób transpłciowych, Przyjazne dla osób LGBTQ+, Studenci, Turyści. Jest popularne szczególnie na: Obiad, Kolacja, Posiłki w pojedynkę.", "google_rating": 4.7, "google_reviews_total": 10616, "google_price_range": "40–60"}}
{"oms_id": 475963866, "name": "Kucak", "Współrzędne": "51.821056, 19.440818", "key_words": {"types": ["Kuchnia azjatycka", "Restauracja mandaryńska", "Restauracja orientalna", "Kuchnia wietnamska"], "address": "Pstrągowa 49A, 91-986 Łódź, Polska", "phone": "+48 884 250 679", "opening_hours": {"sobota": "11:00–21:00", "niedziela": "12:00–20:00", "poniedziałek": "11:00–21:00", "wtorek": "11:00–21:00", "środa": "11:00–21:00", "czwartek": "11:00–21:00", "piątek": "11:00–21:00"}, "service_options": ["Ogródek", "Dostawa bez kontaktu", "Dostawa", "Obsługa zmotoryzowanych", "Na wynos", "Na miejscu"], "specials": [], "popular_for": ["Obiad", "Kolacja", "Posiłki w pojedynkę"], "accessibility": ["Miejsca dla osób na wózkach", "Parking dostępny dla osób na wózkach", "Wejście dostępne dla osób na wózkach"], "offerings": ["Alkohol", "Dania z produktów ekologicznych", "Jedzenie późnym wieczorem", "Kawa", "Małe porcje", "Szybka przekąska", "W ofercie dania wegetariańskie"], "amenities": ["Bar na miejscu"], "atmosphere": ["Modne", "Niezobowiązująca atmosfera", "Spokojne"], "crowd": ["Dla całej rodziny", "Grupy", "Miejsce przyjazne dla osób transpłciowych", "Przyjazne dla osób LGBTQ+", "Studenci", "Turyści"], "children": ["Krzesełka do karmienia"], "parking": ["Bezpłatny parking", "Dużo miejsc parkingowych"], "context": "Miejsce o nazwie Kucak to miejsce typu: Kuchnia azjatycka, Restauracja mandaryńska, Restauracja orientalna, Kuchnia wietnamska. W ofercie znajduje się: Alkohol, Dania z produktów ekologicznych, Jedzenie późnym wieczorem, Kawa, Małe porcje, Szybka przekąska, W ofercie dania wegetariańskie. Atmosfera jest opisywana jako: Modne, Niezobowiązująca atmosfera, Spokojne. Miejsce oferuje udogodnienia dostępności: Miejsca dla osób na wózkach, Parking dostępny dla osób na wózkach, Wejście dostępne dla osób na wózkach. Dostępne udogodnienia to: Bar na miejscu. Typowa grupa odwiedzających: Dla całej rodziny, Grupy, Miejsce przyjazne dla osób transpłciowych, Przyjazne dla osób LGBTQ+, Studenci, Turyści. Jest popularne szczególnie na: Obiad, Kolacja, Posiłki w pojedynkę.", "google_rating": 3.5, "google_reviews_total": 1083, "google_price_range": "20–40"}}
{"oms_id": 475963874, "name": "Da Grasso", "Współrzędne": "51.756829, 19.537076", "key_words": {"types": ["Pizzeria", "Pizza na telefon", "Pizza na wynos", "Restauracja"], "address": "Kossaka 5a, 93-213 Łódź, Polska", "phone": "+48 504 915 603", "opening_hours": {"sobota": "11:00–23:00", "niedziela": "12:00–22:00", "poniedziałek": "11:00–22:00", "wtorek": "11:00–22:00", "środa": "11:00–22:00", "czwartek": "11:00–22:00", "piątek": "11:00–23:00"}, "service_options": ["Ogródek", "Dostawa bez kontaktu", "Dostawa", "Na wynos", "Na miejscu"], "specials": ["Dobra kawa", "Dobre desery", "Duży wybór herbat", "Duży wybór piw", "Sport"], "popular_for": ["Obiad", "Kolacja", "Posiłki w pojedynkę"], "accessibility": ["Parking dostępny dla osób na wózkach", "Wejście dostępne dla osób na wózkach"], "offerings": ["Alkohol", "Jedzenie późnym wieczorem", "Kawa", "Małe porcje", "Piwo", "Szybka przekąska", "To miejsce oferuje dania wegańskie", "W ofercie dania wegetariańskie"], "amenities": ["Toaleta", "Wi-Fi", "Bezpłatne Wi-Fi"], "atmosphere": ["Kameralne", "Modne", "Niezobowiązująca atmosfera", "Spokojne"], "crowd": ["Dla całej rodziny", "Grupy", "Studenci", "Turyści"], "children": ["Dobre miejsce na przyjęcia urodzinowe dla dzieci", "Krzesełka do karmienia", "Menu dla dzieci", "Odpowiednie dla dzieci"], "parking": ["Bezpłatny parking", "Bezpłatny parking przy ulicy", "Raczej trudno znaleźć miejsce"], "context": "Miejsce o nazwie Da Grasso to miejsce typu: Pizzeria, Pizza na telefon, Pizza na wynos, Restauracja. W ofercie znajduje się: Alkohol, Jedzenie późnym wieczorem, Kawa, Małe porcje, Piwo, Szybka przekąska, To miejsce oferuje dania wegańskie, W ofercie dania wegetariańskie. Specjalne cechy miejsca: Dobra kawa, Dobre desery, Duży wybór herbat, Duży wybór piw, Sport. Atmosfera jest opisywana jako: Kameralne, Modne, Niezobowiązująca atmosfera, Spokojne. Miejsce oferuje udogodnienia dostępności: Parking dostępny dla osób na wózkach, Wejście dostępne dla osób na wózkach. Dostępne udogodnienia to: Toaleta, Wi-Fi, Bezpłatne Wi-Fi. Typowa grupa odwiedzających: Dla całej rodziny, Grupy, Studenci, Turyści. Jest popularne szczególnie na: Obiad, Kolacja, Posiłki w pojedynkę.", "google_rating": 4.4, "google_reviews_total": 1438, "google_price_range": "20–40"}}
{"oms_id": 506145823, "name": "Marie", "Współrzędne": "51.756521, 19.534072", "key_words": {"types": ["Restauracja"], "address": "Józefa Elsnera 23, 92-504 Łódź, Polska", "phone": "+48 575 900 062", "opening_hours": {"sobota": "12:00–17:00", "niedziela": "12:00–18:00", "poniedziałek": "11:00–18:00", "wtorek": "11:00–18:00", "środa": "11:00–18:00", "czwartek": "11:00–18:00", "piątek": "11:00–18:00"}, "service_options": ["Ogródek", "Dostawa bez kontaktu", "Dostawa", "Na wynos", "Na miejscu"], "specials": ["Dobra kawa", "Dobre desery", "Dobre drinki", "Duży wybór herbat", "Muzyka na żywo"], "popular_for": ["Śniadanie", "Obiad", "Kolacja", "Posiłki w pojedynkę"], "accessibility": [], "offerings": ["Alkohol", "Alkohol wysokoprocentowy", "Jedzenie późnym wieczorem", "Kawa", "Koktajle", "Małe porcje", "Piwo", "Prywatna sala", "Szybka przekąska", "W ofercie dania wegetariańskie", "Wino"], "amenities": ["Bar na miejscu", "Toaleta", "Wi-Fi", "Bezpłatne Wi-Fi"], "atmosphere": ["Kameralne", "Niezobowiązująca atmosfera", "Spokojne"], "crowd": ["Dla całej rodziny", "Grupy", "Turyści"], "children": ["Dobre miejsce na przyjęcia urodzinowe dla dzieci", "Krzesełka do karmienia", "Ma przewijak(i)", "Menu dla dzieci", "Odpowiednie dla dzieci"], "parking": ["Bezpłatny parking", "Bezpłatny parking przy ulicy", "Dużo miejsc parkingowych"], "context": "Miejsce o nazwie Marie to miejsce typu: Restauracja. W ofercie znajduje się: Alkohol, Alkohol wysokoprocentowy, Jedzenie późnym wieczorem, Kawa, Koktajle, Małe porcje, Piwo, Prywatna sala. Specjalne cechy miejsca: Dobra kawa, Dobre desery, Dobre drinki, Duży wybór herbat, Muzyka na żywo. Atmosfera jest opisywana jako: Kameralne, Niezobowiązująca atmosfera, Spokojne. Dostępne udogodnienia to: Bar na miejscu, Toaleta, Wi-Fi, Bezpłatne Wi-Fi. Typowa grupa odwiedzających: Dla całej rodziny, Grupy, Turyści. Jest popularne szczególnie na: Śniadanie, Obiad, Kolacja, Posiłki w pojedynkę.", "google_rating": 4.4, "google_reviews_total": 583, "google_price_range": "20–40"}}
{"oms_id": 622639589, "name": "The Mexican", "Współrzędne": "51.779484, 19.447041", "key_words": {"types": ["Kuchnia meksykańska", "Restauracja Tex Mex"], "address": "Ogrodowa 19A, 91-065 Łódź, Polska", "phone": "+48 505 100 109", "opening_hours": {"sobota": "11:00–00:00", "niedziela": "11:00–23:00", "poniedziałek": "11:00–23:00", "wtorek": "11:00–23:00", "środa": "11:00–23:00", "czwartek": "11:00–23:00", "piątek": "11:00–00:00"}, "service_options": ["Ogródek", "Dostawa", "Na wynos", "Na miejscu"], "specials": ["Dobra kawa", "Dobre desery", "Dobre drinki", "Duży wybór herbat", "Muzyka na żywo"], "popular_for": ["Obiad", "Kolacja", "Posiłki w pojedynkę"], "accessibility": ["Miejsca dla osób na wózkach", "Wejście dostępne dla osób na wózkach"], "offerings": ["Alkohol", "Alkohol wysokoprocentowy", "Jedzenie późnym wieczorem", "Kawa", "Koktajle", "Małe porcje", "Piwo", "Szybka przekąska", "W ofercie dania wegetariańskie", "Wino"], "amenities": ["Bar na miejscu", "Toaleta"], "atmosphere": ["Kameralne", "Modne", "Niezobowiązująca atmosfera", "Spokojne"], "crowd": ["Dla całej rodziny", "Grupy", "Studenci", "Turyści"], "children": ["Krzesełka do karmienia", "Menu dla dzieci", "Odpowiednie dla dzieci"], "parking": ["Bezpłatny parking", "Bezpłatny parking przy ulicy", "Dużo miejsc parkingowych"], "context": "Miejsce o nazwie The Mexican to miejsce typu: Kuchnia meksykańska, Restauracja Tex Mex. W ofercie znajduje się: Alkohol, Alkohol wysokoprocentowy, Jedzenie późnym wieczorem, Kawa, Koktajle, Małe porcje, Piwo, Szybka przekąska. Specjalne cechy miejsca: Dobra kawa, Dobre desery, Dobre drinki, Duży wybór herbat, Muzyka na żywo. Atmosfera jest opisywana jako: Kameralne, Modne, Niezobowiązująca atmosfera, Spokojne. Miejsce oferuje udogodnienia dostępności: Miejsca dla osób na wózkach, Wejście dostępne dla osób na wózkach. Dostępne udogodnienia to: Bar na miejscu, Toaleta. Typowa grupa odwiedzających: Dla całej rodziny, Grupy, Studenci, Turyści. Jest popularne szczególnie na: Obiad, Kolacja, Posiłki w pojedynkę.", "google_rating": 4.2, "google_reviews_total": 4121, "google_price_range": "40–60"}}
{"oms_id": 772840386, "name": "Prosto z Mostu", "Współrzędne": "51.747495, 19.400869", "key_words": {"types": ["Kawiarnia", "Piwiarnia", "Bistro", "Restauracja śniadaniowa", "Pub", "Pub irlandzki", "Winiarnia"], "address": "aleja Kardynała Stefana Wyszyńskiego 25, 94-048 Łódź, Polska", "phone": "+48 690 416 159", "opening_hours": {"sobota": "10:00–22:00", "niedziela": "10:00–20:00", "poniedziałek": "10:00–22:00", "wtorek": "10:00–22:00", "środa": "10:00–22:00", "czwartek": "10:00–22:00", "piątek": "10:00–22:00"}, "service_options": ["Ogródek", "Dostawa bez kontaktu", "Dostawa", "Na wynos", "Na miejscu"], "specials": ["Dobra kawa", "Dobre desery", "Duży wybór herbat", "Duży wybór piw", "Kominek", "Obszerna karta win"], "popular_for": ["Śniadanie", "Kolacja", "Posiłki w pojedynkę", "Dobre miejsce do pracy na laptopie"], "accessibility": ["Miejsca dla osób na wózkach", "Wejście dostępne dla osób na wózkach"], "offerings": ["Alkohol", "Jedzenie późnym wieczorem", "Kawa", "Koktajle", "Piwo", "Prywatna sala", "Szybka przekąska", "To miejsce oferuje dania wegańskie", "W ofercie dania wegetariańskie", "Wino"], "amenities": ["Bar na miejscu", "Toaleta", "Toaleta unisex", "Wi-Fi", "Bezpłatne Wi-Fi"], "atmosphere": ["Kameralne", "Modne", "Niezobowiązująca atmosfera", "Romantyczna atmosfera", "Spokojne"], "crowd": ["Dla całej rodziny", "Grupy", "Przyjazne dla osób LGBTQ+", "Studenci", "Turyści"], "children": ["Odpowiednie dla dzieci"], "parking": ["Bezpłatny parking", "Bezpłatny parking przy ulicy", "Dużo miejsc parkingowych"], "context": "Miejsce o nazwie Prosto z Mostu to miejsce typu: Kawiarnia, Piwiarnia, Bistro, Restauracja śniadaniowa, Pub, Pub irlandzki, Winiarnia. W ofercie znajduje się: Alkohol, Jedzenie późnym wieczorem, Kawa, Koktajle, Piwo, Prywatna sala, Szybka przekąska, To miejsce oferuje dania wegańskie. Specjalne cechy miejsca: Dobra kawa, Dobre desery, Duży wybór herbat, Duży wybór piw, Kominek, Obszerna karta win. Atmosfera jest opisywana jako: Kameralne, Modne, Niezobowiązująca atmosfera, Romantyczna atmosfera, Spokojne. Miejsce oferuje udogodnienia dostępności: Miejsca dla osób na wózkach, Wejście dostępne dla osób na wózkach. Dostępne udogodnienia to: Bar na miejscu, Toaleta, Toaleta unisex, Wi-Fi, Bezpłatne Wi-Fi. Typowa grupa odwiedzających: Dla całej rodziny, Grupy, Przyjazne dla osób LGBTQ+, Stud...", "google_rating": 4.8, "google_reviews_total": 1427, "google_price_range": "20–40"}}
{"oms_id": 783738142, "name": "Soplicowo", "Współrzędne": "51.756532, 19.463321", "key_words": {"types": ["Restauracja"], "address": "Stanisława Wigury 12A, 90-319 Łódź, Polska", "phone": "+48 42 637 30 81", "opening_hours": {"sobota": "12:00–23:00", "niedziela": "12:00–21:00", "poniedziałek": "Zamknięte", "wtorek": "12:00–22:00", "środa": "12:00–22:00", "czwartek": "12:00–22:00", "piątek": "12:00–23:00"}, "service_options": ["Ogródek", "Na wynos", "Na miejscu"], "specials": ["Dobra kawa", "Dobre desery", "Dobre drinki", "Duży wybór herbat", "Duży wybór piw", "Kominek", "Obszerna karta win"], "popular_for": ["Obiad", "Kolacja", "Posiłki w pojedynkę"], "accessibility": ["Miejsca dla osób na wózkach", "Toaleta dla osób na wózkach"], "offerings": ["Alkohol", "Alkohol wysokoprocentowy", "Jedzenie późnym wieczorem", "Kawa", "Koktajle", "Małe porcje", "Piwo", "To miejsce oferuje dania wegańskie", "W ofercie dania wegetariańskie", "Wino"], "amenities": ["Bar na miejscu", "Toaleta"], "atmosphere": ["Historyczne", "Kameralne", "Miejsce luksusowe", "Modne", "Niezobowiązująca atmosfera", "Romantyczna atmosfera", "Spokojne"], "crowd": ["Grupy", "Turyści"], "children": ["Krzesełka do karmienia", "Menu dla dzieci", "Odpowiednie dla dzieci"], "parking": ["Bezpłatny parking"], "context": "Miejsce o nazwie Soplicowo to miejsce typu: Restauracja. W ofercie znajduje się: Alkohol, Alkohol wysokoprocentowy, Jedzenie późnym wieczorem, Kawa, Koktajle, Małe porcje, Piwo, To miejsce oferuje dania wegańskie. Specjalne cechy miejsca: Dobra kawa, Dobre desery, Dobre drinki, Duży wybór herbat, Duży wybór piw, Kominek, Obszerna karta win. Atmosfera jest opisywana jako: Historyczne, Kameralne, Miejsce luksusowe, Modne, Niezobowiązująca atmosfera, Romantyczna atmosfera, Spokojne. Miejsce oferuje udogodnienia dostępności: Miejsca dla osób na wózkach, Toaleta dla osób na wózkach. Dostępne udogodnienia to: Bar na miejscu, Toaleta. Typowa grupa odwiedzających: Grupy, Turyści. Jest popularne szczególnie na: Obiad, Kolacja, Posiłki w pojedynkę.", "google_rating": 4.6, "google_reviews_total": 1303, "google_price_range": "$$"}}
{"oms_id": 1194330624, "name": "Cukiernia Sowa", "Współrzędne": "51.778819, 19.442600", "key_words": {"types": ["Cukiernia"], "address": "Juliana Tuwima 15, 90-010 Łódź, Polska", "phone": "+48 42 250 03 56", "opening_hours": {"sobota": "09:00–19:00", "niedziela": "10:00–18:00", "poniedziałek": "08:00–19:00", "wtorek": "08:00–19:00", "środa": "08:00–19:00", "czwartek": "08:00–19:00", "piątek": "08:00–19:00"}, "service_options": ["Na wynos", "Na miejscu"], "specials": [], "popular_for": [], "accessibility": ["Wejście dostępne dla osób na wózkach"], "offerings": ["Kawa"], "amenities": ["Toaleta"], "atmosphere": [], "crowd": [], "children": [], "parking": [], "context": "Miejsce o nazwie Cukiernia Sowa to miejsce typu: Cukiernia. W ofercie znajduje się: Kawa. Miejsce oferuje udogodnienia dostępności: Wejście dostępne dla osób na wózkach. Dostępne udogodnienia to: Toaleta.", "google_rating": 4.5, "google_reviews_total": 242, "google_price_range": "20–40"}}
{"oms_id": 1205570976, "name": "Biesiadowo", "Współrzędne": "51.773234, 19.455293", "key_words": {"types": ["Pizzeria", "Kuchnia włoska"], "address": "Piotrkowska 25, 90-410 Łódź, Polska", "phone": "+48 42 671 06 36", "opening_hours": {"sobota": "11:00–00:00", "niedziela": "11:00–23:00", "poniedziałek": "11:00–23:00", "wtorek": "11:00–23:00", "środa": "11:00–23:00", "czwartek": "11:00–23:00", "piątek": "11:00–00:00"}, "service_options": ["Ogródek", "Dostawa", "Na wynos", "Na miejscu"], "specials": ["Dobre desery", "Duży wybór herbat", "Sport"], "popular_for": ["Obiad", "Kolacja", "Posiłki w pojedynkę"], "accessibility": [], "offerings": ["Alkohol", "Alkohol wysokoprocentowy", "Jedzenie późnym wieczorem", "Kawa", "Koktajle", "Małe porcje", "Piwo", "Szybka przekąska", "Wino"], "amenities": ["Bar na miejscu", "Toaleta"], "atmosphere": ["Kameralne", "Modne", "Niezobowiązująca atmosfera", "Spokojne"], "crowd": ["Grupy", "Studenci", "Turyści"], "children": ["Menu dla dzieci", "Odpowiednie dla dzieci"], "parking": ["Bezpłatny parking przy ulicy", "Trudno znaleźć miejsce", "Płatny parking przy ulicy"], "context": "Miejsce o nazwie Biesiadowo to miejsce typu: Pizzeria, Kuchnia włoska. W ofercie znajduje się: Alkohol, Alkohol wysokoprocentowy, Jedzenie późnym wieczorem, Kawa, Koktajle, Małe porcje, Piwo, Szybka przekąska. Specjalne cechy miejsca: Dobre desery, Duży wybór herbat, Sport. Atmosfera jest opisywana jako: Kameralne, Modne, Niezobowiązująca atmosfera, Spokojne. Dostępne udogodnienia to: Bar na miejscu, Toaleta. Typowa grupa odwiedzających: Grupy, Studenci, Turyści. Jest popularne szczególnie na: Obiad, Kolacja, Posiłki w pojedynkę.", "google_rating": 3.8, "google_reviews_total": 1987, "google_price_range": "20–40"}}
{"oms_id": 1360232267, "name": "Manekin", "Współrzędne": "51.768614, 19.455927", "key_words": {"types": ["Naleśnikarnia", "Restauracja"], "address": "6 Sierpnia 1, 90-422 Łódź, Polska", "phone": "+48 570 842 259", "opening_hours": {"sobota": "10:00–23:30", "niedziela": "10:00–22:30", "poniedziałek": "10:00–22:30", "wtorek": "10:00–22:30", "środa": "10:00–22:30", "czwartek": "10:00–22:30", "piątek": "10:00–23:30"}, "service_options": ["Ogródek", "Na wynos", "Na miejscu"], "specials": ["Dobra kawa", "Dobre desery", "Duży wybór herbat"], "popular_for": ["Śniadanie", "Obiad", "Kolacja", "Posiłki w pojedynkę"], "accessibility": [], "offerings": ["Alkohol", "Alkohol wysokoprocentowy", "Dania z produktów ekologicznych", "Jedzenie późnym wieczorem", "Kawa", "Koktajle", "Małe porcje", "Piwo", "To miejsce oferuje dania wegańskie", "W ofercie dania wegetariańskie", "Wino"], "amenities": ["Bar na miejscu", "Toaleta"], "atmosphere": ["Kameralne", "Modne", "Niezobowiązująca atmosfera", "Romantyczna atmosfera", "Spokojne"], "crowd": ["Dla całej rodziny", "Grupy", "Studenci", "Turyści"], "children": ["Krzesełka do karmienia", "Menu dla dzieci", "Odpowiednie dla dzieci"], "parking": ["Płatny parking przy ulicy"], "context": "Miejsce o nazwie Manekin to miejsce typu: Naleśnikarnia, Restauracja. W ofercie znajduje się: Alkohol, Alkohol wysokoprocentowy, Dania z produktów ekologicznych, Jedzenie późnym wieczorem, Kawa, Koktajle, Małe porcje, Piwo. Specjalne cechy miejsca: Dobra kawa, Dobre desery, Duży wybór herbat. Atmosfera jest opisywana jako: Kameralne, Modne, Niezobowiązująca atmosfera, Romantyczna atmosfera, Spokojne. Dostępne udogodnienia to: Bar na miejscu, Toaleta. Typowa grupa odwiedzających: Dla całej rodziny, Grupy, Studenci, Turyści. Jest popularne szczególnie na: Śniadanie, Obiad, Kolacja, Posiłki w pojedynkę.", "google_rating": 4.5, "google_reviews_total": 13076, "google_price_range": "$"}}
{"oms_id": 1728036487, "name": "Fabrykant", "Współrzędne": "51.741110, 19.480095", "key_words": {"types": ["Atrakcja turystyczna"], "address": "Ks. Ignacego Skorupki, 90-532 Łódź, Polska", "phone": "", "opening_hours": {"sobota": "Czynne całą dobę", "niedziela": "Czynne całą dobę", "poniedziałek": "Czynne całą dobę", "wtorek": "Czynne całą dobę", "środa": "Czynne całą dobę", "czwartek": "Czynne całą dobę", "piątek": "Czynne całą dobę"}, "service_options": [], "specials": [], "popular_for": [], "accessibility": ["Wejście dostępne dla osób na wózkach"], "offerings": [], "amenities": [], "atmosphere": [], "crowd": [], "children": ["Odpowiednie dla dzieci"], "parking": [], "context": "Miejsce o nazwie Fabrykant to miejsce typu: Atrakcja turystyczna. Miejsce oferuje udogodnienia dostępności: Wejście dostępne dla osób na wózkach.", "google_rating": 4.9, "google_reviews_total": 60, "google_price_range": null}}
{"oms_id": 1794956363, "name": "Obiady domowe", "Współrzędne": "51.727711, 19.448969", "key_words": {"types": ["Restauracja"], "address": "Zarzewska 3, 93-184 Łódź, Polska", "phone": "+48 503 894 123", "opening_hours": {"sobota": "Zamknięte", "niedziela": "Zamknięte", "poniedziałek": "08:00–16:00", "wtorek": "08:00–16:00", "środa": "08:00–16:00", "czwartek": "08:00–16:00", "piątek": "08:00–16:00"}, "service_options": ["Dostawa bez kontaktu", "Dostawa", "Obsługa zmotoryzowanych", "Na wynos"], "specials": ["Duży wybór herbat"], "popular_for": ["Obiad", "Posiłki w pojedynkę"], "accessibility": ["Wejście dostępne dla osób na wózkach"], "offerings": ["Kawa", "Szybka przekąska"], "amenities": [], "atmosphere": ["Kameralne", "Niezobowiązująca atmosfera", "Spokojne"], "crowd": ["Dla całej rodziny", "Grupy", "Miejsce przyjazne dla osób transpłciowych", "Przyjazne dla osób LGBTQ+", "Turyści"], "children": ["Odpowiednie dla dzieci"], "parking": ["Bezpłatny parking", "Bezpłatny parking przy ulicy", "Dużo miejsc parkingowych"], "context": "Miejsce o nazwie Obiady domowe to miejsce typu: Restauracja. W ofercie znajduje się: Kawa, Szybka przekąska. Specjalne cechy miejsca: Duży wybór herbat. Atmosfera jest opisywana jako: Kameralne, Niezobowiązująca atmosfera, Spokojne. Miejsce oferuje udogodnienia dostępności: Wejście dostępne dla osób na wózkach. Typowa grupa odwiedzających: Dla całej rodziny, Grupy, Miejsce przyjazne dla osób transpłciowych, Przyjazne dla osób LGBTQ+, Turyści. Jest popularne szczególnie na: Obiad, Posiłki w pojedynkę.", "google_rating": 4.7, "google_reviews_total": 329, "google_price_range": "20–40"}}
{"oms_id": 1820217360, "name": "LaVende", "Współrzędne": "51.780667, 19.448171", "key_words": {"types": ["Restauracja"], "address": "Drewnowska 58, 91-002 Łódź, Polska", "phone": "+48 42 633 22 26", "opening_hours": {"sobota": "11:00–22:00", "niedziela": "11:00–21:00", "poniedziałek": "11:00–21:00", "wtorek": "11:00–21:00", "środa": "11:00–21:00", "czwartek": "11:00–21:00", "piątek": "11:00–22:00"}, "service_options": ["Ogródek", "Dostawa", "Na wynos", "Na miejscu"], "specials": ["Dobra kawa", "Dobre desery", "Dobre drinki", "Duży wybór herbat", "Obszerna karta win"], "popular_for": ["Obiad", "Kolacja", "Posiłki w pojedynkę"], "accessibility": ["Miejsca dla osób na wózkach", "Parking dostępny dla osób na wózkach", "Toaleta dla osób na wózkach", "Wejście dostępne dla osób na wózkach"], "offerings": ["Alkohol", "Alkohol wysokoprocentowy", "Jedzenie późnym wieczorem", "Kawa", "Koktajle", "Małe porcje", "Piwo", "To miejsce oferuje dania wegańskie", "W ofercie dania wegetariańskie", "Wino"], "amenities": ["Bar na miejscu", "Toaleta", "Toaleta unisex", "Wi-Fi", "Bezpłatne Wi-Fi"], "atmosphere": ["Kameralne", "Modne", "Niezobowiązująca atmosfera", "Romantyczna atmosfera", "Spokojne"], "crowd": ["Dla całej rodziny", "Grupy", "Turyści"], "children": ["Krzesełka do karmienia", "Menu dla dzieci", "Odpowiednie dla dzieci"], "parking": ["Bezpłatny parking", "Bezpłatny parking przy ulicy", "Dużo miejsc parkingowych"], "context": "Miejsce o nazwie LaVende to miejsce typu: Restauracja. W ofercie znajduje się: Alkohol, Alkohol wysokoprocentowy, Jedzenie późnym wieczorem, Kawa, Koktajle, Małe porcje, Piwo, To miejsce oferuje dania wegańskie. Specjalne cechy miejsca: Dobra kawa, Dobre desery, Dobre drinki, Duży wybór herbat, Obszerna karta win. Atmosfera jest opisywana jako: Kameralne, Modne, Niezobowiązująca atmosfera, Romantyczna atmosfera, Spokojne. Miejsce oferuje udogodnienia dostępności: Miejsca dla osób na wózkach, Parking dostępny dla osób na wózkach, Toaleta dla osób na wózkach, Wejście dostępne dla osób na wózkach. Dostępne udogodnienia to: Bar na miejscu, Toaleta, Toaleta unisex, Wi-Fi, Bezpłatne Wi-Fi. Typowa grupa odwiedzających: Dla całej rodziny, Grupy, Turyści. Jest popularne szczególnie na: Obiad, Ko...", "google_rating": 3.9, "google_reviews_total": 1132, "google_price_range": "$$"}}
{"oms_id": 1820217362, "name": "Pizza Hut", "Współrzędne": "51.780164, 19.446969", "key_words": {"types": ["Pizzeria", "Pizza na telefon", "Pizza na wynos", "Restauracja"], "address": "Drewnowska 58/5, 91-002 Łódź, Polska", "phone": "+48 22 536 36 36", "opening_hours": {"sobota": "11:00–23:00", "niedziela": "11:00–22:00", "poniedziałek": "11:00–22:00", "wtorek": "11:00–22:00", "środa": "11:00–22:00", "czwartek": "11:00–22:00", "piątek": "11:00–23:00"}, "service_options": ["Ogródek", "Dostawa bez kontaktu", "Dostawa", "Na wynos", "Na miejscu"], "specials": ["Dobra kawa", "Dobre desery", "Duży wybór herbat"], "popular_for": ["Obiad", "Kolacja", "Posiłki w pojedynkę"], "accessibility": ["Miejsca dla osób na wózkach", "Parking dostępny dla osób na wózkach", "Toaleta dla osób na wózkach", "Wejście dostępne dla osób na wózkach"], "offerings": ["Alkohol", "Bar sałatkowy", "Drinki w promocji happy hours", "Jedzenie późnym wieczorem", "Jedzenie w promocji happy hours", "Jesz, ile chcesz", "Kawa", "Koktajle", "Małe porcje", "Piwo", "Szybka przekąska", "To miejsce oferuje dania wegańskie", "W ofercie dania wegetariańskie", "Wino"], "amenities": ["Bar na miejscu", "Toaleta"], "atmosphere": ["Kameralne", "Modne", "Niezobowiązująca atmosfera", "Spokojne"], "crowd": ["Dla całej rodziny", "Grupy", "Miejsce przyjazne dla osób transpłciowych", "Przyjazne dla osób LGBTQ+", "Studenci", "Turyści"], "children": ["Krzesełka do karmienia", "Menu dla dzieci"], "parking": ["Bezpłatny parking", "Bezpłatny parking przy ulicy", "Dużo miejsc parkingowych"], "context": "Miejsce o nazwie Pizza Hut to miejsce typu: Pizzeria, Pizza na telefon, Pizza na wynos, Restauracja. W ofercie znajduje się: Alkohol, Bar sałatkowy, Drinki w promocji happy hours, Jedzenie późnym wieczorem, Jedzenie w promocji happy hours, Jesz, ile chcesz, Kawa, Koktajle. Specjalne cechy miejsca: Dobra kawa, Dobre desery, Duży wybór herbat. Atmosfera jest opisywana jako: Kameralne, Modne, Niezobowiązująca atmosfera, Spokojne. Miejsce oferuje udogodnienia dostępności: Miejsca dla osób na wózkach, Parking dostępny dla osób na wózkach, Toaleta dla osób na wózkach, Wejście dostępne dla osób na wózkach. Dostępne udogodnienia to: Bar na miejscu, Toaleta. Typowa grupa odwiedzających: Dla całej rodziny, Grupy, Miejsce przyjazne dla osób transpłciowych, Przyjazne dla osób LGBTQ+, Studenci, Tury...", "google_rating": 4.1, "google_reviews_total": 5465, "google_price_range": "40–60"}}
{"oms_id": 1820217367, "name": "Sphinx", "Współrzędne": "51.780578, 19.447186", "key_words": {"types": ["Restauracja", "Restauracja dla rodzin"], "address": "Piotrkowska 93, 90-423 Łódź, Polska", "phone": "+48 725 100 253", "opening_hours": {"sobota": "10:00–23:30", "niedziela": "12:00–22:00", "poniedziałek": "12:00–22:00", "wtorek": "12:00–22:00", "środa": "12:00–22:00", "czwartek": "12:00–22:00", "piątek": "12:00–23:30"}, "service_options": ["Ogródek", "Dostawa", "Na wynos", "Na miejscu"], "specials": ["Dobra kawa", "Dobre desery", "Dobre drinki", "Duży wybór herbat", "Duży wybór piw"], "popular_for": ["Obiad", "Kolacja", "Posiłki w pojedynkę"], "accessibility": [], "offerings": ["Alkohol", "Alkohol wysokoprocentowy", "Drinki w promocji happy hours", "Jedzenie późnym wieczorem", "Kawa", "Koktajle", "Małe porcje", "Piwo", "Szybka przekąska", "W ofercie dania wegetariańskie", "Wino"], "amenities": ["Bar na miejscu", "Toaleta", "Wi-Fi", "Bezpłatne Wi-Fi"], "atmosphere": ["Kameralne", "Modne", "Niezobowiązująca atmosfera", "Spokojne"], "crowd": ["Dla całej rodziny", "Grupy", "Miejsce przyjazne dla osób transpłciowych", "Przyjazne dla osób LGBTQ+", "Studenci", "Turyści"], "children": ["Krzesełka do karmienia", "Menu dla dzieci", "Odpowiednie dla dzieci"], "parking": ["Bezpłatny parking"], "context": "Miejsce o nazwie Sphinx to miejsce typu: Restauracja, Restauracja dla rodzin. W ofercie znajduje się: Alkohol, Alkohol wysokoprocentowy, Drinki w promocji happy hours, Jedzenie późnym wieczorem, Kawa, Koktajle, Małe porcje, Piwo. Specjalne cechy miejsca: Dobra kawa, Dobre desery, Dobre drinki, Duży wybór herbat, Duży wybór piw. Atmosfera jest opisywana jako: Kameralne, Modne, Niezobowiązująca atmosfera, Spokojne. Dostępne udogodnienia to: Bar na miejscu, Toaleta, Wi-Fi, Bezpłatne Wi-Fi. Typowa grupa odwiedzających: Dla całej rodziny, Grupy, Miejsce przyjazne dla osób transpłciowych, Przyjazne dla osób LGBTQ+, Studenci, Turyści. Jest popularne szczególnie na: Obiad, Kolacja, Posiłki w pojedynkę.", "google_rating": 4.7, "google_reviews_total": 10616, "google_price_range": "40–60"}}
{"oms_id": 1821342774, "name": "Pankejk", "Współrzędne": "51.779507, 19.447287", "key_words": {"types": ["Restauracja", "Pub", "Naleśnikarnia", "Restauracja – amerykańskie naleśniki"], "address": "Ogrodowa 19 a, 91-065 Łódź, Polska", "phone": "+48 530 668 866", "opening_hours": {"sobota": "11:00–00:00", "niedziela": "11:00–23:00", "poniedziałek": "11:00–23:00", "wtorek": "11:00–23:00", "środa": "11:00–23:00", "czwartek": "11:00–23:00", "piątek": "11:00–00:00"}, "service_options": ["Ogródek", "Dostawa bez kontaktu", "Dostawa", "Na wynos", "Na miejscu"], "specials": ["Dobra kawa", "Dobre desery", "Duży wybór herbat"], "popular_for": ["Śniadanie", "Obiad", "Kolacja", "Posiłki w pojedynkę"], "accessibility": ["Miejsca dla osób na wózkach", "Wejście dostępne dla osób na wózkach"], "offerings": ["Alkohol", "Alkohol wysokoprocentowy", "Jedzenie późnym wieczorem", "Kawa", "Koktajle", "Małe porcje", "Piwo", "Szybka przekąska", "Wino"], "amenities": ["Toaleta", "Wi-Fi", "Bezpłatne Wi-Fi"], "atmosphere": ["Kameralne", "Modne", "Niezobowiązująca atmosfera", "Spokojne"], "crowd": ["Grupy", "Miejsce przyjazne dla osób transpłciowych", "Przyjazne dla osób LGBTQ+", "Studenci", "Turyści"], "children": ["Krzesełka do karmienia", "Menu dla dzieci", "Odpowiednie dla dzieci"], "parking": ["Bezpłatny parking", "Dużo miejsc parkingowych"], "context": "Miejsce o nazwie Pankejk to miejsce typu: Restauracja, Pub, Naleśnikarnia, Restauracja – amerykańskie naleśniki. W ofercie znajduje się: Alkohol, Alkohol wysokoprocentowy, Jedzenie późnym wieczorem, Kawa, Koktajle, Małe porcje, Piwo, Szybka przekąska. Specjalne cechy miejsca: Dobra kawa, Dobre desery, Duży wybór herbat. Atmosfera jest opisywana jako: Kameralne, Modne, Niezobowiązująca atmosfera, Spokojne. Miejsce oferuje udogodnienia dostępności: Miejsca dla osób na wózkach, Wejście dostępne dla osób na wózkach. Dostępne udogodnienia to: Toaleta, Wi-Fi, Bezpłatne Wi-Fi. Typowa grupa odwiedzających: Grupy, Miejsce przyjazne dla osób transpłciowych, Przyjazne dla osób LGBTQ+, Studenci, Turyści. Jest popularne szczególnie na: Śniadanie, Obiad, Kolacja, Posiłki w pojedynkę.", "google_rating": 4.1, "google_reviews_total": 4635, "google_price_range": "20–40"}}
{"oms_id": 1821342775, "name": "Costa", "Współrzędne": "51.779576, 19.447952", "key_words": {"types": ["Kawiarnia"], "address": "al. marsz. Józefa Piłsudskiego 15/23, 90-307 Łódź, Polska", "phone": "+48 453 569 732", "opening_hours": {"sobota": "09:00–21:00", "niedziela": "Zamknięte", "poniedziałek": "09:00–21:00", "wtorek": "09:00–21:00", "środa": "09:00–21:00", "czwartek": "09:00–21:00", "piątek": "09:00–21:00"}, "service_options": ["Dostawa", "Na wynos", "Na miejscu"], "specials": ["Dobra kawa", "Dobre desery", "Duży wybór herbat"], "popular_for": ["Śniadanie", "Posiłki w pojedynkę", "Dobre miejsce do pracy na laptopie"], "accessibility": ["Miejsca dla osób na wózkach", "Wejście dostępne dla osób na wózkach"], "offerings": ["Kawa", "Małe porcje", "Szybka przekąska", "W ofercie dania wegetariańskie"], "amenities": [], "atmosphere": ["Kameralne", "Modne", "Niezobowiązująca atmosfera", "Spokojne"], "crowd": ["Grupy", "Przyjazne dla osób LGBTQ+", "Studenci", "Turyści"], "children": ["Odpowiednie dla dzieci"], "parking": ["Bezpłatny parking", "Dużo miejsc parkingowych"], "context": "Miejsce o nazwie Costa to miejsce typu: Kawiarnia. W ofercie znajduje się: Kawa, Małe porcje, Szybka przekąska, W ofercie dania wegetariańskie. Specjalne cechy miejsca: Dobra kawa, Dobre desery, Duży wybór herbat. Atmosfera jest opisywana jako: Kameralne, Modne, Niezobowiązująca atmosfera, Spokojne. Miejsce oferuje udogodnienia dostępności: Miejsca dla osób na wózkach, Wejście dostępne dla osób na wózkach. Typowa grupa odwiedzających: Grupy, Przyjazne dla osób LGBTQ+, Studenci, Turyści. Jest popularne szczególnie na: Śniadanie, Posiłki w pojedynkę, Dobre miejsce do pracy na laptopie.", "google_rating": 4.2, "google_reviews_total": 593, "google_price_range": "20–40"}}
{"oms_id": 1821342777, "name": "Starbucks", "Współrzędne": "51.780011, 19.448829", "key_words": {"types": ["Kawiarnia"], "address": "Drewnowska 58, 91-002 Łódź, Polska", "phone": "+48 572 508 785", "opening_hours": {"sobota": "07:00–23:00", "niedziela": "08:00–22:00", "poniedziałek": "07:00–23:00", "wtorek": "07:00–23:00", "środa": "07:00–23:00", "czwartek": "07:00–23:00", "piątek": "07:00–23:00"}, "service_options": ["Ogródek", "Dostawa", "Na wynos", "Na miejscu"], "specials": ["Dobra kawa", "Dobre desery", "Duży wybór herbat"], "popular_for": ["Śniadanie", "Posiłki w pojedynkę", "Dobre miejsce do pracy na laptopie"], "accessibility": ["Miejsca dla osób na wózkach", "Parking dostępny dla osób na wózkach", "Toaleta dla osób na wózkach", "Wejście dostępne dla osób na wózkach"], "offerings": ["Dania z produktów ekologicznych", "Jedzenie późnym wieczorem", "Kawa", "Małe porcje", "Szybka przekąska", "W ofercie dania wegetariańskie"], "amenities": ["Toaleta"], "atmosphere": ["Kameralne", "Modne", "Niezobowiązująca atmosfera", "Spokojne"], "crowd": ["Grupy", "Studenci", "Turyści"], "children": [], "parking": ["Bezpłatny parking", "Bezpłatny parking przy ulicy", "Dużo miejsc parkingowych"], "context": "Miejsce o nazwie Starbucks to miejsce typu: Kawiarnia. W ofercie znajduje się: Dania z produktów ekologicznych, Jedzenie późnym wieczorem, Kawa, Małe porcje, Szybka przekąska, W ofercie dania wegetariańskie. Specjalne cechy miejsca: Dobra kawa, Dobre desery, Duży wybór herbat. Atmosfera jest opisywana jako: Kameralne, Modne, Niezobowiązująca atmosfera, Spokojne. Miejsce oferuje udogodnienia dostępności: Miejsca dla osób na wózkach, Parking dostępny dla osób na wózkach, Toaleta dla osób na wózkach, Wejście dostępne dla osób na wózkach. Dostępne udogodnienia to: Toaleta. Typowa grupa odwiedzających: Grupy, Studenci, Turyści. Jest popularne szczególnie na: Śniadanie, Posiłki w pojedynkę, Dobre miejsce do pracy na laptopie.", "google_rating": 4.3, "google_reviews_total": 2268, "google_price_range": "20–40"}}
{"oms_id": 1821342782, "name": "Ganesh", "Współrzędne": "51.779516, 19.449036", "key_words": {"types": ["Kuchnia indyjska"], "address": "Ogrodowa 19a, 91-065 Łódź, Polska", "phone": "+48 42 634 12 13", "opening_hours": {"sobota": "11:00–22:00", "niedziela": "12:00–20:00", "poniedziałek": "11:00–21:30", "wtorek": "11:00–21:30", "środa": "11:00–21:30", "czwartek": "11:00–21:30", "piątek": "11:00–22:00"}, "service_options": ["Ogródek", "Dostawa bez kontaktu", "Dostawa", "Na wynos", "Na miejscu"], "specials": ["Dobra kawa", "Dobre desery", "Duży wybór herbat"], "popular_for": ["Obiad", "Kolacja", "Posiłki w pojedynkę"], "accessibility": ["Miejsca dla osób na wózkach", "Wejście dostępne dla osób na wózkach"], "offerings": ["Alkohol", "Alkohol wysokoprocentowy", "Jedzenie późnym wieczorem", "Jedzenie w promocji happy hours", "Kawa", "Koktajle", "Małe porcje", "Piwo", "To miejsce oferuje dania wegańskie", "W ofercie dania wegetariańskie", "Wino"], "amenities": ["Bar na miejscu", "Toaleta", "Wi-Fi", "Bezpłatne Wi-Fi"], "atmosphere": ["Kameralne", "Modne", "Niezobowiązująca atmosfera", "Spokojne"], "crowd": ["Dla całej rodziny", "Grupy", "Turyści"], "children": ["Menu dla dzieci", "Odpowiednie dla dzieci"], "parking": ["Bezpłatny parking", "Dużo miejsc parkingowych"], "context": "Miejsce o nazwie Ganesh to miejsce typu: Kuchnia indyjska. W ofercie znajduje się: Alkohol, Alkohol wysokoprocentowy, Jedzenie późnym wieczorem, Jedzenie w promocji happy hours, Kawa, Koktajle, Małe porcje, Piwo. Specjalne cechy miejsca: Dobra kawa, Dobre desery, Duży wybór herbat. Atmosfera jest opisywana jako: Kameralne, Modne, Niezobowiązująca atmosfera, Spokojne. Miejsce oferuje udogodnienia dostępności: Miejsca dla osób na wózkach, Wejście dostępne dla osób na wózkach. Dostępne udogodnienia to: Bar na miejscu, Toaleta, Wi-Fi, Bezpłatne Wi-Fi. Typowa grupa odwiedzających: Dla całej rodziny, Grupy, Turyści. Jest popularne szczególnie na: Obiad, Kolacja, Posiłki w pojedynkę.", "google_rating": 4, "google_reviews_total": 699, "google_price_range": "40–60"}}
{"oms_id": 1821342801, "name": "Pijalnia Czekolady E. Wedel", "Współrzędne": "51.779525, 19.447465", "key_words": {"types": ["Kawiarnia", "Czekoladziarnia", "Sklep z czekoladą"], "address": "Piotrkowska 69, 90-422 Łódź, Polska", "phone": "+48 661 961 864", "opening_hours": {"sobota": "10:00–22:00", "niedziela": "10:00–21:00", "poniedziałek": "10:00–22:00", "wtorek": "10:00–22:00", "środa": "10:00–22:00", "czwartek": "10:00–22:00", "piątek": "10:00–22:00"}, "service_options": ["Ogródek", "Dostawa", "Na wynos", "Na miejscu"], "specials": ["Dobra kawa", "Dobre desery", "Duży wybór herbat"], "popular_for": ["Śniadanie", "Posiłki w pojedynkę", "Dobre miejsce do pracy na laptopie"], "accessibility": ["Miejsca dla osób na wózkach", "Toaleta dla osób na wózkach"], "offerings": ["Alkohol", "Jedzenie późnym wieczorem", "Kawa", "Małe porcje", "Szybka przekąska", "W ofercie dania wegetariańskie", "Wino"], "amenities": ["Bar na miejscu", "Toaleta", "Wi-Fi", "Bezpłatne Wi-Fi"], "atmosphere": ["Kameralne", "Modne", "Niezobowiązująca atmosfera", "Romantyczna atmosfera", "Spokojne"], "crowd": ["Dla całej rodziny", "Grupy", "Przyjazne dla osób LGBTQ+", "Studenci", "Turyści"], "children": ["Krzesełka do karmienia", "Menu dla dzieci", "Odpowiednie dla dzieci"], "parking": ["Bezpłatny parking", "Trudno znaleźć miejsce", "Płatny parking przy ulicy"], "context": "Miejsce o nazwie Pijalnia Czekolady E. Wedel to miejsce typu: Kawiarnia, Czekoladziarnia, Sklep z czekoladą. W ofercie znajduje się: Alkohol, Jedzenie późnym wieczorem, Kawa, Małe porcje, Szybka przekąska, W ofercie dania wegetariańskie, Wino. Specjalne cechy miejsca: Dobra kawa, Dobre desery, Duży wybór herbat. Atmosfera jest opisywana jako: Kameralne, Modne, Niezobowiązująca atmosfera, Romantyczna atmosfera, Spokojne. Miejsce oferuje udogodnienia dostępności: Miejsca dla osób na wózkach, Toaleta dla osób na wózkach. Dostępne udogodnienia to: Bar na miejscu, Toaleta, Wi-Fi, Bezpłatne Wi-Fi. Typowa grupa odwiedzających: Dla całej rodziny, Grupy, Przyjazne dla osób LGBTQ+, Studenci, Turyści. Jest popularne szczególnie na: Śniadanie, Posiłki w pojedynkę, Dobre miejsce do pracy na laptopie.", "google_rating": 4.4, "google_reviews_total": 1856, "google_price_range": "20–40"}}
{"oms_id": 1821342802, "name": "Polka", "Współrzędne": "51.779602, 19.448259", "key_words": {"types": ["Restauracja"], "address": "Ogrodowa 19 a, 91-065 Łódź, Polska", "phone": "+48 42 630 35 30", "opening_hours": {"sobota": "11:00–23:00", "niedziela": "11:00–22:00", "poniedziałek": "11:00–23:00", "wtorek": "11:00–23:00", "środa": "11:00–23:00", "czwartek": "11:00–23:00", "piątek": "11:00–23:00"}, "service_options": ["Ogródek", "Na wynos", "Na miejscu"], "specials": ["Dobra kawa", "Dobre desery", "Dobre drinki", "Duży wybór herbat", "Obszerna karta win"], "popular_for": ["Obiad", "Kolacja", "Posiłki w pojedynkę"], "accessibility": ["Miejsca dla osób na wózkach", "Parking dostępny dla osób na wózkach", "Toaleta dla osób na wózkach", "Wejście dostępne dla osób na wózkach"], "offerings": ["Alkohol", "Alkohol wysokoprocentowy", "Jedzenie późnym wieczorem", "Kawa", "Koktajle", "Małe porcje", "Piwo", "W ofercie dania wegetariańskie", "Wino"], "amenities": ["Bar na miejscu", "Toaleta"], "atmosphere": ["Kameralne", "Miejsce luksusowe", "Modne", "Niezobowiązująca atmosfera", "Romantyczna atmosfera", "Spokojne"], "crowd": ["Dla całej rodziny", "Grupy", "Turyści"], "children": ["Krzesełka do karmienia", "Menu dla dzieci", "Odpowiednie dla dzieci"], "parking": ["Bezpłatny parking", "Dużo miejsc parkingowych"], "context": "Miejsce o nazwie Polka to miejsce typu: Restauracja. W ofercie znajduje się: Alkohol, Alkohol wysokoprocentowy, Jedzenie późnym wieczorem, Kawa, Koktajle, Małe porcje, Piwo, W ofercie dania wegetariańskie. Specjalne cechy miejsca: Dobra kawa, Dobre desery, Dobre drinki, Duży wybór herbat, Obszerna karta win. Atmosfera jest opisywana jako: Kameralne, Miejsce luksusowe, Modne, Niezobowiązująca atmosfera, Romantyczna atmosfera, Spokojne. Miejsce oferuje udogodnienia dostępności: Miejsca dla osób na wózkach, Parking dostępny dla osób na wózkach, Toaleta dla osób na wózkach, Wejście dostępne dla osób na wózkach. Dostępne udogodnienia to: Bar na miejscu, Toaleta. Typowa grupa odwiedzających: Dla całej rodziny, Grupy, Turyści. Jest popularne szczególnie na: Obiad, Kolacja, Posiłki w pojedynkę.", "google_rating": 3.9, "google_reviews_total": 1630, "google_price_range": "$$"}}
{"oms_id": 1910225844, "name": "Gruby Benek", "Współrzędne": "51.792984, 19.455432", "key_words": {"types": ["Pizzeria", "Pizza na telefon", "Pizza na wynos"], "address": "Łagiewnicka 61, 91-839 Łódź, Polska", "phone": "+48 42 250 65 06", "opening_hours": {"sobota": "11:00–02:45", "niedziela": "12:00–02:45", "poniedziałek": "11:00–02:45", "wtorek": "11:00–02:45", "środa": "11:00–02:45", "czwartek": "11:00–02:45", "piątek": "11:00–02:45"}, "service_options": ["Ogródek", "Dostawa bez kontaktu", "Dostawa", "Na wynos", "Na miejscu"], "specials": ["Kominek"], "popular_for": ["Obiad", "Kolacja", "Posiłki w pojedynkę"], "accessibility": ["Wejście dostępne dla osób na wózkach"], "offerings": ["Alkohol", "Jedzenie późnym wieczorem", "Kawa", "Małe porcje", "Piwo", "Szybka przekąska", "W ofercie dania wegetariańskie"], "amenities": ["Toaleta", "Wi-Fi", "Bezpłatne Wi-Fi"], "atmosphere": ["Kameralne", "Modne", "Niezobowiązująca atmosfera", "Spokojne"], "crowd": ["Dla całej rodziny", "Grupy", "Studenci", "Turyści"], "children": ["Krzesełka do karmienia", "Menu dla dzieci", "Odpowiednie dla dzieci"], "parking": ["Bezpłatny parking", "Bezpłatny parking przy ulicy", "Dużo miejsc parkingowych"], "context": "Miejsce o nazwie Gruby Benek to miejsce typu: Pizzeria, Pizza na telefon, Pizza na wynos. W ofercie znajduje się: Alkohol, Jedzenie późnym wieczorem, Kawa, Małe porcje, Piwo, Szybka przekąska, W ofercie dania wegetariańskie. Specjalne cechy miejsca: Kominek. Atmosfera jest opisywana jako: Kameralne, Modne, Niezobowiązująca atmosfera, Spokojne. Miejsce oferuje udogodnienia dostępności: Wejście dostępne dla osób na wózkach. Dostępne udogodnienia to: Toaleta, Wi-Fi, Bezpłatne Wi-Fi. Typowa grupa odwiedzających: Dla całej rodziny, Grupy, Studenci, Turyści. Jest popularne szczególnie na: Obiad, Kolacja, Posiłki w pojedynkę.", "google_rating": 3.6, "google_reviews_total": 1090, "google_price_range": "20–60"}}
{"oms_id": 1919057798, "name": "Otto", "Współrzędne": "51.800456, 19.375236", "key_words": {"types": ["Pizzeria", "Restauracja"], "address": "Aleksandrowska 76, 91-224 Łódź, Polska", "phone": "+48 42 611 04 11", "opening_hours": {"sobota": "14:00–23:00", "niedziela": "13:00–21:00", "poniedziałek": "Zamknięte", "wtorek": "Zamknięte", "środa": "14:00–21:00", "czwartek": "14:00–21:00", "piątek": "14:00–23:00"}, "service_options": ["Ogródek", "Dostawa bez kontaktu", "Dostawa", "Obsługa zmotoryzowanych", "Na wynos", "Na miejscu"], "specials": ["Dobra kawa", "Duży wybór herbat"], "popular_for": ["Obiad", "Kolacja", "Posiłki w pojedynkę"], "accessibility": ["Miejsca dla osób na wózkach", "Wejście dostępne dla osób na wózkach"], "offerings": ["Alkohol", "Alkohol wysokoprocentowy", "Dania z produktów ekologicznych", "Jedzenie późnym wieczorem", "Kawa", "Małe porcje", "Piwo", "Prywatna sala", "Szybka przekąska", "To miejsce oferuje dania wegańskie", "W ofercie dania wegetariańskie", "Wino"], "amenities": ["Bar na miejscu", "Toaleta"], "atmosphere": ["Kameralne", "Modne", "Niezobowiązująca atmosfera", "Spokojne"], "crowd": ["Grupy", "Studenci", "Turyści"], "children": ["Dobre miejsce na przyjęcia urodzinowe dla dzieci", "Krzesełka do karmienia", "Menu dla dzieci", "Odpowiednie dla dzieci"], "parking": ["Bezpłatny parking", "Bezpłatny parking przy ulicy", "Dużo miejsc parkingowych"], "context": "Miejsce o nazwie Otto to miejsce typu: Pizzeria, Restauracja. W ofercie znajduje się: Alkohol, Alkohol wysokoprocentowy, Dania z produktów ekologicznych, Jedzenie późnym wieczorem, Kawa, Małe porcje, Piwo, Prywatna sala. Specjalne cechy miejsca: Dobra kawa, Duży wybór herbat. Atmosfera jest opisywana jako: Kameralne, Modne, Niezobowiązująca atmosfera, Spokojne. Miejsce oferuje udogodnienia dostępności: Miejsca dla osób na wózkach, Wejście dostępne dla osób na wózkach. Dostępne udogodnienia to: Bar na miejscu, Toaleta. Typowa grupa odwiedzających: Grupy, Studenci, Turyści. Jest popularne szczególnie na: Obiad, Kolacja, Posiłki w pojedynkę.", "google_rating": 4.2, "google_reviews_total": 1237, "google_price_range": "40–60"}}
{"oms_id": 2296382947, "name": "Stołówka studencka", "Współrzędne": "51.779247, 19.493394", "key_words": {"types": ["Restauracja"], "address": "Patrice Lumumby 14, 91-404 Łódź, Polska", "phone": "", "opening_hours": {"sobota": "Zamknięte", "niedziela": "Zamknięte", "poniedziałek": "11:30–17:00", "wtorek": "11:30–17:00", "środa": "11:30–17:00", "czwartek": "11:30–17:00", "piątek": "11:30–17:00"}, "service_options": ["Na wynos", "Na miejscu"], "specials": [], "popular_for": ["Obiad", "Posiłki w pojedynkę"], "accessibility": [], "offerings": ["Kawa", "Małe porcje", "Szybka przekąska"], "amenities": ["Toaleta"], "atmosphere": ["Niezobowiązująca atmosfera", "Spokojne"], "crowd": ["Grupy"], "children": [], "parking": ["Bezpłatny parking", "Bezpłatny parking przy ulicy"], "context": "Miejsce o nazwie Stołówka studencka to miejsce typu: Restauracja. W ofercie znajduje się: Kawa, Małe porcje, Szybka przekąska. Atmosfera jest opisywana jako: Niezobowiązująca atmosfera, Spokojne. Dostępne udogodnienia to: Toaleta. Typowa grupa odwiedzających: Grupy. Jest popularne szczególnie na: Obiad, Posiłki w pojedynkę.", "google_rating": 4.2, "google_reviews_total": 95, "google_price_range": "1–20"}}
{"oms_id": 2389645039, "name": "Cukiernia Braci Miś", "Współrzędne": "51.762860, 19.462367", "key_words": {"types": ["Cukiernia"], "address": "Nawrot 18/20, 90-001 Łódź, Polska", "phone": "+48 663 930 009", "opening_hours": {"sobota": "07:00–19:00", "niedziela": "09:00–18:00", "poniedziałek": "07:00–19:00", "wtorek": "07:00–19:00", "środa": "07:00–19:00", "czwartek": "07:00–19:00", "piątek": "07:00–19:00"}, "service_options": ["Na wynos"], "specials": ["Dobre desery"], "popular_for": [], "accessibility": [], "offerings": [], "amenities": [], "atmosphere": [], "crowd": [], "children": [], "parking": [], "context": "Miejsce o nazwie Cukiernia Braci Miś to miejsce typu: Cukiernia. Specjalne cechy miejsca: Dobre desery.", "google_rating": 4.2, "google_reviews_total": 384, "google_price_range": "$"}}
{"oms_id": 2484841637, "name": "Grande Pizza", "Współrzędne": "51.732990, 19.471909", "key_words": {"types": ["Pizzeria", "Bar", "Restauracja"], "address": "Rzgowska 57, 93-172 Łódź, Polska", "phone": "+48 888 317 333", "opening_hours": {"sobota": "12:00–23:45", "niedziela": "12:00–21:45", "poniedziałek": "12:00–21:45", "wtorek": "12:00–21:45", "środa": "12:00–21:45", "czwartek": "12:00–21:45", "piątek": "12:00–23:45"}, "service_options": ["Ogródek", "Dostawa", "Na wynos", "Na miejscu"], "specials": [], "popular_for": ["Obiad", "Kolacja", "Posiłki w pojedynkę"], "accessibility": [], "offerings": ["Alkohol", "Jedzenie późnym wieczorem", "Małe porcje", "Piwo", "Szybka przekąska", "Wino"], "amenities": ["Toaleta"], "atmosphere": ["Kameralne", "Niezobowiązująca atmosfera", "Spokojne"], "crowd": ["Grupy", "Studenci", "Turyści"], "children": ["Menu dla dzieci"], "parking": ["Bezpłatny parking", "Bezpłatny parking przy ulicy"], "context": "Miejsce o nazwie Grande Pizza to miejsce typu: Pizzeria, Bar, Restauracja. W ofercie znajduje się: Alkohol, Jedzenie późnym wieczorem, Małe porcje, Piwo, Szybka przekąska, Wino. Atmosfera jest opisywana jako: Kameralne, Niezobowiązująca atmosfera, Spokojne. Dostępne udogodnienia to: Toaleta. Typowa grupa odwiedzających: Grupy, Studenci, Turyści. Jest popularne szczególnie na: Obiad, Kolacja, Posiłki w pojedynkę.", "google_rating": 3.8, "google_reviews_total": 673, "google_price_range": "20–40"}}
{"oms_id": 2713840857, "name": "Kofeina", "Współrzędne": "51.756827, 19.478989", "key_words": {"types": ["Kawiarnia", "Restauracja", "Jadłodajnia"], "address": "17 Fabryczna, 90-344 Łódź, Polska", "phone": "+48 660 703 676", "opening_hours": {"sobota": "Zamknięte", "niedziela": "Zamknięte", "poniedziałek": "09:00–16:00", "wtorek": "09:00–17:00", "środa": "09:00–17:00", "czwartek": "09:00–16:00", "piątek": "09:00–17:00"}, "service_options": ["Ogródek", "Dostawa", "Usługi na miejscu", "Na wynos", "Na miejscu"], "specials": ["Dobra kawa", "Dobre desery", "Duży wybór herbat"], "popular_for": ["Śniadanie", "Posiłki w pojedynkę"], "accessibility": ["Parking dostępny dla osób na wózkach", "Wejście dostępne dla osób na wózkach"], "offerings": ["Dania gotowe", "Kawa", "Prywatna sala", "Szybka przekąska", "To miejsce oferuje dania wegańskie", "W ofercie dania wegetariańskie"], "amenities": [], "atmosphere": ["Kameralne", "Niezobowiązująca atmosfera", "Spokojne"], "crowd": ["Dla całej rodziny", "Miejsce przyjazne dla osób transpłciowych", "Przyjazne dla osób LGBTQ+", "Turyści"], "children": [], "parking": ["Bezpłatny parking", "Bezpłatny parking przy ulicy", "Dużo miejsc parkingowych"], "context": "Miejsce o nazwie Kofeina to miejsce typu: Kawiarnia, Restauracja, Jadłodajnia. W ofercie znajduje się: Dania gotowe, Kawa, Prywatna sala, Szybka przekąska, To miejsce oferuje dania wegańskie, W ofercie dania wegetariańskie. Specjalne cechy miejsca: Dobra kawa, Dobre desery, Duży wybór herbat. Atmosfera jest opisywana jako: Kameralne, Niezobowiązująca atmosfera, Spokojne. Miejsce oferuje udogodnienia dostępności: Parking dostępny dla osób na wózkach, Wejście dostępne dla osób na wózkach. Typowa grupa odwiedzających: Dla całej rodziny, Miejsce przyjazne dla osób transpłciowych, Przyjazne dla osób LGBTQ+, Turyści. Jest popularne szczególnie na: Śniadanie, Posiłki w pojedynkę.", "google_rating": 4.8, "google_reviews_total": 13, "google_price_range": "20–40"}}
{"oms_id": 3029304125, "name": "Da Grasso", "Współrzędne": "51.746749, 19.397054", "key_words": {"types": ["Pizzeria", "Pizza na telefon", "Pizza na wynos", "Restauracja"], "address": "Piotrkowska 41/lok.1U, 90-265 Łódź, Polska", "phone": "+48 500 800 200", "opening_hours": {"sobota": "10:00–00:00", "niedziela": "10:30–22:00", "poniedziałek": "10:00–22:00", "wtorek": "10:00–22:00", "środa": "10:00–22:00", "czwartek": "10:00–22:00", "piątek": "10:00–23:00"}, "service_options": ["Ogródek", "Dostawa bez kontaktu", "Dostawa", "Na wynos", "Na miejscu"], "specials": ["Dobra kawa", "Dobre desery", "Duży wybór herbat"], "popular_for": ["Obiad", "Kolacja", "Posiłki w pojedynkę"], "accessibility": ["Miejsca dla osób na wózkach", "Wejście dostępne dla osób na wózkach"], "offerings": ["Alkohol", "Alkohol wysokoprocentowy", "Jedzenie późnym wieczorem", "Kawa", "Koktajle", "Małe porcje", "Piwo", "Szybka przekąska", "To miejsce oferuje dania wegańskie", "W ofercie dania wegetariańskie", "Wino"], "amenities": ["Bar na miejscu", "Toaleta", "Wi-Fi", "Bezpłatne Wi-Fi"], "atmosphere": ["Kameralne", "Modne", "Niezobowiązująca atmosfera", "Spokojne"], "crowd": ["Dla całej rodziny", "Grupy", "Studenci", "Turyści"], "children": ["Krzesełka do karmienia", "Menu dla dzieci", "Odpowiednie dla dzieci"], "parking": ["Bezpłatny parking przy ulicy"], "context": "Miejsce o nazwie Da Grasso to miejsce typu: Pizzeria, Pizza na telefon, Pizza na wynos, Restauracja. W ofercie znajduje się: Alkohol, Alkohol wysokoprocentowy, Jedzenie późnym wieczorem, Kawa, Koktajle, Małe porcje, Piwo, Szybka przekąska. Specjalne cechy miejsca: Dobra kawa, Dobre desery, Duży wybór herbat. Atmosfera jest opisywana jako: Kameralne, Modne, Niezobowiązująca atmosfera, Spokojne. Miejsce oferuje udogodnienia dostępności: Miejsca dla osób na wózkach, Wejście dostępne dla osób na wózkach. Dostępne udogodnienia to: Bar na miejscu, Toaleta, Wi-Fi, Bezpłatne Wi-Fi. Typowa grupa odwiedzających: Dla całej rodziny, Grupy, Studenci, Turyści. Jest popularne szczególnie na: Obiad, Kolacja, Posiłki w pojedynkę.", "google_rating": 3.8, "google_reviews_total": 1518, "google_price_range": "20–40"}}
{"oms_id": 3046865079, "name": "Restauracja Gościnna", "Współrzędne": "51.755638, 19.535538", "key_words": {"types": ["Restauracja"], "address": "Aleksandra Puszkina 18, 92-516 Łódź, Polska", "phone": "+48 42 673 36 31", "opening_hours": {"sobota": "Zamknięte", "niedziela": "Zamknięte", "poniedziałek": "10:00–16:30", "wtorek": "10:00–16:30", "środa": "10:00–16:30", "czwartek": "10:00–16:30", "piątek": "10:00–18:00"}, "service_options": ["Ogródek", "Na wynos", "Na miejscu"], "specials": ["Dobra kawa", "Dobre desery", "Duży wybór herbat"], "popular_for": ["Obiad", "Kolacja", "Posiłki w pojedynkę"], "accessibility": ["Miejsca dla osób na wózkach", "Wejście dostępne dla osób na wózkach"], "offerings": ["Alkohol", "Alkohol wysokoprocentowy", "Kawa", "Koktajle", "Małe porcje", "Piwo", "Szybka przekąska", "Wino"], "amenities": ["Bar na miejscu", "Toaleta"], "atmosphere": ["Niezobowiązująca atmosfera", "Spokojne"], "crowd": ["Grupy", "Turyści"], "children": ["Menu dla dzieci", "Odpowiednie dla dzieci"], "parking": ["Bezpłatny parking"], "context": "Miejsce o nazwie Restauracja Gościnna to miejsce typu: Restauracja. W ofercie znajduje się: Alkohol, Alkohol wysokoprocentowy, Kawa, Koktajle, Małe porcje, Piwo, Szybka przekąska, Wino. Specjalne cechy miejsca: Dobra kawa, Dobre desery, Duży wybór herbat. Atmosfera jest opisywana jako: Niezobowiązująca atmosfera, Spokojne. Miejsce oferuje udogodnienia dostępności: Miejsca dla osób na wózkach, Wejście dostępne dla osób na wózkach. Dostępne udogodnienia to: Bar na miejscu, Toaleta. Typowa grupa odwiedzających: Grupy, Turyści. Jest popularne szczególnie na: Obiad, Kolacja, Posiłki w pojedynkę.", "google_rating": 3.9, "google_reviews_total": 278, "google_price_range": "40–60"}}
{"oms_id": 3190493640, "name": "Da Grasso", "Współrzędne": "51.747236, 19.573271", "key_words": {"types": ["Pizzeria", "Pizza na telefon", "Pizza na wynos", "Restauracja"], "address": "ks. Zdzisława Wujaka 5/lok. 8 i 13, 92-551 Łódź, Polska", "phone": "+48 500 800 200", "opening_hours": {"sobota": "11:00–23:00", "niedziela": "12:00–22:00", "poniedziałek": "11:00–22:00", "wtorek": "11:00–22:00", "środa": "11:00–22:00", "czwartek": "11:00–22:00", "piątek": "11:00–23:00"}, "service_options": ["Ogródek", "Dostawa", "Na wynos", "Na miejscu"], "specials": ["Dobra kawa", "Duży wybór herbat"], "popular_for": ["Obiad", "Kolacja", "Posiłki w pojedynkę"], "accessibility": ["Miejsca dla osób na wózkach", "Wejście dostępne dla osób na wózkach"], "offerings": ["Alkohol", "Jedzenie późnym wieczorem", "Kawa", "Małe porcje", "Piwo", "Szybka przekąska", "To miejsce oferuje dania wegańskie", "W ofercie dania wegetariańskie"], "amenities": ["Toaleta", "Wi-Fi", "Bezpłatne Wi-Fi"], "atmosphere": ["Kameralne", "Modne", "Niezobowiązująca atmosfera", "Spokojne"], "crowd": ["Dla całej rodziny", "Grupy", "Studenci", "Turyści"], "children": ["Krzesełka do karmienia", "Menu dla dzieci", "Odpowiednie dla dzieci"], "parking": ["Bezpłatny parking", "Bezpłatny parking przy ulicy", "Dużo miejsc parkingowych"], "context": "Miejsce o nazwie Da Grasso to miejsce typu: Pizzeria, Pizza na telefon, Pizza na wynos, Restauracja. W ofercie znajduje się: Alkohol, Jedzenie późnym wieczorem, Kawa, Małe porcje, Piwo, Szybka przekąska, To miejsce oferuje dania wegańskie, W ofercie dania wegetariańskie. Specjalne cechy miejsca: Dobra kawa, Duży wybór herbat. Atmosfera jest opisywana jako: Kameralne, Modne, Niezobowiązująca atmosfera, Spokojne. Miejsce oferuje udogodnienia dostępności: Miejsca dla osób na wózkach, Wejście dostępne dla osób na wózkach. Dostępne udogodnienia to: Toaleta, Wi-Fi, Bezpłatne Wi-Fi. Typowa grupa odwiedzających: Dla całej rodziny, Grupy, Studenci, Turyści. Jest popularne szczególnie na: Obiad, Kolacja, Posiłki w pojedynkę.", "google_rating": 4.3, "google_reviews_total": 436, "google_price_range": "20–40"}}
{"oms_id": 3206580191, "name": "Małgosia", "Współrzędne": "51.740183, 19.495687", "key_words": {"types": ["Restauracja z daniami na wynos", "Restauracja"], "address": "Tatrzańska 110A, 93-208 Łódź, Polska", "phone": "+48 42 643 15 64", "opening_hours": {"sobota": "Zamknięte", "niedziela": "Zamknięte", "poniedziałek": "Zamknięte", "wtorek": "12:00–20:00", "środa": "12:00–20:00", "czwartek": "12:00–20:00", "piątek": "12:00–22:00"}, "service_options": ["Ogródek", "Na wynos", "Na miejscu"], "specials": ["Dobra kawa", "Dobre desery", "Duży wybór herbat"], "popular_for": ["Obiad", "Kolacja", "Posiłki w pojedynkę"], "accessibility": ["Miejsca dla osób na wózkach", "Wejście dostępne dla osób na wózkach"], "offerings": ["Alkohol", "Jedzenie późnym wieczorem", "Kawa", "Koktajle", "Małe porcje", "Piwo", "Szybka przekąska"], "amenities": ["Toaleta"], "atmosphere": ["Kameralne", "Niezobowiązująca atmosfera", "Spokojne"], "crowd": ["Grupy", "Turyści"], "children": ["Dobre miejsce na przyjęcia urodzinowe dla dzieci", "Menu dla dzieci", "Odpowiednie dla dzieci"], "parking": ["Bezpłatny parking przy ulicy"], "context": "Miejsce o nazwie Małgosia to miejsce typu: Restauracja z daniami na wynos, Restauracja. W ofercie znajduje się: Alkohol, Jedzenie późnym wieczorem, Kawa, Koktajle, Małe porcje, Piwo, Szybka przekąska. Specjalne cechy miejsca: Dobra kawa, Dobre desery, Duży wybór herbat. Atmosfera jest opisywana jako: Kameralne, Niezobowiązująca atmosfera, Spokojne. Miejsce oferuje udogodnienia dostępności: Miejsca dla osób na wózkach, Wejście dostępne dla osób na wózkach. Dostępne udogodnienia to: Toaleta. Typowa grupa odwiedzających: Grupy, Turyści. Jest popularne szczególnie na: Obiad, Kolacja, Posiłki w pojedynkę.", "google_rating": 4.5, "google_reviews_total": 276, "google_price_range": "20–40"}}
{"oms_id": 3234531790, "name": "Da Grasso", "Współrzędne": "51.737432, 19.493739", "key_words": {"types": ["Pizzeria", "Pizza na telefon", "Pizza na wynos", "Restauracja"], "address": "Kossaka 5a, 93-213 Łódź, Polska", "phone": "+48 504 915 603", "opening_hours": {"sobota": "11:00–23:00", "niedziela": "12:00–22:00", "poniedziałek": "11:00–22:00", "wtorek": "11:00–22:00", "środa": "11:00–22:00", "czwartek": "11:00–22:00", "piątek": "11:00–23:00"}, "service_options": ["Ogródek", "Dostawa bez kontaktu", "Dostawa", "Na wynos", "Na miejscu"], "specials": ["Dobra kawa", "Dobre desery", "Duży wybór herbat", "Duży wybór piw", "Sport"], "popular_for": ["Obiad", "Kolacja", "Posiłki w pojedynkę"], "accessibility": ["Parking dostępny dla osób na wózkach", "Wejście dostępne dla osób na wózkach"], "offerings": ["Alkohol", "Jedzenie późnym wieczorem", "Kawa", "Małe porcje", "Piwo", "Szybka przekąska", "To miejsce oferuje dania wegańskie", "W ofercie dania wegetariańskie"], "amenities": ["Toaleta", "Wi-Fi", "Bezpłatne Wi-Fi"], "atmosphere": ["Kameralne", "Modne", "Niezobowiązująca atmosfera", "Spokojne"], "crowd": ["Dla całej rodziny", "Grupy", "Studenci", "Turyści"], "children": ["Dobre miejsce na przyjęcia urodzinowe dla dzieci", "Krzesełka do karmienia", "Menu dla dzieci", "Odpowiednie dla dzieci"], "parking": ["Bezpłatny parking", "Bezpłatny parking przy ulicy", "Raczej trudno znaleźć miejsce"], "context": "Miejsce o nazwie Da Grasso to miejsce typu: Pizzeria, Pizza na telefon, Pizza na wynos, Restauracja. W ofercie znajduje się: Alkohol, Jedzenie późnym wieczorem, Kawa, Małe porcje, Piwo, Szybka przekąska, To miejsce oferuje dania wegańskie, W ofercie dania wegetariańskie. Specjalne cechy miejsca: Dobra kawa, Dobre desery, Duży wybór herbat, Duży wybór piw, Sport. Atmosfera jest opisywana jako: Kameralne, Modne, Niezobowiązująca atmosfera, Spokojne. Miejsce oferuje udogodnienia dostępności: Parking dostępny dla osób na wózkach, Wejście dostępne dla osób na wózkach. Dostępne udogodnienia to: Toaleta, Wi-Fi, Bezpłatne Wi-Fi. Typowa grupa odwiedzających: Dla całej rodziny, Grupy, Studenci, Turyści. Jest popularne szczególnie na: Obiad, Kolacja, Posiłki w pojedynkę.", "google_rating": 4.4, "google_reviews_total": 1438, "google_price_range": "20–40"}}
{"oms_id": 3599544556, "name": "Beza Krówka - naturalne lody rzemieślnicze", "Współrzędne": "51.753128, 19.566631", "key_words": {"types": ["Lodziarnia"], "address": "Oleńki Billewiczówny 6, 92-437 Łódź, Polska", "phone": "+48 605 994 682", "opening_hours": {}, "service_options": [], "specials": [], "popular_for": ["Posiłki w pojedynkę"], "accessibility": ["Wejście dostępne dla osób na wózkach"], "offerings": [], "amenities": [], "atmosphere": ["Niezobowiązująca atmosfera", "Spokojne"], "crowd": [], "children": ["Odpowiednie dla dzieci"], "parking": [], "context": "Miejsce o nazwie Beza Krówka - naturalne lody rzemieślnicze to miejsce typu: Lodziarnia. Atmosfera jest opisywana jako: Niezobowiązująca atmosfera, Spokojne. Miejsce oferuje udogodnienia dostępności: Wejście dostępne dla osób na wózkach. Jest popularne szczególnie na: Posiłki w pojedynkę.", "google_rating": 4.6, "google_reviews_total": 37, "google_price_range": "$"}}
{"oms_id": 3618398439, "name": "Spółdzielnia", "Współrzędne": "51.761237, 19.460574", "key_words": {"types": ["Restauracja"], "address": "Piotrkowska 138/140, 90-062 Łódź, Polska", "phone": "+48 786 258 555", "opening_hours": {"sobota": "09:30–00:00", "niedziela": "10:00–22:00", "poniedziałek": "09:30–22:00", "wtorek": "09:30–22:00", "środa": "09:30–22:00", "czwartek": "09:30–22:00", "piątek": "09:30–00:00"}, "service_options": ["Ogródek", "Na wynos", "Na miejscu"], "specials": ["Dobra kawa", "Dobre desery", "Dobre drinki", "Duży wybór herbat", "Duży wybór piw", "Muzyka na żywo", "Obszerna karta win"], "popular_for": ["Śniadanie", "Obiad", "Kolacja", "Posiłki w pojedynkę"], "accessibility": ["Miejsca dla osób na wózkach", "Parking dostępny dla osób na wózkach", "Wejście dostępne dla osób na wózkach"], "offerings": ["Alkohol", "Alkohol wysokoprocentowy", "Jedzenie późnym wieczorem", "Kawa", "Koktajle", "Małe porcje", "Piwo", "Szybka przekąska", "To miejsce oferuje dania wegańskie", "W ofercie dania wegetariańskie", "Wino"], "amenities": ["Bar na miejscu", "Toaleta", "Wi-Fi", "Bezpłatne Wi-Fi"], "atmosphere": ["Historyczne", "Kameralne", "Modne", "Niezobowiązująca atmosfera", "Spokojne"], "crowd": ["Dla całej rodziny", "Grupy", "Miejsce przyjazne dla osób transpłciowych", "Przyjazne dla osób LGBTQ+", "Studenci", "Turyści"], "children": ["Krzesełka do karmienia", "Ma przewijak(i)", "Menu dla dzieci", "Odpowiednie dla dzieci"], "parking": ["Dużo miejsc parkingowych", "Płatny parking", "Płatny parking przy ulicy"], "context": "Miejsce o nazwie Spółdzielnia to miejsce typu: Restauracja. W ofercie znajduje się: Alkohol, Alkohol wysokoprocentowy, Jedzenie późnym wieczorem, Kawa, Koktajle, Małe porcje, Piwo, Szybka przekąska. Specjalne cechy miejsca: Dobra kawa, Dobre desery, Dobre drinki, Duży wybór herbat, Duży wybór piw, Muzyka na żywo, Obszerna karta win. Atmosfera jest opisywana jako: Historyczne, Kameralne, Modne, Niezobowiązująca atmosfera, Spokojne. Miejsce oferuje udogodnienia dostępności: Miejsca dla osób na wózkach, Parking dostępny dla osób na wózkach, Wejście dostępne dla osób na wózkach. Dostępne udogodnienia to: Bar na miejscu, Toaleta, Wi-Fi, Bezpłatne Wi-Fi. Typowa grupa odwiedzających: Dla całej rodziny, Grupy, Miejsce przyjazne dla osób transpłciowych, Przyjazne dla osób LGBTQ+, Studenci, Turyś...", "google_rating": 4.5, "google_reviews_total": 4273, "google_price_range": "40–80"}}
{"oms_id": 3618398445, "name": "Drukarnia", "Współrzędne": "51.761056, 19.460376", "key_words": {"types": ["Restauracja", "Piekarnia", "Bar koktajlowy", "Cukiernia"], "address": "Piotrkowska 138/140, 90-062 Łódź, Polska", "phone": "+48 507 808 295", "opening_hours": {"sobota": "09:00–01:00", "niedziela": "10:00–22:00", "poniedziałek": "08:00–22:00", "wtorek": "08:00–22:00", "środa": "08:00–22:00", "czwartek": "08:00–00:00", "piątek": "08:00–01:00"}, "service_options": ["Ogródek", "Dostawa", "Na wynos", "Na miejscu"], "specials": ["Dobra kawa", "Dobre drinki", "Duży wybór herbat", "Duży wybór piw", "Obszerna karta win"], "popular_for": ["Posiłki w pojedynkę"], "accessibility": ["Miejsca dla osób na wózkach", "Wejście dostępne dla osób na wózkach"], "offerings": ["Alkohol", "Alkohol wysokoprocentowy", "Dania z produktów ekologicznych", "Jedzenie późnym wieczorem", "Kawa", "Koktajle", "Piwo", "Szybka przekąska", "To miejsce oferuje dania wegańskie", "W ofercie dania wegetariańskie", "Wino"], "amenities": ["Bar na miejscu", "Toaleta", "Wi-Fi", "Bezpłatne Wi-Fi"], "atmosphere": ["Kameralne", "Modne", "Niezobowiązująca atmosfera", "Spokojne"], "crowd": ["Grupy", "Studenci", "Turyści"], "children": ["Ma przewijak(i)"], "parking": ["Dużo miejsc parkingowych", "Płatny parking"], "context": "Miejsce o nazwie Drukarnia to miejsce typu: Restauracja, Piekarnia, Bar koktajlowy, Cukiernia. W ofercie znajduje się: Alkohol, Alkohol wysokoprocentowy, Dania z produktów ekologicznych, Jedzenie późnym wieczorem, Kawa, Koktajle, Piwo, Szybka przekąska. Specjalne cechy miejsca: Dobra kawa, Dobre drinki, Duży wybór herbat, Duży wybór piw, Obszerna karta win. Atmosfera jest opisywana jako: Kameralne, Modne, Niezobowiązująca atmosfera, Spokojne. Miejsce oferuje udogodnienia dostępności: Miejsca dla osób na wózkach, Wejście dostępne dla osób na wózkach. Dostępne udogodnienia to: Bar na miejscu, Toaleta, Wi-Fi, Bezpłatne Wi-Fi. Typowa grupa odwiedzających: Grupy, Studenci, Turyści. Jest popularne szczególnie na: Posiłki w pojedynkę.", "google_rating": 4.1, "google_reviews_total": 2315, "google_price_range": "40–60"}}
{"oms_id": 3660467551, "name": "Restauracja Stary Rynek 2", "Współrzędne": "51.781438, 19.455222", "key_words": {"types": ["Plac"], "address": "1, 91-400 Łódź, Polska", "phone": "", "opening_hours": {"sobota": "Czynne całą dobę", "niedziela": "Czynne całą dobę", "poniedziałek": "Czynne całą dobę", "wtorek": "Czynne całą dobę", "środa": "Czynne całą dobę", "czwartek": "Czynne całą dobę", "piątek": "Czynne całą dobę"}, "service_options": [], "specials": [], "popular_for": [], "accessibility": ["Wejście dostępne dla osób na wózkach"], "offerings": [], "amenities": [], "atmosphere": [], "crowd": [], "children": [], "parking": [], "context": "Miejsce o nazwie Restauracja Stary Rynek 2 to miejsce typu: Plac. Miejsce oferuje udogodnienia dostępności: Wejście dostępne dla osób na wózkach.", "google_rating": 4.4, "google_reviews_total": 138, "google_price_range": null}}
{"oms_id": 3726088593, "name": "Saga", "Współrzędne": "51.767322, 19.477115", "key_words": {"types": ["Restauracja"], "address": "Juliana Tuwima 86, 90-026 Łódź, Polska", "phone": "+48 42 676 25 70", "opening_hours": {"sobota": "Zamknięte", "niedziela": "Zamknięte", "poniedziałek": "11:00–17:00", "wtorek": "11:00–17:00", "środa": "11:00–17:00", "czwartek": "11:00–17:00", "piątek": "11:00–17:00"}, "service_options": ["Dostawa bez kontaktu", "Dostawa", "Obsługa zmotoryzowanych", "Na wynos", "Na miejscu"], "specials": ["Dobra kawa", "Dobre desery", "Duży wybór herbat"], "popular_for": ["Obiad", "Kolacja", "Posiłki w pojedynkę"], "accessibility": [], "offerings": ["Kawa", "Małe porcje", "Szybka przekąska"], "amenities": ["Toaleta"], "atmosphere": ["Kameralne", "Niezobowiązująca atmosfera", "Spokojne"], "crowd": ["Grupy", "Turyści"], "children": ["Krzesełka do karmienia", "Menu dla dzieci", "Odpowiednie dla dzieci"], "parking": [], "context": "Miejsce o nazwie Saga to miejsce typu: Restauracja. W ofercie znajduje się: Kawa, Małe porcje, Szybka przekąska. Specjalne cechy miejsca: Dobra kawa, Dobre desery, Duży wybór herbat. Atmosfera jest opisywana jako: Kameralne, Niezobowiązująca atmosfera, Spokojne. Dostępne udogodnienia to: Toaleta. Typowa grupa odwiedzających: Grupy, Turyści. Jest popularne szczególnie na: Obiad, Kolacja, Posiłki w pojedynkę.", "google_rating": 4.6, "google_reviews_total": 215, "google_price_range": "20–40"}}
{"oms_id": 3726163445, "name": "Kapusta z grochem", "Współrzędne": "51.745832, 19.457188", "key_words": {"types": ["Kuchnia polska"], "address": "Wólczańska 234, 93-005 Łódź, Polska", "phone": "+48 516 121 116", "opening_hours": {"sobota": "Zamknięte", "niedziela": "Zamknięte", "poniedziałek": "12:00–17:00", "wtorek": "12:00–17:00", "środa": "12:00–17:00", "czwartek": "12:00–17:00", "piątek": "12:00–17:00"}, "service_options": ["Na wynos", "Na miejscu"], "specials": [], "popular_for": ["Obiad", "Kolacja", "Posiłki w pojedynkę"], "accessibility": [], "offerings": ["Kawa", "Małe porcje", "Szybka przekąska"], "amenities": ["Toaleta"], "atmosphere": ["Niezobowiązująca atmosfera", "Spokojne"], "crowd": ["Grupy", "Studenci", "Turyści"], "children": ["Odpowiednie dla dzieci"], "parking": ["Trudno znaleźć miejsce", "Płatny parking", "Płatny parking przy ulicy"], "context": "Miejsce o nazwie Kapusta z grochem to miejsce typu: Kuchnia polska. W ofercie znajduje się: Kawa, Małe porcje, Szybka przekąska. Atmosfera jest opisywana jako: Niezobowiązująca atmosfera, Spokojne. Dostępne udogodnienia to: Toaleta. Typowa grupa odwiedzających: Grupy, Studenci, Turyści. Jest popularne szczególnie na: Obiad, Kolacja, Posiłki w pojedynkę.", "google_rating": 4.5, "google_reviews_total": 539, "google_price_range": "20–40"}}
{"oms_id": 3770216840, "name": "Timo", "Współrzędne": "51.741927, 19.402989", "key_words": {"types": [], "address": "płk. Jana Kilińskiego 113, 90-049 Łódź, Polska", "phone": "", "opening_hours": {"sobota": "09:00–13:00", "niedziela": "Zamknięte", "poniedziałek": "09:00–17:00", "wtorek": "09:00–17:00", "środa": "09:00–17:00", "czwartek": "09:00–17:00", "piątek": "09:00–17:00"}, "service_options": [], "specials": [], "popular_for": [], "accessibility": [], "offerings": [], "amenities": [], "atmosphere": [], "crowd": [], "children": [], "parking": [], "context": "Miejsce o nazwie Timo.", "google_rating": null, "google_reviews_total": null, "google_price_range": null}}
{"oms_id": 3774149125, "name": "Czarna Owca", "Współrzędne": "51.761821, 19.440675", "key_words": {"types": ["Restauracja"], "address": "Łąkowa 11, 90-505 Łódź, Polska", "phone": "+48 509 852 320", "opening_hours": {}, "service_options": ["Dostawa", "Na wynos"], "specials": ["Dobra kawa", "Dobre desery", "Duży wybór herbat"], "popular_for": ["Obiad", "Kolacja", "Posiłki w pojedynkę"], "accessibility": [], "offerings": ["Alkohol", "Alkohol wysokoprocentowy", "Jedzenie późnym wieczorem", "Kawa", "Koktajle", "Małe porcje", "Piwo", "Szybka przekąska", "Wino"], "amenities": ["Bar na miejscu", "Toaleta"], "atmosphere": ["Kameralne", "Niezobowiązująca atmosfera", "Spokojne"], "crowd": ["Grupy", "Turyści"], "children": [], "parking": ["Bezpłatny parking", "Dużo miejsc parkingowych"], "context": "Miejsce o nazwie Czarna Owca to miejsce typu: Restauracja. W ofercie znajduje się: Alkohol, Alkohol wysokoprocentowy, Jedzenie późnym wieczorem, Kawa, Koktajle, Małe porcje, Piwo, Szybka przekąska. Specjalne cechy miejsca: Dobra kawa, Dobre desery, Duży wybór herbat. Atmosfera jest opisywana jako: Kameralne, Niezobowiązująca atmosfera, Spokojne. Dostępne udogodnienia to: Bar na miejscu, Toaleta. Typowa grupa odwiedzających: Grupy, Turyści. Jest popularne szczególnie na: Obiad, Kolacja, Posiłki w pojedynkę.", "google_rating": 4.6, "google_reviews_total": 238, "google_price_range": "120–140"}}
{"oms_id": 3781764393, "name": "Fiero", "Współrzędne": "51.719273, 19.485563", "key_words": {"types": ["Pizzeria", "Kuchnia włoska", "Makarony", "Pizza na telefon", "Pizza na wynos", "Restauracja", "Sałatki"], "address": "Rzgowska 180, 93-311 Łódź, Polska", "phone": "+48 42 645 88 78", "opening_hours": {"sobota": "12:00–02:00", "niedziela": "12:00–02:00", "poniedziałek": "Zamknięte", "wtorek": "12:00–22:00", "środa": "Zamknięte", "czwartek": "12:00–22:00", "piątek": "12:00–02:00"}, "service_options": ["Ogródek", "Dostawa bez kontaktu", "Dostawa", "Na wynos", "Na miejscu"], "specials": ["Dobra kawa", "Duży wybór herbat"], "popular_for": ["Obiad", "Kolacja", "Posiłki w pojedynkę"], "accessibility": ["Miejsca dla osób na wózkach", "Wejście dostępne dla osób na wózkach"], "offerings": ["Alkohol", "Jedzenie późnym wieczorem", "Kawa", "Małe porcje", "Piwo", "Szybka przekąska"], "amenities": ["Toaleta"], "atmosphere": ["Kameralne", "Modne", "Niezobowiązująca atmosfera", "Spokojne"], "crowd": ["Grupy", "Studenci", "Turyści"], "children": ["Krzesełka do karmienia", "Menu dla dzieci", "Odpowiednie dla dzieci"], "parking": ["Bezpłatny parking przy ulicy", "Dużo miejsc parkingowych"], "context": "Miejsce o nazwie Fiero to miejsce typu: Pizzeria, Kuchnia włoska, Makarony, Pizza na telefon, Pizza na wynos, Restauracja, Sałatki. W ofercie znajduje się: Alkohol, Jedzenie późnym wieczorem, Kawa, Małe porcje, Piwo, Szybka przekąska. Specjalne cechy miejsca: Dobra kawa, Duży wybór herbat. Atmosfera jest opisywana jako: Kameralne, Modne, Niezobowiązująca atmosfera, Spokojne. Miejsce oferuje udogodnienia dostępności: Miejsca dla osób na wózkach, Wejście dostępne dla osób na wózkach. Dostępne udogodnienia to: Toaleta. Typowa grupa odwiedzających: Grupy, Studenci, Turyści. Jest popularne szczególnie na: Obiad, Kolacja, Posiłki w pojedynkę.", "google_rating": 3.9, "google_reviews_total": 746, "google_price_range": "20–40"}}
{"oms_id": 3782049725, "name": "Meta", "Współrzędne": "51.756698, 19.425575", "key_words": {"types": ["Bar"], "address": "Foksal 21, 00-372 Warszawa, Polska", "phone": "+48 22 826 45 13", "opening_hours": {"sobota": "12:00–05:00", "niedziela": "12:00–02:00", "poniedziałek": "12:00–02:00", "wtorek": "12:00–02:00", "środa": "12:00–02:00", "czwartek": "12:00–02:00", "piątek": "12:00–05:00"}, "service_options": ["Ogródek", "Na miejscu"], "specials": [], "popular_for": [], "accessibility": [], "offerings": ["Alkohol", "Alkohol wysokoprocentowy", "Jedzenie", "Koktajle", "Piwo", "Posiłki przy barze", "Wino"], "amenities": ["Toaleta"], "atmosphere": ["Modne", "Niezobowiązująca atmosfera"], "crowd": ["Grupy", "Turyści"], "children": [], "parking": [], "context": "Miejsce o nazwie Meta to miejsce typu: Bar. W ofercie znajduje się: Alkohol, Alkohol wysokoprocentowy, Jedzenie, Koktajle, Piwo, Posiłki przy barze, Wino. Atmosfera jest opisywana jako: Modne, Niezobowiązująca atmosfera. Dostępne udogodnienia to: Toaleta. Typowa grupa odwiedzających: Grupy, Turyści.", "google_rating": 4.4, "google_reviews_total": 929, "google_price_range": "20–40"}}
{"oms_id": 3782110665, "name": "Pijalnia Czekolady E. Wedel", "Współrzędne": "51.768135, 19.456401", "key_words": {"types": ["Kawiarnia", "Czekoladziarnia", "Sklep z czekoladą"], "address": "Ogrodowa 19, 91-071 Łódź, Polska", "phone": "", "opening_hours": {"sobota": "10:00–22:00", "niedziela": "10:00–21:00", "poniedziałek": "10:00–22:00", "wtorek": "10:00–22:00", "środa": "10:00–22:00", "czwartek": "10:00–22:00", "piątek": "10:00–22:00"}, "service_options": ["Ogródek", "Dostawa", "Na wynos", "Na miejscu"], "specials": ["Dobra kawa", "Dobre desery", "Duży wybór herbat"], "popular_for": ["Śniadanie", "Posiłki w pojedynkę", "Dobre miejsce do pracy na laptopie"], "accessibility": ["Miejsca dla osób na wózkach", "Parking dostępny dla osób na wózkach", "Toaleta dla osób na wózkach", "Wejście dostępne dla osób na wózkach"], "offerings": ["Alkohol", "Jedzenie późnym wieczorem", "Kawa", "Małe porcje", "Piwo", "Wino"], "amenities": ["Bar na miejscu", "Toaleta", "Wi-Fi", "Bezpłatne Wi-Fi"], "atmosphere": ["Kameralne", "Modne", "Niezobowiązująca atmosfera", "Romantyczna atmosfera", "Spokojne"], "crowd": ["Dla całej rodziny", "Studenci", "Turyści"], "children": ["Krzesełka do karmienia", "Menu dla dzieci", "Odpowiednie dla dzieci"], "parking": ["Bezpłatny parking", "Bezpłatny parking przy ulicy", "Dużo miejsc parkingowych"], "context": "Miejsce o nazwie Pijalnia Czekolady E. Wedel to miejsce typu: Kawiarnia, Czekoladziarnia, Sklep z czekoladą. W ofercie znajduje się: Alkohol, Jedzenie późnym wieczorem, Kawa, Małe porcje, Piwo, Wino. Specjalne cechy miejsca: Dobra kawa, Dobre desery, Duży wybór herbat. Atmosfera jest opisywana jako: Kameralne, Modne, Niezobowiązująca atmosfera, Romantyczna atmosfera, Spokojne. Miejsce oferuje udogodnienia dostępności: Miejsca dla osób na wózkach, Parking dostępny dla osób na wózkach, Toaleta dla osób na wózkach, Wejście dostępne dla osób na wózkach. Dostępne udogodnienia to: Bar na miejscu, Toaleta, Wi-Fi, Bezpłatne Wi-Fi. Typowa grupa odwiedzających: Dla całej rodziny, Studenci, Turyści. Jest popularne szczególnie na: Śniadanie, Posiłki w pojedynkę, Dobre miejsce do pracy na laptopie.", "google_rating": 4.2, "google_reviews_total": 1311, "google_price_range": "20–40"}}
{"oms_id": 3794267766, "name": "Pizzeria Duet", "Współrzędne": "51.743880, 19.398003", "key_words": {"types": ["Pizzeria", "Bar"], "address": "1 Maja 5, 66-200 Świebodzin, Polska", "phone": "+48 575 334 250", "opening_hours": {"sobota": "11:00–00:00", "niedziela": "12:00–22:00", "poniedziałek": "12:00–22:00", "wtorek": "11:00–22:00", "środa": "11:00–22:00", "czwartek": "11:00–22:00", "piątek": "11:00–23:00"}, "service_options": ["Ogródek", "Dostawa", "Na wynos", "Na miejscu"], "specials": ["Dobra kawa", "Dobre drinki", "Duży wybór herbat", "Duży wybór piw", "Sport"], "popular_for": ["Obiad", "Kolacja", "Posiłki w pojedynkę"], "accessibility": ["Miejsca dla osób na wózkach", "Wejście dostępne dla osób na wózkach"], "offerings": ["Alkohol", "Alkohol wysokoprocentowy", "Jedzenie późnym wieczorem", "Kawa", "Koktajle", "Małe porcje", "Piwo", "Szybka przekąska", "Wino"], "amenities": ["Bar na miejscu", "Toaleta", "Wi-Fi", "Bezpłatne Wi-Fi"], "atmosphere": ["Kameralne", "Modne", "Niezobowiązująca atmosfera", "Spokojne"], "crowd": ["Dla całej rodziny", "Grupy", "Studenci", "Turyści"], "children": ["Menu dla dzieci", "Odpowiednie dla dzieci"], "parking": ["Bezpłatny parking przy ulicy", "Dużo miejsc parkingowych"], "context": "Miejsce o nazwie Pizzeria Duet to miejsce typu: Pizzeria, Bar. W ofercie znajduje się: Alkohol, Alkohol wysokoprocentowy, Jedzenie późnym wieczorem, Kawa, Koktajle, Małe porcje, Piwo, Szybka przekąska. Specjalne cechy miejsca: Dobra kawa, Dobre drinki, Duży wybór herbat, Duży wybór piw, Sport. Atmosfera jest opisywana jako: Kameralne, Modne, Niezobowiązująca atmosfera, Spokojne. Miejsce oferuje udogodnienia dostępności: Miejsca dla osób na wózkach, Wejście dostępne dla osób na wózkach. Dostępne udogodnienia to: Bar na miejscu, Toaleta, Wi-Fi, Bezpłatne Wi-Fi. Typowa grupa odwiedzających: Dla całej rodziny, Grupy, Studenci, Turyści. Jest popularne szczególnie na: Obiad, Kolacja, Posiłki w pojedynkę.", "google_rating": 4.3, "google_reviews_total": 959, "google_price_range": "20–40"}}
{"oms_id": 3799101800, "name": "Caffe Przy Ulicy", "Współrzędne": "51.747958, 19.398501", "key_words": {"types": ["Restauracja śniadaniowa", "Restauracja serwująca drugie śniadania", "Kawiarnia", "Sałatki", "Kanapki"], "address": "Aleksandra Kostki-Napierskiego 1, 94-056 Łódź, Polska", "phone": "+48 668 776 844", "opening_hours": {"sobota": "08:00–20:00", "niedziela": "09:00–20:00", "poniedziałek": "08:00–20:00", "wtorek": "08:00–20:00", "środa": "08:00–20:00", "czwartek": "08:00–20:00", "piątek": "08:00–20:00"}, "service_options": ["Dostawa", "Na wynos", "Na miejscu"], "specials": ["Dobra kawa", "Dobre desery", "Duży wybór herbat"], "popular_for": ["Śniadanie", "Posiłki w pojedynkę"], "accessibility": ["Miejsca dla osób na wózkach", "Wejście dostępne dla osób na wózkach"], "offerings": ["Kawa", "Małe porcje", "Szybka przekąska", "To miejsce oferuje dania wegańskie", "W ofercie dania wegetariańskie"], "amenities": ["Toaleta"], "atmosphere": ["Kameralne", "Modne", "Niezobowiązująca atmosfera", "Romantyczna atmosfera", "Spokojne"], "crowd": ["Grupy", "Studenci", "Turyści"], "children": ["Krzesełka do karmienia", "Menu dla dzieci", "Odpowiednie dla dzieci"], "parking": ["Bezpłatny parking", "Bezpłatny parking przy ulicy", "Dużo miejsc parkingowych"], "context": "Miejsce o nazwie Caffe Przy Ulicy to miejsce typu: Restauracja śniadaniowa, Restauracja serwująca drugie śniadania, Kawiarnia, Sałatki, Kanapki. W ofercie znajduje się: Kawa, Małe porcje, Szybka przekąska, To miejsce oferuje dania wegańskie, W ofercie dania wegetariańskie. Specjalne cechy miejsca: Dobra kawa, Dobre desery, Duży wybór herbat. Atmosfera jest opisywana jako: Kameralne, Modne, Niezobowiązująca atmosfera, Romantyczna atmosfera, Spokojne. Miejsce oferuje udogodnienia dostępności: Miejsca dla osób na wózkach, Wejście dostępne dla osób na wózkach. Dostępne udogodnienia to: Toaleta. Typowa grupa odwiedzających: Grupy, Studenci, Turyści. Jest popularne szczególnie na: Śniadanie, Posiłki w pojedynkę.", "google_rating": 4.7, "google_reviews_total": 2190, "google_price_range": "20–40"}}
{"oms_id": 3815523128, "name": "Sushi Kushi", "Współrzędne": "51.752021, 19.398529", "key_words": {"types": ["Sushi", "Sushi na wynos"], "address": "Janusza Kusocińskiego 65/5, 94-054 Łódź, Polska", "phone": "+48 530 987 989", "opening_hours": {"sobota": "12:00–22:00", "niedziela": "12:00–21:00", "poniedziałek": "12:00–21:00", "wtorek": "12:00–21:00", "środa": "12:00–21:00", "czwartek": "12:00–21:00", "piątek": "12:00–22:00"}, "service_options": ["Ogródek", "Dostawa bez kontaktu", "Dostawa", "Na wynos", "Na miejscu"], "specials": ["Duży wybór herbat"], "popular_for": ["Obiad", "Kolacja", "Posiłki w pojedynkę"], "accessibility": ["Wejście dostępne dla osób na wózkach"], "offerings": ["Alkohol", "Dania z produktów ekologicznych", "Jedzenie późnym wieczorem", "Małe porcje", "Szybka przekąska", "To miejsce oferuje dania wegańskie", "W ofercie dania wegetariańskie"], "amenities": ["Toaleta"], "atmosphere": ["Modne", "Niezobowiązująca atmosfera", "Spokojne"], "crowd": ["Turyści"], "children": ["Menu dla dzieci"], "parking": ["Bezpłatny parking", "Bezpłatny parking przy ulicy", "Dużo miejsc parkingowych"], "context": "Miejsce o nazwie Sushi Kushi to miejsce typu: Sushi, Sushi na wynos. W ofercie znajduje się: Alkohol, Dania z produktów ekologicznych, Jedzenie późnym wieczorem, Małe porcje, Szybka przekąska, To miejsce oferuje dania wegańskie, W ofercie dania wegetariańskie. Specjalne cechy miejsca: Duży wybór herbat. Atmosfera jest opisywana jako: Modne, Niezobowiązująca atmosfera, Spokojne. Miejsce oferuje udogodnienia dostępności: Wejście dostępne dla osób na wózkach. Dostępne udogodnienia to: Toaleta. Typowa grupa odwiedzających: Turyści. Jest popularne szczególnie na: Obiad, Kolacja, Posiłki w pojedynkę.", "google_rating": 4.3, "google_reviews_total": 569, "google_price_range": "$$"}}
{"oms_id": 3815523130, "name": "Pełny Brzuszek", "Współrzędne": "51.752037, 19.398271", "key_words": {"types": ["Pizzeria", "Kuchnia włoska"], "address": "Janusza Kusocińskiego 65, 94-054 Łódź, Polska", "phone": "+48 42 686 03 25", "opening_hours": {"sobota": "12:00–00:00", "niedziela": "13:00–23:00", "poniedziałek": "13:00–23:00", "wtorek": "13:00–23:00", "środa": "13:00–23:00", "czwartek": "13:00–23:00", "piątek": "12:00–00:00"}, "service_options": ["Ogródek", "Dostawa bez kontaktu", "Dostawa", "Na wynos", "Na miejscu"], "specials": ["Dobra kawa", "Dobre drinki", "Duży wybór herbat", "Duży wybór piw", "Muzyka na żywo"], "popular_for": ["Obiad", "Kolacja", "Posiłki w pojedynkę"], "accessibility": ["Miejsca dla osób na wózkach", "Toaleta dla osób na wózkach", "Wejście dostępne dla osób na wózkach"], "offerings": ["Alkohol", "Alkohol wysokoprocentowy", "Drinki w promocji happy hours", "Jedzenie późnym wieczorem", "Jedzenie w promocji happy hours", "Kawa", "Koktajle", "Małe porcje", "Piwo", "Szybka przekąska", "W ofercie dania wegetariańskie", "Wino"], "amenities": ["Bar na miejscu", "Toaleta", "Toaleta unisex", "Wi-Fi", "Bezpłatne Wi-Fi"], "atmosphere": ["Kameralne", "Modne", "Niezobowiązująca atmosfera", "Spokojne"], "crowd": ["Dla całej rodziny", "Grupy", "Przyjazne dla osób LGBTQ+", "Studenci", "Turyści"], "children": ["Menu dla dzieci", "Odpowiednie dla dzieci"], "parking": ["Bezpłatny parking", "Bezpłatny parking przy ulicy"], "context": "Miejsce o nazwie Pełny Brzuszek to miejsce typu: Pizzeria, Kuchnia włoska. W ofercie znajduje się: Alkohol, Alkohol wysokoprocentowy, Drinki w promocji happy hours, Jedzenie późnym wieczorem, Jedzenie w promocji happy hours, Kawa, Koktajle, Małe porcje. Specjalne cechy miejsca: Dobra kawa, Dobre drinki, Duży wybór herbat, Duży wybór piw, Muzyka na żywo. Atmosfera jest opisywana jako: Kameralne, Modne, Niezobowiązująca atmosfera, Spokojne. Miejsce oferuje udogodnienia dostępności: Miejsca dla osób na wózkach, Toaleta dla osób na wózkach, Wejście dostępne dla osób na wózkach. Dostępne udogodnienia to: Bar na miejscu, Toaleta, Toaleta unisex, Wi-Fi, Bezpłatne Wi-Fi. Typowa grupa odwiedzających: Dla całej rodziny, Grupy, Przyjazne dla osób LGBTQ+, Studenci, Turyści. Jest popularne szczególn...", "google_rating": 4.1, "google_reviews_total": 541, "google_price_range": "20–40"}}
{"oms_id": 3897477323, "name": "Pizzeria Kultowa", "Współrzędne": "51.781478, 19.484644", "key_words": {"types": ["Pizzeria"], "address": "Balonowa 31, 94-108 Łódź, Polska", "phone": "+48 720 720 723", "opening_hours": {"sobota": "12:00–23:00", "niedziela": "12:00–22:00", "poniedziałek": "12:00–22:00", "wtorek": "12:00–22:00", "środa": "12:00–22:00", "czwartek": "12:00–22:00", "piątek": "12:00–23:00"}, "service_options": ["Ogródek", "Dostawa", "Na wynos", "Na miejscu"], "specials": ["Dobra kawa", "Dobre desery", "Duży wybór herbat", "Duży wybór piw"], "popular_for": ["Obiad", "Kolacja", "Posiłki w pojedynkę"], "accessibility": ["Miejsca dla osób na wózkach", "Toaleta dla osób na wózkach", "Wejście dostępne dla osób na wózkach"], "offerings": ["Alkohol", "Jedzenie późnym wieczorem", "Kawa", "Koktajle", "Małe porcje", "Piwo", "Szybka przekąska", "To miejsce oferuje dania wegańskie", "W ofercie dania wegetariańskie", "Wino"], "amenities": ["Toaleta", "Wi-Fi", "Bezpłatne Wi-Fi"], "atmosphere": ["Kameralne", "Modne", "Niezobowiązująca atmosfera", "Spokojne"], "crowd": ["Dla całej rodziny", "Grupy", "Studenci", "Turyści"], "children": ["Dobre miejsce na przyjęcia urodzinowe dla dzieci", "Krzesełka do karmienia", "Menu dla dzieci", "Odpowiednie dla dzieci"], "parking": ["Bezpłatny parking", "Bezpłatny parking przy ulicy"], "context": "Miejsce o nazwie Pizzeria Kultowa to miejsce typu: Pizzeria. W ofercie znajduje się: Alkohol, Jedzenie późnym wieczorem, Kawa, Koktajle, Małe porcje, Piwo, Szybka przekąska, To miejsce oferuje dania wegańskie. Specjalne cechy miejsca: Dobra kawa, Dobre desery, Duży wybór herbat, Duży wybór piw. Atmosfera jest opisywana jako: Kameralne, Modne, Niezobowiązująca atmosfera, Spokojne. Miejsce oferuje udogodnienia dostępności: Miejsca dla osób na wózkach, Toaleta dla osób na wózkach, Wejście dostępne dla osób na wózkach. Dostępne udogodnienia to: Toaleta, Wi-Fi, Bezpłatne Wi-Fi. Typowa grupa odwiedzających: Dla całej rodziny, Grupy, Studenci, Turyści. Jest popularne szczególnie na: Obiad, Kolacja, Posiłki w pojedynkę.", "google_rating": 4.6, "google_reviews_total": 2640, "google_price_range": "20–40"}}
{"oms_id": 4104811830, "name": "Da Grasso", "Współrzędne": "51.740595, 19.499158", "key_words": {"types": ["Pizzeria", "Pizza na telefon", "Pizza na wynos", "Restauracja"], "address": "Kossaka 5a, 93-213 Łódź, Polska", "phone": "+48 504 915 603", "opening_hours": {"sobota": "11:00–23:00", "niedziela": "12:00–22:00", "poniedziałek": "11:00–22:00", "wtorek": "11:00–22:00", "środa": "11:00–22:00", "czwartek": "11:00–22:00", "piątek": "11:00–23:00"}, "service_options": ["Ogródek", "Dostawa bez kontaktu", "Dostawa", "Na wynos", "Na miejscu"], "specials": ["Dobra kawa", "Dobre desery", "Duży wybór herbat", "Duży wybór piw", "Sport"], "popular_for": ["Obiad", "Kolacja", "Posiłki w pojedynkę"], "accessibility": ["Parking dostępny dla osób na wózkach", "Wejście dostępne dla osób na wózkach"], "offerings": ["Alkohol", "Jedzenie późnym wieczorem", "Kawa", "Małe porcje", "Piwo", "Szybka przekąska", "To miejsce oferuje dania wegańskie", "W ofercie dania wegetariańskie"], "amenities": ["Toaleta", "Wi-Fi", "Bezpłatne Wi-Fi"], "atmosphere": ["Kameralne", "Modne", "Niezobowiązująca atmosfera", "Spokojne"], "crowd": ["Dla całej rodziny", "Grupy", "Studenci", "Turyści"], "children": ["Dobre miejsce na przyjęcia urodzinowe dla dzieci", "Krzesełka do karmienia", "Menu dla dzieci", "Odpowiednie dla dzieci"], "parking": ["Bezpłatny parking", "Bezpłatny parking przy ulicy", "Raczej trudno znaleźć miejsce"], "context": "Miejsce o nazwie Da Grasso to miejsce typu: Pizzeria, Pizza na telefon, Pizza na wynos, Restauracja. W ofercie znajduje się: Alkohol, Jedzenie późnym wieczorem, Kawa, Małe porcje, Piwo, Szybka przekąska, To miejsce oferuje dania wegańskie, W ofercie dania wegetariańskie. Specjalne cechy miejsca: Dobra kawa, Dobre desery, Duży wybór herbat, Duży wybór piw, Sport. Atmosfera jest opisywana jako: Kameralne, Modne, Niezobowiązująca atmosfera, Spokojne. Miejsce oferuje udogodnienia dostępności: Parking dostępny dla osób na wózkach, Wejście dostępne dla osób na wózkach. Dostępne udogodnienia to: Toaleta, Wi-Fi, Bezpłatne Wi-Fi. Typowa grupa odwiedzających: Dla całej rodziny, Grupy, Studenci, Turyści. Jest popularne szczególnie na: Obiad, Kolacja, Posiłki w pojedynkę.", "google_rating": 4.4, "google_reviews_total": 1438, "google_price_range": "20–40"}}
{"oms_id": 4107200997, "name": "Rondo Smaków", "Współrzędne": "51.792772, 19.393014", "key_words": {"types": ["Restauracja", "Sala bankietowa", "Bistro", "Obiekt przeznaczony do organizacji imprez", "Restauracja dla rodzin", "Restauracja obiadowa", "Kuchnia polska"], "address": "Rojna 1, 91-142 Łódź, Polska", "phone": "+48 885 191 919", "opening_hours": {"sobota": "Zamknięte", "niedziela": "Zamknięte", "poniedziałek": "11:00–17:00", "wtorek": "11:00–17:00", "środa": "11:00–17:00", "czwartek": "11:00–17:00", "piątek": "11:00–17:00"}, "service_options": ["Ogródek", "Dostawa bez kontaktu", "Dostawa", "Usługi na miejscu", "Na wynos", "Na miejscu"], "specials": [], "popular_for": ["Obiad", "Kolacja", "Posiłki w pojedynkę"], "accessibility": ["Miejsca dla osób na wózkach", "Toaleta dla osób na wózkach", "Wejście dostępne dla osób na wózkach"], "offerings": ["Kawa", "Małe porcje", "Szybka przekąska"], "amenities": ["Bar na miejscu", "Toaleta", "Toaleta unisex"], "atmosphere": ["Kameralne", "Niezobowiązująca atmosfera", "Spokojne"], "crowd": ["Dla całej rodziny", "Grupy", "Miejsce przyjazne dla osób transpłciowych", "Przyjazne dla osób LGBTQ+", "Turyści"], "children": ["Odpowiednie dla dzieci"], "parking": ["Bezpłatny parking przy ulicy", "Dużo miejsc parkingowych"], "context": "Miejsce o nazwie Rondo Smaków to miejsce typu: Restauracja, Sala bankietowa, Bistro, Obiekt przeznaczony do organizacji imprez, Restauracja dla rodzin, Restauracja obiadowa, Kuchnia polska. W ofercie znajduje się: Kawa, Małe porcje, Szybka przekąska. Atmosfera jest opisywana jako: Kameralne, Niezobowiązująca atmosfera, Spokojne. Miejsce oferuje udogodnienia dostępności: Miejsca dla osób na wózkach, Toaleta dla osób na wózkach, Wejście dostępne dla osób na wózkach. Dostępne udogodnienia to: Bar na miejscu, Toaleta, Toaleta unisex. Typowa grupa odwiedzających: Dla całej rodziny, Grupy, Miejsce przyjazne dla osób transpłciowych, Przyjazne dla osób LGBTQ+, Turyści. Jest popularne szczególnie na: Obiad, Kolacja, Posiłki w pojedynkę.", "google_rating": 4.3, "google_reviews_total": 245, "google_price_range": "20–40"}}
{"oms_id": 4252849395, "name": "A... Nóż Widelec", "Współrzędne": "51.732641, 19.474232", "key_words": {"types": ["Restauracja dla rodzin"], "address": "Doktora Seweryna Sterlinga 26, 90-212 Łódź, Polska", "phone": "+48 881 387 985", "opening_hours": {"sobota": "08:00–17:00", "niedziela": "08:00–17:00", "poniedziałek": "08:30–17:00", "wtorek": "08:30–17:00", "środa": "08:30–17:00", "czwartek": "08:30–17:00", "piątek": "08:30–17:00"}, "service_options": ["Dostawa bez kontaktu", "Dostawa", "Na wynos", "Na miejscu"], "specials": ["Dobra kawa", "Duży wybór herbat"], "popular_for": ["Śniadanie", "Obiad", "Kolacja", "Posiłki w pojedynkę"], "accessibility": ["Miejsca dla osób na wózkach", "Parking dostępny dla osób na wózkach", "Wejście dostępne dla osób na wózkach"], "offerings": ["Kawa", "Małe porcje", "Prywatna sala", "Szybka przekąska", "To miejsce oferuje dania wegańskie", "W ofercie dania wegetariańskie"], "amenities": ["Bar na miejscu", "Toaleta"], "atmosphere": ["Niezobowiązująca atmosfera", "Spokojne"], "crowd": ["Dla całej rodziny", "Grupy", "Miejsce przyjazne dla osób transpłciowych", "Przyjazne dla osób LGBTQ+", "Studenci"], "children": ["Odpowiednie dla dzieci"], "parking": ["Bezpłatny parking", "Bezpłatny parking przy ulicy", "Dużo miejsc parkingowych"], "context": "Miejsce o nazwie A... Nóż Widelec to miejsce typu: Restauracja dla rodzin. W ofercie znajduje się: Kawa, Małe porcje, Prywatna sala, Szybka przekąska, To miejsce oferuje dania wegańskie, W ofercie dania wegetariańskie. Specjalne cechy miejsca: Dobra kawa, Duży wybór herbat. Atmosfera jest opisywana jako: Niezobowiązująca atmosfera, Spokojne. Miejsce oferuje udogodnienia dostępności: Miejsca dla osób na wózkach, Parking dostępny dla osób na wózkach, Wejście dostępne dla osób na wózkach. Dostępne udogodnienia to: Bar na miejscu, Toaleta. Typowa grupa odwiedzających: Dla całej rodziny, Grupy, Miejsce przyjazne dla osób transpłciowych, Przyjazne dla osób LGBTQ+, Studenci. Jest popularne szczególnie na: Śniadanie, Obiad, Kolacja, Posiłki w pojedynkę.", "google_rating": 4.3, "google_reviews_total": 397, "google_price_range": "20–40"}}
{"oms_id": 4262793554, "name": "Phuong Dong", "Współrzędne": "51.768282, 19.446056", "key_words": {"types": ["Kuchnia wietnamska"], "address": "Stefana Żeromskiego 47, 90-743 Łódź, Polska", "phone": "", "opening_hours": {"sobota": "10:00–22:00", "niedziela": "11:00–22:00", "poniedziałek": "10:00–22:00", "wtorek": "10:00–22:00", "środa": "10:00–22:00", "czwartek": "10:00–22:00", "piątek": "10:00–22:00"}, "service_options": ["Dostawa", "Na wynos", "Na miejscu"], "specials": [], "popular_for": ["Obiad", "Kolacja", "Posiłki w pojedynkę"], "accessibility": [], "offerings": ["Jedzenie późnym wieczorem", "Małe porcje", "Szybka przekąska"], "amenities": [], "atmosphere": ["Niezobowiązująca atmosfera", "Spokojne"], "crowd": ["Studenci", "Turyści"], "children": [], "parking": ["Bezpłatny parking przy ulicy", "Płatny parking przy ulicy"], "context": "Miejsce o nazwie Phuong Dong to miejsce typu: Kuchnia wietnamska. W ofercie znajduje się: Jedzenie późnym wieczorem, Małe porcje, Szybka przekąska. Atmosfera jest opisywana jako: Niezobowiązująca atmosfera, Spokojne. Typowa grupa odwiedzających: Studenci, Turyści. Jest popularne szczególnie na: Obiad, Kolacja, Posiłki w pojedynkę.", "google_rating": 4, "google_reviews_total": 930, "google_price_range": "20–40"}}
{"oms_id": 4262893954, "name": "Fiero Pizza", "Współrzędne": "51.750354, 19.460283", "key_words": {"types": ["Pizzeria", "Kuchnia włoska", "Pizza na telefon", "Pizza na wynos", "Restauracja"], "address": "Neonowa 1, 92-202 Łódź, Polska", "phone": "+48 42 673 03 03", "opening_hours": {"sobota": "12:00–01:00", "niedziela": "12:00–01:00", "poniedziałek": "12:00–01:00", "wtorek": "12:00–01:00", "środa": "12:00–01:00", "czwartek": "12:00–01:00", "piątek": "12:00–01:00"}, "service_options": ["Ogródek", "Dostawa bez kontaktu", "Dostawa", "Obsługa zmotoryzowanych", "Na wynos", "Na miejscu"], "specials": ["Dobra kawa", "Duży wybór herbat"], "popular_for": ["Obiad", "Kolacja", "Posiłki w pojedynkę"], "accessibility": [], "offerings": ["Alkohol", "Dania z produktów ekologicznych", "Jedzenie późnym wieczorem", "Jedzenie w promocji happy hours", "Kawa", "Małe porcje", "Piwo", "Szybka przekąska", "To miejsce oferuje dania wegańskie", "W ofercie dania wegetariańskie"], "amenities": ["Toaleta", "Toaleta unisex", "Wi-Fi", "Bezpłatne Wi-Fi"], "atmosphere": ["Kameralne", "Modne", "Niezobowiązująca atmosfera", "Spokojne"], "crowd": ["Dla całej rodziny", "Grupy", "Miejsce przyjazne dla osób transpłciowych", "Przyjazne dla osób LGBTQ+", "Studenci", "Turyści"], "children": ["Krzesełka do karmienia", "Menu dla dzieci", "Odpowiednie dla dzieci"], "parking": ["Bezpłatny parking", "Bezpłatny parking przy ulicy"], "context": "Miejsce o nazwie Fiero Pizza to miejsce typu: Pizzeria, Kuchnia włoska, Pizza na telefon, Pizza na wynos, Restauracja. W ofercie znajduje się: Alkohol, Dania z produktów ekologicznych, Jedzenie późnym wieczorem, Jedzenie w promocji happy hours, Kawa, Małe porcje, Piwo, Szybka przekąska. Specjalne cechy miejsca: Dobra kawa, Duży wybór herbat. Atmosfera jest opisywana jako: Kameralne, Modne, Niezobowiązująca atmosfera, Spokojne. Dostępne udogodnienia to: Toaleta, Toaleta unisex, Wi-Fi, Bezpłatne Wi-Fi. Typowa grupa odwiedzających: Dla całej rodziny, Grupy, Miejsce przyjazne dla osób transpłciowych, Przyjazne dla osób LGBTQ+, Studenci, Turyści. Jest popularne szczególnie na: Obiad, Kolacja, Posiłki w pojedynkę.", "google_rating": 3.8, "google_reviews_total": 842, "google_price_range": "20–40"}}
{"oms_id": 4269748389, "name": "Con Ga Moi", "Współrzędne": "51.778640, 19.486273", "key_words": {"types": ["Kuchnia wietnamska", "Restauracja orientalna"], "address": "Pomorska 116, 91-403 Łódź, Polska", "phone": "+48 602 249 915", "opening_hours": {"sobota": "10:00–21:00", "niedziela": "11:00–20:00", "poniedziałek": "10:00–21:00", "wtorek": "10:00–21:00", "środa": "10:00–21:00", "czwartek": "10:00–21:00", "piątek": "10:00–21:00"}, "service_options": ["Ogródek", "Dostawa", "Na wynos", "Na miejscu"], "specials": ["Duży wybór herbat"], "popular_for": ["Obiad", "Kolacja", "Posiłki w pojedynkę"], "accessibility": ["Wejście dostępne dla osób na wózkach"], "offerings": ["Alkohol", "Jedzenie późnym wieczorem", "Kawa", "Małe porcje", "Piwo", "Szybka przekąska", "To miejsce oferuje dania wegańskie", "W ofercie dania wegetariańskie"], "amenities": ["Toaleta"], "atmosphere": ["Kameralne", "Niezobowiązująca atmosfera", "Spokojne"], "crowd": ["Grupy", "Studenci", "Turyści"], "children": [], "parking": ["Bezpłatny parking", "Dużo miejsc parkingowych"], "context": "Miejsce o nazwie Con Ga Moi to miejsce typu: Kuchnia wietnamska, Restauracja orientalna. W ofercie znajduje się: Alkohol, Jedzenie późnym wieczorem, Kawa, Małe porcje, Piwo, Szybka przekąska, To miejsce oferuje dania wegańskie, W ofercie dania wegetariańskie. Specjalne cechy miejsca: Duży wybór herbat. Atmosfera jest opisywana jako: Kameralne, Niezobowiązująca atmosfera, Spokojne. Miejsce oferuje udogodnienia dostępności: Wejście dostępne dla osób na wózkach. Dostępne udogodnienia to: Toaleta. Typowa grupa odwiedzających: Grupy, Studenci, Turyści. Jest popularne szczególnie na: Obiad, Kolacja, Posiłki w pojedynkę.", "google_rating": 3.9, "google_reviews_total": 667, "google_price_range": "20–40"}}
{"oms_id": 4269836519, "name": "Poczekalnia", "Współrzędne": "51.772277, 19.452281", "key_words": {"types": ["Kawiarnia"], "address": "Kolejowa 1, 95-040 Koluszki, Polska", "phone": "+48 730 105 102", "opening_hours": {"sobota": "13:00–20:00", "niedziela": "13:00–20:00", "poniedziałek": "Zamknięte", "wtorek": "10:00–19:00", "środa": "10:00–19:00", "czwartek": "10:00–19:00", "piątek": "10:00–19:00"}, "service_options": ["Na wynos", "Na miejscu"], "specials": ["Dobra kawa", "Dobre desery", "Duży wybór herbat"], "popular_for": ["Śniadanie", "Obiad", "Kolacja", "Posiłki w pojedynkę", "Dobre miejsce do pracy na laptopie"], "accessibility": ["Miejsca dla osób na wózkach", "Wejście dostępne dla osób na wózkach"], "offerings": ["Alkohol", "Jedzenie późnym wieczorem", "Kawa", "Koktajle", "Małe porcje", "Szybka przekąska", "To miejsce oferuje dania wegańskie", "W ofercie dania wegetariańskie"], "amenities": ["Toaleta"], "atmosphere": ["Kameralne", "Modne", "Niezobowiązująca atmosfera", "Spokojne"], "crowd": ["Dla całej rodziny", "Grupy", "Turyści"], "children": ["Menu dla dzieci", "Odpowiednie dla dzieci"], "parking": ["Bezpłatny parking", "Bezpłatny parking przy ulicy", "Dużo miejsc parkingowych"], "context": "Miejsce o nazwie Poczekalnia to miejsce typu: Kawiarnia. W ofercie znajduje się: Alkohol, Jedzenie późnym wieczorem, Kawa, Koktajle, Małe porcje, Szybka przekąska, To miejsce oferuje dania wegańskie, W ofercie dania wegetariańskie. Specjalne cechy miejsca: Dobra kawa, Dobre desery, Duży wybór herbat. Atmosfera jest opisywana jako: Kameralne, Modne, Niezobowiązująca atmosfera, Spokojne. Miejsce oferuje udogodnienia dostępności: Miejsca dla osób na wózkach, Wejście dostępne dla osób na wózkach. Dostępne udogodnienia to: Toaleta. Typowa grupa odwiedzających: Dla całej rodziny, Grupy, Turyści. Jest popularne szczególnie na: Śniadanie, Obiad, Kolacja, Posiłki w pojedynkę, Dobre miejsce do pracy na laptopie.", "google_rating": 4.8, "google_reviews_total": 277, "google_price_range": "20–40"}}
{"oms_id": 4289336268, "name": "LaVende Bistro", "Współrzędne": "51.767776, 19.456876", "key_words": {"types": ["Restauracja"], "address": "Drewnowska 58, 91-002 Łódź, Polska", "phone": "+48 42 633 22 26", "opening_hours": {"sobota": "11:00–22:00", "niedziela": "11:00–21:00", "poniedziałek": "11:00–21:00", "wtorek": "11:00–21:00", "środa": "11:00–21:00", "czwartek": "11:00–21:00", "piątek": "11:00–22:00"}, "service_options": ["Ogródek", "Dostawa", "Na wynos", "Na miejscu"], "specials": ["Dobra kawa", "Dobre desery", "Dobre drinki", "Duży wybór herbat", "Obszerna karta win"], "popular_for": ["Obiad", "Kolacja", "Posiłki w pojedynkę"], "accessibility": ["Miejsca dla osób na wózkach", "Parking dostępny dla osób na wózkach", "Toaleta dla osób na wózkach", "Wejście dostępne dla osób na wózkach"], "offerings": ["Alkohol", "Alkohol wysokoprocentowy", "Jedzenie późnym wieczorem", "Kawa", "Koktajle", "Małe porcje", "Piwo", "To miejsce oferuje dania wegańskie", "W ofercie dania wegetariańskie", "Wino"], "amenities": ["Bar na miejscu", "Toaleta", "Toaleta unisex", "Wi-Fi", "Bezpłatne Wi-Fi"], "atmosphere": ["Kameralne", "Modne", "Niezobowiązująca atmosfera", "Romantyczna atmosfera", "Spokojne"], "crowd": ["Dla całej rodziny", "Grupy", "Turyści"], "children": ["Krzesełka do karmienia", "Menu dla dzieci", "Odpowiednie dla dzieci"], "parking": ["Bezpłatny parking", "Bezpłatny parking przy ulicy", "Dużo miejsc parkingowych"], "context": "Miejsce o nazwie LaVende Bistro to miejsce typu: Restauracja. W ofercie znajduje się: Alkohol, Alkohol wysokoprocentowy, Jedzenie późnym wieczorem, Kawa, Koktajle, Małe porcje, Piwo, To miejsce oferuje dania wegańskie. Specjalne cechy miejsca: Dobra kawa, Dobre desery, Dobre drinki, Duży wybór herbat, Obszerna karta win. Atmosfera jest opisywana jako: Kameralne, Modne, Niezobowiązująca atmosfera, Romantyczna atmosfera, Spokojne. Miejsce oferuje udogodnienia dostępności: Miejsca dla osób na wózkach, Parking dostępny dla osób na wózkach, Toaleta dla osób na wózkach, Wejście dostępne dla osób na wózkach. Dostępne udogodnienia to: Bar na miejscu, Toaleta, Toaleta unisex, Wi-Fi, Bezpłatne Wi-Fi. Typowa grupa odwiedzających: Dla całej rodziny, Grupy, Turyści. Jest popularne szczególnie na: Ob...", "google_rating": 3.9, "google_reviews_total": 1132, "google_price_range": "$$"}}
{"oms_id": 4289393126, "name": "Cykada", "Współrzędne": "51.761362, 19.457772", "key_words": {"types": ["Restauracja", "Restauracja z deserami", "Kuchnia polska"], "address": "Piotrkowska 137/139, 90-434 Łódź, Polska", "phone": "+48 42 637 47 44", "opening_hours": {"sobota": "12:00–16:00", "niedziela": "Zamknięte", "poniedziałek": "12:00–17:30", "wtorek": "12:00–17:30", "środa": "12:00–17:30", "czwartek": "12:00–17:30", "piątek": "12:00–17:30"}, "service_options": ["Dostawa", "Na wynos", "Na miejscu"], "specials": ["Dobra kawa", "Dobre desery", "Duży wybór herbat", "Kominek"], "popular_for": ["Obiad", "Kolacja", "Posiłki w pojedynkę"], "accessibility": [], "offerings": ["Alkohol", "Alkohol wysokoprocentowy", "Kawa", "Koktajle", "Małe porcje", "Piwo", "Szybka przekąska", "W ofercie dania wegetariańskie", "Wino"], "amenities": ["Bar na miejscu", "Toaleta", "Wi-Fi", "Bezpłatne Wi-Fi"], "atmosphere": ["Kameralne", "Modne", "Niezobowiązująca atmosfera", "Romantyczna atmosfera", "Spokojne"], "crowd": ["Dla całej rodziny", "Grupy", "Turyści"], "children": ["Krzesełka do karmienia", "Menu dla dzieci", "Odpowiednie dla dzieci"], "parking": ["Bezpłatny parking", "Trudno znaleźć miejsce", "Płatny parking"], "context": "Miejsce o nazwie Cykada to miejsce typu: Restauracja, Restauracja z deserami, Kuchnia polska. W ofercie znajduje się: Alkohol, Alkohol wysokoprocentowy, Kawa, Koktajle, Małe porcje, Piwo, Szybka przekąska, W ofercie dania wegetariańskie. Specjalne cechy miejsca: Dobra kawa, Dobre desery, Duży wybór herbat, Kominek. Atmosfera jest opisywana jako: Kameralne, Modne, Niezobowiązująca atmosfera, Romantyczna atmosfera, Spokojne. Dostępne udogodnienia to: Bar na miejscu, Toaleta, Wi-Fi, Bezpłatne Wi-Fi. Typowa grupa odwiedzających: Dla całej rodziny, Grupy, Turyści. Jest popularne szczególnie na: Obiad, Kolacja, Posiłki w pojedynkę.", "google_rating": 4.8, "google_reviews_total": 330, "google_price_range": "40–60"}}
{"oms_id": 4311994755, "name": "Impresja", "Współrzędne": "51.751984, 19.451899", "key_words": {"types": ["Sala bankietowa"], "address": "Tatrzańska 124B, 93-239 Łódź, Polska", "phone": "+48 501 322 066", "opening_hours": {}, "service_options": [], "specials": [], "popular_for": [], "accessibility": [], "offerings": [], "amenities": [], "atmosphere": [], "crowd": [], "children": [], "parking": [], "context": "Miejsce o nazwie Impresja to miejsce typu: Sala bankietowa.", "google_rating": 4.9, "google_reviews_total": 44, "google_price_range": null}}
{"oms_id": 4312013920, "name": "Phuong Dong", "Współrzędne": "51.779335, 19.480783", "key_words": {"types": ["Kuchnia wietnamska"], "address": "Stefana Żeromskiego 47, 90-743 Łódź, Polska", "phone": "", "opening_hours": {"sobota": "10:00–22:00", "niedziela": "11:00–22:00", "poniedziałek": "10:00–22:00", "wtorek": "10:00–22:00", "środa": "10:00–22:00", "czwartek": "10:00–22:00", "piątek": "10:00–22:00"}, "service_options": ["Dostawa", "Na wynos", "Na miejscu"], "specials": [], "popular_for": ["Obiad", "Kolacja", "Posiłki w pojedynkę"], "accessibility": [], "offerings": ["Jedzenie późnym wieczorem", "Małe porcje", "Szybka przekąska"], "amenities": [], "atmosphere": ["Niezobowiązująca atmosfera", "Spokojne"], "crowd": ["Studenci", "Turyści"], "children": [], "parking": ["Bezpłatny parking przy ulicy", "Płatny parking przy ulicy"], "context": "Miejsce o nazwie Phuong Dong to miejsce typu: Kuchnia wietnamska. W ofercie znajduje się: Jedzenie późnym wieczorem, Małe porcje, Szybka przekąska. Atmosfera jest opisywana jako: Niezobowiązująca atmosfera, Spokojne. Typowa grupa odwiedzających: Studenci, Turyści. Jest popularne szczególnie na: Obiad, Kolacja, Posiłki w pojedynkę.", "google_rating": 4, "google_reviews_total": 930, "google_price_range": "20–40"}}
{"oms_id": 4349497281, "name": "Sushi Kushi", "Współrzędne": "51.732916, 19.493575", "key_words": {"types": ["Sushi", "Ramen", "Sushi na wynos"], "address": "Władysława Broniewskiego 69, 93-267 Łódź, Polska", "phone": "+48 42 288 18 89", "opening_hours": {"sobota": "12:00–22:00", "niedziela": "12:00–21:00", "poniedziałek": "12:00–21:00", "wtorek": "12:00–21:00", "środa": "12:00–21:00", "czwartek": "12:00–21:00", "piątek": "12:00–22:00"}, "service_options": ["Dostawa bez kontaktu", "Dostawa", "Na wynos", "Na miejscu"], "specials": ["Duży wybór herbat"], "popular_for": ["Obiad", "Kolacja", "Posiłki w pojedynkę"], "accessibility": ["Wejście dostępne dla osób na wózkach"], "offerings": ["Alkohol", "Jedzenie późnym wieczorem", "Kawa", "Małe porcje", "Piwo", "Szybka przekąska", "To miejsce oferuje dania wegańskie", "W ofercie dania wegetariańskie", "Wino"], "amenities": ["Toaleta"], "atmosphere": ["Kameralne", "Modne", "Niezobowiązująca atmosfera", "Romantyczna atmosfera", "Spokojne"], "crowd": ["Turyści"], "children": ["Menu dla dzieci"], "parking": ["Bezpłatny parking", "Bezpłatny parking przy ulicy", "Raczej trudno znaleźć miejsce"], "context": "Miejsce o nazwie Sushi Kushi to miejsce typu: Sushi, Ramen, Sushi na wynos. W ofercie znajduje się: Alkohol, Jedzenie późnym wieczorem, Kawa, Małe porcje, Piwo, Szybka przekąska, To miejsce oferuje dania wegańskie, W ofercie dania wegetariańskie. Specjalne cechy miejsca: Duży wybór herbat. Atmosfera jest opisywana jako: Kameralne, Modne, Niezobowiązująca atmosfera, Romantyczna atmosfera, Spokojne. Miejsce oferuje udogodnienia dostępności: Wejście dostępne dla osób na wózkach. Dostępne udogodnienia to: Toaleta. Typowa grupa odwiedzających: Turyści. Jest popularne szczególnie na: Obiad, Kolacja, Posiłki w pojedynkę.", "google_rating": 4.3, "google_reviews_total": 722, "google_price_range": "40–60"}}
{"oms_id": 4379274296, "name": "Królewskie Gofry", "Współrzędne": "51.823079, 19.476035", "key_words": {"types": ["Bar"], "address": "Studencka 20, 91-513 Łódź, Polska", "phone": "", "opening_hours": {"sobota": "10:00–19:30", "niedziela": "10:00–19:30", "poniedziałek": "12:00–19:30", "wtorek": "12:00–19:30", "środa": "12:00–19:30", "czwartek": "12:00–19:30", "piątek": "12:00–19:30"}, "service_options": ["Ogródek", "Na miejscu"], "specials": [], "popular_for": ["Posiłki w pojedynkę"], "accessibility": [], "offerings": ["Alkohol", "Jedzenie"], "amenities": ["Toaleta"], "atmosphere": ["Niezobowiązująca atmosfera", "Spokojne"], "crowd": [], "children": [], "parking": ["Bezpłatny parking", "Bezpłatny parking przy ulicy"], "context": "Miejsce o nazwie Królewskie Gofry to miejsce typu: Bar. W ofercie znajduje się: Alkohol, Jedzenie. Atmosfera jest opisywana jako: Niezobowiązująca atmosfera, Spokojne. Dostępne udogodnienia to: Toaleta. Jest popularne szczególnie na: Posiłki w pojedynkę.", "google_rating": 4.7, "google_reviews_total": 76, "google_price_range": "1–20"}}
{"oms_id": 4435840029, "name": "Lawenda", "Współrzędne": "51.761300, 19.471784", "key_words": {"types": ["Restauracja"], "address": "Targowa 35, 90-043 Łódź, Polska", "phone": "+48 42 676 08 88", "opening_hours": {"sobota": "Zamknięte", "niedziela": "Zamknięte", "poniedziałek": "12:00–16:00", "wtorek": "12:00–16:00", "środa": "12:00–16:00", "czwartek": "12:00–16:00", "piątek": "12:00–16:00"}, "service_options": ["Na wynos", "Na miejscu"], "specials": [], "popular_for": ["Obiad", "Posiłki w pojedynkę"], "accessibility": [], "offerings": ["Małe porcje", "Szybka przekąska"], "amenities": ["Toaleta"], "atmosphere": ["Kameralne", "Niezobowiązująca atmosfera", "Spokojne"], "crowd": ["Grupy", "Turyści"], "children": ["Odpowiednie dla dzieci"], "parking": [], "context": "Miejsce o nazwie Lawenda to miejsce typu: Restauracja. W ofercie znajduje się: Małe porcje, Szybka przekąska. Atmosfera jest opisywana jako: Kameralne, Niezobowiązująca atmosfera, Spokojne. Dostępne udogodnienia to: Toaleta. Typowa grupa odwiedzających: Grupy, Turyści. Jest popularne szczególnie na: Obiad, Posiłki w pojedynkę.", "google_rating": 4.5, "google_reviews_total": 99, "google_price_range": "20–40"}}
{"oms_id": 4497457889, "name": "Sphinx", "Współrzędne": "51.749617, 19.439761", "key_words": {"types": ["Restauracja", "Restauracja dla rodzin"], "address": "Piotrkowska 93, 90-423 Łódź, Polska", "phone": "+48 725 100 253", "opening_hours": {"sobota": "10:00–23:30", "niedziela": "12:00–22:00", "poniedziałek": "12:00–22:00", "wtorek": "12:00–22:00", "środa": "12:00–22:00", "czwartek": "12:00–22:00", "piątek": "12:00–23:30"}, "service_options": ["Ogródek", "Dostawa", "Na wynos", "Na miejscu"], "specials": ["Dobra kawa", "Dobre desery", "Dobre drinki", "Duży wybór herbat", "Duży wybór piw"], "popular_for": ["Obiad", "Kolacja", "Posiłki w pojedynkę"], "accessibility": [], "offerings": ["Alkohol", "Alkohol wysokoprocentowy", "Drinki w promocji happy hours", "Jedzenie późnym wieczorem", "Kawa", "Koktajle", "Małe porcje", "Piwo", "Szybka przekąska", "W ofercie dania wegetariańskie", "Wino"], "amenities": ["Bar na miejscu", "Toaleta", "Wi-Fi", "Bezpłatne Wi-Fi"], "atmosphere": ["Kameralne", "Modne", "Niezobowiązująca atmosfera", "Spokojne"], "crowd": ["Dla całej rodziny", "Grupy", "Miejsce przyjazne dla osób transpłciowych", "Przyjazne dla osób LGBTQ+", "Studenci", "Turyści"], "children": ["Krzesełka do karmienia", "Menu dla dzieci", "Odpowiednie dla dzieci"], "parking": ["Bezpłatny parking"], "context": "Miejsce o nazwie Sphinx to miejsce typu: Restauracja, Restauracja dla rodzin. W ofercie znajduje się: Alkohol, Alkohol wysokoprocentowy, Drinki w promocji happy hours, Jedzenie późnym wieczorem, Kawa, Koktajle, Małe porcje, Piwo. Specjalne cechy miejsca: Dobra kawa, Dobre desery, Dobre drinki, Duży wybór herbat, Duży wybór piw. Atmosfera jest opisywana jako: Kameralne, Modne, Niezobowiązująca atmosfera, Spokojne. Dostępne udogodnienia to: Bar na miejscu, Toaleta, Wi-Fi, Bezpłatne Wi-Fi. Typowa grupa odwiedzających: Dla całej rodziny, Grupy, Miejsce przyjazne dla osób transpłciowych, Przyjazne dla osób LGBTQ+, Studenci, Turyści. Jest popularne szczególnie na: Obiad, Kolacja, Posiłki w pojedynkę.", "google_rating": 4.7, "google_reviews_total": 10617, "google_price_range": "40–60"}}
{"oms_id": 4497457897, "name": "New York Hot Dog", "Współrzędne": "51.749526, 19.440180", "key_words": {"types": ["Restauracja"], "address": "aleja Jana Pawła II 30, 93-570 Łódź, Polska", "phone": "+48 42 239 42 85", "opening_hours": {"sobota": "09:00–21:00", "niedziela": "10:00–11:00", "poniedziałek": "09:00–21:00", "wtorek": "09:00–21:00", "środa": "09:00–21:00", "czwartek": "09:00–21:00", "piątek": "09:00–21:00"}, "service_options": ["Na wynos", "Na miejscu"], "specials": [], "popular_for": ["Posiłki w pojedynkę"], "accessibility": ["Wejście dostępne dla osób na wózkach"], "offerings": ["Jedzenie późnym wieczorem", "Szybka przekąska"], "amenities": [], "atmosphere": ["Niezobowiązująca atmosfera", "Spokojne"], "crowd": ["Turyści"], "children": [], "parking": ["Dużo miejsc parkingowych"], "context": "Miejsce o nazwie New York Hot Dog to miejsce typu: Restauracja. W ofercie znajduje się: Jedzenie późnym wieczorem, Szybka przekąska. Atmosfera jest opisywana jako: Niezobowiązująca atmosfera, Spokojne. Miejsce oferuje udogodnienia dostępności: Wejście dostępne dla osób na wózkach. Typowa grupa odwiedzających: Turyści. Jest popularne szczególnie na: Posiłki w pojedynkę.", "google_rating": 2.2, "google_reviews_total": 121, "google_price_range": "20–40"}}
{"oms_id": 4502955993, "name": "Dybalski", "Współrzędne": "51.777360, 19.454763", "key_words": {"types": ["Kawiarnia"], "address": "Piotrkowska 56, 90-105 Łódź, Polska", "phone": "+48 690 072 316", "opening_hours": {"sobota": "07:30–18:00", "niedziela": "10:00–18:00", "poniedziałek": "07:30–18:00", "wtorek": "07:30–18:00", "środa": "07:30–18:00", "czwartek": "07:30–18:00", "piątek": "07:30–18:00"}, "service_options": ["Ogródek", "Na wynos", "Na miejscu"], "specials": ["Dobra kawa", "Dobre desery", "Duży wybór herbat"], "popular_for": ["Posiłki w pojedynkę", "Dobre miejsce do pracy na laptopie"], "accessibility": ["Miejsca dla osób na wózkach", "Wejście dostępne dla osób na wózkach"], "offerings": ["Kawa", "Małe porcje", "Szybka przekąska"], "amenities": ["Toaleta"], "atmosphere": ["Kameralne", "Modne", "Niezobowiązująca atmosfera", "Spokojne"], "crowd": ["Studenci", "Turyści"], "children": ["Menu dla dzieci", "Odpowiednie dla dzieci"], "parking": [], "context": "Miejsce o nazwie Dybalski to miejsce typu: Kawiarnia. W ofercie znajduje się: Kawa, Małe porcje, Szybka przekąska. Specjalne cechy miejsca: Dobra kawa, Dobre desery, Duży wybór herbat. Atmosfera jest opisywana jako: Kameralne, Modne, Niezobowiązująca atmosfera, Spokojne. Miejsce oferuje udogodnienia dostępności: Miejsca dla osób na wózkach, Wejście dostępne dla osób na wózkach. Dostępne udogodnienia to: Toaleta. Typowa grupa odwiedzających: Studenci, Turyści. Jest popularne szczególnie na: Posiłki w pojedynkę, Dobre miejsce do pracy na laptopie.", "google_rating": 3.7, "google_reviews_total": 882, "google_price_range": "1–20"}}
{"oms_id": 4666396693, "name": "Góralska Chata", "Współrzędne": "51.796351, 19.549485", "key_words": {"types": ["Bar"], "address": "Brzezińska 144, 92-118 Łódź, Polska", "phone": "+48 507 424 604", "opening_hours": {"sobota": "12:00–22:00", "niedziela": "15:00–20:30", "poniedziałek": "12:00–20:30", "wtorek": "12:00–20:30", "środa": "11:00–20:00", "czwartek": "12:00–20:30", "piątek": "12:00–22:00"}, "service_options": ["Ogródek", "Na wynos", "Na miejscu"], "specials": [], "popular_for": ["Posiłki w pojedynkę"], "accessibility": [], "offerings": ["Alkohol", "Alkohol wysokoprocentowy", "Jedzenie", "Koktajle", "Piwo", "Posiłki przy barze", "Wino"], "amenities": ["Toaleta"], "atmosphere": ["Kameralne", "Niezobowiązująca atmosfera", "Spokojne"], "crowd": ["Grupy", "Turyści"], "children": [], "parking": ["Bezpłatny parking", "Dużo miejsc parkingowych"], "context": "Miejsce o nazwie Góralska Chata to miejsce typu: Bar. W ofercie znajduje się: Alkohol, Alkohol wysokoprocentowy, Jedzenie, Koktajle, Piwo, Posiłki przy barze, Wino. Atmosfera jest opisywana jako: Kameralne, Niezobowiązująca atmosfera, Spokojne. Dostępne udogodnienia to: Toaleta. Typowa grupa odwiedzających: Grupy, Turyści. Jest popularne szczególnie na: Posiłki w pojedynkę.", "google_rating": 4, "google_reviews_total": 244, "google_price_range": "20–40"}}
{"oms_id": 4705484154, "name": "Bar Orientalny Phuong Thao", "Współrzędne": "51.797119, 19.441131", "key_words": {"types": ["Kuchnia azjatycka", "Restauracja"], "address": "Pojezierska 2/6, 91-322 Łódź, Polska", "phone": "+48 729 219 640", "opening_hours": {"sobota": "10:00–21:00", "niedziela": "11:00–21:00", "poniedziałek": "10:00–21:00", "wtorek": "10:00–21:00", "środa": "10:00–21:00", "czwartek": "10:00–21:00", "piątek": "10:00–21:00"}, "service_options": ["Dostawa", "Na wynos", "Na miejscu"], "specials": [], "popular_for": ["Obiad", "Kolacja", "Posiłki w pojedynkę"], "accessibility": ["Wejście dostępne dla osób na wózkach"], "offerings": ["Alkohol", "Jedzenie późnym wieczorem", "Małe porcje", "Szybka przekąska"], "amenities": ["Bar na miejscu", "Toaleta"], "atmosphere": ["Niezobowiązująca atmosfera", "Spokojne"], "crowd": ["Studenci", "Turyści"], "children": [], "parking": ["Bezpłatny parking", "Dużo miejsc parkingowych"], "context": "Miejsce o nazwie Bar Orientalny Phuong Thao to miejsce typu: Kuchnia azjatycka, Restauracja. W ofercie znajduje się: Alkohol, Jedzenie późnym wieczorem, Małe porcje, Szybka przekąska. Atmosfera jest opisywana jako: Niezobowiązująca atmosfera, Spokojne. Miejsce oferuje udogodnienia dostępności: Wejście dostępne dla osób na wózkach. Dostępne udogodnienia to: Bar na miejscu, Toaleta. Typowa grupa odwiedzających: Studenci, Turyści. Jest popularne szczególnie na: Obiad, Kolacja, Posiłki w pojedynkę.", "google_rating": 3.6, "google_reviews_total": 490, "google_price_range": "20–40"}}
{"oms_id": 4961894423, "name": "Obiady u Gosi", "Współrzędne": "51.777025, 19.447599", "key_words": {"types": ["Restauracja"], "address": "Mikołaja Kopernika 25, 90-001 Łódź, Polska", "phone": "+48 516 472 076", "opening_hours": {"sobota": "Zamknięte", "niedziela": "Zamknięte", "poniedziałek": "11:00–17:00", "wtorek": "11:00–17:00", "środa": "11:00–17:00", "czwartek": "11:00–17:00", "piątek": "11:00–17:00"}, "service_options": ["Dostawa bez kontaktu", "Dostawa", "Na wynos", "Na miejscu"], "specials": [], "popular_for": ["Śniadanie", "Obiad", "Posiłki w pojedynkę"], "accessibility": ["Miejsca dla osób na wózkach", "Wejście dostępne dla osób na wózkach"], "offerings": ["Kawa", "Szybka przekąska"], "amenities": ["Toaleta"], "atmosphere": ["Kameralne", "Niezobowiązująca atmosfera", "Spokojne"], "crowd": ["Grupy", "Turyści"], "children": ["Odpowiednie dla dzieci"], "parking": ["Raczej trudno znaleźć miejsce"], "context": "Miejsce o nazwie Obiady u Gosi to miejsce typu: Restauracja. W ofercie znajduje się: Kawa, Szybka przekąska. Atmosfera jest opisywana jako: Kameralne, Niezobowiązująca atmosfera, Spokojne. Miejsce oferuje udogodnienia dostępności: Miejsca dla osób na wózkach, Wejście dostępne dla osób na wózkach. Dostępne udogodnienia to: Toaleta. Typowa grupa odwiedzających: Grupy, Turyści. Jest popularne szczególnie na: Śniadanie, Obiad, Posiłki w pojedynkę.", "google_rating": 4.4, "google_reviews_total": 434, "google_price_range": "20–40"}}
{"oms_id": 5089484894, "name": "Cafe Vanilia", "Współrzędne": "51.747980, 19.490673", "key_words": {"types": ["Restauracja"], "address": "Stanisława Przybyszewskiego 94B, 93-110 Łódź, Polska", "phone": "+48 42 672 49 78", "opening_hours": {"sobota": "12:00–21:00", "niedziela": "12:00–20:00", "poniedziałek": "Zamknięte", "wtorek": "Zamknięte", "środa": "12:00–19:00", "czwartek": "12:00–19:00", "piątek": "12:00–19:00"}, "service_options": ["Na wynos", "Na miejscu"], "specials": ["Dobra kawa", "Dobre desery", "Duży wybór herbat"], "popular_for": ["Obiad", "Kolacja", "Posiłki w pojedynkę"], "accessibility": ["Miejsca dla osób na wózkach", "Wejście dostępne dla osób na wózkach"], "offerings": ["Alkohol", "Alkohol wysokoprocentowy", "Jedzenie późnym wieczorem", "Kawa", "Koktajle", "Małe porcje", "Szybka przekąska", "Wino"], "amenities": ["Bar na miejscu", "Toaleta"], "atmosphere": ["Kameralne", "Niezobowiązująca atmosfera", "Spokojne"], "crowd": ["Grupy"], "children": ["Menu dla dzieci", "Odpowiednie dla dzieci"], "parking": ["Bezpłatny parking"], "context": "Miejsce o nazwie Cafe Vanilia to miejsce typu: Restauracja. W ofercie znajduje się: Alkohol, Alkohol wysokoprocentowy, Jedzenie późnym wieczorem, Kawa, Koktajle, Małe porcje, Szybka przekąska, Wino. Specjalne cechy miejsca: Dobra kawa, Dobre desery, Duży wybór herbat. Atmosfera jest opisywana jako: Kameralne, Niezobowiązująca atmosfera, Spokojne. Miejsce oferuje udogodnienia dostępności: Miejsca dla osób na wózkach, Wejście dostępne dla osób na wózkach. Dostępne udogodnienia to: Bar na miejscu, Toaleta. Typowa grupa odwiedzających: Grupy. Jest popularne szczególnie na: Obiad, Kolacja, Posiłki w pojedynkę.", "google_rating": 4.5, "google_reviews_total": 123, "google_price_range": "20–40"}}
{"oms_id": 5219223321, "name": "Susharnia", "Współrzędne": "51.776968, 19.458047", "key_words": {"types": ["Restauracja", "Catering"], "address": "Pomorska 13, 90-202 Łódź, Polska", "phone": "+48 42 207 20 87", "opening_hours": {"sobota": "12:00–23:00", "niedziela": "12:00–21:00", "poniedziałek": "12:00–22:00", "wtorek": "12:00–22:00", "środa": "12:00–22:00", "czwartek": "12:00–22:00", "piątek": "12:00–23:00"}, "service_options": ["Dostawa bez kontaktu", "Dostawa", "Na wynos", "Na miejscu"], "specials": ["Dobra kawa", "Dobre desery", "Duży wybór herbat"], "popular_for": ["Obiad", "Kolacja", "Posiłki w pojedynkę"], "accessibility": [], "offerings": ["Alkohol", "Alkohol wysokoprocentowy", "Jedzenie późnym wieczorem", "Kawa", "Koktajle", "Małe porcje", "Piwo", "To miejsce oferuje dania wegańskie", "W ofercie dania wegetariańskie", "Wino"], "amenities": ["Toaleta", "Toaleta unisex", "Wi-Fi", "Bezpłatne Wi-Fi"], "atmosphere": ["Kameralne", "Modne", "Niezobowiązująca atmosfera", "Spokojne"], "crowd": ["Dla całej rodziny", "Grupy", "Turyści"], "children": ["Krzesełka do karmienia", "Odpowiednie dla dzieci"], "parking": ["Bezpłatny parking przy ulicy", "Płatny parking przy ulicy"], "context": "Miejsce o nazwie Susharnia to miejsce typu: Restauracja, Catering. W ofercie znajduje się: Alkohol, Alkohol wysokoprocentowy, Jedzenie późnym wieczorem, Kawa, Koktajle, Małe porcje, Piwo, To miejsce oferuje dania wegańskie. Specjalne cechy miejsca: Dobra kawa, Dobre desery, Duży wybór herbat. Atmosfera jest opisywana jako: Kameralne, Modne, Niezobowiązująca atmosfera, Spokojne. Dostępne udogodnienia to: Toaleta, Toaleta unisex, Wi-Fi, Bezpłatne Wi-Fi. Typowa grupa odwiedzających: Dla całej rodziny, Grupy, Turyści. Jest popularne szczególnie na: Obiad, Kolacja, Posiłki w pojedynkę.", "google_rating": 4.7, "google_reviews_total": 1919, "google_price_range": "$$"}}
{"oms_id": 5579795821, "name": "Teremok", "Współrzędne": "51.771912, 19.464802", "key_words": {"types": ["Pierogarnia"], "address": "Grzegorza Piramowicza 11/13, 90-254 Łódź, Polska", "phone": "+48 536 323 433", "opening_hours": {"sobota": "11:00–19:00", "niedziela": "11:00–19:00", "poniedziałek": "11:00–19:00", "wtorek": "11:00–19:00", "środa": "11:00–19:00", "czwartek": "11:00–19:00", "piątek": "11:00–19:00"}, "service_options": ["Ogródek", "Dostawa bez kontaktu", "Dostawa", "Obsługa zmotoryzowanych", "Usługi na miejscu", "Na wynos", "Na miejscu"], "specials": ["Dobra kawa", "Duży wybór herbat"], "popular_for": ["Śniadanie", "Obiad", "Kolacja", "Posiłki w pojedynkę"], "accessibility": ["Miejsca dla osób na wózkach"], "offerings": ["Bar sałatkowy", "Dania z produktów ekologicznych", "Kawa", "Kuchnia halal", "Małe porcje", "Prywatna sala", "Szybka przekąska", "To miejsce oferuje dania wegańskie", "W ofercie dania wegetariańskie"], "amenities": ["Toaleta", "Wi-Fi", "Bezpłatne Wi-Fi"], "atmosphere": ["Kameralne", "Niezobowiązująca atmosfera", "Spokojne"], "crowd": ["Dla całej rodziny", "Grupy", "Studenci", "Turyści"], "children": ["Krzesełka do karmienia", "Ma przewijak(i)", "Menu dla dzieci", "Odpowiednie dla dzieci"], "parking": ["Bezpłatny parking", "Bezpłatny parking przy ulicy", "Trudno znaleźć miejsce", "Płatny parking przy ulicy"], "context": "Miejsce o nazwie Teremok to miejsce typu: Pierogarnia. W ofercie znajduje się: Bar sałatkowy, Dania z produktów ekologicznych, Kawa, Kuchnia halal, Małe porcje, Prywatna sala, Szybka przekąska, To miejsce oferuje dania wegańskie. Specjalne cechy miejsca: Dobra kawa, Duży wybór herbat. Atmosfera jest opisywana jako: Kameralne, Niezobowiązująca atmosfera, Spokojne. Miejsce oferuje udogodnienia dostępności: Miejsca dla osób na wózkach. Dostępne udogodnienia to: Toaleta, Wi-Fi, Bezpłatne Wi-Fi. Typowa grupa odwiedzających: Dla całej rodziny, Grupy, Studenci, Turyści. Jest popularne szczególnie na: Śniadanie, Obiad, Kolacja, Posiłki w pojedynkę.", "google_rating": 4.5, "google_reviews_total": 826, "google_price_range": "20–40"}}
{"oms_id": 5743599016, "name": "Cynamon", "Współrzędne": "51.777227, 19.454023", "key_words": {"types": ["Catering", "Dostawca pakowanych zestawów obiadowych", "Catering posiłków i napojów", "Organizator imprez", "Jedzenie z dostawą do domu"], "address": "Wyższe Seminarium Duchowne, Stanisława Kostki 14, 90-457 Łódź, Polska", "phone": "+48 530 997 777", "opening_hours": {"sobota": "Zamknięte", "niedziela": "Zamknięte", "poniedziałek": "08:00–18:00", "wtorek": "08:00–18:00", "środa": "08:00–18:00", "czwartek": "08:00–18:00", "piątek": "08:00–18:00"}, "service_options": ["Dostawa bez kontaktu", "Dostawa", "Na wynos"], "specials": [], "popular_for": [], "accessibility": [], "offerings": [], "amenities": [], "atmosphere": [], "crowd": [], "children": [], "parking": [], "context": "Miejsce o nazwie Cynamon to miejsce typu: Catering, Dostawca pakowanych zestawów obiadowych, Catering posiłków i napojów, Organizator imprez, Jedzenie z dostawą do domu.", "google_rating": 4.9, "google_reviews_total": 272, "google_price_range": null}}
{"oms_id": 5743600933, "name": "Delfin", "Współrzędne": "51.773956, 19.455797", "key_words": {"types": ["Sklep zoologiczny"], "address": "Stadion \"Orzeł, 6 Sierpnia 71, 90-645 Łódź, Polska", "phone": "+48 504 487 486", "opening_hours": {"sobota": "09:00–21:00", "niedziela": "Zamknięte", "poniedziałek": "09:00–21:00", "wtorek": "09:00–21:00", "środa": "09:00–21:00", "czwartek": "09:00–21:00", "piątek": "09:00–21:00"}, "service_options": ["Zakupy stacjonarne"], "specials": [], "popular_for": [], "accessibility": ["Parking dostępny dla osób na wózkach", "Wejście dostępne dla osób na wózkach"], "offerings": [], "amenities": [], "atmosphere": [], "crowd": [], "children": [], "parking": [], "context": "Miejsce o nazwie Delfin to miejsce typu: Sklep zoologiczny. Miejsce oferuje udogodnienia dostępności: Parking dostępny dla osób na wózkach, Wejście dostępne dla osób na wózkach.", "google_rating": 4.5, "google_reviews_total": 206, "google_price_range": null}}
{"oms_id": 5743600950, "name": "Dybalski", "Współrzędne": "51.770293, 19.456298", "key_words": {"types": ["Kawiarnia"], "address": "Piotrkowska 56, 90-105 Łódź, Polska", "phone": "+48 690 072 316", "opening_hours": {"sobota": "07:30–18:00", "niedziela": "10:00–18:00", "poniedziałek": "07:30–18:00", "wtorek": "07:30–18:00", "środa": "07:30–18:00", "czwartek": "07:30–18:00", "piątek": "07:30–18:00"}, "service_options": ["Ogródek", "Na wynos", "Na miejscu"], "specials": ["Dobra kawa", "Dobre desery", "Duży wybór herbat"], "popular_for": ["Posiłki w pojedynkę", "Dobre miejsce do pracy na laptopie"], "accessibility": ["Miejsca dla osób na wózkach", "Wejście dostępne dla osób na wózkach"], "offerings": ["Kawa", "Małe porcje", "Szybka przekąska"], "amenities": ["Toaleta"], "atmosphere": ["Kameralne", "Modne", "Niezobowiązująca atmosfera", "Spokojne"], "crowd": ["Studenci", "Turyści"], "children": ["Menu dla dzieci", "Odpowiednie dla dzieci"], "parking": [], "context": "Miejsce o nazwie Dybalski to miejsce typu: Kawiarnia. W ofercie znajduje się: Kawa, Małe porcje, Szybka przekąska. Specjalne cechy miejsca: Dobra kawa, Dobre desery, Duży wybór herbat. Atmosfera jest opisywana jako: Kameralne, Modne, Niezobowiązująca atmosfera, Spokojne. Miejsce oferuje udogodnienia dostępności: Miejsca dla osób na wózkach, Wejście dostępne dla osób na wózkach. Dostępne udogodnienia to: Toaleta. Typowa grupa odwiedzających: Studenci, Turyści. Jest popularne szczególnie na: Posiłki w pojedynkę, Dobre miejsce do pracy na laptopie.", "google_rating": 3.7, "google_reviews_total": 882, "google_price_range": "1–20"}}
{"oms_id": 5743600960, "name": "Ciao", "Współrzędne": "51.768026, 19.456423", "key_words": {"types": ["Kuchnia włoska"], "address": "Piotrkowska 71, 90-422 Łódź, Polska", "phone": "+48 574 092 078", "opening_hours": {"sobota": "12:00–00:00", "niedziela": "12:00–22:30", "poniedziałek": "12:00–22:30", "wtorek": "12:00–22:30", "środa": "12:00–22:30", "czwartek": "12:00–22:30", "piątek": "12:00–00:00"}, "service_options": ["Dostawa bez kontaktu", "Dostawa", "Na wynos", "Na miejscu"], "specials": ["Muzyka na żywo", "Sport"], "popular_for": [], "accessibility": [], "offerings": ["Alkohol", "Alkohol wysokoprocentowy", "Bar sałatkowy", "Dania z produktów ekologicznych", "Drinki w promocji happy hours", "Jedzenie późnym wieczorem", "Jedzenie w promocji happy hours", "Kawa", "Koktajle", "Małe porcje", "Piwo", "Prywatna sala", "To miejsce oferuje dania wegańskie", "W ofercie dania wegetariańskie", "Wino"], "amenities": [], "atmosphere": [], "crowd": ["Dla całej rodziny", "Miejsce przyjazne dla osób transpłciowych", "Przyjazne dla osób LGBTQ+"], "children": ["Krzesełka do karmienia", "Ma przewijak(i)", "Odpowiednie dla dzieci"], "parking": ["Trudno znaleźć miejsce"], "context": "Miejsce o nazwie Ciao to miejsce typu: Kuchnia włoska. W ofercie znajduje się: Alkohol, Alkohol wysokoprocentowy, Bar sałatkowy, Dania z produktów ekologicznych, Drinki w promocji happy hours, Jedzenie późnym wieczorem, Jedzenie w promocji happy hours, Kawa. Specjalne cechy miejsca: Muzyka na żywo, Sport. Typowa grupa odwiedzających: Dla całej rodziny, Miejsce przyjazne dla osób transpłciowych, Przyjazne dla osób LGBTQ+.", "google_rating": 4.2, "google_reviews_total": 381, "google_price_range": "40–60"}}
{"oms_id": 5743600966, "name": "Presto", "Współrzędne": "51.768383, 19.455956", "key_words": {"types": ["Pizzeria", "Kuchnia włoska"], "address": "Piotrkowska 67, 90-422 Łódź, Polska", "phone": "+48 42 630 88 83", "opening_hours": {"sobota": "12:00–23:00", "niedziela": "12:00–22:00", "poniedziałek": "12:00–22:00", "wtorek": "12:00–22:00", "środa": "12:00–22:00", "czwartek": "12:00–22:00", "piątek": "12:00–23:00"}, "service_options": ["Ogródek", "Dostawa bez kontaktu", "Dostawa", "Na wynos", "Na miejscu"], "specials": ["Dobra kawa", "Dobre desery", "Dobre drinki", "Duży wybór herbat"], "popular_for": ["Obiad", "Kolacja", "Posiłki w pojedynkę"], "accessibility": ["Miejsca dla osób na wózkach", "Toaleta dla osób na wózkach", "Wejście dostępne dla osób na wózkach"], "offerings": ["Alkohol", "Alkohol wysokoprocentowy", "Jedzenie późnym wieczorem", "Kawa", "Koktajle", "Małe porcje", "Piwo", "Prywatna sala", "Szybka przekąska", "To miejsce oferuje dania wegańskie", "W ofercie dania wegetariańskie", "Wino"], "amenities": ["Bar na miejscu", "Toaleta", "Toaleta unisex", "Wi-Fi", "Bezpłatne Wi-Fi"], "atmosphere": ["Kameralne", "Modne", "Niezobowiązująca atmosfera", "Romantyczna atmosfera", "Spokojne"], "crowd": ["Dla całej rodziny", "Grupy", "Miejsce przyjazne dla osób transpłciowych", "Przyjazne dla osób LGBTQ+", "Studenci", "Turyści"], "children": ["Krzesełka do karmienia", "Menu dla dzieci", "Odpowiednie dla dzieci"], "parking": ["Raczej trudno znaleźć miejsce"], "context": "Miejsce o nazwie Presto to miejsce typu: Pizzeria, Kuchnia włoska. W ofercie znajduje się: Alkohol, Alkohol wysokoprocentowy, Jedzenie późnym wieczorem, Kawa, Koktajle, Małe porcje, Piwo, Prywatna sala. Specjalne cechy miejsca: Dobra kawa, Dobre desery, Dobre drinki, Duży wybór herbat. Atmosfera jest opisywana jako: Kameralne, Modne, Niezobowiązująca atmosfera, Romantyczna atmosfera, Spokojne. Miejsce oferuje udogodnienia dostępności: Miejsca dla osób na wózkach, Toaleta dla osób na wózkach, Wejście dostępne dla osób na wózkach. Dostępne udogodnienia to: Bar na miejscu, Toaleta, Toaleta unisex, Wi-Fi, Bezpłatne Wi-Fi. Typowa grupa odwiedzających: Dla całej rodziny, Grupy, Miejsce przyjazne dla osób transpłciowych, Przyjazne dla osób LGBTQ+, Studenci, Turyści. Jest popularne szczególnie...", "google_rating": 4.2, "google_reviews_total": 1980, "google_price_range": "40–60"}}
{"oms_id": 5743600967, "name": "Angelo", "Współrzędne": "51.768691, 19.455101", "key_words": {"types": ["Restauracja", "Kuchnia włoska"], "address": "6 Sierpnia 1/3, 90-606 Łódź, Polska", "phone": "+48 507 555 637", "opening_hours": {"sobota": "12:00–23:00", "niedziela": "12:00–21:00", "poniedziałek": "12:00–22:00", "wtorek": "12:00–22:00", "środa": "12:00–22:00", "czwartek": "12:00–22:00", "piątek": "12:00–23:00"}, "service_options": ["Ogródek", "Na wynos", "Na miejscu"], "specials": ["Dobra kawa", "Dobre desery", "Dobre drinki", "Duży wybór herbat", "Obszerna karta win"], "popular_for": ["Obiad", "Kolacja", "Posiłki w pojedynkę"], "accessibility": [], "offerings": ["Alkohol", "Alkohol wysokoprocentowy", "Jedzenie późnym wieczorem", "Kawa", "Koktajle", "Małe porcje", "Piwo", "To miejsce oferuje dania wegańskie", "W ofercie dania wegetariańskie", "Wino"], "amenities": ["Bar na miejscu", "Toaleta", "Wi-Fi", "Bezpłatne Wi-Fi"], "atmosphere": ["Kameralne", "Miejsce luksusowe", "Modne", "Niezobowiązująca atmosfera", "Romantyczna atmosfera", "Spokojne"], "crowd": ["Dla całej rodziny", "Grupy", "Turyści"], "children": ["Krzesełka do karmienia", "Menu dla dzieci", "Odpowiednie dla dzieci"], "parking": ["Bezpłatny parking", "Płatny parking przy ulicy"], "context": "Miejsce o nazwie Angelo to miejsce typu: Restauracja, Kuchnia włoska. W ofercie znajduje się: Alkohol, Alkohol wysokoprocentowy, Jedzenie późnym wieczorem, Kawa, Koktajle, Małe porcje, Piwo, To miejsce oferuje dania wegańskie. Specjalne cechy miejsca: Dobra kawa, Dobre desery, Dobre drinki, Duży wybór herbat, Obszerna karta win. Atmosfera jest opisywana jako: Kameralne, Miejsce luksusowe, Modne, Niezobowiązująca atmosfera, Romantyczna atmosfera, Spokojne. Dostępne udogodnienia to: Bar na miejscu, Toaleta, Wi-Fi, Bezpłatne Wi-Fi. Typowa grupa odwiedzających: Dla całej rodziny, Grupy, Turyści. Jest popularne szczególnie na: Obiad, Kolacja, Posiłki w pojedynkę.", "google_rating": 4.5, "google_reviews_total": 2308, "google_price_range": "$$"}}
{"oms_id": 5752715792, "name": "Hana Sushi", "Współrzędne": "51.779539, 19.447632", "key_words": {"types": ["Sushi"], "address": "Ogrodowa 19A, 91-065 Łódź, Polska", "phone": "+48 42 634 00 60", "opening_hours": {"sobota": "11:00–22:30", "niedziela": "11:00–22:00", "poniedziałek": "11:00–22:00", "wtorek": "11:00–22:00", "środa": "11:00–22:00", "czwartek": "11:00–22:00", "piątek": "11:00–22:30"}, "service_options": ["Ogródek", "Dostawa", "Na wynos", "Na miejscu"], "specials": ["Dobre desery", "Duży wybór herbat"], "popular_for": ["Obiad", "Kolacja", "Posiłki w pojedynkę"], "accessibility": ["Parking dostępny dla osób na wózkach"], "offerings": ["Alkohol", "Jedzenie późnym wieczorem", "Kawa", "Małe porcje", "Piwo", "To miejsce oferuje dania wegańskie", "W ofercie dania wegetariańskie", "Wino"], "amenities": ["Toaleta"], "atmosphere": ["Kameralne", "Modne", "Niezobowiązująca atmosfera", "Romantyczna atmosfera", "Spokojne"], "crowd": ["Grupy", "Turyści"], "children": [], "parking": ["Bezpłatny parking", "Bezpłatny parking przy ulicy", "Dużo miejsc parkingowych"], "context": "Miejsce o nazwie Hana Sushi to miejsce typu: Sushi. W ofercie znajduje się: Alkohol, Jedzenie późnym wieczorem, Kawa, Małe porcje, Piwo, To miejsce oferuje dania wegańskie, W ofercie dania wegetariańskie, Wino. Specjalne cechy miejsca: Dobre desery, Duży wybór herbat. Atmosfera jest opisywana jako: Kameralne, Modne, Niezobowiązująca atmosfera, Romantyczna atmosfera, Spokojne. Miejsce oferuje udogodnienia dostępności: Parking dostępny dla osób na wózkach. Dostępne udogodnienia to: Toaleta. Typowa grupa odwiedzających: Grupy, Turyści. Jest popularne szczególnie na: Obiad, Kolacja, Posiłki w pojedynkę.", "google_rating": 4.1, "google_reviews_total": 1035, "google_price_range": "$$"}}
{"oms_id": 5752716180, "name": "Layali Shisha Club & Restaurant", "Współrzędne": "51.767089, 19.455937", "key_words": {"types": ["Kawiarnia"], "address": "Fennstraße 3, 13347 Berlin, Niemcy", "phone": "", "opening_hours": {"sobota": "15:00–03:00", "niedziela": "16:00–02:00", "poniedziałek": "15:00–02:00", "wtorek": "15:00–02:00", "środa": "15:00–02:00", "czwartek": "13:00–02:00", "piątek": "16:00–03:00"}, "service_options": ["Na miejscu"], "specials": ["Dobra kawa", "Duży wybór herbat"], "popular_for": ["Dobre miejsce do pracy na laptopie"], "accessibility": [], "offerings": ["Alkohol", "Alkohol wysokoprocentowy", "Kawa"], "amenities": ["Toaleta"], "atmosphere": ["Kameralne", "Niezobowiązująca atmosfera"], "crowd": ["Grupy"], "children": [], "parking": [], "context": "Miejsce o nazwie Layali Shisha Club & Restaurant to miejsce typu: Kawiarnia. W ofercie znajduje się: Alkohol, Alkohol wysokoprocentowy, Kawa. Specjalne cechy miejsca: Dobra kawa, Duży wybór herbat. Atmosfera jest opisywana jako: Kameralne, Niezobowiązująca atmosfera. Dostępne udogodnienia to: Toaleta. Typowa grupa odwiedzających: Grupy. Jest popularne szczególnie na: Dobre miejsce do pracy na laptopie.", "google_rating": 4.5, "google_reviews_total": 40, "google_price_range": null}}
{"oms_id": 5752716195, "name": "Gastromachina", "Współrzędne": "51.765768, 19.456294", "key_words": {"types": ["Hamburgery", "Fast food"], "address": "Piotrkowska 93, 90-423 Łódź, Polska", "phone": "+48 537 039 198", "opening_hours": {"sobota": "12:00–22:00", "niedziela": "12:00–20:00", "poniedziałek": "12:00–21:00", "wtorek": "12:00–21:00", "środa": "12:00–21:00", "czwartek": "12:00–21:00", "piątek": "12:00–22:00"}, "service_options": ["Ogródek", "Dostawa", "Na wynos", "Na miejscu"], "specials": ["Duży wybór piw"], "popular_for": ["Obiad", "Kolacja", "Posiłki w pojedynkę"], "accessibility": ["Miejsca dla osób na wózkach", "Toaleta dla osób na wózkach", "Wejście dostępne dla osób na wózkach"], "offerings": ["Alkohol", "Jedzenie późnym wieczorem", "Kawa", "Piwo", "Szybka przekąska", "W ofercie dania wegetariańskie"], "amenities": ["Bar na miejscu", "Toaleta", "Wi-Fi", "Bezpłatne Wi-Fi"], "atmosphere": ["Kameralne", "Modne", "Niezobowiązująca atmosfera", "Spokojne"], "crowd": ["Grupy", "Studenci", "Turyści"], "children": ["Krzesełka do karmienia", "Ma przewijak(i)"], "parking": ["Raczej trudno znaleźć miejsce", "Płatny parking"], "context": "Miejsce o nazwie Gastromachina to miejsce typu: Hamburgery, Fast food. W ofercie znajduje się: Alkohol, Jedzenie późnym wieczorem, Kawa, Piwo, Szybka przekąska, W ofercie dania wegetariańskie. Specjalne cechy miejsca: Duży wybór piw. Atmosfera jest opisywana jako: Kameralne, Modne, Niezobowiązująca atmosfera, Spokojne. Miejsce oferuje udogodnienia dostępności: Miejsca dla osób na wózkach, Toaleta dla osób na wózkach, Wejście dostępne dla osób na wózkach. Dostępne udogodnienia to: Bar na miejscu, Toaleta, Wi-Fi, Bezpłatne Wi-Fi. Typowa grupa odwiedzających: Grupy, Studenci, Turyści. Jest popularne szczególnie na: Obiad, Kolacja, Posiłki w pojedynkę.", "google_rating": 4.7, "google_reviews_total": 4503, "google_price_range": "40–60"}}
{"oms_id": 5752716201, "name": "Ferment", "Współrzędne": "51.765130, 19.457021", "key_words": {"types": ["Pizzeria", "Bar"], "address": "Piotrkowska 99, 90-425 Łódź, Polska", "phone": "+48 723 730 730", "opening_hours": {"sobota": "12:00–23:00", "niedziela": "12:00–22:00", "poniedziałek": "13:00–22:00", "wtorek": "13:00–22:00", "środa": "13:00–22:00", "czwartek": "13:00–22:00", "piątek": "12:00–23:00"}, "service_options": ["Ogródek", "Dostawa bez kontaktu", "Dostawa", "Na wynos", "Na miejscu"], "specials": ["Dobra kawa", "Dobre desery", "Dobre drinki", "Duży wybór herbat", "Duży wybór piw"], "popular_for": ["Obiad", "Kolacja", "Posiłki w pojedynkę"], "accessibility": ["Miejsca dla osób na wózkach", "Parking dostępny dla osób na wózkach", "Wejście dostępne dla osób na wózkach"], "offerings": ["Alkohol", "Alkohol wysokoprocentowy", "Jedzenie późnym wieczorem", "Kawa", "Koktajle", "Małe porcje", "Piwo", "Szybka przekąska", "Wino"], "amenities": ["Bar na miejscu", "Wi-Fi", "Płatne Wi-Fi"], "atmosphere": ["Kameralne", "Modne", "Niezobowiązująca atmosfera", "Spokojne"], "crowd": ["Grupy", "Studenci", "Turyści"], "children": [], "parking": ["Trudno znaleźć miejsce", "Płatny parking przy ulicy"], "context": "Miejsce o nazwie Ferment to miejsce typu: Pizzeria, Bar. W ofercie znajduje się: Alkohol, Alkohol wysokoprocentowy, Jedzenie późnym wieczorem, Kawa, Koktajle, Małe porcje, Piwo, Szybka przekąska. Specjalne cechy miejsca: Dobra kawa, Dobre desery, Dobre drinki, Duży wybór herbat, Duży wybór piw. Atmosfera jest opisywana jako: Kameralne, Modne, Niezobowiązująca atmosfera, Spokojne. Miejsce oferuje udogodnienia dostępności: Miejsca dla osób na wózkach, Parking dostępny dla osób na wózkach, Wejście dostępne dla osób na wózkach. Dostępne udogodnienia to: Bar na miejscu, Wi-Fi, Płatne Wi-Fi. Typowa grupa odwiedzających: Grupy, Studenci, Turyści. Jest popularne szczególnie na: Obiad, Kolacja, Posiłki w pojedynkę.", "google_rating": 4.6, "google_reviews_total": 3295, "google_price_range": "40–60"}}
{"oms_id": 5752716223, "name": "Stare Kino", "Współrzędne": "51.762941, 19.459205", "key_words": {"types": ["Hotel", "Sale konferencyjne", "Kino", "Restauracja", "Apartament wakacyjny"], "address": "Piotrkowska 120, 90-006 Łódź, Polska", "phone": "+48 42 207 27 27", "opening_hours": {}, "service_options": [], "specials": [], "popular_for": [], "accessibility": [], "offerings": [], "amenities": [], "atmosphere": [], "crowd": [], "children": [], "parking": [], "context": "Miejsce o nazwie Stare Kino to miejsce typu: Hotel, Sale konferencyjne, Kino, Restauracja, Apartament wakacyjny.", "google_rating": 4.6, "google_reviews_total": 1973, "google_price_range": "52"}}
{"oms_id": 5752716230, "name": "The Brick Coffee Factory", "Współrzędne": "51.761398, 19.458281", "key_words": {"types": ["Kawiarnia"], "address": "Piotrkowska 63, 90-368 Łódź, Polska", "phone": "", "opening_hours": {"sobota": "08:00–00:00", "niedziela": "08:00–23:00", "poniedziałek": "08:00–22:00", "wtorek": "08:00–22:00", "środa": "08:00–22:00", "czwartek": "08:00–22:00", "piątek": "08:00–00:00"}, "service_options": ["Ogródek", "Na miejscu"], "specials": ["Dobra kawa", "Dobre desery", "Duży wybór herbat"], "popular_for": ["Posiłki w pojedynkę", "Dobre miejsce do pracy na laptopie"], "accessibility": ["Miejsca dla osób na wózkach", "Wejście dostępne dla osób na wózkach"], "offerings": ["Alkohol", "Jedzenie późnym wieczorem", "Kawa", "Koktajle", "Szybka przekąska", "To miejsce oferuje dania wegańskie", "W ofercie dania wegetariańskie"], "amenities": ["Toaleta"], "atmosphere": ["Kameralne", "Modne", "Niezobowiązująca atmosfera", "Romantyczna atmosfera", "Spokojne"], "crowd": ["Grupy", "Studenci", "Turyści"], "children": [], "parking": ["Trudno znaleźć miejsce"], "context": "Miejsce o nazwie The Brick Coffee Factory to miejsce typu: Kawiarnia. W ofercie znajduje się: Alkohol, Jedzenie późnym wieczorem, Kawa, Koktajle, Szybka przekąska, To miejsce oferuje dania wegańskie, W ofercie dania wegetariańskie. Specjalne cechy miejsca: Dobra kawa, Dobre desery, Duży wybór herbat. Atmosfera jest opisywana jako: Kameralne, Modne, Niezobowiązująca atmosfera, Romantyczna atmosfera, Spokojne. Miejsce oferuje udogodnienia dostępności: Miejsca dla osób na wózkach, Wejście dostępne dla osób na wózkach. Dostępne udogodnienia to: Toaleta. Typowa grupa odwiedzających: Grupy, Studenci, Turyści. Jest popularne szczególnie na: Posiłki w pojedynkę, Dobre miejsce do pracy na laptopie.", "google_rating": 4.6, "google_reviews_total": 314, "google_price_range": "1–20"}}
{"oms_id": 5764621577, "name": "Cochise", "Współrzędne": "51.759769, 19.539743", "key_words": {"types": ["Restauracja", "Bar", "Fast food", "Hamburgery", "Kebab", "Jedzenie z dostawą do domu"], "address": "Andrzeja Sacharowa 30, 92-542 Łódź, Polska", "phone": "+48 530 659 991", "opening_hours": {"sobota": "12:00–23:30", "niedziela": "12:00–21:30", "poniedziałek": "12:00–21:45", "wtorek": "12:00–21:45", "środa": "12:00–21:45", "czwartek": "12:00–21:45", "piątek": "12:00–23:30"}, "service_options": ["Dostawa bez kontaktu", "Dostawa", "Na wynos", "Na miejscu"], "specials": [], "popular_for": ["Obiad", "Kolacja", "Posiłki w pojedynkę"], "accessibility": ["Miejsca dla osób na wózkach", "Wejście dostępne dla osób na wózkach"], "offerings": ["Alkohol", "Jedzenie późnym wieczorem", "Kawa", "Małe porcje", "Piwo", "Szybka przekąska"], "amenities": ["Toaleta"], "atmosphere": ["Kameralne", "Modne", "Niezobowiązująca atmosfera", "Spokojne"], "crowd": ["Dla całej rodziny", "Grupy", "Miejsce przyjazne dla osób transpłciowych", "Przyjazne dla osób LGBTQ+", "Studenci", "Turyści"], "children": ["Krzesełka do karmienia", "Menu dla dzieci", "Odpowiednie dla dzieci"], "parking": ["Bezpłatny parking", "Bezpłatny parking przy ulicy"], "context": "Miejsce o nazwie Cochise to miejsce typu: Restauracja, Bar, Fast food, Hamburgery, Kebab, Jedzenie z dostawą do domu. W ofercie znajduje się: Alkohol, Jedzenie późnym wieczorem, Kawa, Małe porcje, Piwo, Szybka przekąska. Atmosfera jest opisywana jako: Kameralne, Modne, Niezobowiązująca atmosfera, Spokojne. Miejsce oferuje udogodnienia dostępności: Miejsca dla osób na wózkach, Wejście dostępne dla osób na wózkach. Dostępne udogodnienia to: Toaleta. Typowa grupa odwiedzających: Dla całej rodziny, Grupy, Miejsce przyjazne dla osób transpłciowych, Przyjazne dla osób LGBTQ+, Studenci, Turyści. Jest popularne szczególnie na: Obiad, Kolacja, Posiłki w pojedynkę.", "google_rating": 4.5, "google_reviews_total": 1676, "google_price_range": "40–60"}}
{"oms_id": 6033613785, "name": "Montag", "Współrzędne": "51.764267, 19.455772", "key_words": {"types": ["Piekarnia", "Bistro", "Cukiernia"], "address": "Piotrkowska 111, 90-425 Łódź, Polska", "phone": "+48 608 632 532", "opening_hours": {"sobota": "07:00–16:00", "niedziela": "09:00–16:00", "poniedziałek": "07:00–18:00", "wtorek": "07:00–18:00", "środa": "07:00–18:00", "czwartek": "07:00–18:00", "piątek": "07:00–18:00"}, "service_options": ["Dostawa", "Zakupy stacjonarne", "Na wynos"], "specials": [], "popular_for": [], "accessibility": ["Wejście dostępne dla osób na wózkach"], "offerings": ["Kawa"], "amenities": ["Wi-Fi"], "atmosphere": [], "crowd": [], "children": [], "parking": [], "context": "Miejsce o nazwie Montag to miejsce typu: Piekarnia, Bistro, Cukiernia. W ofercie znajduje się: Kawa. Miejsce oferuje udogodnienia dostępności: Wejście dostępne dla osób na wózkach. Dostępne udogodnienia to: Wi-Fi.", "google_rating": 4.6, "google_reviews_total": 992, "google_price_range": "40–60"}}
{"oms_id": 6172746103, "name": "Ato Ramen", "Współrzędne": "51.760802, 19.459849", "key_words": {"types": ["Ramen", "Restauracja japońska"], "address": "Franklina Delano Roosevelta 6, 90-056 Łódź, Polska", "phone": "+48 609 650 650", "opening_hours": {"sobota": "12:00–23:00", "niedziela": "12:00–21:00", "poniedziałek": "12:00–22:00", "wtorek": "12:00–22:00", "środa": "12:00–22:00", "czwartek": "12:00–22:00", "piątek": "12:00–23:00"}, "service_options": ["Ogródek", "Dostawa bez kontaktu", "Dostawa", "Na wynos", "Na miejscu"], "specials": ["Dobre desery", "Dobre drinki", "Duży wybór herbat"], "popular_for": ["Obiad", "Kolacja", "Posiłki w pojedynkę"], "accessibility": ["Miejsca dla osób na wózkach", "Wejście dostępne dla osób na wózkach"], "offerings": ["Alkohol", "Jedzenie późnym wieczorem", "Kawa", "Koktajle", "Małe porcje", "Piwo", "Szybka przekąska", "To miejsce oferuje dania wegańskie", "W ofercie dania wegetariańskie", "Wino"], "amenities": ["Bar na miejscu", "Toaleta"], "atmosphere": ["Kameralne", "Modne", "Niezobowiązująca atmosfera"], "crowd": ["Studenci", "Turyści"], "children": [], "parking": ["Płatny parking", "Płatny parking przy ulicy"], "context": "Miejsce o nazwie Ato Ramen to miejsce typu: Ramen, Restauracja japońska. W ofercie znajduje się: Alkohol, Jedzenie późnym wieczorem, Kawa, Koktajle, Małe porcje, Piwo, Szybka przekąska, To miejsce oferuje dania wegańskie. Specjalne cechy miejsca: Dobre desery, Dobre drinki, Duży wybór herbat. Atmosfera jest opisywana jako: Kameralne, Modne, Niezobowiązująca atmosfera. Miejsce oferuje udogodnienia dostępności: Miejsca dla osób na wózkach, Wejście dostępne dla osób na wózkach. Dostępne udogodnienia to: Bar na miejscu, Toaleta. Typowa grupa odwiedzających: Studenci, Turyści. Jest popularne szczególnie na: Obiad, Kolacja, Posiłki w pojedynkę.", "google_rating": 4.7, "google_reviews_total": 7859, "google_price_range": "40–60"}}
{"oms_id": 6172753610, "name": "Steakownia", "Współrzędne": "51.761211, 19.460329", "key_words": {"types": ["Restauracja"], "address": "Franklina Delano Roosevelta 10C, 90-056 Łódź, Polska", "phone": "+48 724 063 701", "opening_hours": {"sobota": "13:00–23:00", "niedziela": "13:00–21:00", "poniedziałek": "13:00–22:00", "wtorek": "13:00–22:00", "środa": "13:00–22:00", "czwartek": "13:00–22:00", "piątek": "13:00–23:00"}, "service_options": ["Dostawa", "Na wynos", "Na miejscu"], "specials": ["Dobra kawa", "Dobre desery"], "popular_for": ["Obiad", "Kolacja", "Posiłki w pojedynkę"], "accessibility": ["Miejsca dla osób na wózkach", "Wejście dostępne dla osób na wózkach"], "offerings": ["Alkohol", "Alkohol wysokoprocentowy", "Jedzenie późnym wieczorem", "Kawa", "Koktajle", "Małe porcje", "Piwo", "Wino"], "amenities": ["Bar na miejscu", "Toaleta"], "atmosphere": ["Kameralne", "Modne", "Niezobowiązująca atmosfera", "Spokojne"], "crowd": ["Dla całej rodziny", "Grupy", "Turyści"], "children": ["Krzesełka do karmienia", "Menu dla dzieci", "Odpowiednie dla dzieci"], "parking": ["Płatny parking", "Płatny parking przy ulicy"], "context": "Miejsce o nazwie Steakownia to miejsce typu: Restauracja. W ofercie znajduje się: Alkohol, Alkohol wysokoprocentowy, Jedzenie późnym wieczorem, Kawa, Koktajle, Małe porcje, Piwo, Wino. Specjalne cechy miejsca: Dobra kawa, Dobre desery. Atmosfera jest opisywana jako: Kameralne, Modne, Niezobowiązująca atmosfera, Spokojne. Miejsce oferuje udogodnienia dostępności: Miejsca dla osób na wózkach, Wejście dostępne dla osób na wózkach. Dostępne udogodnienia to: Bar na miejscu, Toaleta. Typowa grupa odwiedzających: Dla całej rodziny, Grupy, Turyści. Jest popularne szczególnie na: Obiad, Kolacja, Posiłki w pojedynkę.", "google_rating": 4.5, "google_reviews_total": 266, "google_price_range": "$$"}}
{"oms_id": 6172772154, "name": "Sushi Kushi", "Współrzędne": "51.820946, 19.441090", "key_words": {"types": ["Sushi", "Kuchnia japońska", "Sushi na wynos"], "address": "Nastrojowa 43, 91-496 Łódź, Polska", "phone": "+48 42 279 76 37", "opening_hours": {"sobota": "12:00–22:00", "niedziela": "12:00–21:00", "poniedziałek": "12:00–21:00", "wtorek": "12:00–21:00", "środa": "12:00–21:00", "czwartek": "12:00–21:00", "piątek": "12:00–22:00"}, "service_options": ["Ogródek", "Dostawa", "Na wynos", "Na miejscu"], "specials": ["Duży wybór herbat"], "popular_for": ["Obiad", "Kolacja", "Posiłki w pojedynkę"], "accessibility": [], "offerings": ["Alkohol", "Jedzenie późnym wieczorem", "Małe porcje", "Piwo", "Szybka przekąska", "To miejsce oferuje dania wegańskie", "W ofercie dania wegetariańskie"], "amenities": ["Toaleta"], "atmosphere": ["Modne", "Niezobowiązująca atmosfera", "Spokojne"], "crowd": ["Turyści"], "children": [], "parking": ["Bezpłatny parking", "Bezpłatny parking przy ulicy", "Dużo miejsc parkingowych"], "context": "Miejsce o nazwie Sushi Kushi to miejsce typu: Sushi, Kuchnia japońska, Sushi na wynos. W ofercie znajduje się: Alkohol, Jedzenie późnym wieczorem, Małe porcje, Piwo, Szybka przekąska, To miejsce oferuje dania wegańskie, W ofercie dania wegetariańskie. Specjalne cechy miejsca: Duży wybór herbat. Atmosfera jest opisywana jako: Modne, Niezobowiązująca atmosfera, Spokojne. Dostępne udogodnienia to: Toaleta. Typowa grupa odwiedzających: Turyści. Jest popularne szczególnie na: Obiad, Kolacja, Posiłki w pojedynkę.", "google_rating": 4.3, "google_reviews_total": 546, "google_price_range": "40–60"}}
{"oms_id": 6176556558, "name": "Pasta GO!", "Współrzędne": "51.755728, 19.457535", "key_words": {"types": ["Makarony", "Zdrowa żywność", "Kuchnia włoska", "Jedzenie z dostawą do domu", "Sałatki"], "address": "Kpt. Franciszka Żwirki 8, 90-450 Łódź, Polska", "phone": "+48 534 270 100", "opening_hours": {"sobota": "10:00–23:00", "niedziela": "10:00–22:00", "poniedziałek": "10:00–22:00", "wtorek": "10:00–22:00", "środa": "10:00–22:00", "czwartek": "10:00–23:00", "piątek": "10:00–23:00"}, "service_options": ["Dostawa bez kontaktu", "Dostawa", "Odbiór w sklepie", "Zakupy stacjonarne", "Usługi na miejscu", "Na wynos", "Na miejscu"], "specials": [], "popular_for": ["Posiłki w pojedynkę"], "accessibility": [], "offerings": [], "amenities": ["Wi-Fi", "Bezpłatne Wi-Fi"], "atmosphere": [], "crowd": ["Dla całej rodziny", "Przyjazne dla osób LGBTQ+"], "children": ["Menu dla dzieci"], "parking": ["Bezpłatny parking", "Płatny parking"], "context": "Miejsce o nazwie Pasta GO! to miejsce typu: Makarony, Zdrowa żywność, Kuchnia włoska, Jedzenie z dostawą do domu, Sałatki. Dostępne udogodnienia to: Wi-Fi, Bezpłatne Wi-Fi. Typowa grupa odwiedzających: Dla całej rodziny, Przyjazne dla osób LGBTQ+. Jest popularne szczególnie na: Posiłki w pojedynkę.", "google_rating": 4.4, "google_reviews_total": 1034, "google_price_range": "20–40"}}
{"oms_id": 6261981021, "name": "Ekspres do Kawy", "Współrzędne": "51.773318, 19.470665", "key_words": {"types": ["Kawiarnia"], "address": "plac Gen. Henryka Dąbrowskiego 2, 90-249 Łódź, Polska", "phone": "+48 516 574 866", "opening_hours": {"sobota": "10:00–19:00", "niedziela": "10:00–18:00", "poniedziałek": "08:30–19:00", "wtorek": "08:30–19:00", "środa": "08:30–19:00", "czwartek": "08:30–19:00", "piątek": "08:30–19:00"}, "service_options": ["Ogródek", "Na miejscu"], "specials": ["Dobra kawa", "Dobre desery", "Duży wybór herbat", "Muzyka na żywo", "Występy na żywo"], "popular_for": ["Śniadanie", "Obiad", "Posiłki w pojedynkę", "Dobre miejsce do pracy na laptopie"], "accessibility": ["Miejsca dla osób na wózkach", "Wejście dostępne dla osób na wózkach"], "offerings": ["Alkohol", "Kawa", "Koktajle", "Małe porcje", "Piwo", "Szybka przekąska", "W ofercie dania wegetariańskie", "Wino"], "amenities": ["Bar na miejscu", "Toaleta", "Wi-Fi", "Bezpłatne Wi-Fi"], "atmosphere": ["Kameralne", "Modne", "Niezobowiązująca atmosfera", "Romantyczna atmosfera", "Spokojne"], "crowd": ["Dla całej rodziny", "Grupy", "Przyjazne dla osób LGBTQ+", "Studenci", "Turyści"], "children": ["Krzesełka do karmienia", "Odpowiednie dla dzieci"], "parking": ["Płatny parking", "Płatny parking przy ulicy"], "context": "Miejsce o nazwie Ekspres do Kawy to miejsce typu: Kawiarnia. W ofercie znajduje się: Alkohol, Kawa, Koktajle, Małe porcje, Piwo, Szybka przekąska, W ofercie dania wegetariańskie, Wino. Specjalne cechy miejsca: Dobra kawa, Dobre desery, Duży wybór herbat, Muzyka na żywo, Występy na żywo. Atmosfera jest opisywana jako: Kameralne, Modne, Niezobowiązująca atmosfera, Romantyczna atmosfera, Spokojne. Miejsce oferuje udogodnienia dostępności: Miejsca dla osób na wózkach, Wejście dostępne dla osób na wózkach. Dostępne udogodnienia to: Bar na miejscu, Toaleta, Wi-Fi, Bezpłatne Wi-Fi. Typowa grupa odwiedzających: Dla całej rodziny, Grupy, Przyjazne dla osób LGBTQ+, Studenci, Turyści. Jest popularne szczególnie na: Śniadanie, Obiad, Posiłki w pojedynkę, Dobre miejsce do pracy na laptopie.", "google_rating": 4.8, "google_reviews_total": 580, "google_price_range": "20–40"}}
{"oms_id": 6262012857, "name": "A nóż widelec", "Współrzędne": "51.774845, 19.470536", "key_words": {"types": ["Restauracja dla rodzin"], "address": "Doktora Seweryna Sterlinga 26, 90-212 Łódź, Polska", "phone": "+48 881 387 985", "opening_hours": {"sobota": "08:00–17:00", "niedziela": "08:00–17:00", "poniedziałek": "08:30–17:00", "wtorek": "08:30–17:00", "środa": "08:30–17:00", "czwartek": "08:30–17:00", "piątek": "08:30–17:00"}, "service_options": ["Dostawa bez kontaktu", "Dostawa", "Na wynos", "Na miejscu"], "specials": ["Dobra kawa", "Duży wybór herbat"], "popular_for": ["Śniadanie", "Obiad", "Kolacja", "Posiłki w pojedynkę"], "accessibility": ["Miejsca dla osób na wózkach", "Parking dostępny dla osób na wózkach", "Wejście dostępne dla osób na wózkach"], "offerings": ["Kawa", "Małe porcje", "Prywatna sala", "Szybka przekąska", "To miejsce oferuje dania wegańskie", "W ofercie dania wegetariańskie"], "amenities": ["Bar na miejscu", "Toaleta"], "atmosphere": ["Niezobowiązująca atmosfera", "Spokojne"], "crowd": ["Dla całej rodziny", "Grupy", "Miejsce przyjazne dla osób transpłciowych", "Przyjazne dla osób LGBTQ+", "Studenci"], "children": ["Odpowiednie dla dzieci"], "parking": ["Bezpłatny parking", "Bezpłatny parking przy ulicy", "Dużo miejsc parkingowych"], "context": "Miejsce o nazwie A nóż widelec to miejsce typu: Restauracja dla rodzin. W ofercie znajduje się: Kawa, Małe porcje, Prywatna sala, Szybka przekąska, To miejsce oferuje dania wegańskie, W ofercie dania wegetariańskie. Specjalne cechy miejsca: Dobra kawa, Duży wybór herbat. Atmosfera jest opisywana jako: Niezobowiązująca atmosfera, Spokojne. Miejsce oferuje udogodnienia dostępności: Miejsca dla osób na wózkach, Parking dostępny dla osób na wózkach, Wejście dostępne dla osób na wózkach. Dostępne udogodnienia to: Bar na miejscu, Toaleta. Typowa grupa odwiedzających: Dla całej rodziny, Grupy, Miejsce przyjazne dla osób transpłciowych, Przyjazne dla osób LGBTQ+, Studenci. Jest popularne szczególnie na: Śniadanie, Obiad, Kolacja, Posiłki w pojedynkę.", "google_rating": 4.3, "google_reviews_total": 397, "google_price_range": "20–40"}}
{"oms_id": 6270098702, "name": "Casablanca", "Współrzędne": "51.780993, 19.453336", "key_words": {"types": ["Pub z fajkami wodnymi", "Bar", "Ogródek piwny", "Klub", "Bar koktajlowy", "Dyskoteka", "Bar z muzyką na żywo", "Klub muzyczny"], "address": "Piotrkowska 107, 90-425 Łódź, Polska", "phone": "+48 42 630 60 51", "opening_hours": {"sobota": "00:00–06:00, 12:00–00:00", "niedziela": "00:00–06:00, 12:00–00:00", "poniedziałek": "00:00–02:00, 12:00–00:00", "wtorek": "00:00–02:00, 12:00–00:00", "środa": "00:00–02:00, 12:00–00:00", "czwartek": "00:00–02:00, 12:00–00:00", "piątek": "00:00–02:00, 12:00–00:00"}, "service_options": [], "specials": [], "popular_for": [], "accessibility": [], "offerings": [], "amenities": [], "atmosphere": [], "crowd": [], "children": [], "parking": [], "context": "Miejsce o nazwie Casablanca to miejsce typu: Pub z fajkami wodnymi, Bar, Ogródek piwny, Klub, Bar koktajlowy, Dyskoteka, Bar z muzyką na żywo, Klub muzyczny.", "google_rating": 3.5, "google_reviews_total": 1136, "google_price_range": null}}
{"oms_id": 6284631484, "name": "Biesiadowo", "Współrzędne": "51.787020, 19.430458", "key_words": {"types": ["Pizzeria", "Kuchnia włoska"], "address": "Piotrkowska 25, 90-410 Łódź, Polska", "phone": "+48 42 671 06 36", "opening_hours": {"sobota": "11:00–00:00", "niedziela": "11:00–23:00", "poniedziałek": "11:00–23:00", "wtorek": "11:00–23:00", "środa": "11:00–23:00", "czwartek": "11:00–23:00", "piątek": "11:00–00:00"}, "service_options": ["Ogródek", "Dostawa", "Na wynos", "Na miejscu"], "specials": ["Dobre desery", "Duży wybór herbat", "Sport"], "popular_for": ["Obiad", "Kolacja", "Posiłki w pojedynkę"], "accessibility": [], "offerings": ["Alkohol", "Alkohol wysokoprocentowy", "Jedzenie późnym wieczorem", "Kawa", "Koktajle", "Małe porcje", "Piwo", "Szybka przekąska", "Wino"], "amenities": ["Bar na miejscu", "Toaleta"], "atmosphere": ["Kameralne", "Modne", "Niezobowiązująca atmosfera", "Spokojne"], "crowd": ["Grupy", "Studenci", "Turyści"], "children": ["Menu dla dzieci", "Odpowiednie dla dzieci"], "parking": ["Bezpłatny parking przy ulicy", "Trudno znaleźć miejsce", "Płatny parking przy ulicy"], "context": "Miejsce o nazwie Biesiadowo to miejsce typu: Pizzeria, Kuchnia włoska. W ofercie znajduje się: Alkohol, Alkohol wysokoprocentowy, Jedzenie późnym wieczorem, Kawa, Koktajle, Małe porcje, Piwo, Szybka przekąska. Specjalne cechy miejsca: Dobre desery, Duży wybór herbat, Sport. Atmosfera jest opisywana jako: Kameralne, Modne, Niezobowiązująca atmosfera, Spokojne. Dostępne udogodnienia to: Bar na miejscu, Toaleta. Typowa grupa odwiedzających: Grupy, Studenci, Turyści. Jest popularne szczególnie na: Obiad, Kolacja, Posiłki w pojedynkę.", "google_rating": 3.8, "google_reviews_total": 1987, "google_price_range": "20–40"}}
{"oms_id": 6564869685, "name": "Pasta Go!", "Współrzędne": "51.769308, 19.460717", "key_words": {"types": ["Makarony", "Zdrowa żywność", "Kuchnia włoska", "Jedzenie z dostawą do domu", "Sałatki"], "address": "Kpt. Franciszka Żwirki 8, 90-450 Łódź, Polska", "phone": "+48 534 270 100", "opening_hours": {"sobota": "10:00–23:00", "niedziela": "10:00–22:00", "poniedziałek": "10:00–22:00", "wtorek": "10:00–22:00", "środa": "10:00–22:00", "czwartek": "10:00–23:00", "piątek": "10:00–23:00"}, "service_options": ["Dostawa bez kontaktu", "Dostawa", "Odbiór w sklepie", "Zakupy stacjonarne", "Usługi na miejscu", "Na wynos", "Na miejscu"], "specials": [], "popular_for": ["Posiłki w pojedynkę"], "accessibility": [], "offerings": [], "amenities": ["Wi-Fi", "Bezpłatne Wi-Fi"], "atmosphere": [], "crowd": ["Dla całej rodziny", "Przyjazne dla osób LGBTQ+"], "children": ["Menu dla dzieci"], "parking": ["Bezpłatny parking", "Płatny parking"], "context": "Miejsce o nazwie Pasta Go! to miejsce typu: Makarony, Zdrowa żywność, Kuchnia włoska, Jedzenie z dostawą do domu, Sałatki. Dostępne udogodnienia to: Wi-Fi, Bezpłatne Wi-Fi. Typowa grupa odwiedzających: Dla całej rodziny, Przyjazne dla osób LGBTQ+. Jest popularne szczególnie na: Posiłki w pojedynkę.", "google_rating": 4.4, "google_reviews_total": 1034, "google_price_range": "20–40"}}
{"oms_id": 6574396332, "name": "Bubamara", "Współrzędne": "51.779134, 19.449851", "key_words": {"types": ["Lodziarnia"], "address": "Kosovska 5, Beograd 11000, Serbia", "phone": "+381 69 1001090", "opening_hours": {"sobota": "12:00–20:00", "niedziela": "12:00–19:00", "poniedziałek": "12:00–20:00", "wtorek": "12:00–20:00", "środa": "12:00–20:00", "czwartek": "12:00–20:00", "piątek": "12:00–20:00"}, "service_options": ["Dostawa", "Na wynos"], "specials": [], "popular_for": [], "accessibility": ["Wejście dostępne dla osób na wózkach"], "offerings": ["Kawa"], "amenities": ["Wi-Fi", "Bezpłatne Wi-Fi"], "atmosphere": ["Kameralne", "Niezobowiązująca atmosfera"], "crowd": ["Dla całej rodziny", "Przyjazne dla osób LGBTQ+"], "children": ["Odpowiednie dla dzieci"], "parking": [], "context": "Miejsce o nazwie Bubamara to miejsce typu: Lodziarnia. W ofercie znajduje się: Kawa. Atmosfera jest opisywana jako: Kameralne, Niezobowiązująca atmosfera. Miejsce oferuje udogodnienia dostępności: Wejście dostępne dla osób na wózkach. Dostępne udogodnienia to: Wi-Fi, Bezpłatne Wi-Fi. Typowa grupa odwiedzających: Dla całej rodziny, Przyjazne dla osób LGBTQ+.", "google_rating": 4.9, "google_reviews_total": 462, "google_price_range": "$$"}}
{"oms_id": 6795521078, "name": "Pizza Hut", "Współrzędne": "51.743940, 19.400208", "key_words": {"types": ["Pizzeria", "Pizza na telefon", "Pizza na wynos", "Restauracja"], "address": "Armii Krajowej 33, 94-046 Łódź, Polska", "phone": "+48 22 536 36 36", "opening_hours": {"sobota": "12:00–22:00", "niedziela": "12:00–22:00", "poniedziałek": "12:00–22:00", "wtorek": "12:00–22:00", "środa": "12:00–22:00", "czwartek": "12:00–22:00", "piątek": "12:00–22:00"}, "service_options": ["Dostawa bez kontaktu", "Dostawa", "Na wynos", "Na miejscu"], "specials": [], "popular_for": ["Obiad", "Kolacja", "Posiłki w pojedynkę"], "accessibility": ["Miejsca dla osób na wózkach", "Parking dostępny dla osób na wózkach"], "offerings": ["Jedzenie późnym wieczorem", "Jesz, ile chcesz", "Małe porcje", "Piwo", "Szybka przekąska", "W ofercie dania wegetariańskie"], "amenities": ["Toaleta"], "atmosphere": ["Niezobowiązująca atmosfera", "Spokojne"], "crowd": ["Dla całej rodziny", "Miejsce przyjazne dla osób transpłciowych", "Przyjazne dla osób LGBTQ+", "Studenci", "Turyści"], "children": [], "parking": ["Bezpłatny parking", "Bezpłatny parking przy ulicy", "Dużo miejsc parkingowych"], "context": "Miejsce o nazwie Pizza Hut to miejsce typu: Pizzeria, Pizza na telefon, Pizza na wynos, Restauracja. W ofercie znajduje się: Jedzenie późnym wieczorem, Jesz, ile chcesz, Małe porcje, Piwo, Szybka przekąska, W ofercie dania wegetariańskie. Atmosfera jest opisywana jako: Niezobowiązująca atmosfera, Spokojne. Miejsce oferuje udogodnienia dostępności: Miejsca dla osób na wózkach, Parking dostępny dla osób na wózkach. Dostępne udogodnienia to: Toaleta. Typowa grupa odwiedzających: Dla całej rodziny, Miejsce przyjazne dla osób transpłciowych, Przyjazne dla osób LGBTQ+, Studenci, Turyści. Jest popularne szczególnie na: Obiad, Kolacja, Posiłki w pojedynkę.", "google_rating": 3.9, "google_reviews_total": 778, "google_price_range": "20–60"}}
{"oms_id": 6888800822, "name": "Pizzeria Verona", "Współrzędne": "51.722140, 19.442368", "key_words": {"types": ["Pizzeria"], "address": "Pabianicka 128, 93-410 Łódź, Polska", "phone": "+48 608 069 998", "opening_hours": {"sobota": "11:00–23:00", "niedziela": "12:00–22:00", "poniedziałek": "11:00–22:00", "wtorek": "11:00–22:00", "środa": "11:00–22:00", "czwartek": "11:00–22:00", "piątek": "11:00–23:00"}, "service_options": ["Dostawa", "Na wynos", "Na miejscu"], "specials": ["Duży wybór herbat"], "popular_for": ["Obiad", "Kolacja", "Posiłki w pojedynkę"], "accessibility": ["Miejsca dla osób na wózkach"], "offerings": ["Alkohol", "Jedzenie późnym wieczorem", "Kawa", "Małe porcje", "Piwo", "Szybka przekąska", "Wino"], "amenities": ["Toaleta"], "atmosphere": ["Niezobowiązująca atmosfera", "Spokojne"], "crowd": ["Grupy", "Turyści"], "children": ["Menu dla dzieci", "Odpowiednie dla dzieci"], "parking": ["Bezpłatny parking", "Bezpłatny parking przy ulicy", "Dużo miejsc parkingowych"], "context": "Miejsce o nazwie Pizzeria Verona to miejsce typu: Pizzeria. W ofercie znajduje się: Alkohol, Jedzenie późnym wieczorem, Kawa, Małe porcje, Piwo, Szybka przekąska, Wino. Specjalne cechy miejsca: Duży wybór herbat. Atmosfera jest opisywana jako: Niezobowiązująca atmosfera, Spokojne. Miejsce oferuje udogodnienia dostępności: Miejsca dla osób na wózkach. Dostępne udogodnienia to: Toaleta. Typowa grupa odwiedzających: Grupy, Turyści. Jest popularne szczególnie na: Obiad, Kolacja, Posiłki w pojedynkę.", "google_rating": 4.1, "google_reviews_total": 432, "google_price_range": "20–40"}}
{"oms_id": 7069767694, "name": "Limonka", "Współrzędne": "51.818729, 19.419135", "key_words": {"types": ["Kuchnia tajska", "Restauracja azjatycka (kuchnia fusion)", "Chińskie dania na wynos", "Makarony", "Restauracja"], "address": "11 Listopada 39F, 91-371 Łódź, Polska", "phone": "+48 570 039 957", "opening_hours": {"sobota": "13:00–22:00", "niedziela": "13:00–21:00", "poniedziałek": "13:00–20:00", "wtorek": "13:00–20:00", "środa": "13:00–20:00", "czwartek": "13:00–20:00", "piątek": "13:00–22:00"}, "service_options": ["Ogródek", "Dostawa bez kontaktu", "Dostawa", "Obsługa zmotoryzowanych", "Na wynos", "Na miejscu"], "specials": ["Dobre desery", "Duży wybór herbat"], "popular_for": ["Obiad", "Kolacja", "Posiłki w pojedynkę"], "accessibility": ["Parking dostępny dla osób na wózkach"], "offerings": ["Dania z produktów ekologicznych", "Jedzenie późnym wieczorem", "Kawa", "Małe porcje", "Szybka przekąska", "To miejsce oferuje dania wegańskie", "W ofercie dania wegetariańskie"], "amenities": ["Toaleta"], "atmosphere": ["Kameralne", "Modne", "Niezobowiązująca atmosfera", "Spokojne"], "crowd": ["Dla całej rodziny", "Miejsce przyjazne dla osób transpłciowych", "Przyjazne dla osób LGBTQ+", "Turyści"], "children": ["Menu dla dzieci", "Odpowiednie dla dzieci"], "parking": ["Bezpłatny parking", "Bezpłatny parking przy ulicy", "Dużo miejsc parkingowych"], "context": "Miejsce o nazwie Limonka to miejsce typu: Kuchnia tajska, Restauracja azjatycka (kuchnia fusion), Chińskie dania na wynos, Makarony, Restauracja. W ofercie znajduje się: Dania z produktów ekologicznych, Jedzenie późnym wieczorem, Kawa, Małe porcje, Szybka przekąska, To miejsce oferuje dania wegańskie, W ofercie dania wegetariańskie. Specjalne cechy miejsca: Dobre desery, Duży wybór herbat. Atmosfera jest opisywana jako: Kameralne, Modne, Niezobowiązująca atmosfera, Spokojne. Miejsce oferuje udogodnienia dostępności: Parking dostępny dla osób na wózkach. Dostępne udogodnienia to: Toaleta. Typowa grupa odwiedzających: Dla całej rodziny, Miejsce przyjazne dla osób transpłciowych, Przyjazne dla osób LGBTQ+, Turyści. Jest popularne szczególnie na: Obiad, Kolacja, Posiłki w pojedynkę.", "google_rating": 4.5, "google_reviews_total": 1110, "google_price_range": "20–40"}}
{"oms_id": 7101642149, "name": "The Brick Coffee Factory", "Współrzędne": "51.768792, 19.456155", "key_words": {"types": ["Kawiarnia"], "address": "Piotrkowska 63, 90-368 Łódź, Polska", "phone": "", "opening_hours": {"sobota": "08:00–00:00", "niedziela": "08:00–23:00", "poniedziałek": "08:00–22:00", "wtorek": "08:00–22:00", "środa": "08:00–22:00", "czwartek": "08:00–22:00", "piątek": "08:00–00:00"}, "service_options": ["Ogródek", "Na miejscu"], "specials": ["Dobra kawa", "Dobre desery", "Duży wybór herbat"], "popular_for": ["Posiłki w pojedynkę", "Dobre miejsce do pracy na laptopie"], "accessibility": ["Miejsca dla osób na wózkach", "Wejście dostępne dla osób na wózkach"], "offerings": ["Alkohol", "Jedzenie późnym wieczorem", "Kawa", "Koktajle", "Szybka przekąska", "To miejsce oferuje dania wegańskie", "W ofercie dania wegetariańskie"], "amenities": ["Toaleta"], "atmosphere": ["Kameralne", "Modne", "Niezobowiązująca atmosfera", "Romantyczna atmosfera", "Spokojne"], "crowd": ["Grupy", "Studenci", "Turyści"], "children": [], "parking": ["Trudno znaleźć miejsce"], "context": "Miejsce o nazwie The Brick Coffee Factory to miejsce typu: Kawiarnia. W ofercie znajduje się: Alkohol, Jedzenie późnym wieczorem, Kawa, Koktajle, Szybka przekąska, To miejsce oferuje dania wegańskie, W ofercie dania wegetariańskie. Specjalne cechy miejsca: Dobra kawa, Dobre desery, Duży wybór herbat. Atmosfera jest opisywana jako: Kameralne, Modne, Niezobowiązująca atmosfera, Romantyczna atmosfera, Spokojne. Miejsce oferuje udogodnienia dostępności: Miejsca dla osób na wózkach, Wejście dostępne dla osób na wózkach. Dostępne udogodnienia to: Toaleta. Typowa grupa odwiedzających: Grupy, Studenci, Turyści. Jest popularne szczególnie na: Posiłki w pojedynkę, Dobre miejsce do pracy na laptopie.", "google_rating": 4.6, "google_reviews_total": 314, "google_price_range": "1–20"}}
{"oms_id": 7204058385, "name": "Szpulka", "Współrzędne": "51.779498, 19.449254", "key_words": {"types": ["Bistro", "Restauracja śniadaniowa", "Hamburgery", "Restauracja obiadowa", "Restauracja europejska (kuchnia nowoczesna)", "Ramen"], "address": "Ogrodowa 19A, 91-065 Łódź, Polska", "phone": "+48 42 634 24 72", "opening_hours": {"sobota": "12:00–22:30", "niedziela": "12:00–20:00", "poniedziałek": "12:00–21:00", "wtorek": "12:00–21:00", "środa": "12:00–21:00", "czwartek": "12:00–21:30", "piątek": "12:00–22:30"}, "service_options": ["Ogródek", "Na miejscu"], "specials": ["Dobra kawa", "Dobre desery", "Dobre drinki", "Duży wybór herbat", "Duży wybór piw"], "popular_for": ["Śniadanie", "Obiad", "Kolacja", "Posiłki w pojedynkę"], "accessibility": ["Parking dostępny dla osób na wózkach", "Wejście dostępne dla osób na wózkach"], "offerings": ["Alkohol", "Alkohol wysokoprocentowy", "Jedzenie późnym wieczorem", "Kawa", "Koktajle", "Małe porcje", "Piwo", "Szybka przekąska", "To miejsce oferuje dania wegańskie", "W ofercie dania wegetariańskie", "Wino"], "amenities": ["Bar na miejscu", "Toaleta", "Wi-Fi", "Bezpłatne Wi-Fi"], "atmosphere": ["Kameralne", "Modne", "Niezobowiązująca atmosfera", "Spokojne"], "crowd": ["Dla całej rodziny", "Grupy", "Studenci", "Turyści"], "children": ["Krzesełka do karmienia", "Menu dla dzieci", "Odpowiednie dla dzieci"], "parking": ["Bezpłatny parking", "Dużo miejsc parkingowych"], "context": "Miejsce o nazwie Szpulka to miejsce typu: Bistro, Restauracja śniadaniowa, Hamburgery, Restauracja obiadowa, Restauracja europejska (kuchnia nowoczesna), Ramen. W ofercie znajduje się: Alkohol, Alkohol wysokoprocentowy, Jedzenie późnym wieczorem, Kawa, Koktajle, Małe porcje, Piwo, Szybka przekąska. Specjalne cechy miejsca: Dobra kawa, Dobre desery, Dobre drinki, Duży wybór herbat, Duży wybór piw. Atmosfera jest opisywana jako: Kameralne, Modne, Niezobowiązująca atmosfera, Spokojne. Miejsce oferuje udogodnienia dostępności: Parking dostępny dla osób na wózkach, Wejście dostępne dla osób na wózkach. Dostępne udogodnienia to: Bar na miejscu, Toaleta, Wi-Fi, Bezpłatne Wi-Fi. Typowa grupa odwiedzających: Dla całej rodziny, Grupy, Studenci, Turyści. Jest popularne szczególnie na: Śniadanie, O...", "google_rating": 4.5, "google_reviews_total": 2026, "google_price_range": "40–60"}}
{"oms_id": 7537232858, "name": "Pizza Hut", "Współrzędne": "51.797152, 19.440762", "key_words": {"types": ["Pizzeria", "Pizza na telefon", "Pizza na wynos", "Restauracja"], "address": "Drewnowska 58/5, 91-002 Łódź, Polska", "phone": "+48 22 536 36 36", "opening_hours": {"sobota": "11:00–23:00", "niedziela": "11:00–22:00", "poniedziałek": "11:00–22:00", "wtorek": "11:00–22:00", "środa": "11:00–22:00", "czwartek": "11:00–22:00", "piątek": "11:00–23:00"}, "service_options": ["Ogródek", "Dostawa bez kontaktu", "Dostawa", "Na wynos", "Na miejscu"], "specials": ["Dobra kawa", "Dobre desery", "Duży wybór herbat"], "popular_for": ["Obiad", "Kolacja", "Posiłki w pojedynkę"], "accessibility": ["Miejsca dla osób na wózkach", "Parking dostępny dla osób na wózkach", "Toaleta dla osób na wózkach", "Wejście dostępne dla osób na wózkach"], "offerings": ["Alkohol", "Bar sałatkowy", "Drinki w promocji happy hours", "Jedzenie późnym wieczorem", "Jedzenie w promocji happy hours", "Jesz, ile chcesz", "Kawa", "Koktajle", "Małe porcje", "Piwo", "Szybka przekąska", "To miejsce oferuje dania wegańskie", "W ofercie dania wegetariańskie", "Wino"], "amenities": ["Bar na miejscu", "Toaleta"], "atmosphere": ["Kameralne", "Modne", "Niezobowiązująca atmosfera", "Spokojne"], "crowd": ["Dla całej rodziny", "Grupy", "Miejsce przyjazne dla osób transpłciowych", "Przyjazne dla osób LGBTQ+", "Studenci", "Turyści"], "children": ["Krzesełka do karmienia", "Menu dla dzieci"], "parking": ["Bezpłatny parking", "Bezpłatny parking przy ulicy", "Dużo miejsc parkingowych"], "context": "Miejsce o nazwie Pizza Hut to miejsce typu: Pizzeria, Pizza na telefon, Pizza na wynos, Restauracja. W ofercie znajduje się: Alkohol, Bar sałatkowy, Drinki w promocji happy hours, Jedzenie późnym wieczorem, Jedzenie w promocji happy hours, Jesz, ile chcesz, Kawa, Koktajle. Specjalne cechy miejsca: Dobra kawa, Dobre desery, Duży wybór herbat. Atmosfera jest opisywana jako: Kameralne, Modne, Niezobowiązująca atmosfera, Spokojne. Miejsce oferuje udogodnienia dostępności: Miejsca dla osób na wózkach, Parking dostępny dla osób na wózkach, Toaleta dla osób na wózkach, Wejście dostępne dla osób na wózkach. Dostępne udogodnienia to: Bar na miejscu, Toaleta. Typowa grupa odwiedzających: Dla całej rodziny, Grupy, Miejsce przyjazne dla osób transpłciowych, Przyjazne dla osób LGBTQ+, Studenci, Tury...", "google_rating": 4.1, "google_reviews_total": 5465, "google_price_range": "40–60"}}
{"oms_id": 7784779804, "name": "Arteria", "Współrzędne": "51.763241, 19.485519", "key_words": {"types": ["Restauracja"], "address": "Marcinkowskiego 90A, 66-400 Gorzów Wielkopolski, Polska", "phone": "+48 883 918 009", "opening_hours": {"sobota": "Zamknięte", "niedziela": "Zamknięte", "poniedziałek": "11:00–18:00", "wtorek": "11:00–18:00", "środa": "11:00–18:00", "czwartek": "11:00–18:00", "piątek": "11:00–16:00"}, "service_options": ["Dostawa bez kontaktu", "Dostawa", "Na wynos", "Na miejscu"], "specials": ["Dobra kawa", "Dobre desery", "Duży wybór herbat", "Duży wybór piw"], "popular_for": ["Obiad", "Kolacja", "Posiłki w pojedynkę"], "accessibility": [], "offerings": ["Alkohol", "Alkohol wysokoprocentowy", "Jedzenie późnym wieczorem", "Kawa", "Koktajle", "Małe porcje", "Piwo", "Szybka przekąska", "Wino"], "amenities": ["Bar na miejscu", "Toaleta", "Toaleta unisex"], "atmosphere": ["Kameralne", "Modne", "Niezobowiązująca atmosfera", "Spokojne"], "crowd": ["Dla całej rodziny", "Grupy", "Turyści"], "children": ["Dobre miejsce na przyjęcia urodzinowe dla dzieci", "Krzesełka do karmienia", "Menu dla dzieci", "Odpowiednie dla dzieci"], "parking": [], "context": "Miejsce o nazwie Arteria to miejsce typu: Restauracja. W ofercie znajduje się: Alkohol, Alkohol wysokoprocentowy, Jedzenie późnym wieczorem, Kawa, Koktajle, Małe porcje, Piwo, Szybka przekąska. Specjalne cechy miejsca: Dobra kawa, Dobre desery, Duży wybór herbat, Duży wybór piw. Atmosfera jest opisywana jako: Kameralne, Modne, Niezobowiązująca atmosfera, Spokojne. Dostępne udogodnienia to: Bar na miejscu, Toaleta, Toaleta unisex. Typowa grupa odwiedzających: Dla całej rodziny, Grupy, Turyści. Jest popularne szczególnie na: Obiad, Kolacja, Posiłki w pojedynkę.", "google_rating": 4.4, "google_reviews_total": 238, "google_price_range": "20–40"}}
{"oms_id": 7892785631, "name": "Pizzeria Osiedlowa", "Współrzędne": "51.732606, 19.481604", "key_words": {"types": ["Pizzeria", "Restauracja"], "address": "Władysława Broniewskiego 16, 93-162 Łódź, Polska", "phone": "+48 690 512 997", "opening_hours": {"sobota": "12:00–22:00", "niedziela": "12:00–21:30", "poniedziałek": "12:00–21:30", "wtorek": "12:00–21:30", "środa": "12:00–21:30", "czwartek": "12:00–21:30", "piątek": "12:00–22:00"}, "service_options": ["Ogródek", "Dostawa bez kontaktu", "Dostawa", "Na wynos", "Na miejscu"], "specials": ["Dobra kawa", "Dobre desery", "Duży wybór herbat"], "popular_for": ["Obiad", "Kolacja", "Posiłki w pojedynkę"], "accessibility": ["Miejsca dla osób na wózkach", "Wejście dostępne dla osób na wózkach"], "offerings": ["Alkohol", "Jedzenie późnym wieczorem", "Kawa", "Koktajle", "Małe porcje", "Piwo", "Szybka przekąska", "To miejsce oferuje dania wegańskie", "W ofercie dania wegetariańskie", "Wino"], "amenities": ["Toaleta", "Wi-Fi", "Bezpłatne Wi-Fi"], "atmosphere": ["Kameralne", "Modne", "Niezobowiązująca atmosfera", "Spokojne"], "crowd": ["Dla całej rodziny", "Grupy", "Studenci", "Turyści"], "children": ["Krzesełka do karmienia", "Menu dla dzieci", "Odpowiednie dla dzieci"], "parking": ["Bezpłatny parking", "Bezpłatny parking przy ulicy"], "context": "Miejsce o nazwie Pizzeria Osiedlowa to miejsce typu: Pizzeria, Restauracja. W ofercie znajduje się: Alkohol, Jedzenie późnym wieczorem, Kawa, Koktajle, Małe porcje, Piwo, Szybka przekąska, To miejsce oferuje dania wegańskie. Specjalne cechy miejsca: Dobra kawa, Dobre desery, Duży wybór herbat. Atmosfera jest opisywana jako: Kameralne, Modne, Niezobowiązująca atmosfera, Spokojne. Miejsce oferuje udogodnienia dostępności: Miejsca dla osób na wózkach, Wejście dostępne dla osób na wózkach. Dostępne udogodnienia to: Toaleta, Wi-Fi, Bezpłatne Wi-Fi. Typowa grupa odwiedzających: Dla całej rodziny, Grupy, Studenci, Turyści. Jest popularne szczególnie na: Obiad, Kolacja, Posiłki w pojedynkę.", "google_rating": 4.5, "google_reviews_total": 1035, "google_price_range": "40–60"}}
{"oms_id": 8416958708, "name": "Stop Cafe", "Współrzędne": "51.703936, 19.603290", "key_words": {"types": ["Restauracja"], "address": "Kamieńca Podolskiego 10, 93-635 Łódź, Polska", "phone": "+48 24 256 44 07", "opening_hours": {"sobota": "Czynne całą dobę", "niedziela": "Czynne całą dobę", "poniedziałek": "Czynne całą dobę", "wtorek": "Czynne całą dobę", "środa": "Czynne całą dobę", "czwartek": "Czynne całą dobę", "piątek": "Czynne całą dobę"}, "service_options": ["Na wynos", "Na miejscu"], "specials": ["Dobra kawa", "Dobre desery", "Duży wybór herbat"], "popular_for": ["Śniadanie", "Obiad", "Posiłki w pojedynkę"], "accessibility": ["Miejsca dla osób na wózkach", "Parking dostępny dla osób na wózkach", "Toaleta dla osób na wózkach", "Wejście dostępne dla osób na wózkach"], "offerings": ["Kawa", "Szybka przekąska"], "amenities": ["Toaleta"], "atmosphere": ["Niezobowiązująca atmosfera", "Spokojne"], "crowd": ["Turyści"], "children": ["Menu dla dzieci"], "parking": ["Bezpłatny parking", "Bezpłatny parking przy ulicy", "Dużo miejsc parkingowych"], "context": "Miejsce o nazwie Stop Cafe to miejsce typu: Restauracja. W ofercie znajduje się: Kawa, Szybka przekąska. Specjalne cechy miejsca: Dobra kawa, Dobre desery, Duży wybór herbat. Atmosfera jest opisywana jako: Niezobowiązująca atmosfera, Spokojne. Miejsce oferuje udogodnienia dostępności: Miejsca dla osób na wózkach, Parking dostępny dla osób na wózkach, Toaleta dla osób na wózkach, Wejście dostępne dla osób na wózkach. Dostępne udogodnienia to: Toaleta. Typowa grupa odwiedzających: Turyści. Jest popularne szczególnie na: Śniadanie, Obiad, Posiłki w pojedynkę.", "google_rating": 4.3, "google_reviews_total": 112, "google_price_range": "20–40"}}
{"oms_id": 8612095866, "name": "Ibis Kitchen", "Współrzędne": "51.759108, 19.461592", "key_words": {"types": ["Restauracja"], "address": "Szczęśliwicka, 02-366 Warszawa, Polska", "phone": "+48 22 572 25 20", "opening_hours": {"sobota": "06:30–22:00", "niedziela": "06:30–22:00", "poniedziałek": "06:30–22:00", "wtorek": "06:30–22:00", "środa": "06:30–22:00", "czwartek": "06:30–22:00", "piątek": "06:30–22:00"}, "service_options": ["Na wynos", "Na miejscu"], "specials": ["Dobra kawa", "Dobre desery", "Duży wybór herbat"], "popular_for": ["Śniadanie", "Obiad", "Kolacja", "Posiłki w pojedynkę"], "accessibility": ["Miejsca dla osób na wózkach", "Parking dostępny dla osób na wózkach", "Toaleta dla osób na wózkach", "Wejście dostępne dla osób na wózkach"], "offerings": ["Alkohol", "Alkohol wysokoprocentowy", "Jedzenie późnym wieczorem", "Kawa", "Koktajle", "Małe porcje", "Piwo", "Szybka przekąska", "Wino"], "amenities": ["Bar na miejscu", "Toaleta"], "atmosphere": ["Niezobowiązująca atmosfera", "Spokojne"], "crowd": ["Grupy", "Turyści"], "children": ["Menu dla dzieci"], "parking": [], "context": "Miejsce o nazwie Ibis Kitchen to miejsce typu: Restauracja. W ofercie znajduje się: Alkohol, Alkohol wysokoprocentowy, Jedzenie późnym wieczorem, Kawa, Koktajle, Małe porcje, Piwo, Szybka przekąska. Specjalne cechy miejsca: Dobra kawa, Dobre desery, Duży wybór herbat. Atmosfera jest opisywana jako: Niezobowiązująca atmosfera, Spokojne. Miejsce oferuje udogodnienia dostępności: Miejsca dla osób na wózkach, Parking dostępny dla osób na wózkach, Toaleta dla osób na wózkach, Wejście dostępne dla osób na wózkach. Dostępne udogodnienia to: Bar na miejscu, Toaleta. Typowa grupa odwiedzających: Grupy, Turyści. Jest popularne szczególnie na: Śniadanie, Obiad, Kolacja, Posiłki w pojedynkę.", "google_rating": 4.1, "google_reviews_total": 74, "google_price_range": null}}
{"oms_id": 8612171823, "name": "Owoce i warzywa", "Współrzędne": "51.753622, 19.459067", "key_words": {"types": ["Kawiarnia", "Bar"], "address": "Gen. Romualda Traugutta 9, 90-106 Łódź, Polska", "phone": "+48 799 088 107", "opening_hours": {"sobota": "10:00–02:00", "niedziela": "11:00–23:00", "poniedziałek": "10:00–23:00", "wtorek": "10:00–23:00", "środa": "10:00–23:00", "czwartek": "10:00–00:00", "piątek": "10:00–02:00"}, "service_options": ["Ogródek", "Na miejscu"], "specials": ["Dobra kawa", "Dobre desery", "Duży wybór herbat", "Duży wybór piw"], "popular_for": ["Śniadanie", "Posiłki w pojedynkę", "Dobre miejsce do pracy na laptopie"], "accessibility": [], "offerings": ["Alkohol", "Alkohol wysokoprocentowy", "Jedzenie późnym wieczorem", "Kawa", "Koktajle", "Małe porcje", "Piwo", "Szybka przekąska", "To miejsce oferuje dania wegańskie", "W ofercie dania wegetariańskie", "Wino"], "amenities": ["Bar na miejscu", "Toaleta", "Wi-Fi", "Bezpłatne Wi-Fi"], "atmosphere": ["Kameralne", "Modne", "Niezobowiązująca atmosfera", "Romantyczna atmosfera", "Spokojne"], "crowd": ["Grupy", "Miejsce przyjazne dla osób transpłciowych", "Przyjazne dla osób LGBTQ+", "Studenci", "Turyści"], "children": [], "parking": ["Bezpłatny parking przy ulicy", "Trudno znaleźć miejsce", "Płatny parking", "Płatny parking przy ulicy"], "context": "Miejsce o nazwie Owoce i warzywa to miejsce typu: Kawiarnia, Bar. W ofercie znajduje się: Alkohol, Alkohol wysokoprocentowy, Jedzenie późnym wieczorem, Kawa, Koktajle, Małe porcje, Piwo, Szybka przekąska. Specjalne cechy miejsca: Dobra kawa, Dobre desery, Duży wybór herbat, Duży wybór piw. Atmosfera jest opisywana jako: Kameralne, Modne, Niezobowiązująca atmosfera, Romantyczna atmosfera, Spokojne. Dostępne udogodnienia to: Bar na miejscu, Toaleta, Wi-Fi, Bezpłatne Wi-Fi. Typowa grupa odwiedzających: Grupy, Miejsce przyjazne dla osób transpłciowych, Przyjazne dla osób LGBTQ+, Studenci, Turyści. Jest popularne szczególnie na: Śniadanie, Posiłki w pojedynkę, Dobre miejsce do pracy na laptopie.", "google_rating": 4.6, "google_reviews_total": 1312, "google_price_range": "20–40"}}
{"oms_id": 8612250842, "name": "Four Colors", "Współrzędne": "51.757315, 19.443262", "key_words": {"types": ["Restauracja"], "address": "Łąkowa 29, 90-554 Łódź, Polska", "phone": "+48 42 208 80 36", "opening_hours": {"sobota": "17:00–22:00", "niedziela": "17:00–22:00", "poniedziałek": "17:00–22:00", "wtorek": "17:00–22:00", "środa": "17:00–22:00", "czwartek": "17:00–22:00", "piątek": "17:00–22:00"}, "service_options": ["Na miejscu"], "specials": ["Duży wybór herbat"], "popular_for": ["Śniadanie", "Posiłki w pojedynkę"], "accessibility": ["Miejsca dla osób na wózkach", "Parking dostępny dla osób na wózkach", "Toaleta dla osób na wózkach", "Wejście dostępne dla osób na wózkach"], "offerings": ["Małe porcje"], "amenities": ["Bar na miejscu", "Toaleta"], "atmosphere": ["Kameralne", "Niezobowiązująca atmosfera", "Spokojne"], "crowd": ["Grupy", "Turyści"], "children": ["Menu dla dzieci"], "parking": ["Bezpłatny parking", "Płatny parking", "Płatny parking przy ulicy"], "context": "Miejsce o nazwie Four Colors to miejsce typu: Restauracja. W ofercie znajduje się: Małe porcje. Specjalne cechy miejsca: Duży wybór herbat. Atmosfera jest opisywana jako: Kameralne, Niezobowiązująca atmosfera, Spokojne. Miejsce oferuje udogodnienia dostępności: Miejsca dla osób na wózkach, Parking dostępny dla osób na wózkach, Toaleta dla osób na wózkach, Wejście dostępne dla osób na wózkach. Dostępne udogodnienia to: Bar na miejscu, Toaleta. Typowa grupa odwiedzających: Grupy, Turyści. Jest popularne szczególnie na: Śniadanie, Posiłki w pojedynkę.", "google_rating": 4.3, "google_reviews_total": 42, "google_price_range": "100–120"}}
{"oms_id": 8612251772, "name": "Caffe przy ulicy", "Współrzędne": "51.762333, 19.458580", "key_words": {"types": ["Restauracja śniadaniowa", "Restauracja serwująca drugie śniadania", "Kawiarnia", "Sałatki", "Kanapki"], "address": "Nawrot 1a, 90-060 Łódź, Polska", "phone": "+48 662 330 651", "opening_hours": {"sobota": "08:00–17:00", "niedziela": "09:00–17:00", "poniedziałek": "08:00–17:00", "wtorek": "08:00–17:00", "środa": "08:00–17:00", "czwartek": "08:00–17:00", "piątek": "08:00–17:00"}, "service_options": ["Dostawa", "Na wynos", "Na miejscu"], "specials": ["Dobra kawa", "Dobre desery", "Duży wybór herbat"], "popular_for": ["Śniadanie", "Posiłki w pojedynkę"], "accessibility": [], "offerings": ["Kawa", "Małe porcje", "Szybka przekąska", "To miejsce oferuje dania wegańskie", "W ofercie dania wegetariańskie"], "amenities": ["Toaleta"], "atmosphere": ["Kameralne", "Modne", "Niezobowiązująca atmosfera", "Romantyczna atmosfera", "Spokojne"], "crowd": ["Grupy", "Studenci", "Turyści"], "children": [], "parking": ["Płatny parking", "Płatny parking przy ulicy"], "context": "Miejsce o nazwie Caffe przy ulicy to miejsce typu: Restauracja śniadaniowa, Restauracja serwująca drugie śniadania, Kawiarnia, Sałatki, Kanapki. W ofercie znajduje się: Kawa, Małe porcje, Szybka przekąska, To miejsce oferuje dania wegańskie, W ofercie dania wegetariańskie. Specjalne cechy miejsca: Dobra kawa, Dobre desery, Duży wybór herbat. Atmosfera jest opisywana jako: Kameralne, Modne, Niezobowiązująca atmosfera, Romantyczna atmosfera, Spokojne. Dostępne udogodnienia to: Toaleta. Typowa grupa odwiedzających: Grupy, Studenci, Turyści. Jest popularne szczególnie na: Śniadanie, Posiłki w pojedynkę.", "google_rating": 4.6, "google_reviews_total": 1930, "google_price_range": "20–40"}}
{"oms_id": 8612300897, "name": "Restauracja Łódzka", "Współrzędne": "51.752479, 19.459741", "key_words": {"types": ["Kuchnia polska", "Restauracja"], "address": "Henryka Sienkiewicza 67, 90-009 Łódź, Polska", "phone": "+48 42 207 33 30", "opening_hours": {"sobota": "13:00–22:00", "niedziela": "13:00–18:00", "poniedziałek": "Zamknięte", "wtorek": "Zamknięte", "środa": "13:00–21:00", "czwartek": "13:00–21:00", "piątek": "13:00–22:00"}, "service_options": ["Na wynos", "Na miejscu"], "specials": ["Dobra kawa", "Dobre desery", "Dobre drinki", "Duży wybór herbat", "Duży wybór piw", "Obszerna karta win"], "popular_for": ["Obiad", "Kolacja", "Posiłki w pojedynkę"], "accessibility": [], "offerings": ["Alkohol", "Alkohol wysokoprocentowy", "Jedzenie późnym wieczorem", "Kawa", "Koktajle", "Małe porcje", "Piwo", "W ofercie dania wegetariańskie", "Wino"], "amenities": ["Bar na miejscu", "Toaleta", "Toaleta unisex", "Wi-Fi", "Bezpłatne Wi-Fi"], "atmosphere": ["Kameralne", "Modne", "Niezobowiązująca atmosfera", "Romantyczna atmosfera", "Spokojne"], "crowd": ["Dla całej rodziny", "Grupy", "Turyści"], "children": ["Krzesełka do karmienia", "Odpowiednie dla dzieci"], "parking": ["Bezpłatny parking przy ulicy", "Płatny parking", "Płatny parking przy ulicy"], "context": "Miejsce o nazwie Restauracja Łódzka to miejsce typu: Kuchnia polska, Restauracja. W ofercie znajduje się: Alkohol, Alkohol wysokoprocentowy, Jedzenie późnym wieczorem, Kawa, Koktajle, Małe porcje, Piwo, W ofercie dania wegetariańskie. Specjalne cechy miejsca: Dobra kawa, Dobre desery, Dobre drinki, Duży wybór herbat, Duży wybór piw, Obszerna karta win. Atmosfera jest opisywana jako: Kameralne, Modne, Niezobowiązująca atmosfera, Romantyczna atmosfera, Spokojne. Dostępne udogodnienia to: Bar na miejscu, Toaleta, Toaleta unisex, Wi-Fi, Bezpłatne Wi-Fi. Typowa grupa odwiedzających: Dla całej rodziny, Grupy, Turyści. Jest popularne szczególnie na: Obiad, Kolacja, Posiłki w pojedynkę.", "google_rating": 4.7, "google_reviews_total": 1434, "google_price_range": "$$"}}
{"oms_id": 8612302423, "name": "Lepione&Pieczone", "Współrzędne": "51.766306, 19.456805", "key_words": {"types": ["Restauracja", "Pierogarnia"], "address": "Piotrkowska 89, 90-423 Łódź, Polska", "phone": "+48 725 100 320", "opening_hours": {"sobota": "08:00–21:00", "niedziela": "08:00–20:00", "poniedziałek": "08:00–20:00", "wtorek": "08:00–20:00", "środa": "08:00–20:00", "czwartek": "08:00–20:00", "piątek": "08:00–21:00"}, "service_options": ["Ogródek", "Dostawa bez kontaktu", "Dostawa", "Na wynos", "Na miejscu"], "specials": ["Dobra kawa", "Dobre desery", "Duży wybór herbat"], "popular_for": ["Śniadanie", "Obiad", "Kolacja", "Posiłki w pojedynkę"], "accessibility": [], "offerings": ["Alkohol", "Alkohol wysokoprocentowy", "Jedzenie późnym wieczorem", "Kawa", "Koktajle", "Małe porcje", "Piwo", "Szybka przekąska", "To miejsce oferuje dania wegańskie", "W ofercie dania wegetariańskie", "Wino"], "amenities": ["Toaleta"], "atmosphere": ["Kameralne", "Modne", "Niezobowiązująca atmosfera", "Spokojne"], "crowd": ["Grupy", "Studenci", "Turyści"], "children": ["Menu dla dzieci", "Odpowiednie dla dzieci"], "parking": ["Trudno znaleźć miejsce"], "context": "Miejsce o nazwie Lepione&Pieczone to miejsce typu: Restauracja, Pierogarnia. W ofercie znajduje się: Alkohol, Alkohol wysokoprocentowy, Jedzenie późnym wieczorem, Kawa, Koktajle, Małe porcje, Piwo, Szybka przekąska. Specjalne cechy miejsca: Dobra kawa, Dobre desery, Duży wybór herbat. Atmosfera jest opisywana jako: Kameralne, Modne, Niezobowiązująca atmosfera, Spokojne. Dostępne udogodnienia to: Toaleta. Typowa grupa odwiedzających: Grupy, Studenci, Turyści. Jest popularne szczególnie na: Śniadanie, Obiad, Kolacja, Posiłki w pojedynkę.", "google_rating": 4.3, "google_reviews_total": 1324, "google_price_range": "20–40"}}
{"oms_id": 8612304781, "name": "Bicykl", "Współrzędne": "51.769062, 19.456614", "key_words": {"types": ["Sklep rowerowy"], "address": "Bolesława Limanowskiego 115/lok. 2, 91-334 Łódź, Polska", "phone": "+48 570 566 577", "opening_hours": {"sobota": "10:00–14:00", "niedziela": "Zamknięte", "poniedziałek": "10:00–18:00", "wtorek": "10:00–18:00", "środa": "10:00–18:00", "czwartek": "10:00–18:00", "piątek": "10:00–18:00"}, "service_options": ["Odbiór w sklepie", "Zakupy stacjonarne"], "specials": [], "popular_for": [], "accessibility": ["Wejście dostępne dla osób na wózkach"], "offerings": [], "amenities": [], "atmosphere": [], "crowd": [], "children": [], "parking": [], "context": "Miejsce o nazwie Bicykl to miejsce typu: Sklep rowerowy. Miejsce oferuje udogodnienia dostępności: Wejście dostępne dla osób na wózkach.", "google_rating": 4.3, "google_reviews_total": 82, "google_price_range": null}}
{"oms_id": 8612320604, "name": "Cukiernia Dybalski", "Współrzędne": "51.747520, 19.394964", "key_words": {"types": ["Sklep"], "address": "aleja Kardynała Stefana Wyszyńskiego 51, 94-047 Łódź, Polska", "phone": "", "opening_hours": {"sobota": "08:00–14:00", "niedziela": "Zamknięte", "poniedziałek": "07:00–18:00", "wtorek": "07:00–18:00", "środa": "07:00–18:00", "czwartek": "07:00–18:00", "piątek": "07:00–18:00"}, "service_options": [], "specials": [], "popular_for": [], "accessibility": [], "offerings": [], "amenities": [], "atmosphere": [], "crowd": [], "children": [], "parking": [], "context": "Miejsce o nazwie Cukiernia Dybalski to miejsce typu: Sklep.", "google_rating": 4.6, "google_reviews_total": 5, "google_price_range": null}}
{"oms_id": 8612359131, "name": "Novo Square Lounge Bar", "Współrzędne": "51.759248, 19.462412", "key_words": {"types": ["Restauracja"], "address": "al. marsz. Józefa Piłsudskiego 11A, 90-368 Łódź, Polska", "phone": "+48 42 254 39 22", "opening_hours": {"sobota": "12:00–22:00", "niedziela": "12:00–22:00", "poniedziałek": "12:00–22:00", "wtorek": "12:00–22:00", "środa": "12:00–22:00", "czwartek": "12:00–22:00", "piątek": "12:00–22:00"}, "service_options": ["Ogródek", "Usługi na miejscu", "Na miejscu"], "specials": ["Dobra kawa", "Dobre drinki", "Duży wybór herbat"], "popular_for": ["Obiad", "Posiłki w pojedynkę"], "accessibility": ["Parking dostępny dla osób na wózkach", "Wejście dostępne dla osób na wózkach"], "offerings": ["Alkohol", "Alkohol wysokoprocentowy", "Dania z produktów ekologicznych", "Kawa", "Koktajle", "Małe porcje", "Piwo", "Szybka przekąska", "To miejsce oferuje dania wegańskie", "W ofercie dania wegetariańskie", "Wino"], "amenities": ["Bar na miejscu", "Toaleta", "Wi-Fi", "Bezpłatne Wi-Fi"], "atmosphere": ["Niezobowiązująca atmosfera", "Spokojne"], "crowd": ["Grupy", "Turyści"], "children": ["Krzesełka do karmienia", "Ma przewijak(i)", "Menu dla dzieci", "Odpowiednie dla dzieci"], "parking": ["Płatny parking"], "context": "Miejsce o nazwie Novo Square Lounge Bar to miejsce typu: Restauracja. W ofercie znajduje się: Alkohol, Alkohol wysokoprocentowy, Dania z produktów ekologicznych, Kawa, Koktajle, Małe porcje, Piwo, Szybka przekąska. Specjalne cechy miejsca: Dobra kawa, Dobre drinki, Duży wybór herbat. Atmosfera jest opisywana jako: Niezobowiązująca atmosfera, Spokojne. Miejsce oferuje udogodnienia dostępności: Parking dostępny dla osób na wózkach, Wejście dostępne dla osób na wózkach. Dostępne udogodnienia to: Bar na miejscu, Toaleta, Wi-Fi, Bezpłatne Wi-Fi. Typowa grupa odwiedzających: Grupy, Turyści. Jest popularne szczególnie na: Obiad, Posiłki w pojedynkę.", "google_rating": 4.2, "google_reviews_total": 13, "google_price_range": "100–120"}}
{"oms_id": 8732135727, "name": "Da Grasso", "Współrzędne": "51.795547, 19.455923", "key_words": {"types": ["Pizzeria", "Pizza na telefon", "Pizza na wynos", "Restauracja"], "address": "Łagiewnicka 65A, 91-855 Łódź, Polska", "phone": "+48 42 655 22 11", "opening_hours": {"sobota": "10:30–00:00", "niedziela": "11:30–23:00", "poniedziałek": "10:30–23:00", "wtorek": "10:30–23:00", "środa": "10:30–23:00", "czwartek": "10:30–23:00", "piątek": "10:30–00:00"}, "service_options": ["Ogródek", "Dostawa bez kontaktu", "Dostawa", "Na wynos", "Na miejscu"], "specials": ["Dobra kawa", "Dobre desery", "Dobre drinki", "Duży wybór herbat"], "popular_for": ["Obiad", "Kolacja", "Posiłki w pojedynkę"], "accessibility": ["Miejsca dla osób na wózkach", "Toaleta dla osób na wózkach", "Wejście dostępne dla osób na wózkach"], "offerings": ["Alkohol", "Alkohol wysokoprocentowy", "Jedzenie późnym wieczorem", "Kawa", "Koktajle", "Małe porcje", "Piwo", "Szybka przekąska", "To miejsce oferuje dania wegańskie", "W ofercie dania wegetariańskie", "Wino"], "amenities": ["Bar na miejscu", "Toaleta", "Wi-Fi", "Bezpłatne Wi-Fi"], "atmosphere": ["Kameralne", "Modne", "Niezobowiązująca atmosfera", "Spokojne"], "crowd": ["Dla całej rodziny", "Grupy", "Studenci", "Turyści"], "children": ["Dobre miejsce na przyjęcia urodzinowe dla dzieci", "Krzesełka do karmienia", "Menu dla dzieci", "Odpowiednie dla dzieci"], "parking": ["Bezpłatny parking", "Bezpłatny parking przy ulicy", "Dużo miejsc parkingowych"], "context": "Miejsce o nazwie Da Grasso to miejsce typu: Pizzeria, Pizza na telefon, Pizza na wynos, Restauracja. W ofercie znajduje się: Alkohol, Alkohol wysokoprocentowy, Jedzenie późnym wieczorem, Kawa, Koktajle, Małe porcje, Piwo, Szybka przekąska. Specjalne cechy miejsca: Dobra kawa, Dobre desery, Dobre drinki, Duży wybór herbat. Atmosfera jest opisywana jako: Kameralne, Modne, Niezobowiązująca atmosfera, Spokojne. Miejsce oferuje udogodnienia dostępności: Miejsca dla osób na wózkach, Toaleta dla osób na wózkach, Wejście dostępne dla osób na wózkach. Dostępne udogodnienia to: Bar na miejscu, Toaleta, Wi-Fi, Bezpłatne Wi-Fi. Typowa grupa odwiedzających: Dla całej rodziny, Grupy, Studenci, Turyści. Jest popularne szczególnie na: Obiad, Kolacja, Posiłki w pojedynkę.", "google_rating": 4.3, "google_reviews_total": 2945, "google_price_range": "20–60"}}
{"oms_id": 9204892403, "name": "U Gosi", "Współrzędne": "51.762170, 19.447420", "key_words": {"types": ["Restauracja"], "address": "Mikołaja Kopernika 25, 90-001 Łódź, Polska", "phone": "+48 516 472 076", "opening_hours": {"sobota": "Zamknięte", "niedziela": "Zamknięte", "poniedziałek": "11:00–17:00", "wtorek": "11:00–17:00", "środa": "11:00–17:00", "czwartek": "11:00–17:00", "piątek": "11:00–17:00"}, "service_options": ["Dostawa bez kontaktu", "Dostawa", "Na wynos", "Na miejscu"], "specials": [], "popular_for": ["Śniadanie", "Obiad", "Posiłki w pojedynkę"], "accessibility": ["Miejsca dla osób na wózkach", "Wejście dostępne dla osób na wózkach"], "offerings": ["Kawa", "Szybka przekąska"], "amenities": ["Toaleta"], "atmosphere": ["Kameralne", "Niezobowiązująca atmosfera", "Spokojne"], "crowd": ["Grupy", "Turyści"], "children": ["Odpowiednie dla dzieci"], "parking": ["Raczej trudno znaleźć miejsce"], "context": "Miejsce o nazwie U Gosi to miejsce typu: Restauracja. W ofercie znajduje się: Kawa, Szybka przekąska. Atmosfera jest opisywana jako: Kameralne, Niezobowiązująca atmosfera, Spokojne. Miejsce oferuje udogodnienia dostępności: Miejsca dla osób na wózkach, Wejście dostępne dla osób na wózkach. Dostępne udogodnienia to: Toaleta. Typowa grupa odwiedzających: Grupy, Turyści. Jest popularne szczególnie na: Śniadanie, Obiad, Posiłki w pojedynkę.", "google_rating": 4.4, "google_reviews_total": 434, "google_price_range": "20–40"}}
{"oms_id": 9468231183, "name": "Starbucks", "Współrzędne": "51.759897, 19.458115", "key_words": {"types": ["Kawiarnia"], "address": "Drewnowska 58, 91-002 Łódź, Polska", "phone": "+48 572 508 785", "opening_hours": {"sobota": "07:00–23:00", "niedziela": "08:00–22:00", "poniedziałek": "07:00–23:00", "wtorek": "07:00–23:00", "środa": "07:00–23:00", "czwartek": "07:00–23:00", "piątek": "07:00–23:00"}, "service_options": ["Ogródek", "Dostawa", "Na wynos", "Na miejscu"], "specials": ["Dobra kawa", "Dobre desery", "Duży wybór herbat"], "popular_for": ["Śniadanie", "Posiłki w pojedynkę", "Dobre miejsce do pracy na laptopie"], "accessibility": ["Miejsca dla osób na wózkach", "Parking dostępny dla osób na wózkach", "Toaleta dla osób na wózkach", "Wejście dostępne dla osób na wózkach"], "offerings": ["Dania z produktów ekologicznych", "Jedzenie późnym wieczorem", "Kawa", "Małe porcje", "Szybka przekąska", "W ofercie dania wegetariańskie"], "amenities": ["Toaleta"], "atmosphere": ["Kameralne", "Modne", "Niezobowiązująca atmosfera", "Spokojne"], "crowd": ["Grupy", "Studenci", "Turyści"], "children": [], "parking": ["Bezpłatny parking", "Bezpłatny parking przy ulicy", "Dużo miejsc parkingowych"], "context": "Miejsce o nazwie Starbucks to miejsce typu: Kawiarnia. W ofercie znajduje się: Dania z produktów ekologicznych, Jedzenie późnym wieczorem, Kawa, Małe porcje, Szybka przekąska, W ofercie dania wegetariańskie. Specjalne cechy miejsca: Dobra kawa, Dobre desery, Duży wybór herbat. Atmosfera jest opisywana jako: Kameralne, Modne, Niezobowiązująca atmosfera, Spokojne. Miejsce oferuje udogodnienia dostępności: Miejsca dla osób na wózkach, Parking dostępny dla osób na wózkach, Toaleta dla osób na wózkach, Wejście dostępne dla osób na wózkach. Dostępne udogodnienia to: Toaleta. Typowa grupa odwiedzających: Grupy, Studenci, Turyści. Jest popularne szczególnie na: Śniadanie, Posiłki w pojedynkę, Dobre miejsce do pracy na laptopie.", "google_rating": 4.3, "google_reviews_total": 2268, "google_price_range": "20–40"}}
{"oms_id": 9668786629, "name": "Winoteka", "Współrzędne": "51.754062, 19.481410", "key_words": {"types": ["Restauracja"], "address": "ks. bp. Wincentego Tymienieckiego 32, 90-350 Łódź, Polska", "phone": "+48 604 605 650", "opening_hours": {"sobota": "12:00–22:00", "niedziela": "12:00–20:00", "poniedziałek": "Zamknięte", "wtorek": "Zamknięte", "środa": "16:00–20:00", "czwartek": "16:00–22:00", "piątek": "16:00–22:00"}, "service_options": ["Ogródek", "Dostawa", "Na wynos", "Na miejscu"], "specials": ["Dobra kawa", "Dobre desery", "Duży wybór herbat"], "popular_for": ["Obiad", "Kolacja", "Posiłki w pojedynkę"], "accessibility": [], "offerings": ["Alkohol", "Alkohol wysokoprocentowy", "Jedzenie późnym wieczorem", "Kawa", "Koktajle", "Małe porcje", "Piwo", "Szybka przekąska", "Wino"], "amenities": ["Toaleta"], "atmosphere": ["Kameralne", "Modne", "Niezobowiązująca atmosfera", "Spokojne"], "crowd": ["Dla całej rodziny", "Grupy", "Miejsce przyjazne dla osób transpłciowych", "Przyjazne dla osób LGBTQ+", "Turyści"], "children": [], "parking": ["Bezpłatny parking", "Bezpłatny parking przy ulicy", "Dużo miejsc parkingowych", "Płatny parking przy ulicy"], "context": "Miejsce o nazwie Winoteka to miejsce typu: Restauracja. W ofercie znajduje się: Alkohol, Alkohol wysokoprocentowy, Jedzenie późnym wieczorem, Kawa, Koktajle, Małe porcje, Piwo, Szybka przekąska. Specjalne cechy miejsca: Dobra kawa, Dobre desery, Duży wybór herbat. Atmosfera jest opisywana jako: Kameralne, Modne, Niezobowiązująca atmosfera, Spokojne. Dostępne udogodnienia to: Toaleta. Typowa grupa odwiedzających: Dla całej rodziny, Grupy, Miejsce przyjazne dla osób transpłciowych, Przyjazne dla osób LGBTQ+, Turyści. Jest popularne szczególnie na: Obiad, Kolacja, Posiłki w pojedynkę.", "google_rating": 4.4, "google_reviews_total": 190, "google_price_range": null}}
{"oms_id": 9727824675, "name": "Con Ga Moi", "Współrzędne": "51.800885, 19.465305", "key_words": {"types": ["Kuchnia wietnamska", "Restauracja orientalna"], "address": "Pomorska 116, 91-403 Łódź, Polska", "phone": "+48 602 249 915", "opening_hours": {"sobota": "10:00–21:00", "niedziela": "11:00–20:00", "poniedziałek": "10:00–21:00", "wtorek": "10:00–21:00", "środa": "10:00–21:00", "czwartek": "10:00–21:00", "piątek": "10:00–21:00"}, "service_options": ["Ogródek", "Dostawa", "Na wynos", "Na miejscu"], "specials": ["Duży wybór herbat"], "popular_for": ["Obiad", "Kolacja", "Posiłki w pojedynkę"], "accessibility": ["Wejście dostępne dla osób na wózkach"], "offerings": ["Alkohol", "Jedzenie późnym wieczorem", "Kawa", "Małe porcje", "Piwo", "Szybka przekąska", "To miejsce oferuje dania wegańskie", "W ofercie dania wegetariańskie"], "amenities": ["Toaleta"], "atmosphere": ["Kameralne", "Niezobowiązująca atmosfera", "Spokojne"], "crowd": ["Grupy", "Studenci", "Turyści"], "children": [], "parking": ["Bezpłatny parking", "Dużo miejsc parkingowych"], "context": "Miejsce o nazwie Con Ga Moi to miejsce typu: Kuchnia wietnamska, Restauracja orientalna. W ofercie znajduje się: Alkohol, Jedzenie późnym wieczorem, Kawa, Małe porcje, Piwo, Szybka przekąska, To miejsce oferuje dania wegańskie, W ofercie dania wegetariańskie. Specjalne cechy miejsca: Duży wybór herbat. Atmosfera jest opisywana jako: Kameralne, Niezobowiązująca atmosfera, Spokojne. Miejsce oferuje udogodnienia dostępności: Wejście dostępne dla osób na wózkach. Dostępne udogodnienia to: Toaleta. Typowa grupa odwiedzających: Grupy, Studenci, Turyści. Jest popularne szczególnie na: Obiad, Kolacja, Posiłki w pojedynkę.", "google_rating": 3.9, "google_reviews_total": 667, "google_price_range": "20–40"}}
{"oms_id": 9731963700, "name": "Da Grasso", "Współrzędne": "51.793417, 19.588424", "key_words": {"types": ["Pizzeria", "Pizza na telefon", "Pizza na wynos", "Restauracja"], "address": "rynek Nowosolna 8, 92-703 Łódź, Polska", "phone": "+48 573 000 570", "opening_hours": {"sobota": "11:00–23:00", "niedziela": "12:00–22:00", "poniedziałek": "11:00–22:00", "wtorek": "11:00–22:00", "środa": "11:00–22:00", "czwartek": "11:00–22:00", "piątek": "11:00–23:00"}, "service_options": ["Ogródek", "Dostawa", "Na wynos", "Na miejscu"], "specials": ["Dobra kawa", "Dobre desery", "Duży wybór herbat"], "popular_for": ["Obiad", "Kolacja", "Posiłki w pojedynkę"], "accessibility": ["Miejsca dla osób na wózkach", "Wejście dostępne dla osób na wózkach"], "offerings": ["Alkohol", "Jedzenie późnym wieczorem", "Kawa", "Małe porcje", "Piwo", "Szybka przekąska", "To miejsce oferuje dania wegańskie", "W ofercie dania wegetariańskie"], "amenities": ["Toaleta", "Wi-Fi", "Bezpłatne Wi-Fi"], "atmosphere": ["Kameralne", "Modne", "Niezobowiązująca atmosfera", "Spokojne"], "crowd": ["Dla całej rodziny", "Grupy", "Studenci", "Turyści"], "children": ["Menu dla dzieci", "Odpowiednie dla dzieci"], "parking": ["Bezpłatny parking", "Bezpłatny parking przy ulicy", "Dużo miejsc parkingowych"], "context": "Miejsce o nazwie Da Grasso to miejsce typu: Pizzeria, Pizza na telefon, Pizza na wynos, Restauracja. W ofercie znajduje się: Alkohol, Jedzenie późnym wieczorem, Kawa, Małe porcje, Piwo, Szybka przekąska, To miejsce oferuje dania wegańskie, W ofercie dania wegetariańskie. Specjalne cechy miejsca: Dobra kawa, Dobre desery, Duży wybór herbat. Atmosfera jest opisywana jako: Kameralne, Modne, Niezobowiązująca atmosfera, Spokojne. Miejsce oferuje udogodnienia dostępności: Miejsca dla osób na wózkach, Wejście dostępne dla osób na wózkach. Dostępne udogodnienia to: Toaleta, Wi-Fi, Bezpłatne Wi-Fi. Typowa grupa odwiedzających: Dla całej rodziny, Grupy, Studenci, Turyści. Jest popularne szczególnie na: Obiad, Kolacja, Posiłki w pojedynkę.", "google_rating": 4, "google_reviews_total": 430, "google_price_range": "40–60"}}
{"oms_id": 9909733939, "name": "Willa", "Współrzędne": "51.754732, 19.439135", "key_words": {"types": ["Bar", "Klub"], "address": "Stefana Żeromskiego 117, 90-542 Łódź, Polska", "phone": "", "opening_hours": {"sobota": "16:00–22:00", "niedziela": "16:00–22:00", "poniedziałek": "Zamknięte", "wtorek": "Zamknięte", "środa": "Zamknięte", "czwartek": "16:00–22:00", "piątek": "16:00–22:00"}, "service_options": ["Ogródek", "Na miejscu"], "specials": ["Duży wybór piw", "Muzyka na żywo", "Występy na żywo"], "popular_for": [], "accessibility": [], "offerings": ["Alkohol", "Alkohol wysokoprocentowy", "Jedzenie", "Koktajle", "Piwo", "Taniec", "Wino"], "amenities": ["Toaleta"], "atmosphere": ["Kameralne", "Modne", "Niezobowiązująca atmosfera"], "crowd": ["Grupy", "Turyści"], "children": [], "parking": [], "context": "Miejsce o nazwie Willa to miejsce typu: Bar, Klub. W ofercie znajduje się: Alkohol, Alkohol wysokoprocentowy, Jedzenie, Koktajle, Piwo, Taniec, Wino. Specjalne cechy miejsca: Duży wybór piw, Muzyka na żywo, Występy na żywo. Atmosfera jest opisywana jako: Kameralne, Modne, Niezobowiązująca atmosfera. Dostępne udogodnienia to: Toaleta. Typowa grupa odwiedzających: Grupy, Turyści.", "google_rating": 4.3, "google_reviews_total": 270, "google_price_range": "20–40"}}
{"oms_id": 9939348265, "name": "MORNING", "Współrzędne": "51.765555, 19.439446", "key_words": {"types": ["Restauracja śniadaniowa", "Restauracja serwująca drugie śniadania", "Kawiarnia", "Kawiarnia przyjazna dla psów"], "address": "Gen. Lucjana Żeligowskiego 46, 90-644 Łódź, Polska", "phone": "+48 600 016 946", "opening_hours": {"sobota": "08:00–16:00", "niedziela": "09:00–16:00", "poniedziałek": "07:00–16:00", "wtorek": "07:00–16:00", "środa": "07:00–16:00", "czwartek": "07:00–16:00", "piątek": "07:00–16:00"}, "service_options": ["Na wynos", "Na miejscu"], "specials": ["Dobra kawa", "Dobre desery", "Duży wybór herbat"], "popular_for": ["Śniadanie", "Posiłki w pojedynkę"], "accessibility": ["Miejsca dla osób na wózkach", "Wejście dostępne dla osób na wózkach"], "offerings": ["Kawa", "Małe porcje", "Szybka przekąska", "To miejsce oferuje dania wegańskie", "W ofercie dania wegetariańskie"], "amenities": ["Toaleta", "Toaleta unisex", "Wi-Fi", "Bezpłatne Wi-Fi"], "atmosphere": ["Kameralne", "Modne", "Niezobowiązująca atmosfera", "Romantyczna atmosfera", "Spokojne"], "crowd": ["Dla całej rodziny", "Grupy", "Studenci", "Turyści"], "children": ["Krzesełka do karmienia", "Odpowiednie dla dzieci"], "parking": ["Dużo miejsc parkingowych", "Płatny parking", "Płatny parking przy ulicy"], "context": "Miejsce o nazwie MORNING to miejsce typu: Restauracja śniadaniowa, Restauracja serwująca drugie śniadania, Kawiarnia, Kawiarnia przyjazna dla psów. W ofercie znajduje się: Kawa, Małe porcje, Szybka przekąska, To miejsce oferuje dania wegańskie, W ofercie dania wegetariańskie. Specjalne cechy miejsca: Dobra kawa, Dobre desery, Duży wybór herbat. Atmosfera jest opisywana jako: Kameralne, Modne, Niezobowiązująca atmosfera, Romantyczna atmosfera, Spokojne. Miejsce oferuje udogodnienia dostępności: Miejsca dla osób na wózkach, Wejście dostępne dla osób na wózkach. Dostępne udogodnienia to: Toaleta, Toaleta unisex, Wi-Fi, Bezpłatne Wi-Fi. Typowa grupa odwiedzających: Dla całej rodziny, Grupy, Studenci, Turyści. Jest popularne szczególnie na: Śniadanie, Posiłki w pojedynkę.", "google_rating": 4.8, "google_reviews_total": 1401, "google_price_range": "20–40"}}
{"oms_id": 9947802333, "name": "Do.Orso", "Współrzędne": "51.799941, 19.470914", "key_words": {"types": ["Pizzeria"], "address": "Inflancka 53, 91-852 Łódź, Polska", "phone": "+48 530 556 555", "opening_hours": {"sobota": "12:00–22:00", "niedziela": "12:00–22:00", "poniedziałek": "12:00–22:00", "wtorek": "12:00–22:00", "środa": "12:00–22:00", "czwartek": "12:00–22:00", "piątek": "12:00–22:00"}, "service_options": ["Dostawa", "Na wynos", "Na miejscu"], "specials": [], "popular_for": ["Obiad", "Kolacja", "Posiłki w pojedynkę"], "accessibility": ["Miejsca dla osób na wózkach", "Wejście dostępne dla osób na wózkach"], "offerings": ["Alkohol", "Jedzenie późnym wieczorem", "Kawa", "Małe porcje", "Piwo", "Szybka przekąska"], "amenities": ["Toaleta"], "atmosphere": ["Kameralne", "Niezobowiązująca atmosfera", "Spokojne"], "crowd": ["Grupy", "Turyści"], "children": ["Menu dla dzieci", "Odpowiednie dla dzieci"], "parking": ["Bezpłatny parking", "Bezpłatny parking przy ulicy", "Dużo miejsc parkingowych"], "context": "Miejsce o nazwie Do.Orso to miejsce typu: Pizzeria. W ofercie znajduje się: Alkohol, Jedzenie późnym wieczorem, Kawa, Małe porcje, Piwo, Szybka przekąska. Atmosfera jest opisywana jako: Kameralne, Niezobowiązująca atmosfera, Spokojne. Miejsce oferuje udogodnienia dostępności: Miejsca dla osób na wózkach, Wejście dostępne dla osób na wózkach. Dostępne udogodnienia to: Toaleta. Typowa grupa odwiedzających: Grupy, Turyści. Jest popularne szczególnie na: Obiad, Kolacja, Posiłki w pojedynkę.", "google_rating": 3.7, "google_reviews_total": 287, "google_price_range": "20–40"}}
{"oms_id": 9955660645, "name": "Indian Steak", "Współrzędne": "51.762701, 19.485319", "key_words": {"types": ["Restauracja"], "address": "dr. Stefana Kopcińskiego 62/lok.7, 90-032 Łódź, Polska", "phone": "+48 573 560 056", "opening_hours": {"sobota": "12:00–00:00", "niedziela": "12:00–23:00", "poniedziałek": "12:00–23:00", "wtorek": "12:00–23:00", "środa": "12:00–23:00", "czwartek": "12:00–23:00", "piątek": "12:00–00:00"}, "service_options": ["Ogródek", "Na wynos", "Na miejscu"], "specials": ["Dobra kawa", "Dobre desery", "Dobre drinki", "Duży wybór herbat", "Duży wybór piw"], "popular_for": ["Obiad", "Kolacja", "Posiłki w pojedynkę"], "accessibility": ["Miejsca dla osób na wózkach", "Wejście dostępne dla osób na wózkach"], "offerings": ["Alkohol", "Alkohol wysokoprocentowy", "Jedzenie późnym wieczorem", "Kawa", "Koktajle", "Małe porcje", "Piwo", "Wino"], "amenities": ["Bar na miejscu", "Toaleta"], "atmosphere": ["Kameralne", "Miejsce luksusowe", "Modne", "Niezobowiązująca atmosfera", "Spokojne"], "crowd": ["Grupy", "Turyści"], "children": ["Menu dla dzieci"], "parking": ["Dużo miejsc parkingowych", "Płatny parking"], "context": "Miejsce o nazwie Indian Steak to miejsce typu: Restauracja. W ofercie znajduje się: Alkohol, Alkohol wysokoprocentowy, Jedzenie późnym wieczorem, Kawa, Koktajle, Małe porcje, Piwo, Wino. Specjalne cechy miejsca: Dobra kawa, Dobre desery, Dobre drinki, Duży wybór herbat, Duży wybór piw. Atmosfera jest opisywana jako: Kameralne, Miejsce luksusowe, Modne, Niezobowiązująca atmosfera, Spokojne. Miejsce oferuje udogodnienia dostępności: Miejsca dla osób na wózkach, Wejście dostępne dla osób na wózkach. Dostępne udogodnienia to: Bar na miejscu, Toaleta. Typowa grupa odwiedzających: Grupy, Turyści. Jest popularne szczególnie na: Obiad, Kolacja, Posiłki w pojedynkę.", "google_rating": 4.7, "google_reviews_total": 513, "google_price_range": null}}
{"oms_id": 9983846866, "name": "Caffe przy Targu", "Współrzędne": "51.773028, 19.462497", "key_words": {"types": ["Restauracja śniadaniowa", "Restauracja serwująca drugie śniadania", "Kawiarnia", "Sałatki", "Kanapki"], "address": "Nawrot 1a, 90-060 Łódź, Polska", "phone": "+48 662 330 651", "opening_hours": {"sobota": "08:00–17:00", "niedziela": "09:00–17:00", "poniedziałek": "08:00–17:00", "wtorek": "08:00–17:00", "środa": "08:00–17:00", "czwartek": "08:00–17:00", "piątek": "08:00–17:00"}, "service_options": ["Dostawa", "Na wynos", "Na miejscu"], "specials": ["Dobra kawa", "Dobre desery", "Duży wybór herbat"], "popular_for": ["Śniadanie", "Posiłki w pojedynkę"], "accessibility": [], "offerings": ["Kawa", "Małe porcje", "Szybka przekąska", "To miejsce oferuje dania wegańskie", "W ofercie dania wegetariańskie"], "amenities": ["Toaleta"], "atmosphere": ["Kameralne", "Modne", "Niezobowiązująca atmosfera", "Romantyczna atmosfera", "Spokojne"], "crowd": ["Grupy", "Studenci", "Turyści"], "children": [], "parking": ["Płatny parking", "Płatny parking przy ulicy"], "context": "Miejsce o nazwie Caffe przy Targu to miejsce typu: Restauracja śniadaniowa, Restauracja serwująca drugie śniadania, Kawiarnia, Sałatki, Kanapki. W ofercie znajduje się: Kawa, Małe porcje, Szybka przekąska, To miejsce oferuje dania wegańskie, W ofercie dania wegetariańskie. Specjalne cechy miejsca: Dobra kawa, Dobre desery, Duży wybór herbat. Atmosfera jest opisywana jako: Kameralne, Modne, Niezobowiązująca atmosfera, Romantyczna atmosfera, Spokojne. Dostępne udogodnienia to: Toaleta. Typowa grupa odwiedzających: Grupy, Studenci, Turyści. Jest popularne szczególnie na: Śniadanie, Posiłki w pojedynkę.", "google_rating": 4.6, "google_reviews_total": 1930, "google_price_range": "20–40"}}
{"oms_id": 10016853234, "name": "Zahir", "Współrzędne": "51.732663, 19.493979", "key_words": {"types": ["Kebab", "Doner kebab", "Fast food", "Restauracja halal"], "address": "Stanisława Przybyszewskiego 32/34, 93-189 Łódź, Polska", "phone": "+48 726 010 044", "opening_hours": {"sobota": "10:00–00:00", "niedziela": "10:00–00:00", "poniedziałek": "10:00–00:00", "wtorek": "10:00–00:00", "środa": "10:00–00:00", "czwartek": "10:00–00:00", "piątek": "10:00–00:00"}, "service_options": ["Dostawa bez kontaktu", "Dostawa", "Na wynos", "Na miejscu"], "specials": ["Duży wybór herbat"], "popular_for": ["Obiad", "Kolacja", "Posiłki w pojedynkę"], "accessibility": [], "offerings": ["Bar sałatkowy", "Jedzenie późnym wieczorem", "Kuchnia halal", "Małe porcje", "Szybka przekąska", "To miejsce oferuje dania wegańskie", "W ofercie dania wegetariańskie"], "amenities": ["Toaleta", "Toaleta unisex"], "atmosphere": ["Modne", "Niezobowiązująca atmosfera", "Spokojne"], "crowd": ["Dla całej rodziny", "Grupy", "Studenci", "Turyści"], "children": ["Krzesełka do karmienia", "Menu dla dzieci", "Odpowiednie dla dzieci"], "parking": ["Bezpłatny parking", "Bezpłatny parking przy ulicy", "Dużo miejsc parkingowych"], "context": "Miejsce o nazwie Zahir to miejsce typu: Kebab, Doner kebab, Fast food, Restauracja halal. W ofercie znajduje się: Bar sałatkowy, Jedzenie późnym wieczorem, Kuchnia halal, Małe porcje, Szybka przekąska, To miejsce oferuje dania wegańskie, W ofercie dania wegetariańskie. Specjalne cechy miejsca: Duży wybór herbat. Atmosfera jest opisywana jako: Modne, Niezobowiązująca atmosfera, Spokojne. Dostępne udogodnienia to: Toaleta, Toaleta unisex. Typowa grupa odwiedzających: Dla całej rodziny, Grupy, Studenci, Turyści. Jest popularne szczególnie na: Obiad, Kolacja, Posiłki w pojedynkę.", "google_rating": 4.2, "google_reviews_total": 2312, "google_price_range": "20–40"}}
{"oms_id": 10176575053, "name": "Pizzeria 105", "Współrzędne": "51.794666, 19.371394", "key_words": {"types": ["Pizzeria"], "address": "Rojna 64, 91-134 Łódź, Polska", "phone": "+48 501 373 105", "opening_hours": {"sobota": "11:00–00:00", "niedziela": "11:00–22:00", "poniedziałek": "11:00–22:00", "wtorek": "11:00–22:00", "środa": "11:00–22:00", "czwartek": "11:00–22:00", "piątek": "11:00–00:00"}, "service_options": ["Ogródek", "Dostawa bez kontaktu", "Dostawa", "Na wynos", "Na miejscu"], "specials": ["Dobra kawa", "Dobre desery", "Duży wybór herbat", "Muzyka na żywo"], "popular_for": ["Obiad", "Kolacja", "Posiłki w pojedynkę"], "accessibility": ["Miejsca dla osób na wózkach", "Wejście dostępne dla osób na wózkach"], "offerings": ["Alkohol", "Jedzenie późnym wieczorem", "Kawa", "Małe porcje", "Piwo", "Szybka przekąska", "W ofercie dania wegetariańskie", "Wino"], "amenities": ["Toaleta", "Wi-Fi", "Bezpłatne Wi-Fi"], "atmosphere": ["Kameralne", "Modne", "Niezobowiązująca atmosfera", "Spokojne"], "crowd": ["Dla całej rodziny", "Grupy", "Studenci", "Turyści"], "children": ["Dobre miejsce na przyjęcia urodzinowe dla dzieci", "Krzesełka do karmienia", "Menu dla dzieci", "Odpowiednie dla dzieci"], "parking": ["Bezpłatny parking", "Bezpłatny parking przy ulicy", "Dużo miejsc parkingowych"], "context": "Miejsce o nazwie Pizzeria 105 to miejsce typu: Pizzeria. W ofercie znajduje się: Alkohol, Jedzenie późnym wieczorem, Kawa, Małe porcje, Piwo, Szybka przekąska, W ofercie dania wegetariańskie, Wino. Specjalne cechy miejsca: Dobra kawa, Dobre desery, Duży wybór herbat, Muzyka na żywo. Atmosfera jest opisywana jako: Kameralne, Modne, Niezobowiązująca atmosfera, Spokojne. Miejsce oferuje udogodnienia dostępności: Miejsca dla osób na wózkach, Wejście dostępne dla osób na wózkach. Dostępne udogodnienia to: Toaleta, Wi-Fi, Bezpłatne Wi-Fi. Typowa grupa odwiedzających: Dla całej rodziny, Grupy, Studenci, Turyści. Jest popularne szczególnie na: Obiad, Kolacja, Posiłki w pojedynkę.", "google_rating": 4, "google_reviews_total": 1058, "google_price_range": "20–60"}}
{"oms_id": 10231072790, "name": "Stacja Zero kawiarnia piekarnia", "Współrzędne": "51.755766, 19.480635", "key_words": {"types": ["Kawiarnia", "Piekarnia", "Cukiernia", "Lodziarnia"], "address": "Księży Młyn 16, 90-345 Łódź, Polska", "phone": "+48 881 744 444", "opening_hours": {"sobota": "10:00–19:00", "niedziela": "10:00–19:00", "poniedziałek": "Zamknięte", "wtorek": "10:00–19:00", "środa": "10:00–19:00", "czwartek": "10:00–19:00", "piątek": "10:00–19:00"}, "service_options": ["Ogródek", "Dostawa", "Na wynos", "Na miejscu"], "specials": ["Dobra kawa", "Dobre desery", "Duży wybór herbat"], "popular_for": ["Posiłki w pojedynkę", "Dobre miejsce do pracy na laptopie"], "accessibility": [], "offerings": ["Dania z produktów ekologicznych", "Kawa", "Małe porcje", "Szybka przekąska", "To miejsce oferuje dania wegańskie", "W ofercie dania wegetariańskie"], "amenities": ["Toaleta"], "atmosphere": ["Kameralne", "Modne", "Niezobowiązująca atmosfera", "Romantyczna atmosfera", "Spokojne"], "crowd": ["Dla całej rodziny", "Turyści"], "children": ["Odpowiednie dla dzieci"], "parking": ["Bezpłatny parking", "Bezpłatny parking przy ulicy", "Dużo miejsc parkingowych"], "context": "Miejsce o nazwie Stacja Zero kawiarnia piekarnia to miejsce typu: Kawiarnia, Piekarnia, Cukiernia, Lodziarnia. W ofercie znajduje się: Dania z produktów ekologicznych, Kawa, Małe porcje, Szybka przekąska, To miejsce oferuje dania wegańskie, W ofercie dania wegetariańskie. Specjalne cechy miejsca: Dobra kawa, Dobre desery, Duży wybór herbat. Atmosfera jest opisywana jako: Kameralne, Modne, Niezobowiązująca atmosfera, Romantyczna atmosfera, Spokojne. Dostępne udogodnienia to: Toaleta. Typowa grupa odwiedzających: Dla całej rodziny, Turyści. Jest popularne szczególnie na: Posiłki w pojedynkę, Dobre miejsce do pracy na laptopie.", "google_rating": 4.6, "google_reviews_total": 297, "google_price_range": "20–40"}}
{"oms_id": 10263255700, "name": "Muzyczna", "Współrzędne": "51.780206, 19.472770", "key_words": {"types": ["Konserwatorium muzyczne", "Instytucja edukacyjna"], "address": "Gdańska 32, 90-716 Łódź, Polska", "phone": "+48 42 662 16 02", "opening_hours": {"sobota": "09:00–20:00", "niedziela": "Zamknięte", "poniedziałek": "09:00–20:00", "wtorek": "09:00–20:00", "środa": "09:00–20:00", "czwartek": "09:00–20:00", "piątek": "09:00–20:00"}, "service_options": [], "specials": [], "popular_for": [], "accessibility": ["Parking dostępny dla osób na wózkach", "Wejście dostępne dla osób na wózkach"], "offerings": [], "amenities": [], "atmosphere": [], "crowd": [], "children": [], "parking": [], "context": "Miejsce o nazwie Muzyczna to miejsce typu: Konserwatorium muzyczne, Instytucja edukacyjna. Miejsce oferuje udogodnienia dostępności: Parking dostępny dla osób na wózkach, Wejście dostępne dla osób na wózkach.", "google_rating": 4.6, "google_reviews_total": 180, "google_price_range": null}}
{"oms_id": 10265622355, "name": "Boogie cafe", "Współrzędne": "51.748343, 19.407281", "key_words": {"types": ["Restauracja", "Bistro", "Kawiarnia"], "address": "aleja Kardynała Stefana Wyszyńskiego 13, 94-048 Łódź, Polska", "phone": "+48 668 002 555", "opening_hours": {"sobota": "09:00–21:00", "niedziela": "09:00–20:00", "poniedziałek": "09:00–20:00", "wtorek": "09:00–20:00", "środa": "09:00–20:00", "czwartek": "09:00–20:00", "piątek": "09:00–21:00"}, "service_options": ["Ogródek", "Dostawa bez kontaktu", "Dostawa", "Na wynos", "Na miejscu"], "specials": ["Dobra kawa", "Dobre desery", "Duży wybór herbat", "Muzyka na żywo"], "popular_for": ["Śniadanie", "Obiad", "Kolacja", "Posiłki w pojedynkę"], "accessibility": ["Miejsca dla osób na wózkach", "Parking dostępny dla osób na wózkach", "Toaleta dla osób na wózkach", "Wejście dostępne dla osób na wózkach"], "offerings": ["Alkohol", "Dania z produktów ekologicznych", "Jedzenie późnym wieczorem", "Kawa", "Koktajle", "Małe porcje", "Piwo", "Szybka przekąska", "To miejsce oferuje dania wegańskie", "Wino"], "amenities": ["Bar na miejscu", "Toaleta"], "atmosphere": ["Kameralne", "Modne", "Niezobowiązująca atmosfera", "Romantyczna atmosfera", "Spokojne"], "crowd": ["Dla całej rodziny", "Grupy", "Przyjazne dla osób LGBTQ+", "Studenci", "Turyści"], "children": ["Menu dla dzieci", "Odpowiednie dla dzieci"], "parking": ["Bezpłatny parking", "Bezpłatny parking przy ulicy", "Dużo miejsc parkingowych"], "context": "Miejsce o nazwie Boogie cafe to miejsce typu: Restauracja, Bistro, Kawiarnia. W ofercie znajduje się: Alkohol, Dania z produktów ekologicznych, Jedzenie późnym wieczorem, Kawa, Koktajle, Małe porcje, Piwo, Szybka przekąska. Specjalne cechy miejsca: Dobra kawa, Dobre desery, Duży wybór herbat, Muzyka na żywo. Atmosfera jest opisywana jako: Kameralne, Modne, Niezobowiązująca atmosfera, Romantyczna atmosfera, Spokojne. Miejsce oferuje udogodnienia dostępności: Miejsca dla osób na wózkach, Parking dostępny dla osób na wózkach, Toaleta dla osób na wózkach, Wejście dostępne dla osób na wózkach. Dostępne udogodnienia to: Bar na miejscu, Toaleta. Typowa grupa odwiedzających: Dla całej rodziny, Grupy, Przyjazne dla osób LGBTQ+, Studenci, Turyści. Jest popularne szczególnie na: Śniadanie, Obiad,...", "google_rating": 4.6, "google_reviews_total": 1270, "google_price_range": "20–40"}}
{"oms_id": 10271571627, "name": "Jacek Placek", "Współrzędne": "51.778788, 19.486866", "key_words": {"types": ["Restauracja", "Bistro", "Bar"], "address": "Pomorska 118, 91-403 Łódź, Polska", "phone": "+48 570 115 555", "opening_hours": {"sobota": "10:00–18:00", "niedziela": "10:00–18:00", "poniedziałek": "10:00–18:00", "wtorek": "10:00–18:00", "środa": "10:00–18:00", "czwartek": "10:00–18:00", "piątek": "10:00–18:00"}, "service_options": ["Dostawa", "Na wynos", "Na miejscu"], "specials": ["Dobra kawa", "Dobre desery", "Duży wybór herbat"], "popular_for": ["Obiad", "Kolacja", "Posiłki w pojedynkę"], "accessibility": ["Miejsca dla osób na wózkach", "Wejście dostępne dla osób na wózkach"], "offerings": ["Alkohol", "Dania z produktów ekologicznych", "Kawa", "Piwo", "Szybka przekąska", "To miejsce oferuje dania wegańskie", "W ofercie dania wegetariańskie"], "amenities": ["Toaleta", "Toaleta unisex", "Wi-Fi", "Bezpłatne Wi-Fi"], "atmosphere": ["Kameralne", "Modne", "Niezobowiązująca atmosfera", "Spokojne"], "crowd": ["Dla całej rodziny", "Grupy", "Miejsce przyjazne dla osób transpłciowych", "Przyjazne dla osób LGBTQ+", "Studenci", "Turyści"], "children": ["Krzesełka do karmienia", "Odpowiednie dla dzieci"], "parking": ["Bezpłatny parking", "Bezpłatny parking przy ulicy", "Dużo miejsc parkingowych"], "context": "Miejsce o nazwie Jacek Placek to miejsce typu: Restauracja, Bistro, Bar. W ofercie znajduje się: Alkohol, Dania z produktów ekologicznych, Kawa, Piwo, Szybka przekąska, To miejsce oferuje dania wegańskie, W ofercie dania wegetariańskie. Specjalne cechy miejsca: Dobra kawa, Dobre desery, Duży wybór herbat. Atmosfera jest opisywana jako: Kameralne, Modne, Niezobowiązująca atmosfera, Spokojne. Miejsce oferuje udogodnienia dostępności: Miejsca dla osób na wózkach, Wejście dostępne dla osób na wózkach. Dostępne udogodnienia to: Toaleta, Toaleta unisex, Wi-Fi, Bezpłatne Wi-Fi. Typowa grupa odwiedzających: Dla całej rodziny, Grupy, Miejsce przyjazne dla osób transpłciowych, Przyjazne dla osób LGBTQ+, Studenci, Turyści. Jest popularne szczególnie na: Obiad, Kolacja, Posiłki w pojedynkę.", "google_rating": 4.8, "google_reviews_total": 634, "google_price_range": "20–40"}}
{"oms_id": 10286535501, "name": "Da Grasso", "Współrzędne": "51.816966, 19.420335", "key_words": {"types": ["Pizzeria", "Pizza na telefon", "Pizza na wynos", "Restauracja"], "address": "Łagiewnicka 65A, 91-855 Łódź, Polska", "phone": "+48 42 655 22 11", "opening_hours": {"sobota": "10:30–00:00", "niedziela": "11:30–23:00", "poniedziałek": "10:30–23:00", "wtorek": "10:30–23:00", "środa": "10:30–23:00", "czwartek": "10:30–23:00", "piątek": "10:30–00:00"}, "service_options": ["Ogródek", "Dostawa bez kontaktu", "Dostawa", "Na wynos", "Na miejscu"], "specials": ["Dobra kawa", "Dobre desery", "Dobre drinki", "Duży wybór herbat"], "popular_for": ["Obiad", "Kolacja", "Posiłki w pojedynkę"], "accessibility": ["Miejsca dla osób na wózkach", "Toaleta dla osób na wózkach", "Wejście dostępne dla osób na wózkach"], "offerings": ["Alkohol", "Alkohol wysokoprocentowy", "Jedzenie późnym wieczorem", "Kawa", "Koktajle", "Małe porcje", "Piwo", "Szybka przekąska", "To miejsce oferuje dania wegańskie", "W ofercie dania wegetariańskie", "Wino"], "amenities": ["Bar na miejscu", "Toaleta", "Wi-Fi", "Bezpłatne Wi-Fi"], "atmosphere": ["Kameralne", "Modne", "Niezobowiązująca atmosfera", "Spokojne"], "crowd": ["Dla całej rodziny", "Grupy", "Studenci", "Turyści"], "children": ["Dobre miejsce na przyjęcia urodzinowe dla dzieci", "Krzesełka do karmienia", "Menu dla dzieci", "Odpowiednie dla dzieci"], "parking": ["Bezpłatny parking", "Bezpłatny parking przy ulicy", "Dużo miejsc parkingowych"], "context": "Miejsce o nazwie Da Grasso to miejsce typu: Pizzeria, Pizza na telefon, Pizza na wynos, Restauracja. W ofercie znajduje się: Alkohol, Alkohol wysokoprocentowy, Jedzenie późnym wieczorem, Kawa, Koktajle, Małe porcje, Piwo, Szybka przekąska. Specjalne cechy miejsca: Dobra kawa, Dobre desery, Dobre drinki, Duży wybór herbat. Atmosfera jest opisywana jako: Kameralne, Modne, Niezobowiązująca atmosfera, Spokojne. Miejsce oferuje udogodnienia dostępności: Miejsca dla osób na wózkach, Toaleta dla osób na wózkach, Wejście dostępne dla osób na wózkach. Dostępne udogodnienia to: Bar na miejscu, Toaleta, Wi-Fi, Bezpłatne Wi-Fi. Typowa grupa odwiedzających: Dla całej rodziny, Grupy, Studenci, Turyści. Jest popularne szczególnie na: Obiad, Kolacja, Posiłki w pojedynkę.", "google_rating": 4.3, "google_reviews_total": 2945, "google_price_range": "20–60"}}
{"oms_id": 10702778885, "name": "Chude ciacho", "Współrzędne": "51.770864, 19.461859", "key_words": {"types": ["Kawiarnia"], "address": "Jana Karskiego 5, 91-062 Łódź, Polska", "phone": "+48 515 667 686", "opening_hours": {"sobota": "10:00–21:00", "niedziela": "10:00–21:00", "poniedziałek": "10:00–21:00", "wtorek": "10:00–21:00", "środa": "10:00–21:00", "czwartek": "10:00–21:00", "piątek": "10:00–21:00"}, "service_options": ["Ogródek", "Na wynos", "Na miejscu"], "specials": ["Dobra kawa", "Dobre desery", "Duży wybór herbat"], "popular_for": ["Posiłki w pojedynkę", "Dobre miejsce do pracy na laptopie"], "accessibility": ["Miejsca dla osób na wózkach", "Wejście dostępne dla osób na wózkach"], "offerings": ["Alkohol", "Kawa", "Koktajle", "Małe porcje", "Szybka przekąska", "W ofercie dania wegetariańskie"], "amenities": ["Toaleta", "Wi-Fi", "Bezpłatne Wi-Fi"], "atmosphere": ["Kameralne", "Modne", "Niezobowiązująca atmosfera", "Spokojne"], "crowd": ["Dla całej rodziny", "Turyści"], "children": ["Odpowiednie dla dzieci"], "parking": ["Bezpłatny parking", "Dużo miejsc parkingowych"], "context": "Miejsce o nazwie Chude ciacho to miejsce typu: Kawiarnia. W ofercie znajduje się: Alkohol, Kawa, Koktajle, Małe porcje, Szybka przekąska, W ofercie dania wegetariańskie. Specjalne cechy miejsca: Dobra kawa, Dobre desery, Duży wybór herbat. Atmosfera jest opisywana jako: Kameralne, Modne, Niezobowiązująca atmosfera, Spokojne. Miejsce oferuje udogodnienia dostępności: Miejsca dla osób na wózkach, Wejście dostępne dla osób na wózkach. Dostępne udogodnienia to: Toaleta, Wi-Fi, Bezpłatne Wi-Fi. Typowa grupa odwiedzających: Dla całej rodziny, Turyści. Jest popularne szczególnie na: Posiłki w pojedynkę, Dobre miejsce do pracy na laptopie.", "google_rating": 4.1, "google_reviews_total": 292, "google_price_range": "20–40"}}
{"oms_id": 10704165300, "name": "Piękna", "Współrzędne": "51.767563, 19.466433", "key_words": {"types": [], "address": "90-001 Łódź, Polska", "phone": "", "opening_hours": {}, "service_options": [], "specials": [], "popular_for": [], "accessibility": [], "offerings": [], "amenities": [], "atmosphere": [], "crowd": [], "children": [], "parking": [], "context": "Miejsce o nazwie Piękna.", "google_rating": null, "google_reviews_total": null, "google_price_range": null}}
{"oms_id": 10811831964, "name": "MORNING coffee & more", "Współrzędne": "51.735044, 19.505262", "key_words": {"types": ["Restauracja śniadaniowa", "Cukiernia", "Kawiarnia"], "address": "Gojawiczyńskiej 1/3, 90-249 Łódź, Polska", "phone": "+48 796 996 323", "opening_hours": {"sobota": "09:00–19:00", "niedziela": "09:00–16:00", "poniedziałek": "08:00–19:00", "wtorek": "08:00–19:00", "środa": "08:00–19:00", "czwartek": "08:00–19:00", "piątek": "08:00–19:00"}, "service_options": ["Ogródek", "Na wynos", "Na miejscu"], "specials": ["Dobra kawa", "Dobre desery", "Duży wybór herbat"], "popular_for": ["Śniadanie", "Posiłki w pojedynkę"], "accessibility": ["Miejsca dla osób na wózkach", "Parking dostępny dla osób na wózkach", "Wejście dostępne dla osób na wózkach"], "offerings": ["Kawa", "Małe porcje", "Szybka przekąska", "To miejsce oferuje dania wegańskie", "W ofercie dania wegetariańskie"], "amenities": ["Toaleta", "Wi-Fi", "Bezpłatne Wi-Fi"], "atmosphere": ["Kameralne", "Modne", "Niezobowiązująca atmosfera", "Romantyczna atmosfera", "Spokojne"], "crowd": ["Grupy", "Studenci", "Turyści"], "children": ["Menu dla dzieci", "Odpowiednie dla dzieci"], "parking": ["Bezpłatny parking", "Bezpłatny parking przy ulicy", "Dużo miejsc parkingowych"], "context": "Miejsce o nazwie MORNING coffee & more to miejsce typu: Restauracja śniadaniowa, Cukiernia, Kawiarnia. W ofercie znajduje się: Kawa, Małe porcje, Szybka przekąska, To miejsce oferuje dania wegańskie, W ofercie dania wegetariańskie. Specjalne cechy miejsca: Dobra kawa, Dobre desery, Duży wybór herbat. Atmosfera jest opisywana jako: Kameralne, Modne, Niezobowiązująca atmosfera, Romantyczna atmosfera, Spokojne. Miejsce oferuje udogodnienia dostępności: Miejsca dla osób na wózkach, Parking dostępny dla osób na wózkach, Wejście dostępne dla osób na wózkach. Dostępne udogodnienia to: Toaleta, Wi-Fi, Bezpłatne Wi-Fi. Typowa grupa odwiedzających: Grupy, Studenci, Turyści. Jest popularne szczególnie na: Śniadanie, Posiłki w pojedynkę.", "google_rating": 4.8, "google_reviews_total": 522, "google_price_range": "20–40"}}
{"oms_id": 10883127567, "name": "Third Eye", "Współrzędne": "51.739100, 19.570468", "key_words": {"types": ["Restauracja"], "address": "Księcia Władysława Opolczyka 17, 92-417 Łódź, Polska", "phone": "+48 734 191 105", "opening_hours": {"sobota": "12:00–22:00", "niedziela": "12:00–21:00", "poniedziałek": "11:30–21:30", "wtorek": "11:30–21:30", "środa": "11:30–21:30", "czwartek": "11:30–21:30", "piątek": "12:00–22:00"}, "service_options": ["Ogródek", "Dostawa", "Na wynos", "Na miejscu"], "specials": ["Dobre desery", "Duży wybór herbat"], "popular_for": ["Obiad", "Kolacja", "Posiłki w pojedynkę"], "accessibility": ["Miejsca dla osób na wózkach", "Parking dostępny dla osób na wózkach", "Wejście dostępne dla osób na wózkach"], "offerings": ["Alkohol", "Alkohol wysokoprocentowy", "Jedzenie późnym wieczorem", "Kawa", "Koktajle", "Małe porcje", "Piwo", "Szybka przekąska", "To miejsce oferuje dania wegańskie", "W ofercie dania wegetariańskie", "Wino"], "amenities": ["Toaleta"], "atmosphere": ["Kameralne", "Niezobowiązująca atmosfera", "Spokojne"], "crowd": ["Grupy", "Turyści"], "children": ["Krzesełka do karmienia"], "parking": ["Bezpłatny parking", "Bezpłatny parking przy ulicy", "Dużo miejsc parkingowych"], "context": "Miejsce o nazwie Third Eye to miejsce typu: Restauracja. W ofercie znajduje się: Alkohol, Alkohol wysokoprocentowy, Jedzenie późnym wieczorem, Kawa, Koktajle, Małe porcje, Piwo, Szybka przekąska. Specjalne cechy miejsca: Dobre desery, Duży wybór herbat. Atmosfera jest opisywana jako: Kameralne, Niezobowiązująca atmosfera, Spokojne. Miejsce oferuje udogodnienia dostępności: Miejsca dla osób na wózkach, Parking dostępny dla osób na wózkach, Wejście dostępne dla osób na wózkach. Dostępne udogodnienia to: Toaleta. Typowa grupa odwiedzających: Grupy, Turyści. Jest popularne szczególnie na: Obiad, Kolacja, Posiłki w pojedynkę.", "google_rating": 4.5, "google_reviews_total": 459, "google_price_range": "40–60"}}
{"oms_id": 10946814847, "name": "Speedy Romano", "Współrzędne": "51.734869, 19.480041", "key_words": {"types": ["Pizzeria"], "address": "Jana Kochanowskiego 10, 39-400 Tarnobrzeg, Polska", "phone": "+48 729 059 389", "opening_hours": {"sobota": "13:00–22:00", "niedziela": "14:00–21:30", "poniedziałek": "Zamknięte", "wtorek": "12:00–21:00", "środa": "12:00–21:00", "czwartek": "12:00–21:00", "piątek": "12:00–22:00"}, "service_options": ["Dostawa bez kontaktu", "Dostawa", "Obsługa zmotoryzowanych", "Na wynos", "Na miejscu"], "specials": [], "popular_for": ["Obiad", "Kolacja", "Posiłki w pojedynkę"], "accessibility": ["Miejsca dla osób na wózkach", "Parking dostępny dla osób na wózkach"], "offerings": ["Bar sałatkowy", "Dania z produktów ekologicznych", "Jedzenie późnym wieczorem", "Jedzenie w promocji happy hours", "Szybka przekąska"], "amenities": [], "atmosphere": ["Niezobowiązująca atmosfera", "Spokojne"], "crowd": ["Dla całej rodziny", "Turyści"], "children": ["Menu dla dzieci", "Odpowiednie dla dzieci"], "parking": [], "context": "Miejsce o nazwie Speedy Romano to miejsce typu: Pizzeria. W ofercie znajduje się: Bar sałatkowy, Dania z produktów ekologicznych, Jedzenie późnym wieczorem, Jedzenie w promocji happy hours, Szybka przekąska. Atmosfera jest opisywana jako: Niezobowiązująca atmosfera, Spokojne. Miejsce oferuje udogodnienia dostępności: Miejsca dla osób na wózkach, Parking dostępny dla osób na wózkach. Typowa grupa odwiedzających: Dla całej rodziny, Turyści. Jest popularne szczególnie na: Obiad, Kolacja, Posiłki w pojedynkę.", "google_rating": 4.6, "google_reviews_total": 376, "google_price_range": "20–40"}}
{"oms_id": 10946825874, "name": "GastroMachina", "Współrzędne": "51.737351, 19.487750", "key_words": {"types": ["Restauracja"], "address": "Beli Bartoka 70, 92-547 Łódź, Polska", "phone": "+48 530 392 385", "opening_hours": {"sobota": "12:00–22:00", "niedziela": "12:00–21:00", "poniedziałek": "12:00–21:00", "wtorek": "12:00–21:00", "środa": "12:00–21:00", "czwartek": "12:00–21:00", "piątek": "12:00–22:00"}, "service_options": ["Ogródek", "Dostawa bez kontaktu", "Dostawa", "Usługi na miejscu", "Na wynos", "Na miejscu"], "specials": [], "popular_for": [], "accessibility": [], "offerings": [], "amenities": ["Toaleta"], "atmosphere": [], "crowd": [], "children": [], "parking": ["Bezpłatny parking", "Bezpłatny parking przy ulicy", "Dużo miejsc parkingowych"], "context": "Miejsce o nazwie GastroMachina to miejsce typu: Restauracja. Dostępne udogodnienia to: Toaleta.", "google_rating": 4.7, "google_reviews_total": 169, "google_price_range": "40–60"}}
{"oms_id": 10960374060, "name": "Sushi w dłoń", "Współrzędne": "51.736761, 19.478019", "key_words": {"types": ["Restauracja", "Ramen", "Sushi", "Sushi na wynos"], "address": "Ul. Gen. Jarosława Dąbrowskiego 17a, 93-177 Łódź, Polska", "phone": "+48 788 878 780", "opening_hours": {"sobota": "12:00–22:00", "niedziela": "12:00–20:00", "poniedziałek": "12:00–21:00", "wtorek": "12:00–21:00", "środa": "12:00–21:00", "czwartek": "12:00–21:00", "piątek": "12:00–22:00"}, "service_options": ["Ogródek", "Dostawa", "Na wynos", "Na miejscu"], "specials": ["Dobra kawa", "Dobre desery", "Dobre drinki", "Duży wybór herbat"], "popular_for": ["Obiad", "Kolacja", "Posiłki w pojedynkę"], "accessibility": ["Miejsca dla osób na wózkach", "Parking dostępny dla osób na wózkach", "Toaleta dla osób na wózkach", "Wejście dostępne dla osób na wózkach"], "offerings": ["Alkohol", "Alkohol wysokoprocentowy", "Jedzenie późnym wieczorem", "Kawa", "Koktajle", "Małe porcje", "Piwo", "Szybka przekąska", "To miejsce oferuje dania wegańskie", "W ofercie dania wegetariańskie", "Wino"], "amenities": ["Bar na miejscu", "Toaleta"], "atmosphere": ["Kameralne", "Modne", "Niezobowiązująca atmosfera", "Romantyczna atmosfera", "Spokojne"], "crowd": ["Grupy", "Studenci", "Turyści"], "children": ["Krzesełka do karmienia", "Menu dla dzieci", "Odpowiednie dla dzieci"], "parking": ["Bezpłatny parking", "Bezpłatny parking przy ulicy", "Dużo miejsc parkingowych"], "context": "Miejsce o nazwie Sushi w dłoń to miejsce typu: Restauracja, Ramen, Sushi, Sushi na wynos. W ofercie znajduje się: Alkohol, Alkohol wysokoprocentowy, Jedzenie późnym wieczorem, Kawa, Koktajle, Małe porcje, Piwo, Szybka przekąska. Specjalne cechy miejsca: Dobra kawa, Dobre desery, Dobre drinki, Duży wybór herbat. Atmosfera jest opisywana jako: Kameralne, Modne, Niezobowiązująca atmosfera, Romantyczna atmosfera, Spokojne. Miejsce oferuje udogodnienia dostępności: Miejsca dla osób na wózkach, Parking dostępny dla osób na wózkach, Toaleta dla osób na wózkach, Wejście dostępne dla osób na wózkach. Dostępne udogodnienia to: Bar na miejscu, Toaleta. Typowa grupa odwiedzających: Grupy, Studenci, Turyści. Jest popularne szczególnie na: Obiad, Kolacja, Posiłki w pojedynkę.", "google_rating": 4.6, "google_reviews_total": 922, "google_price_range": "40–60"}}
{"oms_id": 10995005073, "name": "A-Dong", "Współrzędne": "51.765209, 19.495441", "key_words": {"types": ["Restauracja orientalna"], "address": "aleje Politechniki 5, 93-590 Łódź", "phone": "572 699 993", "opening_hours": {"sobota": "10:00–22:00", "niedziela": "11:00–21:00", "poniedziałek": "10:00–22:00", "wtorek": "10:00–22:00", "środa": "10:00–22:00", "czwartek": "10:00–22:00", "piątek": "10:00–22:00"}, "service_options": ["Dostawa", "Na wynos", "Na miejscu"], "specials": [], "popular_for": ["Obiad", "Kolacja", "Posiłki w pojedynkę"], "accessibility": [], "offerings": ["Jedzenie późnym wieczorem", "Małe porcje", "Szybka przekąska"], "amenities": [], "atmosphere": ["Niezobowiązująca atmosfera", "Spokojne"], "crowd": ["Grupy", "Studenci", "Turyści"], "children": [], "parking": ["Płatny parking"], "context": "Miejsce o nazwie A-Dong to miejsce typu: Restauracja orientalna. W ofercie znajduje się: Jedzenie późnym wieczorem, Małe porcje, Szybka przekąska. Atmosfera jest opisywana jako: Niezobowiązująca atmosfera, Spokojne. Typowa grupa odwiedzających: Grupy, Studenci, Turyści. Jest popularne szczególnie na: Obiad, Kolacja, Posiłki w pojedynkę.", "google_rating": 3.9, "google_reviews_total": 593, "google_price_range": "20–40"}}
{"oms_id": 10997116669, "name": "Bar Nam-Long", "Współrzędne": "51.761871, 19.491515", "key_words": {"types": ["Kuchnia azjatycka"], "address": "al. marsz. Józefa Piłsudskiego 111, 92-332 Łódź, Polska", "phone": "+48 537 402 417", "opening_hours": {"sobota": "10:00–22:00", "niedziela": "11:00–21:00", "poniedziałek": "10:00–22:00", "wtorek": "10:00–22:00", "środa": "10:00–22:00", "czwartek": "10:00–22:00", "piątek": "10:00–22:00"}, "service_options": ["Dostawa", "Na wynos", "Na miejscu"], "specials": [], "popular_for": ["Obiad", "Kolacja", "Posiłki w pojedynkę"], "accessibility": [], "offerings": ["Szybka przekąska"], "amenities": ["Toaleta"], "atmosphere": ["Niezobowiązująca atmosfera", "Spokojne"], "crowd": ["Turyści"], "children": [], "parking": ["Bezpłatny parking przy ulicy", "Raczej trudno znaleźć miejsce"], "context": "Miejsce o nazwie Bar Nam-Long to miejsce typu: Kuchnia azjatycka. W ofercie znajduje się: Szybka przekąska. Atmosfera jest opisywana jako: Niezobowiązująca atmosfera, Spokojne. Dostępne udogodnienia to: Toaleta. Typowa grupa odwiedzających: Turyści. Jest popularne szczególnie na: Obiad, Kolacja, Posiłki w pojedynkę.", "google_rating": 4.4, "google_reviews_total": 395, "google_price_range": "20–40"}}
{"oms_id": 11029672496, "name": "Pizzeria 105", "Współrzędne": "51.759022, 19.530828", "key_words": {"types": ["Pizzeria"], "address": "Aleksandra Tansmana 1, 90-001 Łódź, Polska", "phone": "+48 535 353 105", "opening_hours": {"sobota": "11:00–23:20", "niedziela": "11:00–21:20", "poniedziałek": "11:00–22:20", "wtorek": "11:00–22:20", "środa": "11:00–22:20", "czwartek": "11:00–22:20", "piątek": "11:00–23:20"}, "service_options": ["Dostawa", "Na wynos", "Na miejscu"], "specials": [], "popular_for": ["Obiad", "Kolacja", "Posiłki w pojedynkę"], "accessibility": ["Miejsca dla osób na wózkach", "Parking dostępny dla osób na wózkach", "Wejście dostępne dla osób na wózkach"], "offerings": ["Alkohol", "Jedzenie późnym wieczorem", "Kawa", "Małe porcje", "Piwo", "Szybka przekąska", "W ofercie dania wegetariańskie"], "amenities": ["Toaleta", "Wi-Fi", "Bezpłatne Wi-Fi"], "atmosphere": ["Kameralne", "Modne", "Niezobowiązująca atmosfera", "Spokojne"], "crowd": ["Dla całej rodziny", "Grupy", "Studenci", "Turyści"], "children": ["Dobre miejsce na przyjęcia urodzinowe dla dzieci", "Krzesełka do karmienia", "Menu dla dzieci", "Odpowiednie dla dzieci"], "parking": ["Bezpłatny parking", "Bezpłatny parking przy ulicy", "Dużo miejsc parkingowych"], "context": "Miejsce o nazwie Pizzeria 105 to miejsce typu: Pizzeria. W ofercie znajduje się: Alkohol, Jedzenie późnym wieczorem, Kawa, Małe porcje, Piwo, Szybka przekąska, W ofercie dania wegetariańskie. Atmosfera jest opisywana jako: Kameralne, Modne, Niezobowiązująca atmosfera, Spokojne. Miejsce oferuje udogodnienia dostępności: Miejsca dla osób na wózkach, Parking dostępny dla osób na wózkach, Wejście dostępne dla osób na wózkach. Dostępne udogodnienia to: Toaleta, Wi-Fi, Bezpłatne Wi-Fi. Typowa grupa odwiedzających: Dla całej rodziny, Grupy, Studenci, Turyści. Jest popularne szczególnie na: Obiad, Kolacja, Posiłki w pojedynkę.", "google_rating": 4, "google_reviews_total": 715, "google_price_range": "20–40"}}
{"oms_id": 11029760943, "name": "Pizzeria 105", "Współrzędne": "51.717960, 19.482862", "key_words": {"types": ["Pizzeria"], "address": "Strażacka 5, 93-318 Łódź, Polska", "phone": "+48 572 494 105", "opening_hours": {"sobota": "11:00–23:30", "niedziela": "11:00–22:00", "poniedziałek": "11:00–22:00", "wtorek": "11:00–22:00", "środa": "11:00–22:00", "czwartek": "11:00–22:00", "piątek": "11:00–23:30"}, "service_options": ["Ogródek", "Dostawa bez kontaktu", "Dostawa", "Na wynos", "Na miejscu"], "specials": ["Dobra kawa", "Duży wybór herbat"], "popular_for": ["Obiad", "Kolacja", "Posiłki w pojedynkę"], "accessibility": ["Miejsca dla osób na wózkach", "Parking dostępny dla osób na wózkach", "Toaleta dla osób na wózkach"], "offerings": ["Alkohol", "Jedzenie późnym wieczorem", "Kawa", "Małe porcje", "Piwo", "Szybka przekąska", "To miejsce oferuje dania wegańskie", "W ofercie dania wegetariańskie"], "amenities": ["Toaleta", "Toaleta unisex", "Wi-Fi", "Bezpłatne Wi-Fi"], "atmosphere": ["Kameralne", "Modne", "Niezobowiązująca atmosfera", "Spokojne"], "crowd": ["Dla całej rodziny", "Grupy", "Studenci", "Turyści"], "children": ["Krzesełka do karmienia", "Menu dla dzieci", "Odpowiednie dla dzieci"], "parking": ["Bezpłatny parking", "Bezpłatny parking przy ulicy", "Dużo miejsc parkingowych"], "context": "Miejsce o nazwie Pizzeria 105 to miejsce typu: Pizzeria. W ofercie znajduje się: Alkohol, Jedzenie późnym wieczorem, Kawa, Małe porcje, Piwo, Szybka przekąska, To miejsce oferuje dania wegańskie, W ofercie dania wegetariańskie. Specjalne cechy miejsca: Dobra kawa, Duży wybór herbat. Atmosfera jest opisywana jako: Kameralne, Modne, Niezobowiązująca atmosfera, Spokojne. Miejsce oferuje udogodnienia dostępności: Miejsca dla osób na wózkach, Parking dostępny dla osób na wózkach, Toaleta dla osób na wózkach. Dostępne udogodnienia to: Toaleta, Toaleta unisex, Wi-Fi, Bezpłatne Wi-Fi. Typowa grupa odwiedzających: Dla całej rodziny, Grupy, Studenci, Turyści. Jest popularne szczególnie na: Obiad, Kolacja, Posiłki w pojedynkę.", "google_rating": 4.1, "google_reviews_total": 1082, "google_price_range": "20–40"}}
{"oms_id": 11047249768, "name": "Pora Karmienia", "Współrzędne": "51.762860, 19.413028", "key_words": {"types": ["Restauracja dla rodzin"], "address": "QC77+3C, Mini ZOO, Konstantynowska 8/10, 94-303 Łódź, Polska", "phone": "+48 42 207 02 20", "opening_hours": {"sobota": "09:00–20:00", "niedziela": "11:00–18:00", "poniedziałek": "09:00–18:00", "wtorek": "09:00–18:00", "środa": "09:00–18:00", "czwartek": "09:00–18:00", "piątek": "09:00–18:00"}, "service_options": ["Ogródek", "Dostawa", "Na wynos", "Na miejscu"], "specials": ["Dobre desery", "Duży wybór herbat"], "popular_for": ["Obiad", "Kolacja", "Posiłki w pojedynkę"], "accessibility": ["Miejsca dla osób na wózkach", "Toaleta dla osób na wózkach", "Wejście dostępne dla osób na wózkach"], "offerings": ["Alkohol", "Kawa", "Małe porcje", "Piwo", "Szybka przekąska", "Wino"], "amenities": ["Toaleta"], "atmosphere": ["Niezobowiązująca atmosfera", "Spokojne"], "crowd": ["Grupy", "Turyści"], "children": ["Menu dla dzieci", "Odpowiednie dla dzieci"], "parking": ["Dużo miejsc parkingowych", "Płatny parking"], "context": "Miejsce o nazwie Pora Karmienia to miejsce typu: Restauracja dla rodzin. W ofercie znajduje się: Alkohol, Kawa, Małe porcje, Piwo, Szybka przekąska, Wino. Specjalne cechy miejsca: Dobre desery, Duży wybór herbat. Atmosfera jest opisywana jako: Niezobowiązująca atmosfera, Spokojne. Miejsce oferuje udogodnienia dostępności: Miejsca dla osób na wózkach, Toaleta dla osób na wózkach, Wejście dostępne dla osób na wózkach. Dostępne udogodnienia to: Toaleta. Typowa grupa odwiedzających: Grupy, Turyści. Jest popularne szczególnie na: Obiad, Kolacja, Posiłki w pojedynkę.", "google_rating": 3.5, "google_reviews_total": 731, "google_price_range": "40–60"}}
{"oms_id": 11047249778, "name": "Pizza Lovers", "Współrzędne": "51.762753, 19.413306", "key_words": {"types": ["Pizzeria"], "address": "QC77+3C, Mini Zoo, Konstantynowska 8/10, 94-303 Łódź, Polska", "phone": "", "opening_hours": {"sobota": "10:00–19:00", "niedziela": "10:00–19:00", "poniedziałek": "10:00–19:00", "wtorek": "10:00–19:00", "środa": "10:00–19:00", "czwartek": "10:00–19:00", "piątek": "10:00–19:00"}, "service_options": ["Dostawa", "Na wynos", "Na miejscu"], "specials": [], "popular_for": ["Obiad", "Kolacja", "Posiłki w pojedynkę"], "accessibility": ["Wejście dostępne dla osób na wózkach"], "offerings": ["Jedzenie późnym wieczorem", "Kawa", "Małe porcje", "Szybka przekąska"], "amenities": [], "atmosphere": ["Niezobowiązująca atmosfera", "Spokojne"], "crowd": [], "children": [], "parking": [], "context": "Miejsce o nazwie Pizza Lovers to miejsce typu: Pizzeria. W ofercie znajduje się: Jedzenie późnym wieczorem, Kawa, Małe porcje, Szybka przekąska. Atmosfera jest opisywana jako: Niezobowiązująca atmosfera, Spokojne. Miejsce oferuje udogodnienia dostępności: Wejście dostępne dla osób na wózkach. Jest popularne szczególnie na: Obiad, Kolacja, Posiłki w pojedynkę.", "google_rating": 4, "google_reviews_total": 117, "google_price_range": "20–40"}}
{"oms_id": 11047249779, "name": "House of Sushi", "Współrzędne": "51.762673, 19.413380", "key_words": {"types": ["Sushi", "Kuchnia azjatycka", "Kuchnia japońska", "Ramen"], "address": "Piotrkowska 91, 90-423 Łódź, Polska", "phone": "+48 570 777 665", "opening_hours": {"sobota": "12:00–23:00", "niedziela": "12:00–21:00", "poniedziałek": "12:00–21:00", "wtorek": "12:00–21:00", "środa": "12:00–21:00", "czwartek": "12:00–21:00", "piątek": "12:00–23:00"}, "service_options": ["Ogródek", "Dostawa bez kontaktu", "Dostawa", "Na wynos", "Na miejscu"], "specials": ["Dobre desery", "Duży wybór herbat"], "popular_for": ["Obiad", "Kolacja", "Posiłki w pojedynkę"], "accessibility": ["Miejsca dla osób na wózkach", "Wejście dostępne dla osób na wózkach"], "offerings": ["Alkohol", "Alkohol wysokoprocentowy", "Jedzenie późnym wieczorem", "Kawa", "Koktajle", "Małe porcje", "Piwo", "Szybka przekąska", "To miejsce oferuje dania wegańskie", "W ofercie dania wegetariańskie", "Wino"], "amenities": ["Bar na miejscu", "Toaleta", "Wi-Fi", "Bezpłatne Wi-Fi"], "atmosphere": ["Kameralne", "Modne", "Niezobowiązująca atmosfera", "Spokojne"], "crowd": ["Dla całej rodziny", "Grupy", "Turyści"], "children": ["Krzesełka do karmienia", "Menu dla dzieci", "Odpowiednie dla dzieci"], "parking": ["Trudno znaleźć miejsce", "Płatny parking", "Płatny parking przy ulicy"], "context": "Miejsce o nazwie House of Sushi to miejsce typu: Sushi, Kuchnia azjatycka, Kuchnia japońska, Ramen. W ofercie znajduje się: Alkohol, Alkohol wysokoprocentowy, Jedzenie późnym wieczorem, Kawa, Koktajle, Małe porcje, Piwo, Szybka przekąska. Specjalne cechy miejsca: Dobre desery, Duży wybór herbat. Atmosfera jest opisywana jako: Kameralne, Modne, Niezobowiązująca atmosfera, Spokojne. Miejsce oferuje udogodnienia dostępności: Miejsca dla osób na wózkach, Wejście dostępne dla osób na wózkach. Dostępne udogodnienia to: Bar na miejscu, Toaleta, Wi-Fi, Bezpłatne Wi-Fi. Typowa grupa odwiedzających: Dla całej rodziny, Grupy, Turyści. Jest popularne szczególnie na: Obiad, Kolacja, Posiłki w pojedynkę.", "google_rating": 4.5, "google_reviews_total": 1272, "google_price_range": "$$"}}
{"oms_id": 11047249782, "name": "Crazy Bubble", "Współrzędne": "51.761821, 19.414344", "key_words": {"types": ["Herbaciarnia", "Kawiarnia"], "address": "aleje Politechniki 1, 93-590 Łódź, Polska", "phone": "+48 531 252 453", "opening_hours": {"sobota": "10:00–21:00", "niedziela": "Zamknięte", "poniedziałek": "10:00–21:00", "wtorek": "10:00–21:00", "środa": "10:00–21:00", "czwartek": "10:00–21:00", "piątek": "10:00–21:00"}, "service_options": ["Usługi na miejscu", "Na wynos", "Na miejscu"], "specials": ["Duży wybór herbat"], "popular_for": [], "accessibility": [], "offerings": [], "amenities": [], "atmosphere": [], "crowd": ["Miejsce przyjazne dla osób transpłciowych", "Przyjazne dla osób LGBTQ+"], "children": [], "parking": ["Bezpłatny parking"], "context": "Miejsce o nazwie Crazy Bubble to miejsce typu: Herbaciarnia, Kawiarnia. Specjalne cechy miejsca: Duży wybór herbat. Typowa grupa odwiedzających: Miejsce przyjazne dla osób transpłciowych, Przyjazne dla osób LGBTQ+.", "google_rating": 4.7, "google_reviews_total": 53, "google_price_range": null}}
{"oms_id": 11063576478, "name": "Koku Sushi", "Współrzędne": "51.744191, 19.400023", "key_words": {"types": ["Sushi", "Sushi na wynos"], "address": "Piotrkowska 123, 90-430 Łódź, Polska", "phone": "+48 505 621 121", "opening_hours": {"sobota": "11:00–22:00", "niedziela": "11:00–21:00", "poniedziałek": "11:00–21:00", "wtorek": "11:00–21:00", "środa": "11:00–21:00", "czwartek": "11:00–21:00", "piątek": "11:00–22:00"}, "service_options": ["Ogródek", "Dostawa", "Na wynos", "Na miejscu"], "specials": ["Dobra kawa", "Dobre desery", "Dobre drinki", "Duży wybór herbat"], "popular_for": ["Obiad", "Kolacja", "Posiłki w pojedynkę"], "accessibility": ["Wejście dostępne dla osób na wózkach"], "offerings": ["Alkohol", "Alkohol wysokoprocentowy", "Bar sałatkowy", "Jedzenie późnym wieczorem", "Kawa", "Koktajle", "Małe porcje", "Piwo", "Szybka przekąska", "To miejsce oferuje dania wegańskie", "W ofercie dania wegetariańskie", "Wino"], "amenities": ["Bar na miejscu", "Toaleta", "Wi-Fi", "Bezpłatne Wi-Fi"], "atmosphere": ["Kameralne", "Modne", "Niezobowiązująca atmosfera", "Romantyczna atmosfera", "Spokojne"], "crowd": ["Dla całej rodziny", "Grupy", "Turyści"], "children": ["Krzesełka do karmienia", "Menu dla dzieci", "Odpowiednie dla dzieci"], "parking": [], "context": "Miejsce o nazwie Koku Sushi to miejsce typu: Sushi, Sushi na wynos. W ofercie znajduje się: Alkohol, Alkohol wysokoprocentowy, Bar sałatkowy, Jedzenie późnym wieczorem, Kawa, Koktajle, Małe porcje, Piwo. Specjalne cechy miejsca: Dobra kawa, Dobre desery, Dobre drinki, Duży wybór herbat. Atmosfera jest opisywana jako: Kameralne, Modne, Niezobowiązująca atmosfera, Romantyczna atmosfera, Spokojne. Miejsce oferuje udogodnienia dostępności: Wejście dostępne dla osób na wózkach. Dostępne udogodnienia to: Bar na miejscu, Toaleta, Wi-Fi, Bezpłatne Wi-Fi. Typowa grupa odwiedzających: Dla całej rodziny, Grupy, Turyści. Jest popularne szczególnie na: Obiad, Kolacja, Posiłki w pojedynkę.", "google_rating": 4, "google_reviews_total": 990, "google_price_range": "$$"}}
{"oms_id": 11122914112, "name": "Locum cafe", "Współrzędne": "51.777033, 19.456587", "key_words": {"types": ["Agencja nieruchomości"], "address": "al. Tadeusza Kościuszki 29, 90-418 Łódź", "phone": "42 632 30 42", "opening_hours": {}, "service_options": [], "specials": [], "popular_for": [], "accessibility": [], "offerings": [], "amenities": [], "atmosphere": [], "crowd": [], "children": [], "parking": [], "context": "Miejsce o nazwie Locum cafe to miejsce typu: Agencja nieruchomości.", "google_rating": 5, "google_reviews_total": 1, "google_price_range": null}}
{"oms_id": 11181871280, "name": "Marco", "Współrzędne": "51.745403, 19.463388", "key_words": {"types": ["Kuchnia włoska"], "address": "Piotrkowska 282, 93-034 Łódź, Polska", "phone": "+48 575 777 406", "opening_hours": {"sobota": "12:00–22:00", "niedziela": "12:00–20:00", "poniedziałek": "Zamknięte", "wtorek": "Zamknięte", "środa": "12:00–20:00", "czwartek": "12:00–20:00", "piątek": "12:00–22:00"}, "service_options": ["Ogródek", "Na wynos", "Na miejscu"], "specials": ["Dobra kawa", "Dobre desery", "Duży wybór herbat"], "popular_for": ["Obiad", "Kolacja", "Posiłki w pojedynkę"], "accessibility": ["Miejsca dla osób na wózkach", "Parking dostępny dla osób na wózkach", "Toaleta dla osób na wózkach", "Wejście dostępne dla osób na wózkach"], "offerings": ["Alkohol", "Jedzenie późnym wieczorem", "Kawa", "Koktajle", "Małe porcje", "Piwo", "Szybka przekąska", "To miejsce oferuje dania wegańskie", "W ofercie dania wegetariańskie", "Wino"], "amenities": ["Bar na miejscu", "Toaleta", "Toaleta unisex", "Wi-Fi", "Bezpłatne Wi-Fi"], "atmosphere": ["Kameralne", "Modne", "Niezobowiązująca atmosfera", "Spokojne"], "crowd": ["Dla całej rodziny", "Grupy", "Miejsce przyjazne dla osób transpłciowych", "Przyjazne dla osób LGBTQ+", "Turyści"], "children": ["Menu dla dzieci", "Odpowiednie dla dzieci"], "parking": ["Bezpłatny parking", "Dużo miejsc parkingowych", "Płatny parking przy ulicy"], "context": "Miejsce o nazwie Marco to miejsce typu: Kuchnia włoska. W ofercie znajduje się: Alkohol, Jedzenie późnym wieczorem, Kawa, Koktajle, Małe porcje, Piwo, Szybka przekąska, To miejsce oferuje dania wegańskie. Specjalne cechy miejsca: Dobra kawa, Dobre desery, Duży wybór herbat. Atmosfera jest opisywana jako: Kameralne, Modne, Niezobowiązująca atmosfera, Spokojne. Miejsce oferuje udogodnienia dostępności: Miejsca dla osób na wózkach, Parking dostępny dla osób na wózkach, Toaleta dla osób na wózkach, Wejście dostępne dla osób na wózkach. Dostępne udogodnienia to: Bar na miejscu, Toaleta, Toaleta unisex, Wi-Fi, Bezpłatne Wi-Fi. Typowa grupa odwiedzających: Dla całej rodziny, Grupy, Miejsce przyjazne dla osób transpłciowych, Przyjazne dla osób LGBTQ+, Turyści. Jest popularne szczególnie na: Obi...", "google_rating": 4.5, "google_reviews_total": 315, "google_price_range": "40–60"}}
{"oms_id": 11243853154, "name": "Pierogarnia Stary Młyn", "Współrzędne": "51.771555, 19.455685", "key_words": {"types": ["Pierogarnia", "Kuchnia polska", "Restauracja"], "address": "Piotrkowska 37, 90-001 Łódź, Polska", "phone": "+48 42 662 02 20", "opening_hours": {"sobota": "11:03–22:56", "niedziela": "11:03–21:56", "poniedziałek": "11:03–21:56", "wtorek": "11:03–21:56", "środa": "11:03–21:56", "czwartek": "11:03–21:56", "piątek": "11:03–22:56"}, "service_options": ["Ogródek", "Dostawa bez kontaktu", "Dostawa", "Usługi na miejscu", "Na wynos", "Na miejscu"], "specials": ["Dobra kawa", "Dobre desery", "Dobre drinki", "Duży wybór herbat", "Obszerna karta win"], "popular_for": ["Obiad", "Kolacja", "Posiłki w pojedynkę"], "accessibility": ["Miejsca dla osób na wózkach", "Toaleta dla osób na wózkach", "Wejście dostępne dla osób na wózkach"], "offerings": ["Alkohol", "Alkohol wysokoprocentowy", "Drinki w promocji happy hours", "Jedzenie późnym wieczorem", "Kawa", "Koktajle", "Małe porcje", "Menu brajlowskie", "Piwo", "Prywatna sala", "Szybka przekąska", "To miejsce oferuje dania wegańskie", "W ofercie dania wegetariańskie", "Wino"], "amenities": ["Bar na miejscu", "Toaleta", "Toaleta unisex", "Wi-Fi", "Bezpłatne Wi-Fi"], "atmosphere": ["Kameralne", "Modne", "Niezobowiązująca atmosfera", "Romantyczna atmosfera", "Spokojne"], "crowd": ["Dla całej rodziny", "Grupy", "Turyści"], "children": ["Krzesełka do karmienia", "Ma przewijak(i)", "Menu dla dzieci", "Odpowiednie dla dzieci"], "parking": ["Trudno znaleźć miejsce"], "context": "Miejsce o nazwie Pierogarnia Stary Młyn to miejsce typu: Pierogarnia, Kuchnia polska, Restauracja. W ofercie znajduje się: Alkohol, Alkohol wysokoprocentowy, Drinki w promocji happy hours, Jedzenie późnym wieczorem, Kawa, Koktajle, Małe porcje, Menu brajlowskie. Specjalne cechy miejsca: Dobra kawa, Dobre desery, Dobre drinki, Duży wybór herbat, Obszerna karta win. Atmosfera jest opisywana jako: Kameralne, Modne, Niezobowiązująca atmosfera, Romantyczna atmosfera, Spokojne. Miejsce oferuje udogodnienia dostępności: Miejsca dla osób na wózkach, Toaleta dla osób na wózkach, Wejście dostępne dla osób na wózkach. Dostępne udogodnienia to: Bar na miejscu, Toaleta, Toaleta unisex, Wi-Fi, Bezpłatne Wi-Fi. Typowa grupa odwiedzających: Dla całej rodziny, Grupy, Turyści. Jest popularne szczególnie...", "google_rating": 4.8, "google_reviews_total": 10123, "google_price_range": "40–80"}}
{"oms_id": 11384158933, "name": "Rajskie Jadło", "Współrzędne": "51.795874, 19.394443", "key_words": {"types": ["Restauracja", "Bistro", "Catering", "Jedzenie z dostawą do domu", "Kuchnia polska"], "address": "Traktorowa 63, 91-111 Łódź, Polska", "phone": "+48 42 652 17 54", "opening_hours": {"sobota": "10:00–17:00", "niedziela": "10:00–17:00", "poniedziałek": "10:00–18:00", "wtorek": "10:00–18:00", "środa": "10:00–18:00", "czwartek": "10:00–18:00", "piątek": "10:00–18:00"}, "service_options": ["Dostawa bez kontaktu", "Dostawa", "Usługi na miejscu", "Na wynos", "Na miejscu"], "specials": ["Duży wybór herbat"], "popular_for": ["Obiad", "Kolacja", "Posiłki w pojedynkę"], "accessibility": ["Wejście dostępne dla osób na wózkach"], "offerings": ["Kawa", "Małe porcje", "Szybka przekąska"], "amenities": ["Toaleta", "Toaleta unisex"], "atmosphere": ["Kameralne", "Modne", "Niezobowiązująca atmosfera", "Spokojne"], "crowd": ["Grupy", "Turyści"], "children": ["Menu dla dzieci", "Odpowiednie dla dzieci"], "parking": ["Bezpłatny parking", "Bezpłatny parking przy ulicy"], "context": "Miejsce o nazwie Rajskie Jadło to miejsce typu: Restauracja, Bistro, Catering, Jedzenie z dostawą do domu, Kuchnia polska. W ofercie znajduje się: Kawa, Małe porcje, Szybka przekąska. Specjalne cechy miejsca: Duży wybór herbat. Atmosfera jest opisywana jako: Kameralne, Modne, Niezobowiązująca atmosfera, Spokojne. Miejsce oferuje udogodnienia dostępności: Wejście dostępne dla osób na wózkach. Dostępne udogodnienia to: Toaleta, Toaleta unisex. Typowa grupa odwiedzających: Grupy, Turyści. Jest popularne szczególnie na: Obiad, Kolacja, Posiłki w pojedynkę.", "google_rating": 4.1, "google_reviews_total": 901, "google_price_range": "20–40"}}
{"oms_id": 11412534454, "name": "Ekspres Do Kawy", "Współrzędne": "51.775566, 19.523146", "key_words": {"types": ["Strefa gastronomiczna", "Serwis sprzętu AGD", "Dostawca ekspresów i akcesoriów do kawy", "Sklep z kawą", "Sklep AGD"], "address": "Strykowska 33/43, 91-725 Łódź, Polska", "phone": "+48 42 674 17 85", "opening_hours": {"sobota": "Zamknięte", "niedziela": "Zamknięte", "poniedziałek": "09:00–17:00", "wtorek": "09:00–17:00", "środa": "09:00–17:00", "czwartek": "09:00–17:00", "piątek": "09:00–17:00"}, "service_options": [], "specials": [], "popular_for": ["Posiłki w pojedynkę"], "accessibility": ["Wejście dostępne dla osób na wózkach"], "offerings": [], "amenities": [], "atmosphere": ["Niezobowiązująca atmosfera"], "crowd": [], "children": [], "parking": [], "context": "Miejsce o nazwie Ekspres Do Kawy to miejsce typu: Strefa gastronomiczna, Serwis sprzętu AGD, Dostawca ekspresów i akcesoriów do kawy, Sklep z kawą, Sklep AGD. Atmosfera jest opisywana jako: Niezobowiązująca atmosfera. Miejsce oferuje udogodnienia dostępności: Wejście dostępne dla osób na wózkach. Jest popularne szczególnie na: Posiłki w pojedynkę.", "google_rating": 5, "google_reviews_total": 4, "google_price_range": null}}
{"oms_id": 11503158057, "name": "Nova Sushi", "Współrzędne": "51.786209, 19.448959", "key_words": {"types": ["Sushi", "Kuchnia japońska", "Ramen", "Kuchnia tajska"], "address": "Zachodnia 21, 90-001 Łódź, Polska", "phone": "+48 513 108 000", "opening_hours": {"sobota": "12:00–22:00", "niedziela": "12:00–22:00", "poniedziałek": "12:00–22:00", "wtorek": "12:00–22:00", "środa": "12:00–22:00", "czwartek": "12:00–22:00", "piątek": "12:00–22:00"}, "service_options": ["Dostawa bez kontaktu", "Dostawa", "Na wynos", "Na miejscu"], "specials": [], "popular_for": ["Obiad", "Kolacja", "Posiłki w pojedynkę"], "accessibility": ["Miejsca dla osób na wózkach"], "offerings": ["Alkohol", "Jedzenie późnym wieczorem", "Małe porcje", "Szybka przekąska", "To miejsce oferuje dania wegańskie", "W ofercie dania wegetariańskie", "Wino"], "amenities": ["Toaleta"], "atmosphere": ["Kameralne", "Modne", "Niezobowiązująca atmosfera", "Spokojne"], "crowd": ["Dla całej rodziny", "Grupy", "Przyjazne dla osób LGBTQ+", "Turyści"], "children": [], "parking": ["Bezpłatny parking", "Bezpłatny parking przy ulicy"], "context": "Miejsce o nazwie Nova Sushi to miejsce typu: Sushi, Kuchnia japońska, Ramen, Kuchnia tajska. W ofercie znajduje się: Alkohol, Jedzenie późnym wieczorem, Małe porcje, Szybka przekąska, To miejsce oferuje dania wegańskie, W ofercie dania wegetariańskie, Wino. Atmosfera jest opisywana jako: Kameralne, Modne, Niezobowiązująca atmosfera, Spokojne. Miejsce oferuje udogodnienia dostępności: Miejsca dla osób na wózkach. Dostępne udogodnienia to: Toaleta. Typowa grupa odwiedzających: Dla całej rodziny, Grupy, Przyjazne dla osób LGBTQ+, Turyści. Jest popularne szczególnie na: Obiad, Kolacja, Posiłki w pojedynkę.", "google_rating": 4.3, "google_reviews_total": 610, "google_price_range": "$$"}}
{"oms_id": 11528237252, "name": "GeoBistro", "Współrzędne": "51.773732, 19.481453", "key_words": {"types": ["Restauracja"], "address": "Row House No 2, Nandgaon, Clover Park Dutta Mandir Chowk, Behind Phoenix Market-City, Pune, Maharashtra 411014, Indie", "phone": "+91 98238 93553", "opening_hours": {}, "service_options": ["Ogródek", "Dostawa", "Na wynos"], "specials": [], "popular_for": [], "accessibility": [], "offerings": ["Alkohol", "Jesz, ile chcesz", "Kawa", "Koktajle", "Kuchnia halal", "Piwo", "W ofercie dania wegetariańskie"], "amenities": ["Bezpłatne Wi-Fi"], "atmosphere": [], "crowd": ["Dla całej rodziny"], "children": ["Krzesełka do karmienia", "Odpowiednie dla dzieci"], "parking": [], "context": "Miejsce o nazwie GeoBistro to miejsce typu: Restauracja. W ofercie znajduje się: Alkohol, Jesz, ile chcesz, Kawa, Koktajle, Kuchnia halal, Piwo, W ofercie dania wegetariańskie. Dostępne udogodnienia to: Bezpłatne Wi-Fi. Typowa grupa odwiedzających: Dla całej rodziny.", "google_rating": 4.2, "google_reviews_total": 763, "google_price_range": "$$$"}}
{"oms_id": 11551688686, "name": "Da Grasso", "Współrzędne": "51.771184, 19.455750", "key_words": {"types": ["Pizzeria", "Pizza na telefon", "Pizza na wynos", "Restauracja"], "address": "Piotrkowska 41/lok.1U, 90-265 Łódź, Polska", "phone": "+48 500 800 200", "opening_hours": {"sobota": "10:00–00:00", "niedziela": "10:30–22:00", "poniedziałek": "10:00–22:00", "wtorek": "10:00–22:00", "środa": "10:00–22:00", "czwartek": "10:00–22:00", "piątek": "10:00–23:00"}, "service_options": ["Ogródek", "Dostawa bez kontaktu", "Dostawa", "Na wynos", "Na miejscu"], "specials": ["Dobra kawa", "Dobre desery", "Duży wybór herbat"], "popular_for": ["Obiad", "Kolacja", "Posiłki w pojedynkę"], "accessibility": ["Miejsca dla osób na wózkach", "Wejście dostępne dla osób na wózkach"], "offerings": ["Alkohol", "Alkohol wysokoprocentowy", "Jedzenie późnym wieczorem", "Kawa", "Koktajle", "Małe porcje", "Piwo", "Szybka przekąska", "To miejsce oferuje dania wegańskie", "W ofercie dania wegetariańskie", "Wino"], "amenities": ["Bar na miejscu", "Toaleta", "Wi-Fi", "Bezpłatne Wi-Fi"], "atmosphere": ["Kameralne", "Modne", "Niezobowiązująca atmosfera", "Spokojne"], "crowd": ["Dla całej rodziny", "Grupy", "Studenci", "Turyści"], "children": ["Krzesełka do karmienia", "Menu dla dzieci", "Odpowiednie dla dzieci"], "parking": ["Bezpłatny parking przy ulicy"], "context": "Miejsce o nazwie Da Grasso to miejsce typu: Pizzeria, Pizza na telefon, Pizza na wynos, Restauracja. W ofercie znajduje się: Alkohol, Alkohol wysokoprocentowy, Jedzenie późnym wieczorem, Kawa, Koktajle, Małe porcje, Piwo, Szybka przekąska. Specjalne cechy miejsca: Dobra kawa, Dobre desery, Duży wybór herbat. Atmosfera jest opisywana jako: Kameralne, Modne, Niezobowiązująca atmosfera, Spokojne. Miejsce oferuje udogodnienia dostępności: Miejsca dla osób na wózkach, Wejście dostępne dla osób na wózkach. Dostępne udogodnienia to: Bar na miejscu, Toaleta, Wi-Fi, Bezpłatne Wi-Fi. Typowa grupa odwiedzających: Dla całej rodziny, Grupy, Studenci, Turyści. Jest popularne szczególnie na: Obiad, Kolacja, Posiłki w pojedynkę.", "google_rating": 3.8, "google_reviews_total": 1518, "google_price_range": "20–40"}}
{"oms_id": 11688103274, "name": "Sushi w Dłoń", "Współrzędne": "51.769083, 19.459943", "key_words": {"types": ["Restauracja", "Ramen", "Sushi", "Sushi na wynos"], "address": "Gen. Romualda Traugutta 14, 90-107 Łódź, Polska", "phone": "+48 534 556 651", "opening_hours": {"sobota": "12:00–22:00", "niedziela": "12:00–20:00", "poniedziałek": "12:00–21:00", "wtorek": "12:00–21:00", "środa": "12:00–21:00", "czwartek": "12:00–21:00", "piątek": "12:00–22:00"}, "service_options": ["Dostawa", "Na wynos", "Na miejscu"], "specials": ["Dobre desery", "Duży wybór herbat"], "popular_for": ["Obiad", "Kolacja", "Posiłki w pojedynkę"], "accessibility": [], "offerings": ["Alkohol", "Jedzenie późnym wieczorem", "Koktajle", "Małe porcje", "Piwo", "Szybka przekąska", "To miejsce oferuje dania wegańskie", "W ofercie dania wegetariańskie", "Wino"], "amenities": ["Toaleta", "Wi-Fi", "Bezpłatne Wi-Fi"], "atmosphere": ["Kameralne", "Modne", "Niezobowiązująca atmosfera", "Spokojne"], "crowd": ["Grupy", "Studenci", "Turyści"], "children": [], "parking": ["Trudno znaleźć miejsce", "Płatny parking przy ulicy"], "context": "Miejsce o nazwie Sushi w Dłoń to miejsce typu: Restauracja, Ramen, Sushi, Sushi na wynos. W ofercie znajduje się: Alkohol, Jedzenie późnym wieczorem, Koktajle, Małe porcje, Piwo, Szybka przekąska, To miejsce oferuje dania wegańskie, W ofercie dania wegetariańskie. Specjalne cechy miejsca: Dobre desery, Duży wybór herbat. Atmosfera jest opisywana jako: Kameralne, Modne, Niezobowiązująca atmosfera, Spokojne. Dostępne udogodnienia to: Toaleta, Wi-Fi, Bezpłatne Wi-Fi. Typowa grupa odwiedzających: Grupy, Studenci, Turyści. Jest popularne szczególnie na: Obiad, Kolacja, Posiłki w pojedynkę.", "google_rating": 4.6, "google_reviews_total": 1498, "google_price_range": "40–60"}}
{"oms_id": 11691016052, "name": "Kimsu", "Współrzędne": "51.760879, 19.458392", "key_words": {"types": ["Restauracja japońska"], "address": "Drewnowska 58, 91-002 Łódź, Polska", "phone": "+48 530 041 529", "opening_hours": {"sobota": "11:00–23:00", "niedziela": "11:00–22:00", "poniedziałek": "11:00–22:00", "wtorek": "11:00–22:00", "środa": "11:00–22:00", "czwartek": "11:00–22:00", "piątek": "11:00–23:00"}, "service_options": ["Dostawa bez kontaktu", "Dostawa", "Na wynos", "Na miejscu"], "specials": ["Duży wybór herbat"], "popular_for": ["Obiad", "Kolacja", "Posiłki w pojedynkę"], "accessibility": ["Wejście dostępne dla osób na wózkach"], "offerings": ["Alkohol", "Alkohol wysokoprocentowy", "Dania z produktów ekologicznych", "Drinki w promocji happy hours", "Jedzenie późnym wieczorem", "Jedzenie w promocji happy hours", "Kawa", "Koktajle", "Małe porcje", "Piwo", "Szybka przekąska", "To miejsce oferuje dania wegańskie", "W ofercie dania wegetariańskie", "Wino"], "amenities": ["Bar na miejscu", "Toaleta", "Wi-Fi", "Bezpłatne Wi-Fi"], "atmosphere": ["Kameralne", "Modne", "Niezobowiązująca atmosfera", "Spokojne"], "crowd": ["Dla całej rodziny", "Miejsce przyjazne dla osób transpłciowych", "Przyjazne dla osób LGBTQ+", "Turyści"], "children": [], "parking": ["Bezpłatny parking", "Bezpłatny parking przy ulicy", "Dużo miejsc parkingowych"], "context": "Miejsce o nazwie Kimsu to miejsce typu: Restauracja japońska. W ofercie znajduje się: Alkohol, Alkohol wysokoprocentowy, Dania z produktów ekologicznych, Drinki w promocji happy hours, Jedzenie późnym wieczorem, Jedzenie w promocji happy hours, Kawa, Koktajle. Specjalne cechy miejsca: Duży wybór herbat. Atmosfera jest opisywana jako: Kameralne, Modne, Niezobowiązująca atmosfera, Spokojne. Miejsce oferuje udogodnienia dostępności: Wejście dostępne dla osób na wózkach. Dostępne udogodnienia to: Bar na miejscu, Toaleta, Wi-Fi, Bezpłatne Wi-Fi. Typowa grupa odwiedzających: Dla całej rodziny, Miejsce przyjazne dla osób transpłciowych, Przyjazne dla osób LGBTQ+, Turyści. Jest popularne szczególnie na: Obiad, Kolacja, Posiłki w pojedynkę.", "google_rating": 4.6, "google_reviews_total": 881, "google_price_range": "40–60"}}
{"oms_id": 11691105258, "name": "Colour Cafe", "Współrzędne": "51.761751, 19.458210", "key_words": {"types": ["Kawiarnia"], "address": "Piotrkowska 132, 90-062 Łódź, Polska", "phone": "+48 790 289 675", "opening_hours": {"sobota": "08:00–20:00", "niedziela": "09:00–20:00", "poniedziałek": "08:00–20:00", "wtorek": "08:00–20:00", "środa": "08:00–20:00", "czwartek": "08:00–20:00", "piątek": "08:00–20:00"}, "service_options": ["Ogródek", "Na wynos", "Na miejscu"], "specials": ["Dobra kawa", "Dobre desery", "Duży wybór herbat"], "popular_for": ["Śniadanie", "Posiłki w pojedynkę", "Dobre miejsce do pracy na laptopie"], "accessibility": ["Miejsca dla osób na wózkach"], "offerings": ["Alkohol", "Kawa", "Koktajle", "Małe porcje", "Szybka przekąska", "To miejsce oferuje dania wegańskie", "W ofercie dania wegetariańskie", "Wino"], "amenities": ["Toaleta"], "atmosphere": ["Kameralne", "Modne", "Niezobowiązująca atmosfera", "Romantyczna atmosfera", "Spokojne"], "crowd": ["Studenci", "Turyści"], "children": ["Krzesełka do karmienia", "Odpowiednie dla dzieci"], "parking": ["Raczej trudno znaleźć miejsce", "Płatny parking przy ulicy"], "context": "Miejsce o nazwie Colour Cafe to miejsce typu: Kawiarnia. W ofercie znajduje się: Alkohol, Kawa, Koktajle, Małe porcje, Szybka przekąska, To miejsce oferuje dania wegańskie, W ofercie dania wegetariańskie, Wino. Specjalne cechy miejsca: Dobra kawa, Dobre desery, Duży wybór herbat. Atmosfera jest opisywana jako: Kameralne, Modne, Niezobowiązująca atmosfera, Romantyczna atmosfera, Spokojne. Miejsce oferuje udogodnienia dostępności: Miejsca dla osób na wózkach. Dostępne udogodnienia to: Toaleta. Typowa grupa odwiedzających: Studenci, Turyści. Jest popularne szczególnie na: Śniadanie, Posiłki w pojedynkę, Dobre miejsce do pracy na laptopie.", "google_rating": 4.4, "google_reviews_total": 767, "google_price_range": "20–40"}}
{"oms_id": 11816366324, "name": "Beijing Taste", "Współrzędne": "51.775812, 19.466112", "key_words": {"types": ["Kuchnia chińska"], "address": "Polska, Łódź, Rewolucji 1905 roku, 邮政编码: 90-213", "phone": "+48 516 598 888", "opening_hours": {"sobota": "11:00–21:00", "niedziela": "11:00–20:00", "poniedziałek": "11:00–21:00", "wtorek": "11:00–21:00", "środa": "11:00–21:00", "czwartek": "11:00–21:00", "piątek": "11:00–21:00"}, "service_options": ["Ogródek", "Na wynos", "Na miejscu"], "specials": ["Duży wybór herbat", "Kominek"], "popular_for": ["Obiad", "Kolacja", "Posiłki w pojedynkę"], "accessibility": ["Miejsca dla osób na wózkach", "Toaleta dla osób na wózkach"], "offerings": ["Alkohol", "Bar sałatkowy", "Małe porcje", "Piwo", "Szybka przekąska", "To miejsce oferuje dania wegańskie", "W ofercie dania wegetariańskie"], "amenities": ["Toaleta", "Wi-Fi", "Bezpłatne Wi-Fi"], "atmosphere": ["Kameralne", "Modne", "Niezobowiązująca atmosfera", "Spokojne"], "crowd": ["Dla całej rodziny", "Grupy", "Miejsce przyjazne dla osób transpłciowych", "Przyjazne dla osób LGBTQ+", "Studenci", "Turyści"], "children": ["Odpowiednie dla dzieci"], "parking": ["Dużo miejsc parkingowych", "Płatny parking", "Płatny parking przy ulicy"], "context": "Miejsce o nazwie Beijing Taste to miejsce typu: Kuchnia chińska. W ofercie znajduje się: Alkohol, Bar sałatkowy, Małe porcje, Piwo, Szybka przekąska, To miejsce oferuje dania wegańskie, W ofercie dania wegetariańskie. Specjalne cechy miejsca: Duży wybór herbat, Kominek. Atmosfera jest opisywana jako: Kameralne, Modne, Niezobowiązująca atmosfera, Spokojne. Miejsce oferuje udogodnienia dostępności: Miejsca dla osób na wózkach, Toaleta dla osób na wózkach. Dostępne udogodnienia to: Toaleta, Wi-Fi, Bezpłatne Wi-Fi. Typowa grupa odwiedzających: Dla całej rodziny, Grupy, Miejsce przyjazne dla osób transpłciowych, Przyjazne dla osób LGBTQ+, Studenci, Turyści. Jest popularne szczególnie na: Obiad, Kolacja, Posiłki w pojedynkę.", "google_rating": 4.5, "google_reviews_total": 521, "google_price_range": "20–40"}}
{"oms_id": 12043520196, "name": "Ba Mien", "Współrzędne": "51.757646, 19.534228", "key_words": {"types": ["Kuchnia azjatycka"], "address": "Beli Bartoka 77, 92-531 Łódź, Polska", "phone": "+48 729 695 828", "opening_hours": {"sobota": "10:30–21:00", "niedziela": "10:30–20:30", "poniedziałek": "10:30–21:00", "wtorek": "10:30–21:00", "środa": "10:30–21:00", "czwartek": "10:30–21:00", "piątek": "10:30–21:00"}, "service_options": ["Dostawa bez kontaktu", "Dostawa", "Obsługa zmotoryzowanych", "Na wynos", "Na miejscu"], "specials": [], "popular_for": ["Obiad", "Kolacja", "Posiłki w pojedynkę"], "accessibility": ["Wejście dostępne dla osób na wózkach"], "offerings": ["Małe porcje", "Szybka przekąska"], "amenities": [], "atmosphere": ["Niezobowiązująca atmosfera", "Spokojne"], "crowd": ["Studenci"], "children": [], "parking": ["Bezpłatny parking", "Bezpłatny parking podziemny", "Bezpłatny parking przy ulicy", "Dużo miejsc parkingowych"], "context": "Miejsce o nazwie Ba Mien to miejsce typu: Kuchnia azjatycka. W ofercie znajduje się: Małe porcje, Szybka przekąska. Atmosfera jest opisywana jako: Niezobowiązująca atmosfera, Spokojne. Miejsce oferuje udogodnienia dostępności: Wejście dostępne dla osób na wózkach. Typowa grupa odwiedzających: Studenci. Jest popularne szczególnie na: Obiad, Kolacja, Posiłki w pojedynkę.", "google_rating": 4.6, "google_reviews_total": 136, "google_price_range": "20–40"}}
{"oms_id": 12060796941, "name": "Smak", "Współrzędne": "51.768521, 19.447391", "key_words": {"types": ["Restauracja", "Bar"], "address": "plac Norberta Barlickiego 7, 90-615 Łódź, Polska", "phone": "+48 799 094 919", "opening_hours": {"sobota": "08:00–18:00", "niedziela": "Zamknięte", "poniedziałek": "08:00–18:00", "wtorek": "08:00–18:00", "środa": "Zamknięte", "czwartek": "08:00–18:00", "piątek": "08:00–18:00"}, "service_options": ["Dostawa", "Obsługa zmotoryzowanych", "Usługi na miejscu", "Na wynos", "Na miejscu"], "specials": ["Duży wybór herbat", "Muzyka na żywo"], "popular_for": ["Śniadanie", "Obiad", "Kolacja", "Posiłki w pojedynkę"], "accessibility": ["Miejsca dla osób na wózkach"], "offerings": ["Bar sałatkowy", "Dania z produktów ekologicznych", "Kawa", "Małe porcje", "Prywatna sala", "Szybka przekąska", "W ofercie dania wegetariańskie"], "amenities": ["Toaleta"], "atmosphere": ["Kameralne", "Niezobowiązująca atmosfera", "Spokojne"], "crowd": ["Dla całej rodziny", "Miejsce przyjazne dla osób transpłciowych", "Przyjazne dla osób LGBTQ+", "Studenci", "Turyści"], "children": ["Krzesełka do karmienia", "Menu dla dzieci", "Odpowiednie dla dzieci"], "parking": ["Bezpłatny parking przy ulicy", "Dużo miejsc parkingowych"], "context": "Miejsce o nazwie Smak to miejsce typu: Restauracja, Bar. W ofercie znajduje się: Bar sałatkowy, Dania z produktów ekologicznych, Kawa, Małe porcje, Prywatna sala, Szybka przekąska, W ofercie dania wegetariańskie. Specjalne cechy miejsca: Duży wybór herbat, Muzyka na żywo. Atmosfera jest opisywana jako: Kameralne, Niezobowiązująca atmosfera, Spokojne. Miejsce oferuje udogodnienia dostępności: Miejsca dla osób na wózkach. Dostępne udogodnienia to: Toaleta. Typowa grupa odwiedzających: Dla całej rodziny, Miejsce przyjazne dla osób transpłciowych, Przyjazne dla osób LGBTQ+, Studenci, Turyści. Jest popularne szczególnie na: Śniadanie, Obiad, Kolacja, Posiłki w pojedynkę.", "google_rating": 4.7, "google_reviews_total": 289, "google_price_range": "20–40"}}
{"oms_id": 12061250667, "name": "Sushi Kushi & Ramen Shop", "Współrzędne": "51.760647, 19.460101", "key_words": {"types": ["Sushi na wynos", "Kuchnia azjatycka", "Makarony", "Ramen", "Restauracja", "Sushi"], "address": "Franklina Delano Roosevelta 7, 90-056 Łódź, Polska", "phone": "+48 780 017 779", "opening_hours": {"sobota": "12:00–23:00", "niedziela": "12:00–22:00", "poniedziałek": "12:00–22:00", "wtorek": "12:00–22:00", "środa": "12:00–22:00", "czwartek": "12:00–22:00", "piątek": "12:00–23:00"}, "service_options": ["Ogródek", "Dostawa bez kontaktu", "Dostawa", "Na wynos", "Na miejscu"], "specials": ["Duży wybór herbat"], "popular_for": ["Obiad", "Kolacja", "Posiłki w pojedynkę"], "accessibility": [], "offerings": ["Alkohol", "Drinki w promocji happy hours", "Jedzenie późnym wieczorem", "Jedzenie w promocji happy hours", "Kawa", "Małe porcje", "Piwo", "Szybka przekąska", "W ofercie dania wegetariańskie"], "amenities": ["Toaleta", "Toaleta unisex"], "atmosphere": ["Kameralne", "Modne", "Niezobowiązująca atmosfera", "Spokojne"], "crowd": ["Dla całej rodziny", "Miejsce przyjazne dla osób transpłciowych", "Przyjazne dla osób LGBTQ+", "Turyści"], "children": ["Ma przewijak(i)", "Menu dla dzieci", "Odpowiednie dla dzieci"], "parking": [], "context": "Miejsce o nazwie Sushi Kushi & Ramen Shop to miejsce typu: Sushi na wynos, Kuchnia azjatycka, Makarony, Ramen, Restauracja, Sushi. W ofercie znajduje się: Alkohol, Drinki w promocji happy hours, Jedzenie późnym wieczorem, Jedzenie w promocji happy hours, Kawa, Małe porcje, Piwo, Szybka przekąska. Specjalne cechy miejsca: Duży wybór herbat. Atmosfera jest opisywana jako: Kameralne, Modne, Niezobowiązująca atmosfera, Spokojne. Dostępne udogodnienia to: Toaleta, Toaleta unisex. Typowa grupa odwiedzających: Dla całej rodziny, Miejsce przyjazne dla osób transpłciowych, Przyjazne dla osób LGBTQ+, Turyści. Jest popularne szczególnie na: Obiad, Kolacja, Posiłki w pojedynkę.", "google_rating": 4, "google_reviews_total": 413, "google_price_range": "40–60"}}
{"oms_id": 12063484650, "name": "Koku Sushi", "Współrzędne": "51.762795, 19.457538", "key_words": {"types": ["Sushi", "Sushi na wynos"], "address": "Piotrkowska 123, 90-430 Łódź, Polska", "phone": "+48 505 621 121", "opening_hours": {"sobota": "11:00–22:00", "niedziela": "11:00–21:00", "poniedziałek": "11:00–21:00", "wtorek": "11:00–21:00", "środa": "11:00–21:00", "czwartek": "11:00–21:00", "piątek": "11:00–22:00"}, "service_options": ["Ogródek", "Dostawa", "Na wynos", "Na miejscu"], "specials": ["Dobra kawa", "Dobre desery", "Dobre drinki", "Duży wybór herbat"], "popular_for": ["Obiad", "Kolacja", "Posiłki w pojedynkę"], "accessibility": ["Wejście dostępne dla osób na wózkach"], "offerings": ["Alkohol", "Alkohol wysokoprocentowy", "Bar sałatkowy", "Jedzenie późnym wieczorem", "Kawa", "Koktajle", "Małe porcje", "Piwo", "Szybka przekąska", "To miejsce oferuje dania wegańskie", "W ofercie dania wegetariańskie", "Wino"], "amenities": ["Bar na miejscu", "Toaleta", "Wi-Fi", "Bezpłatne Wi-Fi"], "atmosphere": ["Kameralne", "Modne", "Niezobowiązująca atmosfera", "Romantyczna atmosfera", "Spokojne"], "crowd": ["Dla całej rodziny", "Grupy", "Turyści"], "children": ["Krzesełka do karmienia", "Menu dla dzieci", "Odpowiednie dla dzieci"], "parking": [], "context": "Miejsce o nazwie Koku Sushi to miejsce typu: Sushi, Sushi na wynos. W ofercie znajduje się: Alkohol, Alkohol wysokoprocentowy, Bar sałatkowy, Jedzenie późnym wieczorem, Kawa, Koktajle, Małe porcje, Piwo. Specjalne cechy miejsca: Dobra kawa, Dobre desery, Dobre drinki, Duży wybór herbat. Atmosfera jest opisywana jako: Kameralne, Modne, Niezobowiązująca atmosfera, Romantyczna atmosfera, Spokojne. Miejsce oferuje udogodnienia dostępności: Wejście dostępne dla osób na wózkach. Dostępne udogodnienia to: Bar na miejscu, Toaleta, Wi-Fi, Bezpłatne Wi-Fi. Typowa grupa odwiedzających: Dla całej rodziny, Grupy, Turyści. Jest popularne szczególnie na: Obiad, Kolacja, Posiłki w pojedynkę.", "google_rating": 4, "google_reviews_total": 990, "google_price_range": "$$"}}
{"oms_id": 12066386906, "name": "Street Tea", "Współrzędne": "51.763685, 19.457358", "key_words": {"types": ["Sklep z herbatą", "Kawiarnia", "Herbaciarnia"], "address": "Piotrkowska 115/119 Lok.U3, 90-430 Łódź, Polska", "phone": "", "opening_hours": {"sobota": "11:00–22:00", "niedziela": "11:00–22:00", "poniedziałek": "11:00–20:00", "wtorek": "11:00–20:00", "środa": "11:00–20:00", "czwartek": "11:00–20:00", "piątek": "11:00–21:00"}, "service_options": ["Zakupy stacjonarne", "Usługi na miejscu", "Na wynos", "Na miejscu"], "specials": [], "popular_for": [], "accessibility": ["Miejsca dla osób na wózkach"], "offerings": [], "amenities": ["Toaleta unisex"], "atmosphere": [], "crowd": ["Miejsce przyjazne dla osób transpłciowych", "Przyjazne dla osób LGBTQ+"], "children": [], "parking": [], "context": "Miejsce o nazwie Street Tea to miejsce typu: Sklep z herbatą, Kawiarnia, Herbaciarnia. Miejsce oferuje udogodnienia dostępności: Miejsca dla osób na wózkach. Dostępne udogodnienia to: Toaleta unisex. Typowa grupa odwiedzających: Miejsce przyjazne dla osób transpłciowych, Przyjazne dla osób LGBTQ+.", "google_rating": 5, "google_reviews_total": 578, "google_price_range": null}}
{"oms_id": 12066508875, "name": "LAS", "Współrzędne": "51.766891, 19.456683", "key_words": {"types": ["Teren spacerowy"], "address": "Gen. Lucjana Żeligowskiego 8/10, 90-753 Łódź, Polska", "phone": "", "opening_hours": {}, "service_options": [], "specials": [], "popular_for": [], "accessibility": [], "offerings": [], "amenities": [], "atmosphere": [], "crowd": [], "children": [], "parking": [], "context": "Miejsce o nazwie LAS to miejsce typu: Teren spacerowy.", "google_rating": 5, "google_reviews_total": 1, "google_price_range": null}}
{"oms_id": 12066587064, "name": "R & D Tea", "Współrzędne": "51.780358, 19.448642", "key_words": {"types": ["Sklep z herbatą"], "address": "Drewnowska 58, 91-002 Łódź, Polska", "phone": "+48 728 411 974", "opening_hours": {"sobota": "11:00–21:00", "niedziela": "11:00–20:00", "poniedziałek": "11:00–21:00", "wtorek": "11:00–21:00", "środa": "11:00–21:00", "czwartek": "11:00–21:00", "piątek": "11:00–21:00"}, "service_options": ["Na wynos", "Na miejscu"], "specials": ["Duży wybór herbat"], "popular_for": [], "accessibility": ["Wejście dostępne dla osób na wózkach"], "offerings": [], "amenities": [], "atmosphere": [], "crowd": ["Miejsce przyjazne dla osób transpłciowych", "Przyjazne dla osób LGBTQ+"], "children": [], "parking": ["Bezpłatny parking"], "context": "Miejsce o nazwie R & D Tea to miejsce typu: Sklep z herbatą. Specjalne cechy miejsca: Duży wybór herbat. Miejsce oferuje udogodnienia dostępności: Wejście dostępne dla osób na wózkach. Typowa grupa odwiedzających: Miejsce przyjazne dla osób transpłciowych, Przyjazne dla osób LGBTQ+.", "google_rating": 4.5, "google_reviews_total": 246, "google_price_range": null}}
{"oms_id": 12382924307, "name": "Bułkę Przez Bibułkę", "Współrzędne": "51.748997, 19.468231", "key_words": {"types": ["Restauracja"], "address": "ks. bp. Wincentego Tymienieckiego 13c, 90-365 Łódź, Polska", "phone": "+48 730 281 100", "opening_hours": {"sobota": "08:00–22:00", "niedziela": "08:00–22:00", "poniedziałek": "07:30–22:00", "wtorek": "07:30–22:00", "środa": "07:30–22:00", "czwartek": "07:30–22:00", "piątek": "07:30–22:00"}, "service_options": ["Ogródek", "Dostawa bez kontaktu", "Dostawa", "Na wynos", "Na miejscu"], "specials": ["Dobra kawa", "Dobre desery", "Duży wybór herbat"], "popular_for": ["Śniadanie", "Obiad", "Kolacja", "Posiłki w pojedynkę"], "accessibility": ["Miejsca dla osób na wózkach", "Wejście dostępne dla osób na wózkach"], "offerings": ["Alkohol", "Jedzenie późnym wieczorem", "Kawa", "Koktajle", "Małe porcje", "Piwo", "Szybka przekąska", "To miejsce oferuje dania wegańskie", "W ofercie dania wegetariańskie", "Wino"], "amenities": ["Bar na miejscu", "Toaleta"], "atmosphere": ["Kameralne", "Modne", "Niezobowiązująca atmosfera", "Spokojne"], "crowd": ["Grupy", "Turyści"], "children": [], "parking": ["Bezpłatny parking przy ulicy"], "context": "Miejsce o nazwie Bułkę Przez Bibułkę to miejsce typu: Restauracja. W ofercie znajduje się: Alkohol, Jedzenie późnym wieczorem, Kawa, Koktajle, Małe porcje, Piwo, Szybka przekąska, To miejsce oferuje dania wegańskie. Specjalne cechy miejsca: Dobra kawa, Dobre desery, Duży wybór herbat. Atmosfera jest opisywana jako: Kameralne, Modne, Niezobowiązująca atmosfera, Spokojne. Miejsce oferuje udogodnienia dostępności: Miejsca dla osób na wózkach, Wejście dostępne dla osób na wózkach. Dostępne udogodnienia to: Bar na miejscu, Toaleta. Typowa grupa odwiedzających: Grupy, Turyści. Jest popularne szczególnie na: Śniadanie, Obiad, Kolacja, Posiłki w pojedynkę.", "google_rating": 4.6, "google_reviews_total": 392, "google_price_range": "40–60"}}
{"oms_id": 12425922185, "name": "Presto", "Współrzędne": "51.818987, 19.430323", "key_words": {"types": ["Pizzeria", "Catering", "Knajpa", "Kuchnia włoska", "Restauracja obiadowa", "Jedzenie z dostawą do domu", "Makarony", "Pizza na telefon", "Pizza na wynos", "Restauracja"], "address": "Jagiellońska 8b, 91-362 Łódź, Polska", "phone": "+48 514 700 105", "opening_hours": {"sobota": "12:00–22:00", "niedziela": "12:00–21:00", "poniedziałek": "12:00–22:00", "wtorek": "12:00–22:00", "środa": "12:00–22:00", "czwartek": "12:00–22:00", "piątek": "12:00–22:00"}, "service_options": ["Ogródek", "Dostawa", "Na wynos", "Na miejscu"], "specials": ["Dobra kawa", "Dobre desery", "Duży wybór herbat"], "popular_for": ["Obiad", "Kolacja", "Posiłki w pojedynkę"], "accessibility": ["Miejsca dla osób na wózkach", "Wejście dostępne dla osób na wózkach"], "offerings": ["Alkohol", "Jedzenie późnym wieczorem", "Kawa", "Małe porcje", "Piwo", "Szybka przekąska", "To miejsce oferuje dania wegańskie", "W ofercie dania wegetariańskie", "Wino"], "amenities": ["Toaleta"], "atmosphere": ["Kameralne", "Niezobowiązująca atmosfera", "Spokojne"], "crowd": ["Grupy", "Turyści"], "children": ["Menu dla dzieci", "Odpowiednie dla dzieci"], "parking": ["Bezpłatny parking", "Bezpłatny parking przy ulicy"], "context": "Miejsce o nazwie Presto to miejsce typu: Pizzeria, Catering, Knajpa, Kuchnia włoska, Restauracja obiadowa, Jedzenie z dostawą do domu, Makarony, Pizza na telefon. W ofercie znajduje się: Alkohol, Jedzenie późnym wieczorem, Kawa, Małe porcje, Piwo, Szybka przekąska, To miejsce oferuje dania wegańskie, W ofercie dania wegetariańskie. Specjalne cechy miejsca: Dobra kawa, Dobre desery, Duży wybór herbat. Atmosfera jest opisywana jako: Kameralne, Niezobowiązująca atmosfera, Spokojne. Miejsce oferuje udogodnienia dostępności: Miejsca dla osób na wózkach, Wejście dostępne dla osób na wózkach. Dostępne udogodnienia to: Toaleta. Typowa grupa odwiedzających: Grupy, Turyści. Jest popularne szczególnie na: Obiad, Kolacja, Posiłki w pojedynkę.", "google_rating": 4.6, "google_reviews_total": 427, "google_price_range": "40–60"}}
{"oms_id": 12497994083, "name": "Starbucks", "Współrzędne": "51.750561, 19.448992", "key_words": {"types": ["Kawiarnia"], "address": "Piotrkowska 155, 90-004 Łódź, Polska", "phone": "+48 512 423 557", "opening_hours": {"sobota": "07:30–22:00", "niedziela": "07:30–22:00", "poniedziałek": "06:30–22:00", "wtorek": "06:30–22:00", "środa": "06:30–22:00", "czwartek": "06:30–22:00", "piątek": "06:30–22:00"}, "service_options": ["Ogródek", "Dostawa", "Na wynos", "Na miejscu"], "specials": ["Dobra kawa", "Dobre desery", "Duży wybór herbat"], "popular_for": ["Śniadanie", "Posiłki w pojedynkę", "Dobre miejsce do pracy na laptopie"], "accessibility": ["Miejsca dla osób na wózkach", "Toaleta dla osób na wózkach", "Wejście dostępne dla osób na wózkach"], "offerings": ["Jedzenie późnym wieczorem", "Kawa", "Małe porcje", "Szybka przekąska"], "amenities": ["Toaleta"], "atmosphere": ["Kameralne", "Modne", "Niezobowiązująca atmosfera", "Spokojne"], "crowd": ["Grupy", "Studenci", "Turyści"], "children": [], "parking": ["Trudno znaleźć miejsce", "Płatny parking przy ulicy"], "context": "Miejsce o nazwie Starbucks to miejsce typu: Kawiarnia. W ofercie znajduje się: Jedzenie późnym wieczorem, Kawa, Małe porcje, Szybka przekąska. Specjalne cechy miejsca: Dobra kawa, Dobre desery, Duży wybór herbat. Atmosfera jest opisywana jako: Kameralne, Modne, Niezobowiązująca atmosfera, Spokojne. Miejsce oferuje udogodnienia dostępności: Miejsca dla osób na wózkach, Toaleta dla osób na wózkach, Wejście dostępne dla osób na wózkach. Dostępne udogodnienia to: Toaleta. Typowa grupa odwiedzających: Grupy, Studenci, Turyści. Jest popularne szczególnie na: Śniadanie, Posiłki w pojedynkę, Dobre miejsce do pracy na laptopie.", "google_rating": 4.4, "google_reviews_total": 1069, "google_price_range": "20–40"}}
{"oms_id": 12573454901, "name": "Roma", "Współrzędne": "51.762710, 19.457997", "key_words": {"types": ["Kuchnia włoska", "Restauracja"], "address": "Piotrkowska 122, 90-060 Łódź, Polska", "phone": "+48 576 706 606", "opening_hours": {"sobota": "12:00–23:00", "niedziela": "12:00–21:00", "poniedziałek": "12:00–21:00", "wtorek": "12:00–22:00", "środa": "12:00–22:00", "czwartek": "12:00–22:00", "piątek": "12:00–23:00"}, "service_options": ["Dostawa", "Na wynos", "Na miejscu"], "specials": ["Dobra kawa", "Dobre desery", "Dobre drinki", "Duży wybór herbat", "Muzyka na żywo", "Obszerna karta win"], "popular_for": ["Obiad", "Kolacja", "Posiłki w pojedynkę"], "accessibility": ["Miejsca dla osób na wózkach"], "offerings": ["Alkohol", "Alkohol wysokoprocentowy", "Jedzenie późnym wieczorem", "Kawa", "Koktajle", "Piwo", "To miejsce oferuje dania wegańskie", "W ofercie dania wegetariańskie", "Wino"], "amenities": ["Bar na miejscu", "Toaleta"], "atmosphere": ["Kameralne", "Modne", "Niezobowiązująca atmosfera", "Romantyczna atmosfera", "Spokojne"], "crowd": ["Dla całej rodziny", "Grupy", "Turyści"], "children": ["Ma przewijak(i)", "Odpowiednie dla dzieci"], "parking": ["Płatny parking przy ulicy"], "context": "Miejsce o nazwie Roma to miejsce typu: Kuchnia włoska, Restauracja. W ofercie znajduje się: Alkohol, Alkohol wysokoprocentowy, Jedzenie późnym wieczorem, Kawa, Koktajle, Piwo, To miejsce oferuje dania wegańskie, W ofercie dania wegetariańskie. Specjalne cechy miejsca: Dobra kawa, Dobre desery, Dobre drinki, Duży wybór herbat, Muzyka na żywo, Obszerna karta win. Atmosfera jest opisywana jako: Kameralne, Modne, Niezobowiązująca atmosfera, Romantyczna atmosfera, Spokojne. Miejsce oferuje udogodnienia dostępności: Miejsca dla osób na wózkach. Dostępne udogodnienia to: Bar na miejscu, Toaleta. Typowa grupa odwiedzających: Dla całej rodziny, Grupy, Turyści. Jest popularne szczególnie na: Obiad, Kolacja, Posiłki w pojedynkę.", "google_rating": 4.6, "google_reviews_total": 2921, "google_price_range": "40–60"}}
{"oms_id": 12593476011, "name": "Sayuri Sushi", "Współrzędne": "51.749291, 19.468778", "key_words": {"types": ["Restauracja"], "address": "Milionowa 8a, 93-193 Łódź, Polska", "phone": "+48 506 050 068", "opening_hours": {"sobota": "12:00–23:00", "niedziela": "12:00–21:00", "poniedziałek": "14:00–21:00", "wtorek": "12:00–21:00", "środa": "12:00–21:00", "czwartek": "12:00–21:00", "piątek": "12:00–23:00"}, "service_options": ["Dostawa", "Na wynos", "Na miejscu"], "specials": ["Duży wybór herbat"], "popular_for": ["Obiad", "Kolacja", "Posiłki w pojedynkę"], "accessibility": [], "offerings": ["Jedzenie późnym wieczorem", "Małe porcje"], "amenities": [], "atmosphere": ["Kameralne", "Modne", "Niezobowiązująca atmosfera", "Spokojne"], "crowd": ["Turyści"], "children": [], "parking": [], "context": "Miejsce o nazwie Sayuri Sushi to miejsce typu: Restauracja. W ofercie znajduje się: Jedzenie późnym wieczorem, Małe porcje. Specjalne cechy miejsca: Duży wybór herbat. Atmosfera jest opisywana jako: Kameralne, Modne, Niezobowiązująca atmosfera, Spokojne. Typowa grupa odwiedzających: Turyści. Jest popularne szczególnie na: Obiad, Kolacja, Posiłki w pojedynkę.", "google_rating": 4.9, "google_reviews_total": 219, "google_price_range": "40–60"}}
{"oms_id": 12606493669, "name": "Thai Wok", "Współrzędne": "51.749768, 19.448491", "key_words": {"types": ["Kuchnia tajska"], "address": "aleje Politechniki 1, 93-590 Łódź, Polska", "phone": "+48 697 100 027", "opening_hours": {"sobota": "10:00–21:00", "niedziela": "Zamknięte", "poniedziałek": "10:00–21:00", "wtorek": "10:00–21:00", "środa": "10:00–21:00", "czwartek": "10:00–21:00", "piątek": "10:00–21:00"}, "service_options": ["Dostawa bez kontaktu", "Dostawa", "Na wynos", "Na miejscu"], "specials": [], "popular_for": ["Obiad", "Kolacja", "Posiłki w pojedynkę"], "accessibility": [], "offerings": ["Jedzenie późnym wieczorem", "Małe porcje", "Szybka przekąska", "To miejsce oferuje dania wegańskie", "W ofercie dania wegetariańskie"], "amenities": [], "atmosphere": ["Niezobowiązująca atmosfera", "Spokojne"], "crowd": ["Turyści"], "children": [], "parking": ["Bezpłatny parking", "Bezpłatny parking podziemny", "Dużo miejsc parkingowych", "Płatny parking"], "context": "Miejsce o nazwie Thai Wok to miejsce typu: Kuchnia tajska. W ofercie znajduje się: Jedzenie późnym wieczorem, Małe porcje, Szybka przekąska, To miejsce oferuje dania wegańskie, W ofercie dania wegetariańskie. Atmosfera jest opisywana jako: Niezobowiązująca atmosfera, Spokojne. Typowa grupa odwiedzających: Turyści. Jest popularne szczególnie na: Obiad, Kolacja, Posiłki w pojedynkę.", "google_rating": 3.7, "google_reviews_total": 75, "google_price_range": "20–40"}}
{"oms_id": 12606493672, "name": "Kuchnia Marché", "Współrzędne": "51.749804, 19.448967", "key_words": {"types": ["Restauracja"], "address": "al. marsz. Józefa Piłsudskiego 15/23, 90-307 Łódź, Polska", "phone": "+48 508 104 109", "opening_hours": {"sobota": "09:00–21:00", "niedziela": "Zamknięte", "poniedziałek": "09:00–21:00", "wtorek": "09:00–21:00", "środa": "09:00–21:00", "czwartek": "09:00–21:00", "piątek": "09:00–21:00"}, "service_options": ["Na wynos", "Na miejscu"], "specials": ["Dobre desery", "Duży wybór herbat"], "popular_for": ["Obiad", "Kolacja", "Posiłki w pojedynkę"], "accessibility": ["Miejsca dla osób na wózkach", "Parking dostępny dla osób na wózkach", "Toaleta dla osób na wózkach", "Wejście dostępne dla osób na wózkach"], "offerings": ["Kawa", "Małe porcje", "Szybka przekąska"], "amenities": ["Toaleta"], "atmosphere": ["Niezobowiązująca atmosfera", "Spokojne"], "crowd": ["Grupy", "Turyści"], "children": ["Menu dla dzieci", "Odpowiednie dla dzieci"], "parking": ["Bezpłatny parking", "Bezpłatny parking przy ulicy", "Dużo miejsc parkingowych", "Płatny parking"], "context": "Miejsce o nazwie Kuchnia Marché to miejsce typu: Restauracja. W ofercie znajduje się: Kawa, Małe porcje, Szybka przekąska. Specjalne cechy miejsca: Dobre desery, Duży wybór herbat. Atmosfera jest opisywana jako: Niezobowiązująca atmosfera, Spokojne. Miejsce oferuje udogodnienia dostępności: Miejsca dla osób na wózkach, Parking dostępny dla osób na wózkach, Toaleta dla osób na wózkach, Wejście dostępne dla osób na wózkach. Dostępne udogodnienia to: Toaleta. Typowa grupa odwiedzających: Grupy, Turyści. Jest popularne szczególnie na: Obiad, Kolacja, Posiłki w pojedynkę.", "google_rating": 3.4, "google_reviews_total": 283, "google_price_range": "20–40"}}
{"oms_id": 12606493673, "name": "China Hotpot", "Współrzędne": "51.749789, 19.448744", "key_words": {"types": ["Restauracja", "Grill", "Restauracja z bufetem", "Kuchnia chińska", "Restauracja typu hot pot"], "address": "Pańska 100, 00-837 Warszawa, Polska", "phone": "+48 732 553 555", "opening_hours": {"sobota": "12:00–23:00", "niedziela": "12:00–22:00", "poniedziałek": "12:00–22:00", "wtorek": "12:00–22:00", "środa": "12:00–22:00", "czwartek": "12:00–22:00", "piątek": "12:00–23:00"}, "service_options": ["Na wynos", "Na miejscu"], "specials": ["Dobra kawa", "Dobre desery", "Dobre drinki", "Duży wybór herbat"], "popular_for": ["Obiad", "Kolacja"], "accessibility": ["Miejsca dla osób na wózkach", "Wejście dostępne dla osób na wózkach"], "offerings": ["Alkohol", "Alkohol wysokoprocentowy", "Jedzenie późnym wieczorem", "Kawa", "Koktajle", "Małe porcje", "Piwo", "Prywatna sala", "Wino"], "amenities": ["Bar na miejscu", "Toaleta"], "atmosphere": ["Kameralne", "Modne", "Niezobowiązująca atmosfera", "Spokojne"], "crowd": ["Grupy", "Turyści"], "children": [], "parking": ["Płatny parking", "Płatny parking przy ulicy"], "context": "Miejsce o nazwie China Hotpot to miejsce typu: Restauracja, Grill, Restauracja z bufetem, Kuchnia chińska, Restauracja typu hot pot. W ofercie znajduje się: Alkohol, Alkohol wysokoprocentowy, Jedzenie późnym wieczorem, Kawa, Koktajle, Małe porcje, Piwo, Prywatna sala. Specjalne cechy miejsca: Dobra kawa, Dobre desery, Dobre drinki, Duży wybór herbat. Atmosfera jest opisywana jako: Kameralne, Modne, Niezobowiązująca atmosfera, Spokojne. Miejsce oferuje udogodnienia dostępności: Miejsca dla osób na wózkach, Wejście dostępne dla osób na wózkach. Dostępne udogodnienia to: Bar na miejscu, Toaleta. Typowa grupa odwiedzających: Grupy, Turyści. Jest popularne szczególnie na: Obiad, Kolacja.", "google_rating": 4.6, "google_reviews_total": 970, "google_price_range": "120–140"}}
{"oms_id": 12606493675, "name": "Crazy Bubble", "Współrzędne": "51.749603, 19.448761", "key_words": {"types": ["Herbaciarnia", "Kawiarnia"], "address": "aleje Politechniki 1, 93-590 Łódź, Polska", "phone": "+48 531 252 453", "opening_hours": {"sobota": "10:00–21:00", "niedziela": "Zamknięte", "poniedziałek": "10:00–21:00", "wtorek": "10:00–21:00", "środa": "10:00–21:00", "czwartek": "10:00–21:00", "piątek": "10:00–21:00"}, "service_options": ["Usługi na miejscu", "Na wynos", "Na miejscu"], "specials": ["Duży wybór herbat"], "popular_for": [], "accessibility": [], "offerings": [], "amenities": [], "atmosphere": [], "crowd": ["Miejsce przyjazne dla osób transpłciowych", "Przyjazne dla osób LGBTQ+"], "children": [], "parking": ["Bezpłatny parking"], "context": "Miejsce o nazwie Crazy Bubble to miejsce typu: Herbaciarnia, Kawiarnia. Specjalne cechy miejsca: Duży wybór herbat. Typowa grupa odwiedzających: Miejsce przyjazne dla osób transpłciowych, Przyjazne dla osób LGBTQ+.", "google_rating": 4.7, "google_reviews_total": 53, "google_price_range": null}}
{"oms_id": 12656866390, "name": "HASHTAG SUSHI", "Współrzędne": "51.763698, 19.456881", "key_words": {"types": ["Sushi", "Restauracja śniadaniowa", "Restauracja japońska", "Makarony", "Ramen", "Sushi na wynos"], "address": "Piotrkowska 113/115, 90-430 Łódź, Polska", "phone": "+48 42 632 81 90", "opening_hours": {"sobota": "10:00–22:00", "niedziela": "10:00–22:00", "poniedziałek": "10:00–21:00", "wtorek": "10:00–21:00", "środa": "10:00–21:00", "czwartek": "10:00–22:00", "piątek": "10:00–22:00"}, "service_options": ["Ogródek", "Dostawa bez kontaktu", "Dostawa", "Obsługa zmotoryzowanych", "Usługi na miejscu", "Na wynos", "Na miejscu"], "specials": ["Duży wybór herbat", "Sport"], "popular_for": ["Obiad", "Kolacja", "Posiłki w pojedynkę"], "accessibility": ["Miejsca dla osób na wózkach"], "offerings": ["Alkohol", "Dania z produktów ekologicznych", "Drinki w promocji happy hours", "Jedzenie późnym wieczorem", "Jedzenie w promocji happy hours", "Jesz, ile chcesz", "Kawa", "Koktajle", "Małe porcje", "Piwo", "Szybka przekąska", "To miejsce oferuje dania wegańskie", "W ofercie dania wegetariańskie", "Wino"], "amenities": ["Toaleta", "Toaleta unisex", "Wi-Fi", "Bezpłatne Wi-Fi"], "atmosphere": ["Kameralne", "Modne", "Niezobowiązująca atmosfera", "Spokojne"], "crowd": ["Dla całej rodziny", "Grupy", "Miejsce przyjazne dla osób transpłciowych", "Przyjazne dla osób LGBTQ+", "Turyści"], "children": ["Menu dla dzieci", "Odpowiednie dla dzieci"], "parking": ["Bezpłatny parking", "Dużo miejsc parkingowych"], "context": "Miejsce o nazwie HASHTAG SUSHI to miejsce typu: Sushi, Restauracja śniadaniowa, Restauracja japońska, Makarony, Ramen, Sushi na wynos. W ofercie znajduje się: Alkohol, Dania z produktów ekologicznych, Drinki w promocji happy hours, Jedzenie późnym wieczorem, Jedzenie w promocji happy hours, Jesz, ile chcesz, Kawa, Koktajle. Specjalne cechy miejsca: Duży wybór herbat, Sport. Atmosfera jest opisywana jako: Kameralne, Modne, Niezobowiązująca atmosfera, Spokojne. Miejsce oferuje udogodnienia dostępności: Miejsca dla osób na wózkach. Dostępne udogodnienia to: Toaleta, Toaleta unisex, Wi-Fi, Bezpłatne Wi-Fi. Typowa grupa odwiedzających: Dla całej rodziny, Grupy, Miejsce przyjazne dla osób transpłciowych, Przyjazne dla osób LGBTQ+, Turyści. Jest popularne szczególnie na: Obiad, Kolacja, Posiłk...", "google_rating": 3.9, "google_reviews_total": 831, "google_price_range": "40–60"}}
{"oms_id": 12672969576, "name": "Wok-Art", "Współrzędne": "51.742755, 19.384684", "key_words": {"types": ["Restauracja orientalna", "Kuchnia azjatycka", "Kuchnia tajska", "Kuchnia wietnamska"], "address": "aleja Kardynała Stefana Wyszyńskiego 111, 94-050 Łódź, Polska", "phone": "+48 515 459 200", "opening_hours": {"sobota": "12:00–21:00", "niedziela": "12:00–20:00", "poniedziałek": "11:00–21:00", "wtorek": "11:00–21:00", "środa": "11:00–21:00", "czwartek": "11:00–21:00", "piątek": "11:00–21:00"}, "service_options": ["Ogródek", "Dostawa bez kontaktu", "Dostawa", "Na wynos", "Na miejscu"], "specials": [], "popular_for": ["Obiad", "Kolacja", "Posiłki w pojedynkę"], "accessibility": [], "offerings": ["Jedzenie późnym wieczorem", "Szybka przekąska", "To miejsce oferuje dania wegańskie", "W ofercie dania wegetariańskie"], "amenities": ["Toaleta"], "atmosphere": ["Niezobowiązująca atmosfera", "Spokojne"], "crowd": ["Turyści"], "children": [], "parking": ["Bezpłatny parking", "Bezpłatny parking przy ulicy", "Raczej trudno znaleźć miejsce"], "context": "Miejsce o nazwie Wok-Art to miejsce typu: Restauracja orientalna, Kuchnia azjatycka, Kuchnia tajska, Kuchnia wietnamska. W ofercie znajduje się: Jedzenie późnym wieczorem, Szybka przekąska, To miejsce oferuje dania wegańskie, W ofercie dania wegetariańskie. Atmosfera jest opisywana jako: Niezobowiązująca atmosfera, Spokojne. Dostępne udogodnienia to: Toaleta. Typowa grupa odwiedzających: Turyści. Jest popularne szczególnie na: Obiad, Kolacja, Posiłki w pojedynkę.", "google_rating": 4.3, "google_reviews_total": 267, "google_price_range": "20–40"}}
{"oms_id": 12735263940, "name": "Boska Włoska", "Współrzędne": "51.730348, 19.504425", "key_words": {"types": ["Pizzeria"], "address": "Gojawiczyńskiej 22, 93-253 Łódź, Polska", "phone": "+48 42 307 07 07", "opening_hours": {"sobota": "12:00–21:00", "niedziela": "12:00–21:00", "poniedziałek": "12:00–21:00", "wtorek": "12:00–21:00", "środa": "12:00–21:00", "czwartek": "12:00–21:00", "piątek": "12:00–21:00"}, "service_options": ["Ogródek", "Dostawa bez kontaktu", "Dostawa", "Na wynos", "Na miejscu"], "specials": ["Dobra kawa", "Dobre desery", "Duży wybór herbat"], "popular_for": ["Obiad", "Kolacja", "Posiłki w pojedynkę"], "accessibility": ["Miejsca dla osób na wózkach", "Parking dostępny dla osób na wózkach"], "offerings": ["Alkohol", "Jedzenie późnym wieczorem", "Kawa", "Koktajle", "Małe porcje", "Piwo", "Szybka przekąska", "To miejsce oferuje dania wegańskie", "W ofercie dania wegetariańskie", "Wino"], "amenities": ["Toaleta", "Toaleta unisex", "Wi-Fi", "Bezpłatne Wi-Fi"], "atmosphere": ["Kameralne", "Modne", "Niezobowiązująca atmosfera", "Spokojne"], "crowd": ["Dla całej rodziny", "Grupy", "Turyści"], "children": ["Krzesełka do karmienia", "Menu dla dzieci", "Odpowiednie dla dzieci"], "parking": ["Bezpłatny parking", "Bezpłatny parking przy ulicy", "Dużo miejsc parkingowych"], "context": "Miejsce o nazwie Boska Włoska to miejsce typu: Pizzeria. W ofercie znajduje się: Alkohol, Jedzenie późnym wieczorem, Kawa, Koktajle, Małe porcje, Piwo, Szybka przekąska, To miejsce oferuje dania wegańskie. Specjalne cechy miejsca: Dobra kawa, Dobre desery, Duży wybór herbat. Atmosfera jest opisywana jako: Kameralne, Modne, Niezobowiązująca atmosfera, Spokojne. Miejsce oferuje udogodnienia dostępności: Miejsca dla osób na wózkach, Parking dostępny dla osób na wózkach. Dostępne udogodnienia to: Toaleta, Toaleta unisex, Wi-Fi, Bezpłatne Wi-Fi. Typowa grupa odwiedzających: Dla całej rodziny, Grupy, Turyści. Jest popularne szczególnie na: Obiad, Kolacja, Posiłki w pojedynkę.", "google_rating": 4.5, "google_reviews_total": 992, "google_price_range": "40–60"}}
{"oms_id": 12762740485, "name": "Bukowiecki Sushi", "Współrzędne": "51.824068, 19.438680", "key_words": {"types": ["Sushi", "Restauracja japońska", "Sushi na wynos"], "address": "Świtezianki 31, 91-496 Łódź, Polska", "phone": "+48 790 666 865", "opening_hours": {"sobota": "11:00–22:00", "niedziela": "13:00–21:00", "poniedziałek": "Zamknięte", "wtorek": "Zamknięte", "środa": "12:00–21:00", "czwartek": "12:00–21:00", "piątek": "11:00–22:00"}, "service_options": ["Dostawa bez kontaktu", "Dostawa", "Na wynos", "Na miejscu"], "specials": ["Duży wybór herbat"], "popular_for": ["Obiad", "Kolacja", "Posiłki w pojedynkę"], "accessibility": [], "offerings": ["Dania z produktów ekologicznych", "Jedzenie późnym wieczorem", "Kawa", "Małe porcje", "Szybka przekąska", "To miejsce oferuje dania wegańskie", "W ofercie dania wegetariańskie"], "amenities": [], "atmosphere": ["Modne", "Niezobowiązująca atmosfera", "Spokojne"], "crowd": ["Dla całej rodziny", "Miejsce przyjazne dla osób transpłciowych", "Studenci"], "children": ["Menu dla dzieci"], "parking": ["Bezpłatny parking", "Bezpłatny parking przy ulicy"], "context": "Miejsce o nazwie Bukowiecki Sushi to miejsce typu: Sushi, Restauracja japońska, Sushi na wynos. W ofercie znajduje się: Dania z produktów ekologicznych, Jedzenie późnym wieczorem, Kawa, Małe porcje, Szybka przekąska, To miejsce oferuje dania wegańskie, W ofercie dania wegetariańskie. Specjalne cechy miejsca: Duży wybór herbat. Atmosfera jest opisywana jako: Modne, Niezobowiązująca atmosfera, Spokojne. Typowa grupa odwiedzających: Dla całej rodziny, Miejsce przyjazne dla osób transpłciowych, Studenci. Jest popularne szczególnie na: Obiad, Kolacja, Posiłki w pojedynkę.", "google_rating": 4.8, "google_reviews_total": 385, "google_price_range": "$$"}}
{"oms_id": 12800715488, "name": "Basilia", "Współrzędne": "51.819163, 19.435215", "key_words": {"types": ["Pizzeria"], "address": "Telimeny 8, 91-498 Łódź, Polska", "phone": "", "opening_hours": {"sobota": "13:00–23:00", "niedziela": "13:00–22:00", "poniedziałek": "13:00–22:00", "wtorek": "13:00–22:00", "środa": "13:00–22:00", "czwartek": "13:00–22:00", "piątek": "13:00–23:00"}, "service_options": ["Dostawa bez kontaktu", "Dostawa", "Na wynos", "Na miejscu"], "specials": [], "popular_for": ["Obiad", "Kolacja", "Posiłki w pojedynkę"], "accessibility": [], "offerings": ["Jedzenie późnym wieczorem", "Kawa", "Małe porcje", "Szybka przekąska", "To miejsce oferuje dania wegańskie", "W ofercie dania wegetariańskie"], "amenities": [], "atmosphere": ["Kameralne", "Modne", "Niezobowiązująca atmosfera", "Spokojne"], "crowd": ["Turyści"], "children": ["Odpowiednie dla dzieci"], "parking": ["Bezpłatny parking", "Bezpłatny parking przy ulicy", "Dużo miejsc parkingowych"], "context": "Miejsce o nazwie Basilia to miejsce typu: Pizzeria. W ofercie znajduje się: Jedzenie późnym wieczorem, Kawa, Małe porcje, Szybka przekąska, To miejsce oferuje dania wegańskie, W ofercie dania wegetariańskie. Atmosfera jest opisywana jako: Kameralne, Modne, Niezobowiązująca atmosfera, Spokojne. Typowa grupa odwiedzających: Turyści. Jest popularne szczególnie na: Obiad, Kolacja, Posiłki w pojedynkę.", "google_rating": 4.4, "google_reviews_total": 249, "google_price_range": "20–40"}}
{"oms_id": 12868899849, "name": "Manekin", "Współrzędne": "51.757595, 19.462588", "key_words": {"types": ["Naleśnikarnia", "Restauracja"], "address": "6 Sierpnia 1, 90-422 Łódź, Polska", "phone": "+48 570 842 259", "opening_hours": {"sobota": "10:00–23:30", "niedziela": "10:00–22:30", "poniedziałek": "10:00–22:30", "wtorek": "10:00–22:30", "środa": "10:00–22:30", "czwartek": "10:00–22:30", "piątek": "10:00–23:30"}, "service_options": ["Ogródek", "Na wynos", "Na miejscu"], "specials": ["Dobra kawa", "Dobre desery", "Duży wybór herbat"], "popular_for": ["Śniadanie", "Obiad", "Kolacja", "Posiłki w pojedynkę"], "accessibility": [], "offerings": ["Alkohol", "Alkohol wysokoprocentowy", "Dania z produktów ekologicznych", "Jedzenie późnym wieczorem", "Kawa", "Koktajle", "Małe porcje", "Piwo", "To miejsce oferuje dania wegańskie", "W ofercie dania wegetariańskie", "Wino"], "amenities": ["Bar na miejscu", "Toaleta"], "atmosphere": ["Kameralne", "Modne", "Niezobowiązująca atmosfera", "Romantyczna atmosfera", "Spokojne"], "crowd": ["Dla całej rodziny", "Grupy", "Studenci", "Turyści"], "children": ["Krzesełka do karmienia", "Menu dla dzieci", "Odpowiednie dla dzieci"], "parking": ["Płatny parking przy ulicy"], "context": "Miejsce o nazwie Manekin to miejsce typu: Naleśnikarnia, Restauracja. W ofercie znajduje się: Alkohol, Alkohol wysokoprocentowy, Dania z produktów ekologicznych, Jedzenie późnym wieczorem, Kawa, Koktajle, Małe porcje, Piwo. Specjalne cechy miejsca: Dobra kawa, Dobre desery, Duży wybór herbat. Atmosfera jest opisywana jako: Kameralne, Modne, Niezobowiązująca atmosfera, Romantyczna atmosfera, Spokojne. Dostępne udogodnienia to: Bar na miejscu, Toaleta. Typowa grupa odwiedzających: Dla całej rodziny, Grupy, Studenci, Turyści. Jest popularne szczególnie na: Śniadanie, Obiad, Kolacja, Posiłki w pojedynkę.", "google_rating": 4.5, "google_reviews_total": 13076, "google_price_range": "$"}}
{"oms_id": 13127932061, "name": "Costa", "Współrzędne": "51.779180, 19.444680", "key_words": {"types": ["Kawiarnia"], "address": "al. marsz. Józefa Piłsudskiego 15/23, 90-307 Łódź, Polska", "phone": "+48 453 569 732", "opening_hours": {"sobota": "09:00–21:00", "niedziela": "Zamknięte", "poniedziałek": "09:00–21:00", "wtorek": "09:00–21:00", "środa": "09:00–21:00", "czwartek": "09:00–21:00", "piątek": "09:00–21:00"}, "service_options": ["Dostawa", "Na wynos", "Na miejscu"], "specials": ["Dobra kawa", "Dobre desery", "Duży wybór herbat"], "popular_for": ["Śniadanie", "Posiłki w pojedynkę", "Dobre miejsce do pracy na laptopie"], "accessibility": ["Miejsca dla osób na wózkach", "Wejście dostępne dla osób na wózkach"], "offerings": ["Kawa", "Małe porcje", "Szybka przekąska", "W ofercie dania wegetariańskie"], "amenities": [], "atmosphere": ["Kameralne", "Modne", "Niezobowiązująca atmosfera", "Spokojne"], "crowd": ["Grupy", "Przyjazne dla osób LGBTQ+", "Studenci", "Turyści"], "children": ["Odpowiednie dla dzieci"], "parking": ["Bezpłatny parking", "Dużo miejsc parkingowych"], "context": "Miejsce o nazwie Costa to miejsce typu: Kawiarnia. W ofercie znajduje się: Kawa, Małe porcje, Szybka przekąska, W ofercie dania wegetariańskie. Specjalne cechy miejsca: Dobra kawa, Dobre desery, Duży wybór herbat. Atmosfera jest opisywana jako: Kameralne, Modne, Niezobowiązująca atmosfera, Spokojne. Miejsce oferuje udogodnienia dostępności: Miejsca dla osób na wózkach, Wejście dostępne dla osób na wózkach. Typowa grupa odwiedzających: Grupy, Przyjazne dla osób LGBTQ+, Studenci, Turyści. Jest popularne szczególnie na: Śniadanie, Posiłki w pojedynkę, Dobre miejsce do pracy na laptopie.", "google_rating": 4.2, "google_reviews_total": 593, "google_price_range": "20–40"}}
{"oms_id": 13163549419, "name": "Kawka", "Współrzędne": "51.773412, 19.466139", "key_words": {"types": ["Kawiarnia", "Ciasta i tarty", "Kanapki", "Herbaciarnia"], "address": "Polskiej Organizacji Wojskowej 17, 90-248 Łódź, Polska", "phone": "+48 793 180 537", "opening_hours": {"sobota": "09:00–19:00", "niedziela": "13:00–19:00", "poniedziałek": "09:00–19:00", "wtorek": "09:00–19:00", "środa": "09:00–19:00", "czwartek": "09:00–19:00", "piątek": "09:00–19:00"}, "service_options": ["Na wynos", "Na miejscu"], "specials": ["Dobra kawa", "Dobre desery", "Duży wybór herbat"], "popular_for": ["Śniadanie", "Posiłki w pojedynkę", "Dobre miejsce do pracy na laptopie"], "accessibility": [], "offerings": ["Dania gotowe", "Dania z produktów ekologicznych", "Kawa", "Szybka przekąska"], "amenities": ["Toaleta"], "atmosphere": ["Kameralne", "Modne", "Niezobowiązująca atmosfera", "Romantyczna atmosfera", "Spokojne"], "crowd": ["Dla całej rodziny", "Studenci", "Turyści"], "children": [], "parking": ["Raczej trudno znaleźć miejsce"], "context": "Miejsce o nazwie Kawka to miejsce typu: Kawiarnia, Ciasta i tarty, Kanapki, Herbaciarnia. W ofercie znajduje się: Dania gotowe, Dania z produktów ekologicznych, Kawa, Szybka przekąska. Specjalne cechy miejsca: Dobra kawa, Dobre desery, Duży wybór herbat. Atmosfera jest opisywana jako: Kameralne, Modne, Niezobowiązująca atmosfera, Romantyczna atmosfera, Spokojne. Dostępne udogodnienia to: Toaleta. Typowa grupa odwiedzających: Dla całej rodziny, Studenci, Turyści. Jest popularne szczególnie na: Śniadanie, Posiłki w pojedynkę, Dobre miejsce do pracy na laptopie.", "google_rating": 4.9, "google_reviews_total": 235, "google_price_range": "20–40"}}
{"oms_id": 13172000504, "name": "Coffee to go", "Współrzędne": "51.769838, 19.469073", "key_words": {"types": ["Kawiarnia", "Sklep z herbatą", "Restauracja z deserami", "Lodziarnia", "Pijalnia soków", "Restauracja z daniami na wynos", "Herbaciarnia", "Kuchnia wegańska"], "address": "Piotrkowska 31, 90-410 Łódź, Polska", "phone": "+48 574 613 137", "opening_hours": {"sobota": "10:00–20:00", "niedziela": "10:00–20:00", "poniedziałek": "10:00–20:00", "wtorek": "10:00–20:00", "środa": "10:00–20:00", "czwartek": "10:00–20:00", "piątek": "10:00–20:00"}, "service_options": ["Dostawa bez kontaktu", "Dostawa", "Obsługa zmotoryzowanych", "Na wynos", "Na miejscu"], "specials": [], "popular_for": [], "accessibility": [], "offerings": ["Kawa"], "amenities": [], "atmosphere": [], "crowd": [], "children": [], "parking": [], "context": "Miejsce o nazwie Coffee to go to miejsce typu: Kawiarnia, Sklep z herbatą, Restauracja z deserami, Lodziarnia, Pijalnia soków, Restauracja z daniami na wynos, Herbaciarnia, Kuchnia wegańska. W ofercie znajduje się: Kawa.", "google_rating": 4.9, "google_reviews_total": 161, "google_price_range": "20–40"}}
{"oms_id": 13172000505, "name": "Coffee to go", "Współrzędne": "51.769709, 19.467940", "key_words": {"types": ["Kawiarnia", "Sklep z herbatą", "Restauracja z deserami", "Lodziarnia", "Pijalnia soków", "Restauracja z daniami na wynos", "Herbaciarnia", "Kuchnia wegańska"], "address": "Piotrkowska 31, 90-410 Łódź, Polska", "phone": "+48 574 613 137", "opening_hours": {"sobota": "10:00–20:00", "niedziela": "10:00–20:00", "poniedziałek": "10:00–20:00", "wtorek": "10:00–20:00", "środa": "10:00–20:00", "czwartek": "10:00–20:00", "piątek": "10:00–20:00"}, "service_options": ["Dostawa bez kontaktu", "Dostawa", "Obsługa zmotoryzowanych", "Na wynos", "Na miejscu"], "specials": [], "popular_for": [], "accessibility": [], "offerings": ["Kawa"], "amenities": [], "atmosphere": [], "crowd": [], "children": [], "parking": [], "context": "Miejsce o nazwie Coffee to go to miejsce typu: Kawiarnia, Sklep z herbatą, Restauracja z deserami, Lodziarnia, Pijalnia soków, Restauracja z daniami na wynos, Herbaciarnia, Kuchnia wegańska. W ofercie znajduje się: Kawa.", "google_rating": 4.9, "google_reviews_total": 161, "google_price_range": "20–40"}}
{"oms_id": 13200796076, "name": "Masala Trail", "Współrzędne": "51.777364, 19.454871", "key_words": {"types": ["Restauracja", "Kuchnia indyjska", "Kuchnia nepalska", "Kuchnia wegetariańska"], "address": "Plac Wolności 9, 91-415 Łódź, Polska", "phone": "+48 503 119 995", "opening_hours": {"sobota": "11:00–22:30", "niedziela": "11:00–21:30", "poniedziałek": "Zamknięte", "wtorek": "11:00–21:30", "środa": "11:00–21:30", "czwartek": "11:00–21:30", "piątek": "11:00–22:00"}, "service_options": ["Ogródek", "Dostawa bez kontaktu", "Dostawa", "Na wynos", "Na miejscu"], "specials": [], "popular_for": [], "accessibility": [], "offerings": ["Jesz, ile chcesz", "Piwo", "To miejsce oferuje dania wegańskie", "W ofercie dania wegetariańskie"], "amenities": [], "atmosphere": [], "crowd": [], "children": ["Krzesełka do karmienia", "Ma przewijak(i)", "Menu dla dzieci", "Odpowiednie dla dzieci"], "parking": ["Trudno znaleźć miejsce", "Płatny parking przy ulicy"], "context": "Miejsce o nazwie Masala Trail to miejsce typu: Restauracja, Kuchnia indyjska, Kuchnia nepalska, Kuchnia wegetariańska. W ofercie znajduje się: Jesz, ile chcesz, Piwo, To miejsce oferuje dania wegańskie, W ofercie dania wegetariańskie.", "google_rating": 4.9, "google_reviews_total": 321, "google_price_range": "40–60"}}
{"oms_id": 104142196, "name": "Restauracja Europa", "Współrzędne": "51.757134, 19.457075", "key_words": {"types": ["Restauracja", "Catering posiłków i napojów", "Catering", "Obiekt przeznaczony do organizacji imprez", "Hotel"], "address": "Żołędziowa 100, 44-217 Rybnik, Polska", "phone": "+48 32 421 13 96", "opening_hours": {}, "service_options": ["Ogródek", "Dostawa", "Na wynos", "Na miejscu"], "specials": ["Dobra kawa", "Dobre desery", "Dobre drinki", "Duży wybór herbat", "Duży wybór piw", "Obszerna karta win"], "popular_for": ["Śniadanie", "Obiad", "Kolacja", "Posiłki w pojedynkę"], "accessibility": ["Miejsca dla osób na wózkach", "Parking dostępny dla osób na wózkach", "Toaleta dla osób na wózkach", "Wejście dostępne dla osób na wózkach"], "offerings": ["Alkohol", "Alkohol wysokoprocentowy", "Dania z produktów ekologicznych", "Jedzenie późnym wieczorem", "Kawa", "Koktajle", "Małe porcje", "Piwo", "Prywatna sala", "Szybka przekąska", "To miejsce oferuje dania wegańskie", "W ofercie dania wegetariańskie", "Wino"], "amenities": ["Bar na miejscu", "Toaleta", "Wi-Fi", "Bezpłatne Wi-Fi"], "atmosphere": ["Kameralne", "Modne", "Niezobowiązująca atmosfera", "Romantyczna atmosfera", "Spokojne"], "crowd": ["Dla całej rodziny", "Grupy", "Turyści"], "children": ["Dobre miejsce na przyjęcia urodzinowe dla dzieci", "Krzesełka do karmienia", "Menu dla dzieci", "Odpowiednie dla dzieci"], "parking": ["Bezpłatny parking", "Bezpłatny parking przy ulicy", "Dużo miejsc parkingowych"], "context": "Miejsce o nazwie Restauracja Europa to miejsce typu: Restauracja, Catering posiłków i napojów, Catering, Obiekt przeznaczony do organizacji imprez, Hotel. W ofercie znajduje się: Alkohol, Alkohol wysokoprocentowy, Dania z produktów ekologicznych, Jedzenie późnym wieczorem, Kawa, Koktajle, Małe porcje, Piwo. Specjalne cechy miejsca: Dobra kawa, Dobre desery, Dobre drinki, Duży wybór herbat, Duży wybór piw, Obszerna karta win. Atmosfera jest opisywana jako: Kameralne, Modne, Niezobowiązująca atmosfera, Romantyczna atmosfera, Spokojne. Miejsce oferuje udogodnienia dostępności: Miejsca dla osób na wózkach, Parking dostępny dla osób na wózkach, Toaleta dla osób na wózkach, Wejście dostępne dla osób na wózkach. Dostępne udogodnienia to: Bar na miejscu, Toaleta, Wi-Fi, Bezpłatne Wi-Fi. Typowa...", "google_rating": 4.6, "google_reviews_total": 1099, "google_price_range": null}}
{"oms_id": 104182647, "name": "Da Grasso", "Współrzędne": "51.717078, 19.483928", "key_words": {"types": ["Pizzeria", "Pizza na telefon", "Pizza na wynos", "Restauracja"], "address": "Michała 6, 93-324 Łódź, Polska", "phone": "+48 504 914 514", "opening_hours": {"sobota": "11:00–23:00", "niedziela": "12:00–22:00", "poniedziałek": "11:00–22:00", "wtorek": "11:00–22:00", "środa": "11:00–22:00", "czwartek": "11:00–22:00", "piątek": "11:00–23:00"}, "service_options": ["Ogródek", "Dostawa", "Na wynos", "Na miejscu"], "specials": ["Dobra kawa", "Dobre desery", "Duży wybór herbat", "Duży wybór piw", "Sport"], "popular_for": ["Obiad", "Kolacja", "Posiłki w pojedynkę"], "accessibility": ["Miejsca dla osób na wózkach", "Toaleta dla osób na wózkach", "Wejście dostępne dla osób na wózkach"], "offerings": ["Alkohol", "Jedzenie późnym wieczorem", "Kawa", "Koktajle", "Małe porcje", "Piwo", "Szybka przekąska", "To miejsce oferuje dania wegańskie", "W ofercie dania wegetariańskie", "Wino"], "amenities": ["Toaleta", "Wi-Fi", "Bezpłatne Wi-Fi"], "atmosphere": ["Kameralne", "Modne", "Niezobowiązująca atmosfera", "Spokojne"], "crowd": ["Dla całej rodziny", "Grupy", "Studenci", "Turyści"], "children": ["Dobre miejsce na przyjęcia urodzinowe dla dzieci", "Krzesełka do karmienia", "Menu dla dzieci", "Odpowiednie dla dzieci"], "parking": ["Bezpłatny parking", "Bezpłatny parking przy ulicy", "Dużo miejsc parkingowych"], "context": "Miejsce o nazwie Da Grasso to miejsce typu: Pizzeria, Pizza na telefon, Pizza na wynos, Restauracja. W ofercie znajduje się: Alkohol, Jedzenie późnym wieczorem, Kawa, Koktajle, Małe porcje, Piwo, Szybka przekąska, To miejsce oferuje dania wegańskie. Specjalne cechy miejsca: Dobra kawa, Dobre desery, Duży wybór herbat, Duży wybór piw, Sport. Atmosfera jest opisywana jako: Kameralne, Modne, Niezobowiązująca atmosfera, Spokojne. Miejsce oferuje udogodnienia dostępności: Miejsca dla osób na wózkach, Toaleta dla osób na wózkach, Wejście dostępne dla osób na wózkach. Dostępne udogodnienia to: Toaleta, Wi-Fi, Bezpłatne Wi-Fi. Typowa grupa odwiedzających: Dla całej rodziny, Grupy, Studenci, Turyści. Jest popularne szczególnie na: Obiad, Kolacja, Posiłki w pojedynkę.", "google_rating": 4.2, "google_reviews_total": 1106, "google_price_range": "20–40"}}
{"oms_id": 106874788, "name": "Złota Kaczka", "Współrzędne": "51.786394, 19.380242", "key_words": {"types": ["Kuchnia chińska", "Restauracja"], "address": "Rąbieńska 53, 94-244 Łódź, Polska", "phone": "+48 604 579 889", "opening_hours": {"sobota": "12:00–22:00", "niedziela": "12:00–21:00", "poniedziałek": "12:00–22:00", "wtorek": "12:00–22:00", "środa": "12:00–22:00", "czwartek": "12:00–22:00", "piątek": "12:00–22:00"}, "service_options": ["Ogródek", "Dostawa bez kontaktu", "Dostawa", "Na wynos", "Na miejscu"], "specials": ["Dobra kawa", "Dobre desery", "Dobre drinki", "Duży wybór herbat", "Kominek", "Obszerna karta win"], "popular_for": ["Obiad", "Kolacja", "Posiłki w pojedynkę"], "accessibility": ["Miejsca dla osób na wózkach", "Parking dostępny dla osób na wózkach", "Toaleta dla osób na wózkach", "Wejście dostępne dla osób na wózkach"], "offerings": ["Alkohol", "Alkohol wysokoprocentowy", "Jedzenie późnym wieczorem", "Kawa", "Koktajle", "Małe porcje", "Piwo", "Szybka przekąska", "To miejsce oferuje dania wegańskie", "W ofercie dania wegetariańskie", "Wino"], "amenities": ["Bar na miejscu", "Toaleta", "Wi-Fi", "Bezpłatne Wi-Fi"], "atmosphere": ["Kameralne", "Miejsce luksusowe", "Modne", "Niezobowiązująca atmosfera", "Romantyczna atmosfera", "Spokojne"], "crowd": ["Grupy", "Turyści"], "children": ["Dobre miejsce na przyjęcia urodzinowe dla dzieci", "Krzesełka do karmienia", "Ma przewijak(i)", "Menu dla dzieci", "Odpowiednie dla dzieci"], "parking": ["Bezpłatny parking", "Bezpłatny parking przy ulicy", "Dużo miejsc parkingowych"], "context": "Miejsce o nazwie Złota Kaczka to miejsce typu: Kuchnia chińska, Restauracja. W ofercie znajduje się: Alkohol, Alkohol wysokoprocentowy, Jedzenie późnym wieczorem, Kawa, Koktajle, Małe porcje, Piwo, Szybka przekąska. Specjalne cechy miejsca: Dobra kawa, Dobre desery, Dobre drinki, Duży wybór herbat, Kominek, Obszerna karta win. Atmosfera jest opisywana jako: Kameralne, Miejsce luksusowe, Modne, Niezobowiązująca atmosfera, Romantyczna atmosfera, Spokojne. Miejsce oferuje udogodnienia dostępności: Miejsca dla osób na wózkach, Parking dostępny dla osób na wózkach, Toaleta dla osób na wózkach, Wejście dostępne dla osób na wózkach. Dostępne udogodnienia to: Bar na miejscu, Toaleta, Wi-Fi, Bezpłatne Wi-Fi. Typowa grupa odwiedzających: Grupy, Turyści. Jest popularne szczególnie na: Obiad, Kolac...", "google_rating": 4.4, "google_reviews_total": 1071, "google_price_range": "$$"}}
{"oms_id": 132445803, "name": "Wodnik", "Współrzędne": "51.698416, 19.436246", "key_words": {"types": ["Restauracja", "Pałac ślubów"], "address": "Patriotyczna 2, 93-452 Łódź, Polska", "phone": "+48 509 410 200", "opening_hours": {"sobota": "11:00–22:00", "niedziela": "Zamknięte", "poniedziałek": "11:00–21:00", "wtorek": "11:00–21:00", "środa": "11:00–21:00", "czwartek": "11:00–21:00", "piątek": "11:00–21:00"}, "service_options": ["Ogródek", "Na miejscu"], "specials": ["Dobra kawa", "Dobre desery", "Duży wybór herbat"], "popular_for": ["Obiad", "Kolacja"], "accessibility": ["Miejsca dla osób na wózkach", "Parking dostępny dla osób na wózkach", "Toaleta dla osób na wózkach", "Wejście dostępne dla osób na wózkach"], "offerings": ["Alkohol", "Alkohol wysokoprocentowy", "Kawa", "Koktajle", "Małe porcje", "Piwo", "Prywatna sala", "Wino"], "amenities": ["Toaleta", "Toaleta unisex"], "atmosphere": ["Kameralne", "Niezobowiązująca atmosfera", "Spokojne"], "crowd": ["Grupy"], "children": ["Krzesełka do karmienia", "Menu dla dzieci", "Odpowiednie dla dzieci"], "parking": ["Bezpłatny parking", "Bezpłatny parking przy ulicy", "Dużo miejsc parkingowych"], "context": "Miejsce o nazwie Wodnik to miejsce typu: Restauracja, Pałac ślubów. W ofercie znajduje się: Alkohol, Alkohol wysokoprocentowy, Kawa, Koktajle, Małe porcje, Piwo, Prywatna sala, Wino. Specjalne cechy miejsca: Dobra kawa, Dobre desery, Duży wybór herbat. Atmosfera jest opisywana jako: Kameralne, Niezobowiązująca atmosfera, Spokojne. Miejsce oferuje udogodnienia dostępności: Miejsca dla osób na wózkach, Parking dostępny dla osób na wózkach, Toaleta dla osób na wózkach, Wejście dostępne dla osób na wózkach. Dostępne udogodnienia to: Toaleta, Toaleta unisex. Typowa grupa odwiedzających: Grupy. Jest popularne szczególnie na: Obiad, Kolacja.", "google_rating": 4.5, "google_reviews_total": 637, "google_price_range": "$$"}}
{"oms_id": 151368341, "name": "Da Grasso", "Współrzędne": "51.730585, 19.452988", "key_words": {"types": ["Pizzeria", "Pizza na telefon", "Pizza na wynos", "Restauracja"], "address": "Ignacego Paderewskiego 1/7, 93-530 Łódź, Polska", "phone": "+48 504 915 626", "opening_hours": {"sobota": "11:00–23:00", "niedziela": "12:00–22:00", "poniedziałek": "11:00–22:00", "wtorek": "11:00–22:00", "środa": "11:00–22:00", "czwartek": "11:00–22:00", "piątek": "11:00–23:00"}, "service_options": ["Ogródek", "Dostawa", "Na wynos", "Na miejscu"], "specials": ["Dobra kawa"], "popular_for": ["Obiad", "Kolacja", "Posiłki w pojedynkę"], "accessibility": ["Miejsca dla osób na wózkach", "Toaleta dla osób na wózkach", "Wejście dostępne dla osób na wózkach"], "offerings": ["Alkohol", "Jedzenie późnym wieczorem", "Kawa", "Małe porcje", "Piwo", "Szybka przekąska", "To miejsce oferuje dania wegańskie", "W ofercie dania wegetariańskie"], "amenities": ["Toaleta", "Wi-Fi", "Bezpłatne Wi-Fi"], "atmosphere": ["Kameralne", "Modne", "Niezobowiązująca atmosfera", "Spokojne"], "crowd": ["Dla całej rodziny", "Grupy", "Studenci", "Turyści"], "children": ["Krzesełka do karmienia", "Menu dla dzieci", "Odpowiednie dla dzieci"], "parking": ["Bezpłatny parking", "Bezpłatny parking przy ulicy", "Dużo miejsc parkingowych"], "context": "Miejsce o nazwie Da Grasso to miejsce typu: Pizzeria, Pizza na telefon, Pizza na wynos, Restauracja. W ofercie znajduje się: Alkohol, Jedzenie późnym wieczorem, Kawa, Małe porcje, Piwo, Szybka przekąska, To miejsce oferuje dania wegańskie, W ofercie dania wegetariańskie. Specjalne cechy miejsca: Dobra kawa. Atmosfera jest opisywana jako: Kameralne, Modne, Niezobowiązująca atmosfera, Spokojne. Miejsce oferuje udogodnienia dostępności: Miejsca dla osób na wózkach, Toaleta dla osób na wózkach, Wejście dostępne dla osób na wózkach. Dostępne udogodnienia to: Toaleta, Wi-Fi, Bezpłatne Wi-Fi. Typowa grupa odwiedzających: Dla całej rodziny, Grupy, Studenci, Turyści. Jest popularne szczególnie na: Obiad, Kolacja, Posiłki w pojedynkę.", "google_rating": 3.8, "google_reviews_total": 1267, "google_price_range": "20–40"}}
{"oms_id": 171797953, "name": "Pizzeria Do Orso", "Współrzędne": "51.734524, 19.471405", "key_words": {"types": ["Pizzeria"], "address": "Rzgowska 58, 93-172 Łódź, Polska", "phone": "+48 605 401 407", "opening_hours": {"sobota": "12:00–22:00", "niedziela": "12:00–22:00", "poniedziałek": "12:00–22:00", "wtorek": "12:00–22:00", "środa": "12:00–22:00", "czwartek": "12:00–22:00", "piątek": "12:00–22:00"}, "service_options": ["Dostawa", "Na wynos", "Na miejscu"], "specials": ["Dobra kawa", "Duży wybór herbat"], "popular_for": ["Obiad", "Kolacja", "Posiłki w pojedynkę"], "accessibility": [], "offerings": ["Alkohol", "Jedzenie późnym wieczorem", "Kawa", "Małe porcje", "Piwo", "Szybka przekąska"], "amenities": ["Bar na miejscu", "Toaleta"], "atmosphere": ["Kameralne", "Niezobowiązująca atmosfera", "Spokojne"], "crowd": ["Grupy", "Studenci", "Turyści"], "children": ["Menu dla dzieci", "Odpowiednie dla dzieci"], "parking": ["Bezpłatny parking przy ulicy", "Raczej trudno znaleźć miejsce"], "context": "Miejsce o nazwie Pizzeria Do Orso to miejsce typu: Pizzeria. W ofercie znajduje się: Alkohol, Jedzenie późnym wieczorem, Kawa, Małe porcje, Piwo, Szybka przekąska. Specjalne cechy miejsca: Dobra kawa, Duży wybór herbat. Atmosfera jest opisywana jako: Kameralne, Niezobowiązująca atmosfera, Spokojne. Dostępne udogodnienia to: Bar na miejscu, Toaleta. Typowa grupa odwiedzających: Grupy, Studenci, Turyści. Jest popularne szczególnie na: Obiad, Kolacja, Posiłki w pojedynkę.", "google_rating": 3.6, "google_reviews_total": 671, "google_price_range": "20–60"}}
{"oms_id": 180379626, "name": "Tchibo", "Współrzędne": "51.778949, 19.443769", "key_words": {"types": ["Sklep", "Kawiarnia", "Kafeteria", "Sklep odzieżowy", "Sklep z kawą", "Sklep AGD", "Sklep sportowy", "Sklep wielobranżowy"], "address": "al. marsz. Józefa Piłsudskiego 15/23, 90-307 Łódź, Polska", "phone": "+48 785 789 487", "opening_hours": {"sobota": "09:00–21:00", "niedziela": "Zamknięte", "poniedziałek": "09:00–21:00", "wtorek": "09:00–21:00", "środa": "09:00–21:00", "czwartek": "09:00–21:00", "piątek": "09:00–21:00"}, "service_options": ["Odbiór w sklepie", "Zakupy stacjonarne"], "specials": [], "popular_for": [], "accessibility": ["Miejsca dla osób na wózkach", "Parking dostępny dla osób na wózkach", "Wejście dostępne dla osób na wózkach"], "offerings": [], "amenities": [], "atmosphere": [], "crowd": ["Przyjazne dla osób LGBTQ+"], "children": [], "parking": [], "context": "Miejsce o nazwie Tchibo to miejsce typu: Sklep, Kawiarnia, Kafeteria, Sklep odzieżowy, Sklep z kawą, Sklep AGD, Sklep sportowy, Sklep wielobranżowy. Miejsce oferuje udogodnienia dostępności: Miejsca dla osób na wózkach, Parking dostępny dla osób na wózkach, Wejście dostępne dla osób na wózkach. Typowa grupa odwiedzających: Przyjazne dla osób LGBTQ+.", "google_rating": 4.7, "google_reviews_total": 127, "google_price_range": null}}
{"oms_id": 196281716, "name": "Meat Point", "Współrzędne": "51.786149, 19.449923", "key_words": {"types": ["Kuchnia turecka", "Sklep mięsny", "Delikatesy", "Cukiernia"], "address": "Krótka 11, 91-058 Łódź, Polska", "phone": "+48 576 843 814", "opening_hours": {"sobota": "10:00–23:00", "niedziela": "10:00–22:00", "poniedziałek": "10:00–22:00", "wtorek": "10:00–22:00", "środa": "10:00–22:00", "czwartek": "10:00–22:00", "piątek": "10:00–23:00"}, "service_options": ["Ogródek", "Dostawa", "Usługi na miejscu", "Na wynos", "Na miejscu"], "specials": ["Dobra kawa", "Dobre desery", "Dobre drinki", "Duży wybór herbat"], "popular_for": ["Śniadanie", "Obiad", "Kolacja", "Posiłki w pojedynkę"], "accessibility": ["Miejsca dla osób na wózkach", "Parking dostępny dla osób na wózkach", "Toaleta dla osób na wózkach", "Wejście dostępne dla osób na wózkach"], "offerings": ["Alkohol", "Alkohol wysokoprocentowy", "Bar sałatkowy", "Dania z produktów ekologicznych", "Drinki w promocji happy hours", "Jedzenie późnym wieczorem", "Jedzenie w promocji happy hours", "Kawa", "Koktajle", "Kuchnia halal", "Małe porcje", "Piwo", "Szybka przekąska", "W ofercie dania wegetariańskie", "Wino"], "amenities": ["Bar na miejscu", "Toaleta", "Toaleta unisex"], "atmosphere": ["Kameralne", "Modne", "Niezobowiązująca atmosfera", "Spokojne"], "crowd": ["Dla całej rodziny", "Grupy", "Miejsce przyjazne dla osób transpłciowych", "Przyjazne dla osób LGBTQ+", "Turyści"], "children": ["Krzesełka do karmienia", "Menu dla dzieci", "Odpowiednie dla dzieci"], "parking": ["Bezpłatny parking", "Bezpłatny parking przy ulicy", "Dużo miejsc parkingowych"], "context": "Miejsce o nazwie Meat Point to miejsce typu: Kuchnia turecka, Sklep mięsny, Delikatesy, Cukiernia. W ofercie znajduje się: Alkohol, Alkohol wysokoprocentowy, Bar sałatkowy, Dania z produktów ekologicznych, Drinki w promocji happy hours, Jedzenie późnym wieczorem, Jedzenie w promocji happy hours, Kawa. Specjalne cechy miejsca: Dobra kawa, Dobre desery, Dobre drinki, Duży wybór herbat. Atmosfera jest opisywana jako: Kameralne, Modne, Niezobowiązująca atmosfera, Spokojne. Miejsce oferuje udogodnienia dostępności: Miejsca dla osób na wózkach, Parking dostępny dla osób na wózkach, Toaleta dla osób na wózkach, Wejście dostępne dla osób na wózkach. Dostępne udogodnienia to: Bar na miejscu, Toaleta, Toaleta unisex. Typowa grupa odwiedzających: Dla całej rodziny, Grupy, Miejsce przyjazne dla osó...", "google_rating": 4.5, "google_reviews_total": 1679, "google_price_range": "$$"}}
{"oms_id": 196292474, "name": "Costa", "Współrzędne": "51.703359, 19.415011", "key_words": {"types": ["Kawiarnia"], "address": "Pabianicka 245, 93-457 Łódź, Polska", "phone": "+48 453 569 857", "opening_hours": {"sobota": "10:00–21:00", "niedziela": "Zamknięte", "poniedziałek": "10:00–21:00", "wtorek": "10:00–21:00", "środa": "10:00–21:00", "czwartek": "10:00–21:00", "piątek": "10:00–21:00"}, "service_options": ["Dostawa", "Na wynos", "Na miejscu"], "specials": ["Dobra kawa", "Dobre desery", "Duży wybór herbat"], "popular_for": ["Śniadanie", "Posiłki w pojedynkę", "Dobre miejsce do pracy na laptopie"], "accessibility": ["Miejsca dla osób na wózkach", "Parking dostępny dla osób na wózkach", "Toaleta dla osób na wózkach", "Wejście dostępne dla osób na wózkach"], "offerings": ["Kawa", "Małe porcje", "Szybka przekąska", "W ofercie dania wegetariańskie"], "amenities": ["Toaleta"], "atmosphere": ["Kameralne", "Modne", "Niezobowiązująca atmosfera", "Spokojne"], "crowd": ["Przyjazne dla osób LGBTQ+", "Studenci", "Turyści"], "children": ["Odpowiednie dla dzieci"], "parking": ["Bezpłatny parking", "Bezpłatny parking podziemny", "Bezpłatny parking przy ulicy", "Dużo miejsc parkingowych"], "context": "Miejsce o nazwie Costa to miejsce typu: Kawiarnia. W ofercie znajduje się: Kawa, Małe porcje, Szybka przekąska, W ofercie dania wegetariańskie. Specjalne cechy miejsca: Dobra kawa, Dobre desery, Duży wybór herbat. Atmosfera jest opisywana jako: Kameralne, Modne, Niezobowiązująca atmosfera, Spokojne. Miejsce oferuje udogodnienia dostępności: Miejsca dla osób na wózkach, Parking dostępny dla osób na wózkach, Toaleta dla osób na wózkach, Wejście dostępne dla osób na wózkach. Dostępne udogodnienia to: Toaleta. Typowa grupa odwiedzających: Przyjazne dla osób LGBTQ+, Studenci, Turyści. Jest popularne szczególnie na: Śniadanie, Posiłki w pojedynkę, Dobre miejsce do pracy na laptopie.", "google_rating": 4.3, "google_reviews_total": 233, "google_price_range": "1–20"}}
{"oms_id": 196292614, "name": "Wasabi Sushi", "Współrzędne": "51.703584, 19.415119", "key_words": {"types": ["Sushi"], "address": "CH Port Łódź, ul, Pabianicka 245, 93-457 Łódź, Polska", "phone": "", "opening_hours": {"sobota": "10:00–21:00", "niedziela": "10:00–20:00", "poniedziałek": "10:00–21:00", "wtorek": "10:00–21:00", "środa": "10:00–21:00", "czwartek": "10:00–21:00", "piątek": "10:00–21:00"}, "service_options": ["Dostawa", "Na wynos", "Na miejscu"], "specials": [], "popular_for": ["Obiad", "Kolacja", "Posiłki w pojedynkę"], "accessibility": ["Miejsca dla osób na wózkach", "Wejście dostępne dla osób na wózkach"], "offerings": ["Małe porcje", "Szybka przekąska"], "amenities": [], "atmosphere": ["Niezobowiązująca atmosfera", "Spokojne"], "crowd": [], "children": [], "parking": ["Bezpłatny parking", "Dużo miejsc parkingowych"], "context": "Miejsce o nazwie Wasabi Sushi to miejsce typu: Sushi. W ofercie znajduje się: Małe porcje, Szybka przekąska. Atmosfera jest opisywana jako: Niezobowiązująca atmosfera, Spokojne. Miejsce oferuje udogodnienia dostępności: Miejsca dla osób na wózkach, Wejście dostępne dla osób na wózkach. Jest popularne szczególnie na: Obiad, Kolacja, Posiłki w pojedynkę.", "google_rating": 3.7, "google_reviews_total": 234, "google_price_range": "20–40"}}
{"oms_id": 196292617, "name": "Crazy Bubble", "Współrzędne": "51.703824, 19.416063", "key_words": {"types": ["Herbaciarnia", "Kawiarnia"], "address": "Pabianicka 245, 93-457 Łódź, Polska", "phone": "", "opening_hours": {"sobota": "09:00–21:00", "niedziela": "Zamknięte", "poniedziałek": "09:00–21:00", "wtorek": "09:00–21:00", "środa": "09:00–21:00", "czwartek": "09:00–21:00", "piątek": "09:00–21:00"}, "service_options": ["Usługi na miejscu", "Na wynos", "Na miejscu"], "specials": ["Duży wybór herbat"], "popular_for": [], "accessibility": [], "offerings": [], "amenities": [], "atmosphere": [], "crowd": ["Miejsce przyjazne dla osób transpłciowych", "Przyjazne dla osób LGBTQ+"], "children": [], "parking": ["Bezpłatny parking"], "context": "Miejsce o nazwie Crazy Bubble to miejsce typu: Herbaciarnia, Kawiarnia. Specjalne cechy miejsca: Duży wybór herbat. Typowa grupa odwiedzających: Miejsce przyjazne dla osób transpłciowych, Przyjazne dla osób LGBTQ+.", "google_rating": 3.5, "google_reviews_total": 20, "google_price_range": null}}
{"oms_id": 196292619, "name": "Wasabi Sushi", "Współrzędne": "51.702401, 19.413078", "key_words": {"types": ["Sushi"], "address": "CH Port Łódź, ul, Pabianicka 245, 93-457 Łódź, Polska", "phone": "", "opening_hours": {"sobota": "10:00–21:00", "niedziela": "10:00–20:00", "poniedziałek": "10:00–21:00", "wtorek": "10:00–21:00", "środa": "10:00–21:00", "czwartek": "10:00–21:00", "piątek": "10:00–21:00"}, "service_options": ["Dostawa", "Na wynos", "Na miejscu"], "specials": [], "popular_for": ["Obiad", "Kolacja", "Posiłki w pojedynkę"], "accessibility": ["Miejsca dla osób na wózkach", "Wejście dostępne dla osób na wózkach"], "offerings": ["Małe porcje", "Szybka przekąska"], "amenities": [], "atmosphere": ["Niezobowiązująca atmosfera", "Spokojne"], "crowd": [], "children": [], "parking": ["Bezpłatny parking", "Dużo miejsc parkingowych"], "context": "Miejsce o nazwie Wasabi Sushi to miejsce typu: Sushi. W ofercie znajduje się: Małe porcje, Szybka przekąska. Atmosfera jest opisywana jako: Niezobowiązująca atmosfera, Spokojne. Miejsce oferuje udogodnienia dostępności: Miejsca dla osób na wózkach, Wejście dostępne dla osób na wózkach. Jest popularne szczególnie na: Obiad, Kolacja, Posiłki w pojedynkę.", "google_rating": 3.7, "google_reviews_total": 234, "google_price_range": "20–40"}}
{"oms_id": 196292642, "name": "Solo Pizza", "Współrzędne": "51.703873, 19.414987", "key_words": {"types": ["Pizzeria"], "address": "Pabianicka 245, 93-457 Łódź, Polska", "phone": "+48 42 298 11 10", "opening_hours": {"sobota": "10:00–21:00", "niedziela": "Zamknięte", "poniedziałek": "10:00–21:00", "wtorek": "10:00–21:00", "środa": "10:00–21:00", "czwartek": "10:00–21:00", "piątek": "10:00–21:00"}, "service_options": ["Dostawa", "Na wynos", "Na miejscu"], "specials": [], "popular_for": ["Obiad", "Kolacja", "Posiłki w pojedynkę"], "accessibility": ["Miejsca dla osób na wózkach", "Wejście dostępne dla osób na wózkach"], "offerings": ["Jedzenie późnym wieczorem", "Małe porcje", "Szybka przekąska"], "amenities": [], "atmosphere": ["Niezobowiązująca atmosfera", "Spokojne"], "crowd": ["Grupy", "Studenci"], "children": ["Menu dla dzieci", "Odpowiednie dla dzieci"], "parking": [], "context": "Miejsce o nazwie Solo Pizza to miejsce typu: Pizzeria. W ofercie znajduje się: Jedzenie późnym wieczorem, Małe porcje, Szybka przekąska. Atmosfera jest opisywana jako: Niezobowiązująca atmosfera, Spokojne. Miejsce oferuje udogodnienia dostępności: Miejsca dla osób na wózkach, Wejście dostępne dla osób na wózkach. Typowa grupa odwiedzających: Grupy, Studenci. Jest popularne szczególnie na: Obiad, Kolacja, Posiłki w pojedynkę.", "google_rating": 3.2, "google_reviews_total": 193, "google_price_range": "20–60"}}
{"oms_id": 196292682, "name": "Olimp", "Współrzędne": "51.703910, 19.414920", "key_words": {"types": ["Restauracja z bufetem"], "address": "Pabianicka 245, 90-001 Łódź, Polska", "phone": "", "opening_hours": {"sobota": "10:00–21:00", "niedziela": "Zamknięte", "poniedziałek": "10:00–21:00", "wtorek": "10:00–21:00", "środa": "10:00–21:00", "czwartek": "10:00–21:00", "piątek": "10:00–21:00"}, "service_options": ["Na miejscu"], "specials": [], "popular_for": ["Obiad", "Posiłki w pojedynkę"], "accessibility": ["Miejsca dla osób na wózkach", "Parking dostępny dla osób na wózkach", "Toaleta dla osób na wózkach", "Wejście dostępne dla osób na wózkach"], "offerings": ["Kawa", "Szybka przekąska"], "amenities": ["Toaleta"], "atmosphere": ["Niezobowiązująca atmosfera", "Spokojne"], "crowd": ["Grupy"], "children": [], "parking": [], "context": "Miejsce o nazwie Olimp to miejsce typu: Restauracja z bufetem. W ofercie znajduje się: Kawa, Szybka przekąska. Atmosfera jest opisywana jako: Niezobowiązująca atmosfera, Spokojne. Miejsce oferuje udogodnienia dostępności: Miejsca dla osób na wózkach, Parking dostępny dla osób na wózkach, Toaleta dla osób na wózkach, Wejście dostępne dla osób na wózkach. Dostępne udogodnienia to: Toaleta. Typowa grupa odwiedzających: Grupy. Jest popularne szczególnie na: Obiad, Posiłki w pojedynkę.", "google_rating": 3.1, "google_reviews_total": 108, "google_price_range": "20–40"}}
{"oms_id": 205358657, "name": "Obiady Domowe", "Współrzędne": "51.794101, 19.446169", "key_words": {"types": ["Restauracja"], "address": "Bolesława Limanowskiego 37, 91-334 Łódź, Polska", "phone": "+48 510 086 580", "opening_hours": {"sobota": "12:00–16:00", "niedziela": "Zamknięte", "poniedziałek": "12:00–17:30", "wtorek": "12:00–17:30", "środa": "12:00–17:30", "czwartek": "12:00–17:30", "piątek": "12:00–17:30"}, "service_options": ["Na wynos", "Na miejscu"], "specials": ["Duży wybór herbat"], "popular_for": ["Obiad", "Posiłki w pojedynkę"], "accessibility": ["Wejście dostępne dla osób na wózkach"], "offerings": ["Kawa", "Małe porcje", "Szybka przekąska"], "amenities": ["Toaleta"], "atmosphere": ["Kameralne", "Niezobowiązująca atmosfera", "Spokojne"], "crowd": ["Grupy", "Studenci", "Turyści"], "children": ["Odpowiednie dla dzieci"], "parking": ["Bezpłatny parking", "Bezpłatny parking przy ulicy"], "context": "Miejsce o nazwie Obiady Domowe to miejsce typu: Restauracja. W ofercie znajduje się: Kawa, Małe porcje, Szybka przekąska. Specjalne cechy miejsca: Duży wybór herbat. Atmosfera jest opisywana jako: Kameralne, Niezobowiązująca atmosfera, Spokojne. Miejsce oferuje udogodnienia dostępności: Wejście dostępne dla osób na wózkach. Dostępne udogodnienia to: Toaleta. Typowa grupa odwiedzających: Grupy, Studenci, Turyści. Jest popularne szczególnie na: Obiad, Posiłki w pojedynkę.", "google_rating": 4.6, "google_reviews_total": 365, "google_price_range": "20–40"}}
{"oms_id": 295160445, "name": "Pizzeria 105", "Współrzędne": "51.818468, 19.430819", "key_words": {"types": ["Pizzeria"], "address": "Anyżowa 7, 91-358 Łódź, Polska", "phone": "+48 572 875 105", "opening_hours": {"niedziela": "11:00–22:00", "poniedziałek": "11:00–22:00", "wtorek": "11:00–22:00", "środa": "11:00–22:00", "czwartek": "11:00–22:00", "piątek": "11:00–00:00", "sobota": "11:00–00:00"}, "service_options": ["Ogródek", "Dostawa", "Na wynos", "Na miejscu"], "specials": ["Dobra kawa", "Dobre desery", "Duży wybór herbat", "Duży wybór piw", "Sport"], "popular_for": ["Obiad", "Kolacja", "Posiłki w pojedynkę"], "accessibility": ["Miejsca dla osób na wózkach", "Wejście dostępne dla osób na wózkach"], "offerings": ["Alkohol", "Jedzenie późnym wieczorem", "Kawa", "Koktajle", "Małe porcje", "Piwo", "Szybka przekąska", "W ofercie dania wegetariańskie", "Wino"], "amenities": ["Toaleta", "Wi-Fi", "Bezpłatne Wi-Fi"], "atmosphere": ["Kameralne", "Modne", "Niezobowiązująca atmosfera", "Spokojne"], "crowd": ["Dla całej rodziny", "Grupy", "Studenci", "Turyści"], "children": ["Krzesełka do karmienia", "Menu dla dzieci", "Odpowiednie dla dzieci"], "parking": ["Bezpłatny parking", "Bezpłatny parking przy ulicy", "Dużo miejsc parkingowych"], "context": "Miejsce o nazwie Pizzeria 105 to miejsce typu: Pizzeria. W ofercie znajduje się: Alkohol, Jedzenie późnym wieczorem, Kawa, Koktajle, Małe porcje, Piwo, Szybka przekąska, W ofercie dania wegetariańskie. Specjalne cechy miejsca: Dobra kawa, Dobre desery, Duży wybór herbat, Duży wybór piw, Sport. Atmosfera jest opisywana jako: Kameralne, Modne, Niezobowiązująca atmosfera, Spokojne. Miejsce oferuje udogodnienia dostępności: Miejsca dla osób na wózkach, Wejście dostępne dla osób na wózkach. Dostępne udogodnienia to: Toaleta, Wi-Fi, Bezpłatne Wi-Fi. Typowa grupa odwiedzających: Dla całej rodziny, Grupy, Studenci, Turyści. Jest popularne szczególnie na: Obiad, Kolacja, Posiłki w pojedynkę.", "google_rating": 4.1, "google_reviews_total": 616, "google_price_range": "20–40"}}
{"oms_id": 309071775, "name": "Stylowa", "Współrzędne": "51.790800, 19.484098", "key_words": {"types": ["Sklep"], "address": "Berka Joselewicza 18, 91-830 Łódź, Polska", "phone": "+48 500 550 500", "opening_hours": {"niedziela": "Zamknięte", "poniedziałek": "09:00–18:00", "wtorek": "09:00–18:00", "środa": "09:00–18:00", "czwartek": "09:00–18:00", "piątek": "09:00–18:00", "sobota": "09:30–14:30"}, "service_options": [], "specials": [], "popular_for": [], "accessibility": [], "offerings": [], "amenities": [], "atmosphere": [], "crowd": [], "children": [], "parking": [], "context": "Miejsce o nazwie Stylowa to miejsce typu: Sklep.", "google_rating": 3, "google_reviews_total": 1, "google_price_range": null}}
{"oms_id": 331290066, "name": "Dwór Artusa", "Współrzędne": "51.741127, 19.550445", "key_words": {"types": ["Sala weselna", "Catering", "Sala bankietowa", "Organizator imprez", "Planowanie wesel"], "address": "Przyjazna 20, 92-404 Łódź, Polska", "phone": "+48 606 704 205", "opening_hours": {"niedziela": "Zamknięte", "poniedziałek": "10:00–16:00", "wtorek": "10:00–16:00", "środa": "10:00–16:00", "czwartek": "10:00–16:00", "piątek": "10:00–16:00", "sobota": "Zamknięte"}, "service_options": ["Dostawa", "Usługi na miejscu", "Na miejscu"], "specials": [], "popular_for": [], "accessibility": ["Parking dostępny dla osób na wózkach", "Wejście dostępne dla osób na wózkach"], "offerings": [], "amenities": [], "atmosphere": [], "crowd": [], "children": [], "parking": [], "context": "Miejsce o nazwie Dwór Artusa to miejsce typu: Sala weselna, Catering, Sala bankietowa, Organizator imprez, Planowanie wesel. Miejsce oferuje udogodnienia dostępności: Parking dostępny dla osób na wózkach, Wejście dostępne dla osób na wózkach.", "google_rating": 4.6, "google_reviews_total": 1274, "google_price_range": "$$"}}
{"oms_id": 361437940, "name": "Złoty Smok", "Współrzędne": "51.797260, 19.391678", "key_words": {"types": ["Kuchnia wietnamska"], "address": "Aleksandrowska 38, 91-201 Łódź, Polska", "phone": "", "opening_hours": {"niedziela": "10:00–20:00", "poniedziałek": "10:00–21:00", "wtorek": "10:00–21:00", "środa": "10:00–21:00", "czwartek": "10:00–21:00", "piątek": "10:00–21:00", "sobota": "10:00–21:00"}, "service_options": ["Na wynos", "Na miejscu"], "specials": [], "popular_for": ["Obiad", "Kolacja", "Posiłki w pojedynkę"], "accessibility": ["Miejsca dla osób na wózkach", "Wejście dostępne dla osób na wózkach"], "offerings": ["Jedzenie późnym wieczorem", "Małe porcje", "Szybka przekąska"], "amenities": [], "atmosphere": ["Niezobowiązująca atmosfera", "Spokojne"], "crowd": ["Studenci", "Turyści"], "children": [], "parking": ["Bezpłatny parking", "Bezpłatny parking przy ulicy", "Dużo miejsc parkingowych", "Płatny parking"], "context": "Miejsce o nazwie Złoty Smok to miejsce typu: Kuchnia wietnamska. W ofercie znajduje się: Jedzenie późnym wieczorem, Małe porcje, Szybka przekąska. Atmosfera jest opisywana jako: Niezobowiązująca atmosfera, Spokojne. Miejsce oferuje udogodnienia dostępności: Miejsca dla osób na wózkach, Wejście dostępne dla osób na wózkach. Typowa grupa odwiedzających: Studenci, Turyści. Jest popularne szczególnie na: Obiad, Kolacja, Posiłki w pojedynkę.", "google_rating": 4, "google_reviews_total": 499, "google_price_range": "20–40"}}
{"oms_id": 380825503, "name": "Bar", "Współrzędne": "51.798520, 19.409967", "key_words": {"types": ["Bar"], "address": "Ogrodowa 16, 91-065 Łódź, Polska", "phone": "+48 42 715 90 50", "opening_hours": {"niedziela": "17:00–01:00", "poniedziałek": "17:00–01:00", "wtorek": "17:00–01:00", "środa": "17:00–01:00", "czwartek": "17:00–01:00", "piątek": "17:00–01:00", "sobota": "17:00–01:00"}, "service_options": ["Na miejscu"], "specials": ["Dobre drinki"], "popular_for": [], "accessibility": [], "offerings": ["Alkohol", "Alkohol wysokoprocentowy", "Jedzenie", "Koktajle", "Piwo", "Taniec", "Wino"], "amenities": ["Toaleta"], "atmosphere": ["Kameralne", "Modne", "Niezobowiązująca atmosfera"], "crowd": ["Grupy", "Turyści"], "children": [], "parking": [], "context": "Miejsce o nazwie Bar to miejsce typu: Bar. W ofercie znajduje się: Alkohol, Alkohol wysokoprocentowy, Jedzenie, Koktajle, Piwo, Taniec, Wino. Specjalne cechy miejsca: Dobre drinki. Atmosfera jest opisywana jako: Kameralne, Modne, Niezobowiązująca atmosfera. Dostępne udogodnienia to: Toaleta. Typowa grupa odwiedzających: Grupy, Turyści.", "google_rating": 4.8, "google_reviews_total": 165, "google_price_range": null}}
{"oms_id": 387726460, "name": "Dominik", "Współrzędne": "51.717527, 19.484744", "key_words": {"types": ["Kuchnia polska", "Sala bankietowa", "Bar", "Restauracja obiadowa"], "address": "Centralna 40, 95-030 Starowa Góra, Polska", "phone": "+48 609 151 113", "opening_hours": {"niedziela": "12:00–17:00", "poniedziałek": "09:00–18:00", "wtorek": "09:00–18:00", "środa": "09:00–18:00", "czwartek": "09:00–18:00", "piątek": "09:00–18:00", "sobota": "12:00–17:00"}, "service_options": ["Ogródek", "Dostawa bez kontaktu", "Dostawa", "Na wynos", "Na miejscu"], "specials": ["Dobra kawa", "Dobre desery", "Duży wybór herbat", "Kominek"], "popular_for": ["Śniadanie", "Obiad", "Kolacja", "Posiłki w pojedynkę"], "accessibility": ["Miejsca dla osób na wózkach", "Parking dostępny dla osób na wózkach", "Toaleta dla osób na wózkach", "Wejście dostępne dla osób na wózkach"], "offerings": ["Alkohol", "Alkohol wysokoprocentowy", "Dania z produktów ekologicznych", "Kawa", "Piwo", "Prywatna sala", "Szybka przekąska", "To miejsce oferuje dania wegańskie", "W ofercie dania wegetariańskie", "Wino"], "amenities": ["Bar na miejscu", "Toaleta"], "atmosphere": ["Kameralne", "Niezobowiązująca atmosfera", "Spokojne"], "crowd": ["Grupy", "Miejsce przyjazne dla osób transpłciowych", "Przyjazne dla osób LGBTQ+", "Turyści"], "children": ["Dobre miejsce na przyjęcia urodzinowe dla dzieci", "Krzesełka do karmienia", "Menu dla dzieci", "Odpowiednie dla dzieci"], "parking": ["Bezpłatny parking", "Bezpłatny parking przy ulicy", "Dużo miejsc parkingowych"], "context": "Miejsce o nazwie Dominik to miejsce typu: Kuchnia polska, Sala bankietowa, Bar, Restauracja obiadowa. W ofercie znajduje się: Alkohol, Alkohol wysokoprocentowy, Dania z produktów ekologicznych, Kawa, Piwo, Prywatna sala, Szybka przekąska, To miejsce oferuje dania wegańskie. Specjalne cechy miejsca: Dobra kawa, Dobre desery, Duży wybór herbat, Kominek. Atmosfera jest opisywana jako: Kameralne, Niezobowiązująca atmosfera, Spokojne. Miejsce oferuje udogodnienia dostępności: Miejsca dla osób na wózkach, Parking dostępny dla osób na wózkach, Toaleta dla osób na wózkach, Wejście dostępne dla osób na wózkach. Dostępne udogodnienia to: Bar na miejscu, Toaleta. Typowa grupa odwiedzających: Grupy, Miejsce przyjazne dla osób transpłciowych, Przyjazne dla osób LGBTQ+, Turyści. Jest popularne szczeg...", "google_rating": 4.4, "google_reviews_total": 334, "google_price_range": "40–60"}}
{"oms_id": 419229354, "name": "Pod Jabłonką", "Współrzędne": "51.795739, 19.533768", "key_words": {"types": ["Kuchnia polska", "Restauracja z daniami na wynos"], "address": "Koniczynowa 1, 91-355 Łódź, Polska", "phone": "+48 692 459 399", "opening_hours": {"niedziela": "12:00–18:00", "poniedziałek": "11:00–18:00", "wtorek": "11:00–18:00", "środa": "11:00–18:00", "czwartek": "11:00–18:00", "piątek": "11:00–18:00", "sobota": "12:00–18:00"}, "service_options": ["Ogródek", "Dostawa", "Obsługa zmotoryzowanych", "Na wynos", "Na miejscu"], "specials": ["Dobra kawa", "Dobre desery", "Duży wybór herbat"], "popular_for": ["Obiad", "Posiłki w pojedynkę"], "accessibility": ["Miejsca dla osób na wózkach", "Wejście dostępne dla osób na wózkach"], "offerings": ["Kawa", "Małe porcje", "Szybka przekąska", "W ofercie dania wegetariańskie"], "amenities": ["Toaleta"], "atmosphere": ["Kameralne", "Modne", "Niezobowiązująca atmosfera", "Spokojne"], "crowd": ["Grupy", "Turyści"], "children": ["Krzesełka do karmienia", "Menu dla dzieci", "Odpowiednie dla dzieci"], "parking": ["Bezpłatny parking", "Bezpłatny parking przy ulicy", "Dużo miejsc parkingowych"], "context": "Miejsce o nazwie Pod Jabłonką to miejsce typu: Kuchnia polska, Restauracja z daniami na wynos. W ofercie znajduje się: Kawa, Małe porcje, Szybka przekąska, W ofercie dania wegetariańskie. Specjalne cechy miejsca: Dobra kawa, Dobre desery, Duży wybór herbat. Atmosfera jest opisywana jako: Kameralne, Modne, Niezobowiązująca atmosfera, Spokojne. Miejsce oferuje udogodnienia dostępności: Miejsca dla osób na wózkach, Wejście dostępne dla osób na wózkach. Dostępne udogodnienia to: Toaleta. Typowa grupa odwiedzających: Grupy, Turyści. Jest popularne szczególnie na: Obiad, Posiłki w pojedynkę.", "google_rating": 3.9, "google_reviews_total": 2451, "google_price_range": "20–40"}}
{"oms_id": 519086743, "name": "Ice&Coffe", "Współrzędne": "51.794139, 19.509858", "key_words": {"types": ["Kawiarnia"], "address": "Brzezińska 27/M1, 92-103 Łódź, Polska", "phone": "", "opening_hours": {"niedziela": "Zamknięte", "poniedziałek": "09:00–21:00", "wtorek": "09:00–21:00", "środa": "09:00–21:00", "czwartek": "09:00–21:00", "piątek": "09:00–21:00", "sobota": "09:00–21:00"}, "service_options": ["Na wynos", "Na miejscu"], "specials": ["Dobra kawa", "Dobre desery", "Duży wybór herbat"], "popular_for": ["Posiłki w pojedynkę"], "accessibility": ["Wejście dostępne dla osób na wózkach"], "offerings": ["Kawa", "Szybka przekąska"], "amenities": [], "atmosphere": ["Niezobowiązująca atmosfera", "Spokojne"], "crowd": [], "children": ["Odpowiednie dla dzieci"], "parking": [], "context": "Miejsce o nazwie Ice&Coffe to miejsce typu: Kawiarnia. W ofercie znajduje się: Kawa, Szybka przekąska. Specjalne cechy miejsca: Dobra kawa, Dobre desery, Duży wybór herbat. Atmosfera jest opisywana jako: Niezobowiązująca atmosfera, Spokojne. Miejsce oferuje udogodnienia dostępności: Wejście dostępne dla osób na wózkach. Jest popularne szczególnie na: Posiłki w pojedynkę.", "google_rating": 3.3, "google_reviews_total": 43, "google_price_range": "20–40"}}
{"oms_id": 543115266, "name": "Igraszka", "Współrzędne": "51.778883, 19.460663", "key_words": {"types": ["Sala bankietowa", "Planowanie wesel"], "address": "płk. Jana Kilińskiego 3, 91-421 Łódź, Polska", "phone": "+48 504 077 072", "opening_hours": {}, "service_options": [], "specials": [], "popular_for": [], "accessibility": [], "offerings": [], "amenities": [], "atmosphere": [], "crowd": [], "children": ["Odpowiednie dla dzieci"], "parking": [], "context": "Miejsce o nazwie Igraszka to miejsce typu: Sala bankietowa, Planowanie wesel.", "google_rating": 3.6, "google_reviews_total": 42, "google_price_range": null}}
{"oms_id": 622059228, "name": "Karczma Raz na Wozie", "Współrzędne": "51.792804, 19.510160", "key_words": {"types": ["Restauracja"], "address": "Brzezińska 27/M1, 92-103 Łódź, Polska", "phone": "+48 42 679 60 75", "opening_hours": {}, "service_options": ["Na wynos", "Na miejscu"], "specials": [], "popular_for": ["Obiad", "Posiłki w pojedynkę"], "accessibility": [], "offerings": ["Kawa", "Małe porcje", "Szybka przekąska"], "amenities": ["Toaleta"], "atmosphere": ["Niezobowiązująca atmosfera", "Spokojne"], "crowd": ["Turyści"], "children": [], "parking": ["Bezpłatny parking", "Dużo miejsc parkingowych"], "context": "Miejsce o nazwie Karczma Raz na Wozie to miejsce typu: Restauracja. W ofercie znajduje się: Kawa, Małe porcje, Szybka przekąska. Atmosfera jest opisywana jako: Niezobowiązująca atmosfera, Spokojne. Dostępne udogodnienia to: Toaleta. Typowa grupa odwiedzających: Turyści. Jest popularne szczególnie na: Obiad, Posiłki w pojedynkę.", "google_rating": 3, "google_reviews_total": 74, "google_price_range": "20–40"}}
{"oms_id": 851856759, "name": "Gruby Benek", "Współrzędne": "51.745978, 19.395948", "key_words": {"types": ["Pizzeria", "Pizza na telefon", "Pizza na wynos"], "address": "Retkińska 131, 94-004 Łódź, Polska", "phone": "+48 42 250 15 01", "opening_hours": {"niedziela": "11:00–22:45", "poniedziałek": "11:00–22:45", "wtorek": "11:00–22:45", "środa": "11:00–22:45", "czwartek": "11:00–22:45", "piątek": "11:00–00:45", "sobota": "11:00–00:45"}, "service_options": ["Dostawa bez kontaktu", "Dostawa", "Na wynos"], "specials": [], "popular_for": ["Obiad", "Kolacja", "Posiłki w pojedynkę"], "accessibility": ["Wejście dostępne dla osób na wózkach"], "offerings": ["Jedzenie późnym wieczorem", "Małe porcje", "Szybka przekąska", "W ofercie dania wegetariańskie"], "amenities": [], "atmosphere": ["Niezobowiązująca atmosfera", "Spokojne"], "crowd": ["Studenci", "Turyści"], "children": ["Odpowiednie dla dzieci"], "parking": ["Bezpłatny parking", "Bezpłatny parking przy ulicy", "Dużo miejsc parkingowych"], "context": "Miejsce o nazwie Gruby Benek to miejsce typu: Pizzeria, Pizza na telefon, Pizza na wynos. W ofercie znajduje się: Jedzenie późnym wieczorem, Małe porcje, Szybka przekąska, W ofercie dania wegetariańskie. Atmosfera jest opisywana jako: Niezobowiązująca atmosfera, Spokojne. Miejsce oferuje udogodnienia dostępności: Wejście dostępne dla osób na wózkach. Typowa grupa odwiedzających: Studenci, Turyści. Jest popularne szczególnie na: Obiad, Kolacja, Posiłki w pojedynkę.", "google_rating": 4.3, "google_reviews_total": 268, "google_price_range": "20–40"}}
{"oms_id": 948741154, "name": "Bar Pod Dębem", "Współrzędne": "51.723438, 19.375549", "key_words": {"types": ["Dania z grilla", "Piwiarnia"], "address": "Latawcowa 28a, 93-469 Łódź, Polska", "phone": "+48 514 529 572", "opening_hours": {"niedziela": "12:00–20:00", "poniedziałek": "Zamknięte", "wtorek": "12:00–20:00", "środa": "12:00–20:00", "czwartek": "12:00–20:00", "piątek": "12:00–20:00", "sobota": "12:00–20:00"}, "service_options": ["Ogródek", "Dostawa", "Obsługa zmotoryzowanych", "Na wynos", "Na miejscu"], "specials": ["Dobra kawa", "Duży wybór herbat", "Sport"], "popular_for": ["Obiad", "Kolacja", "Posiłki w pojedynkę"], "accessibility": ["Miejsca dla osób na wózkach", "Parking dostępny dla osób na wózkach", "Wejście dostępne dla osób na wózkach"], "offerings": ["Alkohol", "Jedzenie późnym wieczorem", "Kawa", "Małe porcje", "Piwo", "Szybka przekąska"], "amenities": ["Bar na miejscu", "Toaleta"], "atmosphere": ["Kameralne", "Niezobowiązująca atmosfera", "Ostatnio modne", "Spokojne"], "crowd": ["Grupy", "Turyści"], "children": ["Odpowiednie dla dzieci"], "parking": ["Bezpłatny parking"], "context": "Miejsce o nazwie Bar Pod Dębem to miejsce typu: Dania z grilla, Piwiarnia. W ofercie znajduje się: Alkohol, Jedzenie późnym wieczorem, Kawa, Małe porcje, Piwo, Szybka przekąska. Specjalne cechy miejsca: Dobra kawa, Duży wybór herbat, Sport. Atmosfera jest opisywana jako: Kameralne, Niezobowiązująca atmosfera, Ostatnio modne, Spokojne. Miejsce oferuje udogodnienia dostępności: Miejsca dla osób na wózkach, Parking dostępny dla osób na wózkach, Wejście dostępne dla osób na wózkach. Dostępne udogodnienia to: Bar na miejscu, Toaleta. Typowa grupa odwiedzających: Grupy, Turyści. Jest popularne szczególnie na: Obiad, Kolacja, Posiłki w pojedynkę.", "google_rating": 4.6, "google_reviews_total": 311, "google_price_range": "1–20"}}
{"oms_id": 1081329807, "name": "Kucak", "Współrzędne": "51.743536, 19.488634", "key_words": {"types": ["Strefa gastronomiczna"], "address": "ks. Zdzisława Wujaka 7, 92-551 Łódź, Polska", "phone": "+48 42 673 49 26", "opening_hours": {}, "service_options": ["Dostawa", "Na wynos", "Na miejscu"], "specials": [], "popular_for": ["Posiłki w pojedynkę"], "accessibility": ["Wejście dostępne dla osób na wózkach"], "offerings": [], "amenities": [], "atmosphere": ["Niezobowiązująca atmosfera"], "crowd": [], "children": [], "parking": [], "context": "Miejsce o nazwie Kucak to miejsce typu: Strefa gastronomiczna. Atmosfera jest opisywana jako: Niezobowiązująca atmosfera. Miejsce oferuje udogodnienia dostępności: Wejście dostępne dla osób na wózkach. Jest popularne szczególnie na: Posiłki w pojedynkę.", "google_rating": 2.8, "google_reviews_total": 37, "google_price_range": "20–40"}}
{"oms_id": 1210862154, "name": "Nienażarty", "Współrzędne": "51.779656, 19.397478", "key_words": {"types": ["Kuchnia polska", "Dania z grilla", "Pub", "Kuchnia śródziemnomorska", "Restauracja", "Kuchnia wegetariańska"], "address": "Złotno 8/10, 94-221 Łódź, Polska", "phone": "+48 42 650 51 00", "opening_hours": {"niedziela": "12:00–19:00", "poniedziałek": "12:00–19:00", "wtorek": "12:00–19:00", "środa": "12:00–19:00", "czwartek": "12:00–19:00", "piątek": "12:00–20:00", "sobota": "12:00–20:00"}, "service_options": ["Ogródek", "Dostawa", "Na wynos", "Na miejscu"], "specials": ["Dobra kawa", "Dobre desery", "Dobre drinki", "Duży wybór herbat", "Duży wybór piw"], "popular_for": ["Śniadanie", "Obiad", "Kolacja", "Posiłki w pojedynkę"], "accessibility": ["Miejsca dla osób na wózkach", "Toaleta dla osób na wózkach", "Wejście dostępne dla osób na wózkach"], "offerings": ["Alkohol", "Alkohol wysokoprocentowy", "Jedzenie późnym wieczorem", "Kawa", "Koktajle", "Małe porcje", "Piwo", "Szybka przekąska", "Wino"], "amenities": ["Bar na miejscu", "Toaleta"], "atmosphere": ["Kameralne", "Modne", "Niezobowiązująca atmosfera", "Spokojne"], "crowd": ["Grupy", "Turyści"], "children": ["Dobre miejsce na przyjęcia urodzinowe dla dzieci", "Krzesełka do karmienia", "Menu dla dzieci", "Odpowiednie dla dzieci"], "parking": ["Bezpłatny parking", "Bezpłatny parking przy ulicy", "Dużo miejsc parkingowych"], "context": "Miejsce o nazwie Nienażarty to miejsce typu: Kuchnia polska, Dania z grilla, Pub, Kuchnia śródziemnomorska, Restauracja, Kuchnia wegetariańska. W ofercie znajduje się: Alkohol, Alkohol wysokoprocentowy, Jedzenie późnym wieczorem, Kawa, Koktajle, Małe porcje, Piwo, Szybka przekąska. Specjalne cechy miejsca: Dobra kawa, Dobre desery, Dobre drinki, Duży wybór herbat, Duży wybór piw. Atmosfera jest opisywana jako: Kameralne, Modne, Niezobowiązująca atmosfera, Spokojne. Miejsce oferuje udogodnienia dostępności: Miejsca dla osób na wózkach, Toaleta dla osób na wózkach, Wejście dostępne dla osób na wózkach. Dostępne udogodnienia to: Bar na miejscu, Toaleta. Typowa grupa odwiedzających: Grupy, Turyści. Jest popularne szczególnie na: Śniadanie, Obiad, Kolacja, Posiłki w pojedynkę.", "google_rating": 4.6, "google_reviews_total": 2049, "google_price_range": "40–60"}}
{"oms_id": 1370138259, "name": "Bufet", "Współrzędne": "51.776006, 19.494713", "key_words": {"types": ["Restauracja obiadowa", "Restauracja śniadaniowa", "Sklep spożywczy", "Cukiernia"], "address": "Czechosłowacka 8/10/B1, 92-216 Łódź, Polska", "phone": "+48 518 592 332", "opening_hours": {"niedziela": "11:00–16:00", "poniedziałek": "08:00–16:00", "wtorek": "08:00–16:00", "środa": "08:00–16:00", "czwartek": "08:00–16:00", "piątek": "08:00–16:00", "sobota": "10:00–16:00"}, "service_options": ["Na wynos", "Na miejscu"], "specials": [], "popular_for": ["Obiad", "Posiłki w pojedynkę"], "accessibility": ["Wejście dostępne dla osób na wózkach"], "offerings": ["Kawa", "Szybka przekąska"], "amenities": [], "atmosphere": ["Niezobowiązująca atmosfera", "Spokojne"], "crowd": [], "children": ["Odpowiednie dla dzieci"], "parking": [], "context": "Miejsce o nazwie Bufet to miejsce typu: Restauracja obiadowa, Restauracja śniadaniowa, Sklep spożywczy, Cukiernia. W ofercie znajduje się: Kawa, Szybka przekąska. Atmosfera jest opisywana jako: Niezobowiązująca atmosfera, Spokojne. Miejsce oferuje udogodnienia dostępności: Wejście dostępne dla osób na wózkach. Jest popularne szczególnie na: Obiad, Posiłki w pojedynkę.", "google_rating": 4.7, "google_reviews_total": 15, "google_price_range": "1–20"}}
{"oms_id": 1427957370, "name": "Vita Cafe", "Współrzędne": "51.779266, 19.445210", "key_words": {"types": ["Kawiarnia", "Cukiernia", "Sklep z pączkami", "Lodziarnia", "Pijalnia soków", "Kanapki"], "address": "Drewnowska 58, 91-002 Łódź, Polska", "phone": "", "opening_hours": {"niedziela": "Zamknięte", "poniedziałek": "09:30–22:00", "wtorek": "09:30–22:00", "środa": "09:30–22:00", "czwartek": "09:30–22:00", "piątek": "09:30–22:00", "sobota": "09:30–22:00"}, "service_options": ["Na wynos", "Na miejscu"], "specials": ["Dobra kawa", "Dobre desery", "Duży wybór herbat"], "popular_for": ["Śniadanie", "Posiłki w pojedynkę", "Dobre miejsce do pracy na laptopie"], "accessibility": ["Miejsca dla osób na wózkach", "Parking dostępny dla osób na wózkach", "Toaleta dla osób na wózkach", "Wejście dostępne dla osób na wózkach"], "offerings": ["Dania z produktów ekologicznych", "Kawa", "Małe porcje", "Szybka przekąska", "To miejsce oferuje dania wegańskie", "W ofercie dania wegetariańskie"], "amenities": ["Toaleta", "Wi-Fi", "Bezpłatne Wi-Fi"], "atmosphere": ["Kameralne", "Modne", "Niezobowiązująca atmosfera", "Spokojne"], "crowd": ["Dla całej rodziny", "Studenci", "Turyści"], "children": ["Odpowiednie dla dzieci"], "parking": ["Bezpłatny parking", "Bezpłatny parking podziemny", "Bezpłatny parking przy ulicy", "Dużo miejsc parkingowych"], "context": "Miejsce o nazwie Vita Cafe to miejsce typu: Kawiarnia, Cukiernia, Sklep z pączkami, Lodziarnia, Pijalnia soków, Kanapki. W ofercie znajduje się: Dania z produktów ekologicznych, Kawa, Małe porcje, Szybka przekąska, To miejsce oferuje dania wegańskie, W ofercie dania wegetariańskie. Specjalne cechy miejsca: Dobra kawa, Dobre desery, Duży wybór herbat. Atmosfera jest opisywana jako: Kameralne, Modne, Niezobowiązująca atmosfera, Spokojne. Miejsce oferuje udogodnienia dostępności: Miejsca dla osób na wózkach, Parking dostępny dla osób na wózkach, Toaleta dla osób na wózkach, Wejście dostępne dla osób na wózkach. Dostępne udogodnienia to: Toaleta, Wi-Fi, Bezpłatne Wi-Fi. Typowa grupa odwiedzających: Dla całej rodziny, Studenci, Turyści. Jest popularne szczególnie na: Śniadanie, Posiłki w poj...", "google_rating": 4.7, "google_reviews_total": 815, "google_price_range": "20–40"}}
